"No.","Time","Source","Destination","Protocol","Length","Info"
"1","0.000000000","149.43.156.190","192.168.1.12","TCP","1158","80 > 54919 [PSH, ACK] Seq=1 Ack=1 Win=3456 Len=1104"
"2","0.005407000","149.43.156.190","192.168.1.12","TCP","1514","80 > 54421 [ACK] Seq=1 Ack=1 Win=3456 Len=1460"
"3","0.006253000","149.43.156.190","192.168.1.12","TCP","1514","80 > 54421 [ACK] Seq=1461 Ack=1 Win=3456 Len=1460"
"4","0.006283000","192.168.1.12","149.43.156.190","TCP","54","54421 > 80 [ACK] Seq=1 Ack=2921 Win=65335 Len=0"
"5","0.006546000","149.43.156.190","192.168.1.12","TCP","1514","80 > 54421 [ACK] Seq=2921 Ack=1 Win=3456 Len=1460"
"6","0.007220000","149.43.156.190","192.168.1.12","TCP","1514","80 > 54421 [ACK] Seq=4381 Ack=1 Win=3456 Len=1460"
"7","0.007240000","192.168.1.12","149.43.156.190","TCP","54","54421 > 80 [ACK] Seq=1 Ack=5841 Win=65335 Len=0"
"8","0.007956000","149.43.156.190","192.168.1.12","TCP","1514","80 > 54421 [ACK] Seq=5841 Ack=1 Win=3456 Len=1460"
"9","0.008689000","149.43.156.190","192.168.1.12","TCP","1514","80 > 54421 [ACK] Seq=7301 Ack=1 Win=3456 Len=1460"
"10","0.008712000","192.168.1.12","149.43.156.190","TCP","54","54421 > 80 [ACK] Seq=1 Ack=8761 Win=65335 Len=0"
"11","0.013188000","149.43.156.190","192.168.1.12","TCP","1514","80 > 54421 [ACK] Seq=8761 Ack=1 Win=3456 Len=1460"
"12","0.013756000","149.43.156.190","192.168.1.12","TCP","1514","80 > 54421 [ACK] Seq=10221 Ack=1 Win=3456 Len=1460"
"13","0.013784000","192.168.1.12","149.43.156.190","TCP","54","54421 > 80 [ACK] Seq=1 Ack=11681 Win=65335 Len=0"
"14","0.014023000","149.43.156.190","192.168.1.12","TCP","1514","80 > 54421 [ACK] Seq=11681 Ack=1 Win=3456 Len=1460"
"15","0.014258000","149.43.156.190","192.168.1.12","TCP","1514","80 > 54421 [ACK] Seq=13141 Ack=1 Win=3456 Len=1460"
"16","0.014283000","192.168.1.12","149.43.156.190","TCP","54","54421 > 80 [ACK] Seq=1 Ack=14601 Win=65335 Len=0"
"17","0.014514000","149.43.156.190","192.168.1.12","TCP","1514","80 > 54421 [ACK] Seq=14601 Ack=1 Win=3456 Len=1460"
"18","0.014854000","149.43.156.190","192.168.1.12","TCP","1514","80 > 54421 [ACK] Seq=16061 Ack=1 Win=3456 Len=1460"
"19","0.014882000","192.168.1.12","149.43.156.190","TCP","54","54421 > 80 [ACK] Seq=1 Ack=17521 Win=65335 Len=0"
"20","0.014981000","149.43.156.190","192.168.1.12","TCP","1514","80 > 54421 [ACK] Seq=17521 Ack=1 Win=3456 Len=1460"
"21","0.015249000","149.43.156.190","192.168.1.12","TCP","1514","80 > 54421 [ACK] Seq=18981 Ack=1 Win=3456 Len=1460"
"22","0.015264000","192.168.1.12","149.43.156.190","TCP","54","54421 > 80 [ACK] Seq=1 Ack=20441 Win=65335 Len=0"
"23","0.015490000","149.43.156.190","192.168.1.12","TCP","1514","80 > 54421 [ACK] Seq=20441 Ack=1 Win=3456 Len=1460"
"24","0.015720000","149.43.156.190","192.168.1.12","TCP","1514","80 > 54421 [ACK] Seq=21901 Ack=1 Win=3456 Len=1460"
"25","0.015738000","192.168.1.12","149.43.156.190","TCP","54","54421 > 80 [ACK] Seq=1 Ack=23361 Win=65335 Len=0"
"26","0.015959000","149.43.156.190","192.168.1.12","TCP","1514","80 > 54421 [ACK] Seq=23361 Ack=1 Win=3456 Len=1460"
"27","0.016208000","149.43.156.190","192.168.1.12","TCP","1514","80 > 54421 [ACK] Seq=24821 Ack=1 Win=3456 Len=1460"
"28","0.016230000","192.168.1.12","149.43.156.190","TCP","54","54421 > 80 [ACK] Seq=1 Ack=26281 Win=65335 Len=0"
"29","0.016788000","149.43.156.190","192.168.1.12","TCP","1514","80 > 54421 [ACK] Seq=26281 Ack=1 Win=3456 Len=1460"
"30","0.017795000","149.43.156.190","192.168.1.12","TCP","1514","80 > 54421 [ACK] Seq=27741 Ack=1 Win=3456 Len=1460"
"31","0.017824000","192.168.1.12","149.43.156.190","TCP","54","54421 > 80 [ACK] Seq=1 Ack=29201 Win=65335 Len=0"
"32","0.018090000","149.43.156.190","192.168.1.12","TCP","1514","80 > 54421 [ACK] Seq=29201 Ack=1 Win=3456 Len=1460"
"33","0.018288000","149.43.156.190","192.168.1.12","TCP","1514","80 > 54421 [ACK] Seq=30661 Ack=1 Win=3456 Len=1460"
"34","0.018311000","192.168.1.12","149.43.156.190","TCP","54","54421 > 80 [ACK] Seq=1 Ack=32121 Win=65335 Len=0"
"35","0.018587000","149.43.156.190","192.168.1.12","TCP","1514","80 > 54421 [ACK] Seq=32121 Ack=1 Win=3456 Len=1460"
"36","0.018762000","149.43.156.190","192.168.1.12","TCP","1514","80 > 54421 [ACK] Seq=33581 Ack=1 Win=3456 Len=1460"
"37","0.018786000","192.168.1.12","149.43.156.190","TCP","54","54421 > 80 [ACK] Seq=1 Ack=35041 Win=65335 Len=0"
"38","0.019702000","149.43.156.190","192.168.1.12","TCP","1514","80 > 54421 [ACK] Seq=35041 Ack=1 Win=3456 Len=1460"
"39","0.020267000","149.43.156.190","192.168.1.12","TCP","1514","80 > 54421 [ACK] Seq=36501 Ack=1 Win=3456 Len=1460"
"40","0.020302000","192.168.1.12","149.43.156.190","TCP","54","54421 > 80 [ACK] Seq=1 Ack=37961 Win=65335 Len=0"
"41","0.020482000","149.43.156.190","192.168.1.12","TCP","1514","80 > 54421 [ACK] Seq=37961 Ack=1 Win=3456 Len=1460"
"42","0.020751000","149.43.156.190","192.168.1.12","TCP","1514","80 > 54421 [ACK] Seq=39421 Ack=1 Win=3456 Len=1460"
"43","0.020768000","192.168.1.12","149.43.156.190","TCP","54","54421 > 80 [ACK] Seq=1 Ack=40881 Win=65335 Len=0"
"44","0.020973000","149.43.156.190","192.168.1.12","TCP","1514","80 > 54421 [ACK] Seq=40881 Ack=1 Win=3456 Len=1460"
"45","0.021891000","149.43.156.190","192.168.1.12","TCP","1514","80 > 54421 [ACK] Seq=42341 Ack=1 Win=3456 Len=1460"
"46","0.021905000","192.168.1.12","149.43.156.190","TCP","54","54421 > 80 [ACK] Seq=1 Ack=43801 Win=65335 Len=0"
"47","0.022351000","149.43.156.190","192.168.1.12","TCP","1514","80 > 54421 [ACK] Seq=43801 Ack=1 Win=3456 Len=1460"
"48","0.022573000","149.43.156.190","192.168.1.12","TCP","1514","80 > 54421 [ACK] Seq=45261 Ack=1 Win=3456 Len=1460"
"49","0.022595000","192.168.1.12","149.43.156.190","TCP","54","54421 > 80 [ACK] Seq=1 Ack=46721 Win=65335 Len=0"
"50","0.022832000","149.43.156.190","192.168.1.12","TCP","1514","80 > 54421 [ACK] Seq=46721 Ack=1 Win=3456 Len=1460"
"51","0.061548000","149.43.156.190","192.168.1.12","TCP","1143","80 > 54421 [PSH, ACK] Seq=48181 Ack=1 Win=3456 Len=1089"
"52","0.061623000","192.168.1.12","149.43.156.190","TCP","54","54421 > 80 [ACK] Seq=1 Ack=49270 Win=65335 Len=0"
"54","0.103604000","149.43.156.190","192.168.1.12","TCP","1514","80 > 54919 [ACK] Seq=1105 Ack=1 Win=3456 Len=1460"
"55","0.103677000","192.168.1.12","149.43.156.190","TCP","54","54919 > 80 [ACK] Seq=1 Ack=2565 Win=65335 Len=0"
"56","0.104054000","149.43.156.190","192.168.1.12","TCP","1514","80 > 54919 [ACK] Seq=2565 Ack=1 Win=3456 Len=1460"
"57","0.104546000","149.43.156.190","192.168.1.12","TCP","1514","80 > 54919 [ACK] Seq=4025 Ack=1 Win=3456 Len=1460"
"58","0.104635000","192.168.1.12","149.43.156.190","TCP","54","54919 > 80 [ACK] Seq=1 Ack=5485 Win=65335 Len=0"
"59","0.104714000","149.43.156.190","192.168.1.12","TCP","1514","80 > 54919 [ACK] Seq=5485 Ack=1 Win=3456 Len=1460"
"60","0.105106000","149.43.156.190","192.168.1.12","TCP","1514","80 > 54919 [ACK] Seq=6945 Ack=1 Win=3456 Len=1460"
"61","0.105197000","192.168.1.12","149.43.156.190","TCP","54","54919 > 80 [ACK] Seq=1 Ack=8405 Win=65335 Len=0"
"62","0.105950000","149.43.156.190","192.168.1.12","TCP","1514","80 > 54919 [ACK] Seq=8405 Ack=1 Win=3456 Len=1460"
"63","0.106180000","149.43.156.190","192.168.1.12","TCP","1514","80 > 54919 [ACK] Seq=9865 Ack=1 Win=3456 Len=1460"
"64","0.106237000","192.168.1.12","149.43.156.190","TCP","54","54919 > 80 [ACK] Seq=1 Ack=11325 Win=65335 Len=0"
"65","0.106650000","149.43.156.190","192.168.1.12","TCP","1514","80 > 54919 [ACK] Seq=11325 Ack=1 Win=3456 Len=1460"
"66","0.107263000","149.43.156.190","192.168.1.12","TCP","1514","80 > 54919 [ACK] Seq=12785 Ack=1 Win=3456 Len=1460"
"67","0.107339000","192.168.1.12","149.43.156.190","TCP","54","54919 > 80 [ACK] Seq=1 Ack=14245 Win=65335 Len=0"
"68","0.107683000","149.43.156.190","192.168.1.12","TCP","1514","80 > 54919 [ACK] Seq=14245 Ack=1 Win=3456 Len=1460"
"69","0.107804000","149.43.156.190","192.168.1.12","TCP","1514","80 > 54919 [ACK] Seq=15705 Ack=1 Win=3456 Len=1460"
"70","0.107828000","192.168.1.12","149.43.156.190","TCP","54","54919 > 80 [ACK] Seq=1 Ack=17165 Win=65335 Len=0"
"71","0.108423000","149.43.156.190","192.168.1.12","TCP","1514","80 > 54919 [ACK] Seq=17165 Ack=1 Win=3456 Len=1460"
"72","0.108696000","149.43.156.190","192.168.1.12","TCP","1514","80 > 54919 [ACK] Seq=18625 Ack=1 Win=3456 Len=1460"
"73","0.108718000","192.168.1.12","149.43.156.190","TCP","54","54919 > 80 [ACK] Seq=1 Ack=20085 Win=65335 Len=0"
"74","0.109078000","149.43.156.190","192.168.1.12","TCP","1514","80 > 54919 [ACK] Seq=20085 Ack=1 Win=3456 Len=1460"
"75","0.111282000","149.43.156.190","192.168.1.12","TCP","1514","80 > 54919 [ACK] Seq=21545 Ack=1 Win=3456 Len=1460"
"76","0.111360000","192.168.1.12","149.43.156.190","TCP","54","54919 > 80 [ACK] Seq=1 Ack=23005 Win=65335 Len=0"
"77","0.111586000","149.43.156.190","192.168.1.12","TCP","1514","80 > 54919 [ACK] Seq=23005 Ack=1 Win=3456 Len=1460"
"78","0.116302000","149.43.156.190","192.168.1.12","TCP","1514","80 > 54421 [ACK] Seq=49270 Ack=1 Win=3456 Len=1460"
"79","0.118295000","149.43.156.190","192.168.1.12","TCP","1514","80 > 54421 [ACK] Seq=50730 Ack=1 Win=3456 Len=1460"
"80","0.118312000","192.168.1.12","149.43.156.190","TCP","54","54421 > 80 [ACK] Seq=1 Ack=52190 Win=65335 Len=0"
"81","0.118515000","149.43.156.190","192.168.1.12","TCP","1514","80 > 54421 [ACK] Seq=52190 Ack=1 Win=3456 Len=1460"
"82","0.119727000","149.43.156.190","192.168.1.12","TCP","1514","80 > 54919 [ACK] Seq=24465 Ack=1 Win=3456 Len=1460"
"83","0.119770000","192.168.1.12","149.43.156.190","TCP","54","54919 > 80 [ACK] Seq=1 Ack=25925 Win=65335 Len=0"
"84","0.120537000","149.43.156.190","192.168.1.12","TCP","1514","80 > 54421 [ACK] Seq=53650 Ack=1 Win=3456 Len=1460"
"85","0.120583000","192.168.1.12","149.43.156.190","TCP","54","54421 > 80 [ACK] Seq=1 Ack=55110 Win=65335 Len=0"
"86","0.122639000","149.43.156.190","192.168.1.12","TCP","1514","80 > 54421 [ACK] Seq=55110 Ack=1 Win=3456 Len=1460"
"87","0.122966000","149.43.156.190","192.168.1.12","TCP","1514","80 > 54421 [ACK] Seq=56570 Ack=1 Win=3456 Len=1460"
"88","0.123049000","192.168.1.12","149.43.156.190","TCP","54","54421 > 80 [ACK] Seq=1 Ack=58030 Win=65335 Len=0"
"89","0.127107000","149.43.156.190","192.168.1.12","TCP","1514","80 > 54421 [ACK] Seq=58030 Ack=1 Win=3456 Len=1460"
"90","0.127446000","149.43.156.190","192.168.1.12","TCP","1514","80 > 54421 [ACK] Seq=59490 Ack=1 Win=3456 Len=1460"
"91","0.127740000","192.168.1.12","149.43.156.190","TCP","54","54421 > 80 [ACK] Seq=1 Ack=60950 Win=65335 Len=0"
"92","0.127817000","149.43.156.190","192.168.1.12","TCP","1514","80 > 54919 [ACK] Seq=25925 Ack=1 Win=3456 Len=1460"
"93","0.128092000","149.43.156.190","192.168.1.12","TCP","1514","80 > 54421 [ACK] Seq=60950 Ack=1 Win=3456 Len=1460"
"94","0.128327000","149.43.156.190","192.168.1.12","TCP","1514","80 > 54421 [ACK] Seq=62410 Ack=1 Win=3456 Len=1460"
"95","0.128353000","192.168.1.12","149.43.156.190","TCP","54","54421 > 80 [ACK] Seq=1 Ack=63870 Win=65335 Len=0"
"96","0.128814000","149.43.156.190","192.168.1.12","TCP","1514","80 > 54421 [ACK] Seq=63870 Ack=1 Win=3456 Len=1460"
"97","0.129164000","149.43.156.190","192.168.1.12","TCP","1514","80 > 54421 [ACK] Seq=65330 Ack=1 Win=3456 Len=1460"
"98","0.129209000","192.168.1.12","149.43.156.190","TCP","54","54421 > 80 [ACK] Seq=1 Ack=66790 Win=65335 Len=0"
"99","0.129512000","149.43.156.190","192.168.1.12","TCP","1514","80 > 54421 [ACK] Seq=66790 Ack=1 Win=3456 Len=1460"
"100","0.129808000","149.43.156.190","192.168.1.12","TCP","1514","80 > 54421 [ACK] Seq=68250 Ack=1 Win=3456 Len=1460"
"101","0.129829000","192.168.1.12","149.43.156.190","TCP","54","54421 > 80 [ACK] Seq=1 Ack=69710 Win=65335 Len=0"
"102","0.130160000","149.43.156.190","192.168.1.12","TCP","1514","80 > 54421 [ACK] Seq=69710 Ack=1 Win=3456 Len=1460"
"103","0.130455000","149.43.156.190","192.168.1.12","TCP","1514","80 > 54421 [ACK] Seq=71170 Ack=1 Win=3456 Len=1460"
"104","0.130472000","192.168.1.12","149.43.156.190","TCP","54","54421 > 80 [ACK] Seq=1 Ack=72630 Win=65335 Len=0"
"105","0.130787000","149.43.156.190","192.168.1.12","TCP","1514","80 > 54421 [ACK] Seq=72630 Ack=1 Win=3456 Len=1460"
"106","0.131117000","149.43.156.190","192.168.1.12","TCP","1514","80 > 54421 [ACK] Seq=74090 Ack=1 Win=3456 Len=1460"
"107","0.131136000","192.168.1.12","149.43.156.190","TCP","54","54421 > 80 [ACK] Seq=1 Ack=75550 Win=65335 Len=0"
"108","0.131473000","149.43.156.190","192.168.1.12","TCP","1514","80 > 54421 [ACK] Seq=75550 Ack=1 Win=3456 Len=1460"
"109","0.131787000","149.43.156.190","192.168.1.12","TCP","1514","80 > 54421 [ACK] Seq=77010 Ack=1 Win=3456 Len=1460"
"110","0.131890000","192.168.1.12","149.43.156.190","TCP","54","54421 > 80 [ACK] Seq=1 Ack=78470 Win=65335 Len=0"
"111","0.132099000","149.43.156.190","192.168.1.12","TCP","1514","80 > 54421 [ACK] Seq=78470 Ack=1 Win=3456 Len=1460"
"112","0.132533000","149.43.156.190","192.168.1.12","TCP","1514","80 > 54421 [ACK] Seq=79930 Ack=1 Win=3456 Len=1460"
"113","0.132592000","192.168.1.12","149.43.156.190","TCP","54","54421 > 80 [ACK] Seq=1 Ack=81390 Win=65335 Len=0"
"114","0.132782000","149.43.156.190","192.168.1.12","TCP","1514","80 > 54919 [ACK] Seq=27385 Ack=1 Win=3456 Len=1460"
"115","0.132801000","192.168.1.12","149.43.156.190","TCP","54","54919 > 80 [ACK] Seq=1 Ack=28845 Win=65335 Len=0"
"116","0.133088000","149.43.156.190","192.168.1.12","TCP","1514","80 > 54919 [ACK] Seq=28845 Ack=1 Win=3456 Len=1460"
"117","0.133409000","149.43.156.190","192.168.1.12","TCP","1514","80 > 54919 [ACK] Seq=30305 Ack=1 Win=3456 Len=1460"
"118","0.133431000","192.168.1.12","149.43.156.190","TCP","54","54919 > 80 [ACK] Seq=1 Ack=31765 Win=65335 Len=0"
"119","0.140194000","149.43.156.190","192.168.1.12","TCP","1514","80 > 54919 [ACK] Seq=31765 Ack=1 Win=3456 Len=1460"
"120","0.140196000","149.43.156.190","192.168.1.12","TCP","1514","80 > 54919 [ACK] Seq=33225 Ack=1 Win=3456 Len=1460"
"121","0.140218000","149.43.156.190","192.168.1.12","TCP","1514","80 > 54919 [ACK] Seq=34685 Ack=1 Win=3456 Len=1460"
"122","0.140220000","149.43.156.190","192.168.1.12","TCP","1514","80 > 54919 [ACK] Seq=36145 Ack=1 Win=3456 Len=1460"
"123","0.140221000","149.43.156.190","192.168.1.12","TCP","1514","80 > 54919 [ACK] Seq=37605 Ack=1 Win=3456 Len=1460"
"124","0.140223000","149.43.156.190","192.168.1.12","TCP","1514","80 > 54919 [ACK] Seq=39065 Ack=1 Win=3456 Len=1460"
"125","0.140225000","149.43.156.190","192.168.1.12","TCP","1514","80 > 54919 [ACK] Seq=40525 Ack=1 Win=3456 Len=1460"
"126","0.140226000","149.43.156.190","192.168.1.12","TCP","1514","80 > 54919 [ACK] Seq=41985 Ack=1 Win=3456 Len=1460"
"127","0.140228000","149.43.156.190","192.168.1.12","TCP","1514","80 > 54919 [ACK] Seq=43445 Ack=1 Win=3456 Len=1460"
"128","0.140229000","149.43.156.190","192.168.1.12","TCP","1514","80 > 54919 [ACK] Seq=44905 Ack=1 Win=3456 Len=1460"
"129","0.140332000","192.168.1.12","149.43.156.190","TCP","54","54919 > 80 [ACK] Seq=1 Ack=35825 Win=65335 Len=0"
"130","0.140541000","192.168.1.12","149.43.156.190","TCP","54","54919 > 80 [ACK] Seq=1 Ack=39297 Win=65335 Len=0"
"131","0.140594000","192.168.1.12","149.43.156.190","TCP","54","54919 > 80 [ACK] Seq=1 Ack=42769 Win=65335 Len=0"
"132","0.140644000","192.168.1.12","149.43.156.190","TCP","54","54919 > 80 [ACK] Seq=1 Ack=46241 Win=65335 Len=0"
"133","0.140715000","149.43.156.190","192.168.1.12","TCP","1514","80 > 54919 [ACK] Seq=46365 Ack=1 Win=3456 Len=1460"
"134","0.140716000","149.43.156.190","192.168.1.12","TCP","1514","80 > 54919 [ACK] Seq=47825 Ack=1 Win=3456 Len=1460"
"135","0.140795000","149.43.156.190","192.168.1.12","TCP","1514","80 > 54421 [ACK] Seq=81390 Ack=1 Win=3456 Len=1460"
"136","0.140799000","149.43.156.190","192.168.1.12","TCP","1514","80 > 54421 [ACK] Seq=82850 Ack=1 Win=3456 Len=1460"
"137","0.140802000","149.43.156.190","192.168.1.12","TCP","1514","80 > 54421 [ACK] Seq=84310 Ack=1 Win=3456 Len=1460"
"138","0.140805000","149.43.156.190","192.168.1.12","TCP","1514","80 > 54421 [ACK] Seq=85770 Ack=1 Win=3456 Len=1460"
"139","0.140863000","192.168.1.12","149.43.156.190","TCP","54","54919 > 80 [ACK] Seq=1 Ack=49285 Win=65335 Len=0"
"140","0.140901000","192.168.1.12","149.43.156.190","TCP","54","54421 > 80 [ACK] Seq=1 Ack=87230 Win=65335 Len=0"
"141","0.141019000","149.43.156.190","192.168.1.12","TCP","1514","80 > 54421 [ACK] Seq=87230 Ack=1 Win=3456 Len=1460"
"142","0.141021000","149.43.156.190","192.168.1.12","TCP","1514","80 > 54421 [ACK] Seq=88690 Ack=1 Win=3456 Len=1460"
"143","0.141053000","149.43.156.190","192.168.1.12","TCP","1514","80 > 54421 [ACK] Seq=90150 Ack=1 Win=3456 Len=1460"
"144","0.141100000","192.168.1.12","149.43.156.190","TCP","54","54421 > 80 [ACK] Seq=1 Ack=90934 Win=65335 Len=0"
"145","0.141332000","149.43.156.190","192.168.1.12","TCP","1514","80 > 54421 [ACK] Seq=91610 Ack=1 Win=3456 Len=1460"
"146","0.141348000","192.168.1.12","149.43.156.190","TCP","54","54421 > 80 [ACK] Seq=1 Ack=93070 Win=65335 Len=0"
"147","0.141660000","149.43.156.190","192.168.1.12","TCP","1514","80 > 54421 [ACK] Seq=93070 Ack=1 Win=3456 Len=1460"
"148","0.141990000","149.43.156.190","192.168.1.12","TCP","1514","80 > 54421 [ACK] Seq=94530 Ack=1 Win=3456 Len=1460"
"149","0.142010000","192.168.1.12","149.43.156.190","TCP","54","54421 > 80 [ACK] Seq=1 Ack=95990 Win=65335 Len=0"
"150","0.142304000","149.43.156.190","192.168.1.12","TCP","1514","80 > 54421 [ACK] Seq=95990 Ack=1 Win=3456 Len=1460"
"151","0.144758000","149.43.156.190","192.168.1.12","TCP","1118","80 > 54919 [PSH, ACK] Seq=49285 Ack=1 Win=3456 Len=1064"
"152","0.173790000","149.43.156.190","192.168.1.12","TCP","1514","80 > 54919 [ACK] Seq=50349 Ack=1 Win=3456 Len=1460"
"153","0.173905000","192.168.1.12","149.43.156.190","TCP","54","54919 > 80 [ACK] Seq=1 Ack=51809 Win=65335 Len=0"
"154","0.174745000","149.43.156.190","192.168.1.12","TCP","1514","80 > 54919 [ACK] Seq=51809 Ack=1 Win=3456 Len=1460"
"155","0.177507000","149.43.156.190","192.168.1.12","TCP","1514","80 > 54919 [ACK] Seq=53269 Ack=1 Win=3456 Len=1460"
"156","0.177630000","192.168.1.12","149.43.156.190","TCP","54","54919 > 80 [ACK] Seq=1 Ack=54729 Win=65335 Len=0"
"157","0.180810000","149.43.156.190","192.168.1.12","TCP","1514","80 > 54919 [ACK] Seq=54729 Ack=1 Win=3456 Len=1460"
"158","0.183348000","149.43.156.190","192.168.1.12","TCP","1118","80 > 54421 [PSH, ACK] Seq=97450 Ack=1 Win=3456 Len=1064"
"159","0.183557000","192.168.1.12","149.43.156.190","TCP","54","54421 > 80 [ACK] Seq=1 Ack=98514 Win=65335 Len=0"
"160","0.183727000","149.43.156.190","192.168.1.12","TCP","1514","80 > 54919 [ACK] Seq=56189 Ack=1 Win=3456 Len=1460"
"161","0.183756000","192.168.1.12","149.43.156.190","TCP","54","54919 > 80 [ACK] Seq=1 Ack=57649 Win=65335 Len=0"
"162","0.185913000","149.43.156.190","192.168.1.12","TCP","1514","80 > 54919 [ACK] Seq=57649 Ack=1 Win=3456 Len=1460"
"163","0.186108000","149.43.156.190","192.168.1.12","TCP","1514","80 > 54919 [ACK] Seq=59109 Ack=1 Win=3456 Len=1460"
"164","0.186135000","192.168.1.12","149.43.156.190","TCP","54","54919 > 80 [ACK] Seq=1 Ack=60569 Win=65335 Len=0"
"165","0.186406000","149.43.156.190","192.168.1.12","TCP","1514","80 > 54919 [ACK] Seq=60569 Ack=1 Win=3456 Len=1460"
"166","0.186661000","149.43.156.190","192.168.1.12","TCP","1514","80 > 54919 [ACK] Seq=62029 Ack=1 Win=3456 Len=1460"
"167","0.186688000","192.168.1.12","149.43.156.190","TCP","54","54919 > 80 [ACK] Seq=1 Ack=63489 Win=65335 Len=0"
"168","0.186860000","149.43.156.190","192.168.1.12","TCP","1514","80 > 54919 [ACK] Seq=63489 Ack=1 Win=3456 Len=1460"
"169","0.188249000","149.43.156.190","192.168.1.12","TCP","1514","80 > 54919 [ACK] Seq=64949 Ack=1 Win=3456 Len=1460"
"170","0.188285000","192.168.1.12","149.43.156.190","TCP","54","54919 > 80 [ACK] Seq=1 Ack=66409 Win=65335 Len=0"
"171","0.188757000","149.43.156.190","192.168.1.12","TCP","1514","80 > 54919 [ACK] Seq=66409 Ack=1 Win=3456 Len=1460"
"172","0.188972000","149.43.156.190","192.168.1.12","TCP","1514","80 > 54919 [ACK] Seq=67869 Ack=1 Win=3456 Len=1460"
"173","0.189017000","192.168.1.12","149.43.156.190","TCP","54","54919 > 80 [ACK] Seq=1 Ack=69329 Win=65335 Len=0"
"174","0.189158000","149.43.156.190","192.168.1.12","TCP","1514","80 > 54919 [ACK] Seq=69329 Ack=1 Win=3456 Len=1460"
"175","0.189396000","149.43.156.190","192.168.1.12","TCP","1514","80 > 54919 [ACK] Seq=70789 Ack=1 Win=3456 Len=1460"
"176","0.189451000","192.168.1.12","149.43.156.190","TCP","54","54919 > 80 [ACK] Seq=1 Ack=72249 Win=65335 Len=0"
"177","0.189694000","149.43.156.190","192.168.1.12","TCP","1514","80 > 54919 [ACK] Seq=72249 Ack=1 Win=3456 Len=1460"
"178","0.189877000","149.43.156.190","192.168.1.12","TCP","1514","80 > 54919 [ACK] Seq=73709 Ack=1 Win=3456 Len=1460"
"179","0.189931000","192.168.1.12","149.43.156.190","TCP","54","54919 > 80 [ACK] Seq=1 Ack=75169 Win=65335 Len=0"
"180","0.190511000","149.43.156.190","192.168.1.12","TCP","1514","80 > 54919 [ACK] Seq=75169 Ack=1 Win=3456 Len=1460"
"181","0.191195000","149.43.156.190","192.168.1.12","TCP","1514","80 > 54919 [ACK] Seq=76629 Ack=1 Win=3456 Len=1460"
"182","0.191233000","192.168.1.12","149.43.156.190","TCP","54","54919 > 80 [ACK] Seq=1 Ack=78089 Win=65335 Len=0"
"183","0.191710000","149.43.156.190","192.168.1.12","TCP","1514","80 > 54919 [ACK] Seq=78089 Ack=1 Win=3456 Len=1460"
"184","0.191930000","149.43.156.190","192.168.1.12","TCP","1514","80 > 54919 [ACK] Seq=79549 Ack=1 Win=3456 Len=1460"
"185","0.191958000","192.168.1.12","149.43.156.190","TCP","54","54919 > 80 [ACK] Seq=1 Ack=81009 Win=65335 Len=0"
"186","0.192083000","149.43.156.190","192.168.1.12","TCP","1514","80 > 54919 [ACK] Seq=81009 Ack=1 Win=3456 Len=1460"
"187","0.192334000","149.43.156.190","192.168.1.12","TCP","1514","80 > 54919 [ACK] Seq=82469 Ack=1 Win=3456 Len=1460"
"188","0.192375000","192.168.1.12","149.43.156.190","TCP","54","54919 > 80 [ACK] Seq=1 Ack=83929 Win=65335 Len=0"
"189","0.192567000","149.43.156.190","192.168.1.12","TCP","1514","80 > 54919 [ACK] Seq=83929 Ack=1 Win=3456 Len=1460"
"190","0.192956000","149.43.156.190","192.168.1.12","TCP","1514","80 > 54919 [ACK] Seq=85389 Ack=1 Win=3456 Len=1460"
"191","0.192993000","192.168.1.12","149.43.156.190","TCP","54","54919 > 80 [ACK] Seq=1 Ack=86849 Win=65335 Len=0"
"192","0.193197000","149.43.156.190","192.168.1.12","TCP","1514","80 > 54919 [ACK] Seq=86849 Ack=1 Win=3456 Len=1460"
"193","0.193932000","149.43.156.190","192.168.1.12","TCP","1514","80 > 54919 [ACK] Seq=88309 Ack=1 Win=3456 Len=1460"
"194","0.193987000","192.168.1.12","149.43.156.190","TCP","54","54919 > 80 [ACK] Seq=1 Ack=89769 Win=65335 Len=0"
"195","0.194182000","149.43.156.190","192.168.1.12","TCP","1514","80 > 54919 [ACK] Seq=89769 Ack=1 Win=3456 Len=1460"
"196","0.194423000","149.43.156.190","192.168.1.12","TCP","1514","80 > 54919 [ACK] Seq=91229 Ack=1 Win=3456 Len=1460"
"197","0.194473000","192.168.1.12","149.43.156.190","TCP","54","54919 > 80 [ACK] Seq=1 Ack=92689 Win=65335 Len=0"
"198","0.194719000","149.43.156.190","192.168.1.12","TCP","1514","80 > 54919 [ACK] Seq=92689 Ack=1 Win=3456 Len=1460"
"199","0.195380000","149.43.156.190","192.168.1.12","TCP","1514","80 > 54919 [ACK] Seq=94149 Ack=1 Win=3456 Len=1460"
"200","0.195435000","192.168.1.12","149.43.156.190","TCP","54","54919 > 80 [ACK] Seq=1 Ack=95609 Win=65335 Len=0"
"201","0.195705000","149.43.156.190","192.168.1.12","TCP","1514","80 > 54919 [ACK] Seq=95609 Ack=1 Win=3456 Len=1460"
"202","0.196077000","149.43.156.190","192.168.1.12","TCP","1514","80 > 54919 [ACK] Seq=97069 Ack=1 Win=3456 Len=1460"
"203","0.196112000","192.168.1.12","149.43.156.190","TCP","54","54919 > 80 [ACK] Seq=1 Ack=98529 Win=65335 Len=0"
"204","0.224337000","149.43.156.190","192.168.1.12","TCP","1514","80 > 54421 [ACK] Seq=98514 Ack=1 Win=3456 Len=1460"
"205","0.224718000","149.43.156.190","192.168.1.12","TCP","1514","80 > 54421 [ACK] Seq=99974 Ack=1 Win=3456 Len=1460"
"206","0.224751000","192.168.1.12","149.43.156.190","TCP","54","54421 > 80 [ACK] Seq=1 Ack=101434 Win=65335 Len=0"
"207","0.225448000","149.43.156.190","192.168.1.12","TCP","1514","80 > 54421 [ACK] Seq=101434 Ack=1 Win=3456 Len=1460"
"208","0.225967000","149.43.156.190","192.168.1.12","TCP","1514","80 > 54421 [ACK] Seq=102894 Ack=1 Win=3456 Len=1460"
"209","0.225990000","192.168.1.12","149.43.156.190","TCP","54","54421 > 80 [ACK] Seq=1 Ack=104354 Win=65335 Len=0"
"210","0.226386000","149.43.156.190","192.168.1.12","TCP","1514","80 > 54421 [ACK] Seq=104354 Ack=1 Win=3456 Len=1460"
"211","0.227303000","149.43.156.190","192.168.1.12","TCP","1514","80 > 54421 [ACK] Seq=105814 Ack=1 Win=3456 Len=1460"
"212","0.227325000","192.168.1.12","149.43.156.190","TCP","54","54421 > 80 [ACK] Seq=1 Ack=107274 Win=65335 Len=0"
"213","0.227744000","149.43.156.190","192.168.1.12","TCP","1514","80 > 54421 [ACK] Seq=107274 Ack=1 Win=3456 Len=1460"
"214","0.228386000","149.43.156.190","192.168.1.12","TCP","1514","80 > 54421 [ACK] Seq=108734 Ack=1 Win=3456 Len=1460"
"215","0.228432000","192.168.1.12","149.43.156.190","TCP","54","54421 > 80 [ACK] Seq=1 Ack=110194 Win=65335 Len=0"
"216","0.228621000","149.43.156.190","192.168.1.12","TCP","1514","80 > 54421 [ACK] Seq=110194 Ack=1 Win=3456 Len=1460"
"217","0.229102000","149.43.156.190","192.168.1.12","TCP","1514","80 > 54421 [ACK] Seq=111654 Ack=1 Win=3456 Len=1460"
"218","0.229235000","192.168.1.12","149.43.156.190","TCP","54","54421 > 80 [ACK] Seq=1 Ack=113114 Win=65335 Len=0"
"219","0.229946000","149.43.156.190","192.168.1.12","TCP","1514","80 > 54421 [ACK] Seq=113114 Ack=1 Win=3456 Len=1460"
"220","0.230790000","149.43.156.190","192.168.1.12","TCP","1246","80 > 54919 [PSH, ACK] Seq=98529 Ack=1 Win=3456 Len=1192"
"221","0.231640000","149.43.156.190","192.168.1.12","TCP","1514","80 > 54421 [ACK] Seq=114574 Ack=1 Win=3456 Len=1460"
"222","0.231683000","192.168.1.12","149.43.156.190","TCP","54","54421 > 80 [ACK] Seq=1 Ack=116034 Win=65335 Len=0"
"223","0.237770000","149.43.156.190","192.168.1.12","TCP","1514","80 > 54421 [ACK] Seq=116034 Ack=1 Win=3456 Len=1460"
"224","0.238098000","149.43.156.190","192.168.1.12","TCP","1514","80 > 54421 [ACK] Seq=117494 Ack=1 Win=3456 Len=1460"
"225","0.238196000","192.168.1.12","149.43.156.190","TCP","54","54421 > 80 [ACK] Seq=1 Ack=118954 Win=65335 Len=0"
"226","0.238493000","149.43.156.190","192.168.1.12","TCP","1514","80 > 54421 [ACK] Seq=118954 Ack=1 Win=3456 Len=1460"
"227","0.238774000","149.43.156.190","192.168.1.12","TCP","1514","80 > 54421 [ACK] Seq=120414 Ack=1 Win=3456 Len=1460"
"228","0.238799000","192.168.1.12","149.43.156.190","TCP","54","54421 > 80 [ACK] Seq=1 Ack=121874 Win=65335 Len=0"
"229","0.238909000","149.43.156.190","192.168.1.12","TCP","1514","80 > 54421 [ACK] Seq=121874 Ack=1 Win=3456 Len=1460"
"230","0.239222000","149.43.156.190","192.168.1.12","TCP","1514","80 > 54421 [ACK] Seq=123334 Ack=1 Win=3456 Len=1460"
"231","0.239278000","192.168.1.12","149.43.156.190","TCP","54","54421 > 80 [ACK] Seq=1 Ack=124794 Win=65335 Len=0"
"232","0.239773000","149.43.156.190","192.168.1.12","TCP","1514","80 > 54421 [ACK] Seq=124794 Ack=1 Win=3456 Len=1460"
"233","0.240460000","149.43.156.190","192.168.1.12","TCP","1514","80 > 54421 [ACK] Seq=126254 Ack=1 Win=3456 Len=1460"
"234","0.240617000","192.168.1.12","149.43.156.190","TCP","54","54421 > 80 [ACK] Seq=1 Ack=127714 Win=65335 Len=0"
"235","0.240852000","149.43.156.190","192.168.1.12","TCP","1514","80 > 54421 [ACK] Seq=127714 Ack=1 Win=3456 Len=1460"
"236","0.241078000","149.43.156.190","192.168.1.12","TCP","1514","80 > 54421 [ACK] Seq=129174 Ack=1 Win=3456 Len=1460"
"237","0.241174000","192.168.1.12","149.43.156.190","TCP","54","54421 > 80 [ACK] Seq=1 Ack=130634 Win=65335 Len=0"
"238","0.241340000","149.43.156.190","192.168.1.12","TCP","1514","80 > 54421 [ACK] Seq=130634 Ack=1 Win=3456 Len=1460"
"239","0.241641000","149.43.156.190","192.168.1.12","TCP","1514","80 > 54421 [ACK] Seq=132094 Ack=1 Win=3456 Len=1460"
"240","0.241684000","192.168.1.12","149.43.156.190","TCP","54","54421 > 80 [ACK] Seq=1 Ack=133554 Win=65335 Len=0"
"241","0.241811000","149.43.156.190","192.168.1.12","TCP","1514","80 > 54421 [ACK] Seq=133554 Ack=1 Win=3456 Len=1460"
"242","0.242127000","149.43.156.190","192.168.1.12","TCP","1514","80 > 54421 [ACK] Seq=135014 Ack=1 Win=3456 Len=1460"
"243","0.242211000","192.168.1.12","149.43.156.190","TCP","54","54421 > 80 [ACK] Seq=1 Ack=136474 Win=65335 Len=0"
"244","0.242324000","149.43.156.190","192.168.1.12","TCP","1514","80 > 54421 [ACK] Seq=136474 Ack=1 Win=3456 Len=1460"
"245","0.242668000","149.43.156.190","192.168.1.12","TCP","1514","80 > 54421 [ACK] Seq=137934 Ack=1 Win=3456 Len=1460"
"246","0.242699000","192.168.1.12","149.43.156.190","TCP","54","54421 > 80 [ACK] Seq=1 Ack=139394 Win=65335 Len=0"
"247","0.243782000","149.43.156.190","192.168.1.12","TCP","1514","80 > 54421 [ACK] Seq=139394 Ack=1 Win=3456 Len=1460"
"248","0.246090000","149.43.156.190","192.168.1.12","TCP","1514","80 > 54421 [ACK] Seq=140854 Ack=1 Win=3456 Len=1460"
"249","0.246174000","192.168.1.12","149.43.156.190","TCP","54","54421 > 80 [ACK] Seq=1 Ack=142314 Win=65335 Len=0"
"250","0.246327000","149.43.156.190","192.168.1.12","TCP","1514","80 > 54421 [ACK] Seq=142314 Ack=1 Win=3456 Len=1460"
"251","0.246521000","149.43.156.190","192.168.1.12","TCP","1514","80 > 54421 [ACK] Seq=143774 Ack=1 Win=3456 Len=1460"
"252","0.246737000","192.168.1.12","149.43.156.190","TCP","54","54421 > 80 [ACK] Seq=1 Ack=145234 Win=65335 Len=0"
"253","0.246849000","149.43.156.190","192.168.1.12","TCP","1514","80 > 54421 [ACK] Seq=145234 Ack=1 Win=3456 Len=1460"
"254","0.270071000","149.43.156.190","192.168.1.12","TCP","1223","80 > 54421 [PSH, ACK] Seq=146694 Ack=1 Win=3456 Len=1169"
"255","0.270146000","192.168.1.12","149.43.156.190","TCP","54","54421 > 80 [ACK] Seq=1 Ack=147863 Win=65335 Len=0"
"256","0.276259000","149.43.156.190","192.168.1.12","TCP","1514","80 > 54919 [ACK] Seq=99721 Ack=1 Win=3456 Len=1460"
"257","0.276305000","192.168.1.12","149.43.156.190","TCP","54","54919 > 80 [ACK] Seq=1 Ack=101181 Win=65335 Len=0"
"258","0.276802000","149.43.156.190","192.168.1.12","TCP","1514","80 > 54919 [ACK] Seq=101181 Ack=1 Win=3456 Len=1460"
"259","0.277100000","149.43.156.190","192.168.1.12","TCP","1514","80 > 54919 [ACK] Seq=102641 Ack=1 Win=3456 Len=1460"
"260","0.277148000","192.168.1.12","149.43.156.190","TCP","54","54919 > 80 [ACK] Seq=1 Ack=104101 Win=65335 Len=0"
"261","0.277380000","149.43.156.190","192.168.1.12","TCP","1514","80 > 54919 [ACK] Seq=104101 Ack=1 Win=3456 Len=1460"
"262","0.277767000","149.43.156.190","192.168.1.12","TCP","1514","80 > 54919 [ACK] Seq=105561 Ack=1 Win=3456 Len=1460"
"263","0.277825000","192.168.1.12","149.43.156.190","TCP","54","54919 > 80 [ACK] Seq=1 Ack=107021 Win=65335 Len=0"
"264","0.278348000","149.43.156.190","192.168.1.12","TCP","1514","80 > 54919 [ACK] Seq=107021 Ack=1 Win=3456 Len=1460"
"265","0.278800000","149.43.156.190","192.168.1.12","TCP","1514","80 > 54919 [ACK] Seq=108481 Ack=1 Win=3456 Len=1460"
"266","0.278845000","192.168.1.12","149.43.156.190","TCP","54","54919 > 80 [ACK] Seq=1 Ack=109941 Win=65335 Len=0"
"267","0.279372000","149.43.156.190","192.168.1.12","TCP","1514","80 > 54919 [ACK] Seq=109941 Ack=1 Win=3456 Len=1460"
"268","0.280547000","149.43.156.190","192.168.1.12","TCP","1514","80 > 54919 [ACK] Seq=111401 Ack=1 Win=3456 Len=1460"
"269","0.280591000","192.168.1.12","149.43.156.190","TCP","54","54919 > 80 [ACK] Seq=1 Ack=112861 Win=65335 Len=0"
"270","0.280801000","149.43.156.190","192.168.1.12","TCP","1514","80 > 54919 [ACK] Seq=112861 Ack=1 Win=3456 Len=1460"
"271","0.281526000","149.43.156.190","192.168.1.12","TCP","1514","80 > 54919 [ACK] Seq=114321 Ack=1 Win=3456 Len=1460"
"272","0.281561000","192.168.1.12","149.43.156.190","TCP","54","54919 > 80 [ACK] Seq=1 Ack=115781 Win=65335 Len=0"
"273","0.282017000","149.43.156.190","192.168.1.12","TCP","1514","80 > 54919 [ACK] Seq=115781 Ack=1 Win=3456 Len=1460"
"274","0.282568000","149.43.156.190","192.168.1.12","TCP","1514","80 > 54919 [ACK] Seq=117241 Ack=1 Win=3456 Len=1460"
"275","0.282609000","192.168.1.12","149.43.156.190","TCP","54","54919 > 80 [ACK] Seq=1 Ack=118701 Win=65335 Len=0"
"276","0.285816000","149.43.156.190","192.168.1.12","TCP","1514","80 > 54919 [ACK] Seq=118701 Ack=1 Win=3456 Len=1460"
"277","0.286183000","149.43.156.190","192.168.1.12","TCP","1514","80 > 54919 [ACK] Seq=120161 Ack=1 Win=3456 Len=1460"
"278","0.286234000","192.168.1.12","149.43.156.190","TCP","54","54919 > 80 [ACK] Seq=1 Ack=121621 Win=65335 Len=0"
"279","0.289405000","149.43.156.190","192.168.1.12","TCP","1514","80 > 54919 [ACK] Seq=121621 Ack=1 Win=3456 Len=1460"
"280","0.290353000","149.43.156.190","192.168.1.12","TCP","1514","80 > 54919 [ACK] Seq=123081 Ack=1 Win=3456 Len=1460"
"281","0.290405000","192.168.1.12","149.43.156.190","TCP","54","54919 > 80 [ACK] Seq=1 Ack=124541 Win=65335 Len=0"
"282","0.291001000","149.43.156.190","192.168.1.12","TCP","1514","80 > 54919 [ACK] Seq=124541 Ack=1 Win=3456 Len=1460"
"283","0.291417000","149.43.156.190","192.168.1.12","TCP","1514","80 > 54919 [ACK] Seq=126001 Ack=1 Win=3456 Len=1460"
"284","0.291452000","192.168.1.12","149.43.156.190","TCP","54","54919 > 80 [ACK] Seq=1 Ack=127461 Win=65335 Len=0"
"285","0.291641000","149.43.156.190","192.168.1.12","TCP","1514","80 > 54919 [ACK] Seq=127461 Ack=1 Win=3456 Len=1460"
"286","0.291853000","149.43.156.190","192.168.1.12","TCP","1514","80 > 54919 [ACK] Seq=128921 Ack=1 Win=3456 Len=1460"
"287","0.291892000","192.168.1.12","149.43.156.190","TCP","54","54919 > 80 [ACK] Seq=1 Ack=130381 Win=65335 Len=0"
"288","0.292104000","149.43.156.190","192.168.1.12","TCP","1514","80 > 54919 [ACK] Seq=130381 Ack=1 Win=3456 Len=1460"
"289","0.292390000","149.43.156.190","192.168.1.12","TCP","1514","80 > 54919 [ACK] Seq=131841 Ack=1 Win=3456 Len=1460"
"290","0.292428000","192.168.1.12","149.43.156.190","TCP","54","54919 > 80 [ACK] Seq=1 Ack=133301 Win=65335 Len=0"
"291","0.292718000","149.43.156.190","192.168.1.12","TCP","1514","80 > 54919 [ACK] Seq=133301 Ack=1 Win=3456 Len=1460"
"292","0.292871000","149.43.156.190","192.168.1.12","TCP","1514","80 > 54919 [ACK] Seq=134761 Ack=1 Win=3456 Len=1460"
"293","0.292911000","192.168.1.12","149.43.156.190","TCP","54","54919 > 80 [ACK] Seq=1 Ack=136221 Win=65335 Len=0"
"294","0.293084000","149.43.156.190","192.168.1.12","TCP","1514","80 > 54919 [ACK] Seq=136221 Ack=1 Win=3456 Len=1460"
"295","0.293327000","149.43.156.190","192.168.1.12","TCP","1514","80 > 54919 [ACK] Seq=137681 Ack=1 Win=3456 Len=1460"
"296","0.293426000","192.168.1.12","149.43.156.190","TCP","54","54919 > 80 [ACK] Seq=1 Ack=139141 Win=65335 Len=0"
"297","0.293681000","149.43.156.190","192.168.1.12","TCP","1514","80 > 54919 [ACK] Seq=139141 Ack=1 Win=3456 Len=1460"
"298","0.294002000","149.43.156.190","192.168.1.12","TCP","1514","80 > 54919 [ACK] Seq=140601 Ack=1 Win=3456 Len=1460"
"299","0.294101000","192.168.1.12","149.43.156.190","TCP","54","54919 > 80 [ACK] Seq=1 Ack=142061 Win=65335 Len=0"
"300","0.294556000","149.43.156.190","192.168.1.12","TCP","1514","80 > 54919 [ACK] Seq=142061 Ack=1 Win=3456 Len=1460"
"301","0.294853000","149.43.156.190","192.168.1.12","TCP","1514","80 > 54919 [ACK] Seq=143521 Ack=1 Win=3456 Len=1460"
"302","0.294964000","192.168.1.12","149.43.156.190","TCP","54","54919 > 80 [ACK] Seq=1 Ack=144981 Win=65335 Len=0"
"303","0.295127000","149.43.156.190","192.168.1.12","TCP","1514","80 > 54919 [ACK] Seq=144981 Ack=1 Win=3456 Len=1460"
"304","0.295305000","149.43.156.190","192.168.1.12","TCP","1514","80 > 54919 [ACK] Seq=146441 Ack=1 Win=3456 Len=1460"
"305","0.295347000","192.168.1.12","149.43.156.190","TCP","54","54919 > 80 [ACK] Seq=1 Ack=147901 Win=65335 Len=0"
"306","0.320821000","149.43.156.190","192.168.1.12","TCP","1176","80 > 54919 [PSH, ACK] Seq=147901 Ack=1 Win=3456 Len=1122"
"307","0.326093000","149.43.156.190","192.168.1.12","TCP","1514","80 > 54421 [ACK] Seq=147863 Ack=1 Win=3456 Len=1460"
"308","0.327315000","149.43.156.190","192.168.1.12","TCP","1514","80 > 54421 [ACK] Seq=149323 Ack=1 Win=3456 Len=1460"
"309","0.327356000","192.168.1.12","149.43.156.190","TCP","54","54421 > 80 [ACK] Seq=1 Ack=150783 Win=65335 Len=0"
"310","0.327739000","149.43.156.190","192.168.1.12","TCP","1514","80 > 54421 [ACK] Seq=150783 Ack=1 Win=3456 Len=1460"
"311","0.328400000","149.43.156.190","192.168.1.12","TCP","1514","80 > 54421 [ACK] Seq=152243 Ack=1 Win=3456 Len=1460"
"312","0.328438000","192.168.1.12","149.43.156.190","TCP","54","54421 > 80 [ACK] Seq=1 Ack=153703 Win=65335 Len=0"
"313","0.328759000","149.43.156.190","192.168.1.12","TCP","1514","80 > 54421 [ACK] Seq=153703 Ack=1 Win=3456 Len=1460"
"314","0.328940000","149.43.156.190","192.168.1.12","TCP","1514","80 > 54421 [ACK] Seq=155163 Ack=1 Win=3456 Len=1460"
"315","0.328978000","192.168.1.12","149.43.156.190","TCP","54","54421 > 80 [ACK] Seq=1 Ack=156623 Win=65335 Len=0"
"316","0.329412000","149.43.156.190","192.168.1.12","TCP","1514","80 > 54421 [ACK] Seq=156623 Ack=1 Win=3456 Len=1460"
"317","0.330316000","149.43.156.190","192.168.1.12","TCP","1514","80 > 54421 [ACK] Seq=158083 Ack=1 Win=3456 Len=1460"
"318","0.330484000","192.168.1.12","149.43.156.190","TCP","54","54421 > 80 [ACK] Seq=1 Ack=159543 Win=65335 Len=0"
"319","0.331266000","149.43.156.190","192.168.1.12","TCP","1514","80 > 54421 [ACK] Seq=159543 Ack=1 Win=3456 Len=1460"
"320","0.331705000","149.43.156.190","192.168.1.12","TCP","1514","80 > 54421 [ACK] Seq=161003 Ack=1 Win=3456 Len=1460"
"321","0.331754000","192.168.1.12","149.43.156.190","TCP","54","54421 > 80 [ACK] Seq=1 Ack=162463 Win=65335 Len=0"
"322","0.331926000","149.43.156.190","192.168.1.12","TCP","1514","80 > 54421 [ACK] Seq=162463 Ack=1 Win=3456 Len=1460"
"323","0.333790000","149.43.156.190","192.168.1.12","TCP","1514","80 > 54421 [ACK] Seq=163923 Ack=1 Win=3456 Len=1460"
"324","0.333838000","192.168.1.12","149.43.156.190","TCP","54","54421 > 80 [ACK] Seq=1 Ack=165383 Win=65335 Len=0"
"325","0.334963000","149.43.156.190","192.168.1.12","TCP","1514","80 > 54421 [ACK] Seq=165383 Ack=1 Win=3456 Len=1460"
"326","0.335409000","149.43.156.190","192.168.1.12","TCP","1514","80 > 54421 [ACK] Seq=166843 Ack=1 Win=3456 Len=1460"
"327","0.335474000","192.168.1.12","149.43.156.190","TCP","54","54421 > 80 [ACK] Seq=1 Ack=168303 Win=65335 Len=0"
"328","0.335887000","149.43.156.190","192.168.1.12","TCP","1514","80 > 54421 [ACK] Seq=168303 Ack=1 Win=3456 Len=1460"
"329","0.336239000","149.43.156.190","192.168.1.12","TCP","1514","80 > 54421 [ACK] Seq=169763 Ack=1 Win=3456 Len=1460"
"330","0.336277000","192.168.1.12","149.43.156.190","TCP","54","54421 > 80 [ACK] Seq=1 Ack=171223 Win=65335 Len=0"
"331","0.336443000","149.43.156.190","192.168.1.12","TCP","1514","80 > 54421 [ACK] Seq=171223 Ack=1 Win=3456 Len=1460"
"332","0.337268000","149.43.156.190","192.168.1.12","TCP","1514","80 > 54421 [ACK] Seq=172683 Ack=1 Win=3456 Len=1460"
"333","0.337302000","192.168.1.12","149.43.156.190","TCP","54","54421 > 80 [ACK] Seq=1 Ack=174143 Win=65335 Len=0"
"334","0.340453000","149.43.156.190","192.168.1.12","TCP","1514","80 > 54421 [ACK] Seq=174143 Ack=1 Win=3456 Len=1460"
"335","0.340976000","149.43.156.190","192.168.1.12","TCP","1514","80 > 54421 [ACK] Seq=175603 Ack=1 Win=3456 Len=1460"
"336","0.341037000","192.168.1.12","149.43.156.190","TCP","54","54421 > 80 [ACK] Seq=1 Ack=177063 Win=65335 Len=0"
"337","0.341697000","149.43.156.190","192.168.1.12","TCP","1514","80 > 54421 [ACK] Seq=177063 Ack=1 Win=3456 Len=1460"
"338","0.342327000","149.43.156.190","192.168.1.12","TCP","1514","80 > 54421 [ACK] Seq=178523 Ack=1 Win=3456 Len=1460"
"339","0.342403000","192.168.1.12","149.43.156.190","TCP","54","54421 > 80 [ACK] Seq=1 Ack=179983 Win=65335 Len=0"
"340","0.342536000","149.43.156.190","192.168.1.12","TCP","1514","80 > 54421 [ACK] Seq=179983 Ack=1 Win=3456 Len=1460"
