"No.","Time","Source","Destination","Protocol","Length","Info"
"1","0.000000000","193.138.213.160","192.168.1.5","TCP","1078","80 > 55531 [PSH, ACK] Seq=1 Ack=1 Win=2920 Len=1024"
"3","0.016000000","193.138.213.160","192.168.1.5","TCP","1078","80 > 55531 [PSH, ACK] Seq=1025 Ack=1 Win=2920 Len=1024"
"4","0.019451000","193.138.213.160","192.168.1.5","TCP","1078","80 > 55531 [PSH, ACK] Seq=2049 Ack=1 Win=2920 Len=1024"
"6","0.027376000","193.138.213.160","192.168.1.5","TCP","1078","80 > 55531 [PSH, ACK] Seq=3073 Ack=1 Win=2920 Len=1024"
"7","0.030605000","193.138.213.160","192.168.1.5","TCP","1078","80 > 55531 [PSH, ACK] Seq=4097 Ack=1 Win=2920 Len=1024"
"9","0.060002000","193.138.213.160","192.168.1.5","TCP","1078","80 > 55531 [PSH, ACK] Seq=5121 Ack=1 Win=2920 Len=1024"
"10","0.072004000","193.138.213.160","192.168.1.5","TCP","1078","80 > 55531 [PSH, ACK] Seq=6145 Ack=1 Win=2920 Len=1024"
"12","0.092075000","193.138.213.160","192.168.1.5","TCP","1078","80 > 55531 [PSH, ACK] Seq=7169 Ack=1 Win=2920 Len=1024"
"13","0.134004000","193.138.213.160","192.168.1.5","TCP","288","80 > 55531 [ACK] Seq=8193 Ack=1 Win=2920 Len=234"
"15","0.136000000","193.138.213.160","192.168.1.5","TCP","121","80 > 55531 [ACK] Seq=8427 Ack=1 Win=2920 Len=67"
"16","0.139000000","193.138.213.160","192.168.1.5","TCP","1078","80 > 55531 [PSH, ACK] Seq=8494 Ack=1 Win=2920 Len=1024"
"18","0.157008000","193.138.213.160","192.168.1.5","TCP","1078","80 > 55531 [PSH, ACK] Seq=9518 Ack=1 Win=2920 Len=1024"
"19","0.163729000","193.138.213.160","192.168.1.5","TCP","1078","80 > 55531 [PSH, ACK] Seq=10542 Ack=1 Win=2920 Len=1024"
"21","0.181621000","193.138.213.160","192.168.1.5","TCP","1078","80 > 55531 [PSH, ACK] Seq=11566 Ack=1 Win=2920 Len=1024"
"22","0.189906000","193.138.213.160","192.168.1.5","TCP","1078","80 > 55531 [PSH, ACK] Seq=12590 Ack=1 Win=2920 Len=1024"
"24","0.200891000","193.138.213.160","192.168.1.5","TCP","1078","80 > 55531 [PSH, ACK] Seq=13614 Ack=1 Win=2920 Len=1024"
"25","0.226004000","193.138.213.160","192.168.1.5","TCP","1078","80 > 55531 [PSH, ACK] Seq=14638 Ack=1 Win=2920 Len=1024"
"27","0.235619000","193.138.213.160","192.168.1.5","TCP","1078","80 > 55531 [PSH, ACK] Seq=15662 Ack=1 Win=2920 Len=1024"
"28","0.249006000","193.138.213.160","192.168.1.5","TCP","1078","80 > 55531 [PSH, ACK] Seq=16686 Ack=1 Win=2920 Len=1024"
"30","0.262003000","193.138.213.160","192.168.1.5","TCP","1078","80 > 55531 [PSH, ACK] Seq=17710 Ack=1 Win=2920 Len=1024"
"31","0.269208000","193.138.213.160","192.168.1.5","TCP","1078","80 > 55531 [PSH, ACK] Seq=18734 Ack=1 Win=2920 Len=1024"
"33","0.285003000","193.138.213.160","192.168.1.5","TCP","1078","80 > 55531 [PSH, ACK] Seq=19758 Ack=1 Win=2920 Len=1024"
"34","0.290638000","193.138.213.160","192.168.1.5","TCP","1078","80 > 55531 [PSH, ACK] Seq=20782 Ack=1 Win=2920 Len=1024"
"36","0.300900000","193.138.213.160","192.168.1.5","TCP","1078","80 > 55531 [PSH, ACK] Seq=21806 Ack=1 Win=2920 Len=1024"
"37","0.313009000","193.138.213.160","192.168.1.5","TCP","1078","80 > 55531 [PSH, ACK] Seq=22830 Ack=1 Win=2920 Len=1024"
"39","0.321133000","193.138.213.160","192.168.1.5","TCP","1078","80 > 55531 [PSH, ACK] Seq=23854 Ack=1 Win=2920 Len=1024"
"40","0.336004000","193.138.213.160","192.168.1.5","TCP","1078","80 > 55531 [PSH, ACK] Seq=24878 Ack=1 Win=2920 Len=1024"
"42","0.356694000","193.138.213.160","192.168.1.5","TCP","1078","80 > 55531 [PSH, ACK] Seq=25902 Ack=1 Win=2920 Len=1024"
"43","0.369189000","193.138.213.160","192.168.1.5","TCP","1078","80 > 55531 [PSH, ACK] Seq=26926 Ack=1 Win=2920 Len=1024"
"45","0.381597000","193.138.213.160","192.168.1.5","TCP","1078","80 > 55531 [PSH, ACK] Seq=27950 Ack=1 Win=2920 Len=1024"
"46","0.402004000","193.138.213.160","192.168.1.5","TCP","1078","80 > 55531 [PSH, ACK] Seq=28974 Ack=1 Win=2920 Len=1024"
"48","0.414882000","193.138.213.160","192.168.1.5","TCP","1078","80 > 55531 [PSH, ACK] Seq=29998 Ack=1 Win=2920 Len=1024"
"49","0.422004000","193.138.213.160","192.168.1.5","TCP","1078","80 > 55531 [PSH, ACK] Seq=31022 Ack=1 Win=2920 Len=1024"
"51","0.427010000","193.138.213.160","192.168.1.5","TCP","1078","80 > 55531 [PSH, ACK] Seq=32046 Ack=1 Win=2920 Len=1024"
"52","0.436006000","193.138.213.160","192.168.1.5","TCP","1078","80 > 55531 [PSH, ACK] Seq=33070 Ack=1 Win=2920 Len=1024"
"54","0.446020000","193.138.213.160","192.168.1.5","TCP","1078","80 > 55531 [PSH, ACK] Seq=34094 Ack=1 Win=2920 Len=1024"
"55","0.466006000","193.138.213.160","192.168.1.5","TCP","1078","80 > 55531 [PSH, ACK] Seq=35118 Ack=1 Win=2920 Len=1024"
"57","0.473009000","193.138.213.160","192.168.1.5","TCP","1078","80 > 55531 [PSH, ACK] Seq=36142 Ack=1 Win=2920 Len=1024"
"58","0.489006000","193.138.213.160","192.168.1.5","TCP","1078","80 > 55531 [PSH, ACK] Seq=37166 Ack=1 Win=2920 Len=1024"
"60","0.502005000","193.138.213.160","192.168.1.5","TCP","1078","80 > 55531 [PSH, ACK] Seq=38190 Ack=1 Win=2920 Len=1024"
"61","0.516008000","193.138.213.160","192.168.1.5","TCP","1078","80 > 55531 [PSH, ACK] Seq=39214 Ack=1 Win=2920 Len=1024"
"63","0.559008000","193.138.213.160","192.168.1.5","TCP","393","80 > 55531 [ACK] Seq=40238 Ack=1 Win=2920 Len=339"
"64","0.560264000","193.138.213.160","192.168.1.5","TCP","1078","80 > 55531 [PSH, ACK] Seq=40577 Ack=1 Win=2920 Len=1024"
"66","0.586496000","193.138.213.160","192.168.1.5","TCP","1078","80 > 55531 [PSH, ACK] Seq=41601 Ack=1 Win=2920 Len=1024"
"67","0.602145000","193.138.213.160","192.168.1.5","TCP","1078","80 > 55531 [PSH, ACK] Seq=42625 Ack=1 Win=2920 Len=1024"
"69","0.616655000","193.138.213.160","192.168.1.5","TCP","1078","80 > 55531 [PSH, ACK] Seq=43649 Ack=1 Win=2920 Len=1024"
"70","0.622864000","193.138.213.160","192.168.1.5","TCP","1078","80 > 55531 [PSH, ACK] Seq=44673 Ack=1 Win=2920 Len=1024"
"72","0.625674000","193.138.213.160","192.168.1.5","TCP","1078","80 > 55531 [PSH, ACK] Seq=45697 Ack=1 Win=2920 Len=1024"
"73","0.633852000","193.138.213.160","192.168.1.5","TCP","1078","80 > 55531 [PSH, ACK] Seq=46721 Ack=1 Win=2920 Len=1024"
"75","0.649010000","193.138.213.160","192.168.1.5","TCP","1078","80 > 55531 [PSH, ACK] Seq=47745 Ack=1 Win=2920 Len=1024"
"76","0.665009000","193.138.213.160","192.168.1.5","TCP","1078","80 > 55531 [PSH, ACK] Seq=48769 Ack=1 Win=2920 Len=1024"
"78","0.678005000","193.138.213.160","192.168.1.5","TCP","1078","80 > 55531 [PSH, ACK] Seq=49793 Ack=1 Win=2920 Len=1024"
"79","0.698728000","193.138.213.160","192.168.1.5","TCP","1078","80 > 55531 [PSH, ACK] Seq=50817 Ack=1 Win=2920 Len=1024"
"81","0.717009000","193.138.213.160","192.168.1.5","TCP","1078","80 > 55531 [PSH, ACK] Seq=51841 Ack=1 Win=2920 Len=1024"
"82","0.728160000","193.138.213.160","192.168.1.5","TCP","1078","80 > 55531 [PSH, ACK] Seq=52865 Ack=1 Win=2920 Len=1024"
"84","0.734891000","193.138.213.160","192.168.1.5","TCP","1078","80 > 55531 [PSH, ACK] Seq=53889 Ack=1 Win=2920 Len=1024"
"85","0.753010000","193.138.213.160","192.168.1.5","TCP","1078","80 > 55531 [PSH, ACK] Seq=54913 Ack=1 Win=2920 Len=1024"
"87","0.760008000","193.138.213.160","192.168.1.5","TCP","1078","80 > 55531 [PSH, ACK] Seq=55937 Ack=1 Win=2920 Len=1024"
"88","0.765849000","193.138.213.160","192.168.1.5","TCP","1078","80 > 55531 [PSH, ACK] Seq=56961 Ack=1 Win=2920 Len=1024"
"90","0.771320000","193.138.213.160","192.168.1.5","TCP","1078","80 > 55531 [PSH, ACK] Seq=57985 Ack=1 Win=2920 Len=1024"
"91","0.791353000","193.138.213.160","192.168.1.5","TCP","1078","80 > 55531 [PSH, ACK] Seq=59009 Ack=1 Win=2920 Len=1024"
"93","0.798138000","193.138.213.160","192.168.1.5","TCP","1078","80 > 55531 [PSH, ACK] Seq=60033 Ack=1 Win=2920 Len=1024"
"94","0.833011000","193.138.213.160","192.168.1.5","TCP","1078","80 > 55531 [PSH, ACK] Seq=61057 Ack=1 Win=2920 Len=1024"
"96","0.847015000","193.138.213.160","192.168.1.5","TCP","1078","80 > 55531 [PSH, ACK] Seq=62081 Ack=1 Win=2920 Len=1024"
"97","0.853010000","193.138.213.160","192.168.1.5","TCP","1078","80 > 55531 [PSH, ACK] Seq=63105 Ack=1 Win=2920 Len=1024"
"99","0.858818000","193.138.213.160","192.168.1.5","TCP","1078","80 > 55531 [PSH, ACK] Seq=64129 Ack=1 Win=2920 Len=1024"
"100","0.871012000","193.138.213.160","192.168.1.5","TCP","1078","80 > 55531 [PSH, ACK] Seq=65153 Ack=1 Win=2920 Len=1024"
"102","0.886011000","193.138.213.160","192.168.1.5","TCP","1078","80 > 55531 [PSH, ACK] Seq=66177 Ack=1 Win=2920 Len=1024"
"103","0.894010000","193.138.213.160","192.168.1.5","TCP","1078","80 > 55531 [PSH, ACK] Seq=67201 Ack=1 Win=2920 Len=1024"
"105","0.899011000","193.138.213.160","192.168.1.5","TCP","1078","80 > 55531 [PSH, ACK] Seq=68225 Ack=1 Win=2920 Len=1024"
"106","0.912013000","193.138.213.160","192.168.1.5","TCP","1078","80 > 55531 [PSH, ACK] Seq=69249 Ack=1 Win=2920 Len=1024"
"108","0.931010000","193.138.213.160","192.168.1.5","TCP","1078","80 > 55531 [PSH, ACK] Seq=70273 Ack=1 Win=2920 Len=1024"
"109","0.946017000","193.138.213.160","192.168.1.5","TCP","1078","80 > 55531 [PSH, ACK] Seq=71297 Ack=1 Win=2920 Len=1024"
"111","0.996013000","193.138.213.160","192.168.1.5","TCP","357","80 > 55531 [ACK] Seq=72321 Ack=1 Win=2920 Len=303"
"112","0.998011000","193.138.213.160","192.168.1.5","TCP","1078","80 > 55531 [PSH, ACK] Seq=72624 Ack=1 Win=2920 Len=1024"
"114","1.017013000","193.138.213.160","192.168.1.5","TCP","1078","80 > 55531 [PSH, ACK] Seq=73648 Ack=1 Win=2920 Len=1024"
"115","1.027012000","193.138.213.160","192.168.1.5","TCP","1078","80 > 55531 [PSH, ACK] Seq=74672 Ack=1 Win=2920 Len=1024"
"117","1.033023000","193.138.213.160","192.168.1.5","TCP","1078","80 > 55531 [PSH, ACK] Seq=75696 Ack=1 Win=2920 Len=1024"
"118","1.038017000","193.138.213.160","192.168.1.5","TCP","1078","80 > 55531 [PSH, ACK] Seq=76720 Ack=1 Win=2920 Len=1024"
"120","1.044011000","193.138.213.160","192.168.1.5","TCP","1078","80 > 55531 [PSH, ACK] Seq=77744 Ack=1 Win=2920 Len=1024"
"121","1.064011000","193.138.213.160","192.168.1.5","TCP","1078","80 > 55531 [PSH, ACK] Seq=78768 Ack=1 Win=2920 Len=1024"
"123","1.079014000","193.138.213.160","192.168.1.5","TCP","1078","80 > 55531 [PSH, ACK] Seq=79792 Ack=1 Win=2920 Len=1024"
"124","1.091013000","193.138.213.160","192.168.1.5","TCP","1078","80 > 55531 [PSH, ACK] Seq=80816 Ack=1 Win=2920 Len=1024"
"126","1.096015000","193.138.213.160","192.168.1.5","TCP","1078","80 > 55531 [PSH, ACK] Seq=81840 Ack=1 Win=2920 Len=1024"
"127","1.099010000","193.138.213.160","192.168.1.5","TCP","1078","80 > 55531 [PSH, ACK] Seq=82864 Ack=1 Win=2920 Len=1024"
"129","1.105023000","193.138.213.160","192.168.1.5","TCP","1078","80 > 55531 [PSH, ACK] Seq=83888 Ack=1 Win=2920 Len=1024"
"130","1.119013000","193.138.213.160","192.168.1.5","TCP","1078","80 > 55531 [PSH, ACK] Seq=84912 Ack=1 Win=2920 Len=1024"
"132","1.134013000","193.138.213.160","192.168.1.5","TCP","1078","80 > 55531 [PSH, ACK] Seq=85936 Ack=1 Win=2920 Len=1024"
"133","1.147013000","193.138.213.160","192.168.1.5","TCP","1078","80 > 55531 [PSH, ACK] Seq=86960 Ack=1 Win=2920 Len=1024"
"135","1.168024000","193.138.213.160","192.168.1.5","TCP","1078","80 > 55531 [PSH, ACK] Seq=87984 Ack=1 Win=2920 Len=1024"
"136","1.196020000","193.138.213.160","192.168.1.5","TCP","1078","80 > 55531 [PSH, ACK] Seq=89008 Ack=1 Win=2920 Len=1024"
"138","1.201019000","193.138.213.160","192.168.1.5","TCP","1078","80 > 55531 [PSH, ACK] Seq=90032 Ack=1 Win=2920 Len=1024"
"139","1.220014000","193.138.213.160","192.168.1.5","TCP","1078","80 > 55531 [PSH, ACK] Seq=91056 Ack=1 Win=2920 Len=1024"
"141","1.224015000","193.138.213.160","192.168.1.5","TCP","1078","80 > 55531 [PSH, ACK] Seq=92080 Ack=1 Win=2920 Len=1024"
"142","1.248514000","193.138.213.160","192.168.1.5","TCP","1078","80 > 55531 [PSH, ACK] Seq=93104 Ack=1 Win=2920 Len=1024"
"144","1.254149000","193.138.213.160","192.168.1.5","TCP","1078","80 > 55531 [PSH, ACK] Seq=94128 Ack=1 Win=2920 Len=1024"
"145","1.263698000","193.138.213.160","192.168.1.5","TCP","1078","80 > 55531 [PSH, ACK] Seq=95152 Ack=1 Win=2920 Len=1024"
"147","1.272015000","193.138.213.160","192.168.1.5","TCP","1078","80 > 55531 [PSH, ACK] Seq=96176 Ack=1 Win=2920 Len=1024"
"148","1.287016000","193.138.213.160","192.168.1.5","TCP","1078","80 > 55531 [PSH, ACK] Seq=97200 Ack=1 Win=2920 Len=1024"
"150","1.304016000","193.138.213.160","192.168.1.5","TCP","1078","80 > 55531 [PSH, ACK] Seq=98224 Ack=1 Win=2920 Len=1024"
"151","1.316017000","193.138.213.160","192.168.1.5","TCP","1078","80 > 55531 [PSH, ACK] Seq=99248 Ack=1 Win=2920 Len=1024"
"153","1.324452000","193.138.213.160","192.168.1.5","TCP","1078","80 > 55531 [PSH, ACK] Seq=100272 Ack=1 Win=2920 Len=1024"
"154","1.329174000","193.138.213.160","192.168.1.5","TCP","1078","80 > 55531 [PSH, ACK] Seq=101296 Ack=1 Win=2920 Len=1024"
"156","1.369019000","193.138.213.160","192.168.1.5","TCP","1078","80 > 55531 [PSH, ACK] Seq=102320 Ack=1 Win=2920 Len=1024"
"157","1.376017000","193.138.213.160","192.168.1.5","TCP","1078","80 > 55531 [PSH, ACK] Seq=103344 Ack=1 Win=2920 Len=1024"
"159","1.417018000","193.138.213.160","192.168.1.5","TCP","393","80 > 55531 [ACK] Seq=104368 Ack=1 Win=2920 Len=339"
"160","1.419015000","193.138.213.160","192.168.1.5","TCP","1078","80 > 55531 [PSH, ACK] Seq=104707 Ack=1 Win=2920 Len=1024"
"162","1.424017000","193.138.213.160","192.168.1.5","TCP","1078","80 > 55531 [PSH, ACK] Seq=105731 Ack=1 Win=2920 Len=1024"
"163","1.459017000","193.138.213.160","192.168.1.5","TCP","1078","80 > 55531 [PSH, ACK] Seq=106755 Ack=1 Win=2920 Len=1024"
"165","1.465972000","193.138.213.160","192.168.1.5","TCP","1078","80 > 55531 [PSH, ACK] Seq=107779 Ack=1 Win=2920 Len=1024"
"167","1.479017000","193.138.213.160","192.168.1.5","HTTP","1078","Continuation"
"191","1.501679000","193.138.213.160","192.168.1.5","TCP","1078","80 > 55531 [PSH, ACK] Seq=109827 Ack=1 Win=2920 Len=1024"
"197","1.503027000","193.138.213.160","192.168.1.5","TCP","1078","80 > 55531 [PSH, ACK] Seq=110851 Ack=1 Win=2920 Len=1024"
"224","1.518021000","193.138.213.160","192.168.1.5","TCP","1078","80 > 55531 [PSH, ACK] Seq=111875 Ack=1 Win=2920 Len=1024"
"226","1.525162000","193.138.213.160","192.168.1.5","TCP","1078","80 > 55531 [PSH, ACK] Seq=112899 Ack=1 Win=2920 Len=1024"
"230","1.538016000","193.138.213.160","192.168.1.5","TCP","1078","80 > 55531 [PSH, ACK] Seq=113923 Ack=1 Win=2920 Len=1024"
"231","1.559030000","193.138.213.160","192.168.1.5","TCP","1078","80 > 55531 [PSH, ACK] Seq=114947 Ack=1 Win=2920 Len=1024"
"233","1.567016000","193.138.213.160","192.168.1.5","TCP","1078","80 > 55531 [PSH, ACK] Seq=115971 Ack=1 Win=2920 Len=1024"
"234","1.580176000","193.138.213.160","192.168.1.5","TCP","1078","80 > 55531 [PSH, ACK] Seq=116995 Ack=1 Win=2920 Len=1024"
"236","1.592021000","193.138.213.160","192.168.1.5","TCP","1078","80 > 55531 [PSH, ACK] Seq=118019 Ack=1 Win=2920 Len=1024"
"241","1.626030000","193.138.213.160","192.168.1.5","TCP","1078","80 > 55531 [PSH, ACK] Seq=119043 Ack=1 Win=2920 Len=1024"
"243","1.629874000","193.138.213.160","192.168.1.5","TCP","1078","80 > 55531 [PSH, ACK] Seq=120067 Ack=1 Win=2920 Len=1024"
"244","1.649020000","193.138.213.160","192.168.1.5","TCP","1078","80 > 55531 [PSH, ACK] Seq=121091 Ack=1 Win=2920 Len=1024"
"246","1.663022000","193.138.213.160","192.168.1.5","TCP","1078","80 > 55531 [PSH, ACK] Seq=122115 Ack=1 Win=2920 Len=1024"
"247","1.668104000","193.138.213.160","192.168.1.5","TCP","1078","80 > 55531 [PSH, ACK] Seq=123139 Ack=1 Win=2920 Len=1024"
"249","1.699021000","193.138.213.160","192.168.1.5","TCP","1078","80 > 55531 [PSH, ACK] Seq=124163 Ack=1 Win=2920 Len=1024"
"255","1.731396000","193.138.213.160","192.168.1.5","TCP","1078","80 > 55531 [PSH, ACK] Seq=125187 Ack=1 Win=2920 Len=1024"
"256","1.731398000","193.138.213.160","192.168.1.5","TCP","1078","80 > 55531 [PSH, ACK] Seq=126211 Ack=1 Win=2920 Len=1024"
"258","1.735352000","193.138.213.160","192.168.1.5","TCP","1078","80 > 55531 [PSH, ACK] Seq=127235 Ack=1 Win=2920 Len=1024"
"259","1.741021000","193.138.213.160","192.168.1.5","TCP","1078","80 > 55531 [PSH, ACK] Seq=128259 Ack=1 Win=2920 Len=1024"
"261","1.759020000","193.138.213.160","192.168.1.5","TCP","1078","80 > 55531 [PSH, ACK] Seq=129283 Ack=1 Win=2920 Len=1024"
"262","1.770106000","193.138.213.160","192.168.1.5","TCP","1078","80 > 55531 [PSH, ACK] Seq=130307 Ack=1 Win=2920 Len=1024"
"264","1.779020000","193.138.213.160","192.168.1.5","TCP","1078","80 > 55531 [PSH, ACK] Seq=131331 Ack=1 Win=2920 Len=1024"
"265","1.781562000","193.138.213.160","192.168.1.5","TCP","1078","80 > 55531 [PSH, ACK] Seq=132355 Ack=1 Win=2920 Len=1024"
"267","1.792023000","193.138.213.160","192.168.1.5","TCP","1078","80 > 55531 [PSH, ACK] Seq=133379 Ack=1 Win=2920 Len=1024"
"268","1.807021000","193.138.213.160","192.168.1.5","TCP","1078","80 > 55531 [PSH, ACK] Seq=134403 Ack=1 Win=2920 Len=1024"
"270","1.817021000","193.138.213.160","192.168.1.5","TCP","1078","80 > 55531 [PSH, ACK] Seq=135427 Ack=1 Win=2920 Len=1024"
"271","1.857230000","193.138.213.160","192.168.1.5","TCP","328","80 > 55531 [ACK] Seq=136451 Ack=1 Win=2920 Len=274"
"273","1.858539000","193.138.213.160","192.168.1.5","TCP","121","80 > 55531 [ACK] Seq=136725 Ack=1 Win=2920 Len=67"
"274","1.862021000","193.138.213.160","192.168.1.5","TCP","1078","80 > 55531 [PSH, ACK] Seq=136792 Ack=1 Win=2920 Len=1024"
"276","1.871289000","193.138.213.160","192.168.1.5","TCP","1078","80 > 55531 [PSH, ACK] Seq=137816 Ack=1 Win=2920 Len=1024"
"277","1.879431000","193.138.213.160","192.168.1.5","TCP","1078","80 > 55531 [PSH, ACK] Seq=138840 Ack=1 Win=2920 Len=1024"
"279","1.895008000","193.138.213.160","192.168.1.5","TCP","1078","80 > 55531 [PSH, ACK] Seq=139864 Ack=1 Win=2920 Len=1024"
"280","1.903122000","193.138.213.160","192.168.1.5","TCP","1078","80 > 55531 [PSH, ACK] Seq=140888 Ack=1 Win=2920 Len=1024"
"282","1.916776000","193.138.213.160","192.168.1.5","TCP","1078","80 > 55531 [PSH, ACK] Seq=141912 Ack=1 Win=2920 Len=1024"
"283","1.925282000","193.138.213.160","192.168.1.5","HTTP","1078","Continuation"
"285","1.950609000","193.138.213.160","192.168.1.5","TCP","1078","80 > 55531 [PSH, ACK] Seq=143960 Ack=1 Win=2920 Len=1024"
"286","1.962074000","193.138.213.160","192.168.1.5","TCP","1078","80 > 55531 [PSH, ACK] Seq=144984 Ack=1 Win=2920 Len=1024"
"288","1.981084000","193.138.213.160","192.168.1.5","TCP","1078","80 > 55531 [PSH, ACK] Seq=146008 Ack=1 Win=2920 Len=1024"
"289","1.985173000","193.138.213.160","192.168.1.5","TCP","1078","80 > 55531 [PSH, ACK] Seq=147032 Ack=1 Win=2920 Len=1024"
"291","1.997023000","193.138.213.160","192.168.1.5","TCP","1078","80 > 55531 [PSH, ACK] Seq=148056 Ack=1 Win=2920 Len=1024"
"292","2.019427000","193.138.213.160","192.168.1.5","TCP","1078","80 > 55531 [PSH, ACK] Seq=149080 Ack=1 Win=2920 Len=1024"
"294","2.025068000","193.138.213.160","192.168.1.5","TCP","1078","80 > 55531 [PSH, ACK] Seq=150104 Ack=1 Win=2920 Len=1024"
"295","2.035025000","193.138.213.160","192.168.1.5","TCP","1078","80 > 55531 [PSH, ACK] Seq=151128 Ack=1 Win=2920 Len=1024"
"297","2.040022000","193.138.213.160","192.168.1.5","TCP","1078","80 > 55531 [PSH, ACK] Seq=152152 Ack=1 Win=2920 Len=1024"
"298","2.053024000","193.138.213.160","192.168.1.5","TCP","1078","80 > 55531 [PSH, ACK] Seq=153176 Ack=1 Win=2920 Len=1024"
"300","2.064025000","193.138.213.160","192.168.1.5","TCP","1078","80 > 55531 [PSH, ACK] Seq=154200 Ack=1 Win=2920 Len=1024"
"301","2.082144000","193.138.213.160","192.168.1.5","TCP","1078","80 > 55531 [PSH, ACK] Seq=155224 Ack=1 Win=2920 Len=1024"
"303","2.107026000","193.138.213.160","192.168.1.5","TCP","1078","80 > 55531 [PSH, ACK] Seq=156248 Ack=1 Win=2920 Len=1024"
"304","2.120027000","193.138.213.160","192.168.1.5","TCP","1078","80 > 55531 [PSH, ACK] Seq=157272 Ack=1 Win=2920 Len=1024"
"306","2.133030000","193.138.213.160","192.168.1.5","TCP","1078","80 > 55531 [PSH, ACK] Seq=158296 Ack=1 Win=2920 Len=1024"
"307","2.140024000","193.138.213.160","192.168.1.5","TCP","1078","80 > 55531 [PSH, ACK] Seq=159320 Ack=1 Win=2920 Len=1024"
"309","2.148025000","193.138.213.160","192.168.1.5","TCP","1078","80 > 55531 [PSH, ACK] Seq=160344 Ack=1 Win=2920 Len=1024"
"310","2.161025000","193.138.213.160","192.168.1.5","TCP","1078","80 > 55531 [PSH, ACK] Seq=161368 Ack=1 Win=2920 Len=1024"
"312","2.169023000","193.138.213.160","192.168.1.5","TCP","1078","80 > 55531 [PSH, ACK] Seq=162392 Ack=1 Win=2920 Len=1024"
"313","2.183028000","193.138.213.160","192.168.1.5","TCP","1078","80 > 55531 [PSH, ACK] Seq=163416 Ack=1 Win=2920 Len=1024"
"315","2.191329000","193.138.213.160","192.168.1.5","TCP","1078","80 > 55531 [PSH, ACK] Seq=164440 Ack=1 Win=2920 Len=1024"
"316","2.196023000","193.138.213.160","192.168.1.5","TCP","1078","80 > 55531 [PSH, ACK] Seq=165464 Ack=1 Win=2920 Len=1024"
"318","2.204025000","193.138.213.160","192.168.1.5","TCP","1078","80 > 55531 [PSH, ACK] Seq=166488 Ack=1 Win=2920 Len=1024"
"319","2.220030000","193.138.213.160","192.168.1.5","TCP","1078","80 > 55531 [PSH, ACK] Seq=167512 Ack=1 Win=2920 Len=1024"
"321","2.263031000","193.138.213.160","192.168.1.5","TCP","291","[TCP segment of a reassembled PDU]"
"322","2.263034000","193.138.213.160","192.168.1.5","TCP","121","80 > 55531 [ACK] Seq=168773 Ack=1 Win=2920 Len=67"
"324","2.265024000","193.138.213.160","192.168.1.5","TCP","1078","80 > 55531 [PSH, ACK] Seq=168840 Ack=1 Win=2920 Len=1024"
"325","2.273808000","193.138.213.160","192.168.1.5","TCP","1078","80 > 55531 [PSH, ACK] Seq=169864 Ack=1 Win=2920 Len=1024"
"330","2.288023000","193.138.213.160","192.168.1.5","TCP","1078","80 > 55531 [PSH, ACK] Seq=170888 Ack=1 Win=2920 Len=1024"
"331","2.293031000","193.138.213.160","192.168.1.5","TCP","1078","80 > 55531 [PSH, ACK] Seq=171912 Ack=1 Win=2920 Len=1024"
"333","2.299026000","193.138.213.160","192.168.1.5","HTTP","1078","Continuation"
"334","2.313026000","193.138.213.160","192.168.1.5","TCP","1078","80 > 55531 [PSH, ACK] Seq=173960 Ack=1 Win=2920 Len=1024"
"336","2.327085000","193.138.213.160","192.168.1.5","TCP","1078","80 > 55531 [PSH, ACK] Seq=174984 Ack=1 Win=2920 Len=1024"
"338","2.340025000","193.138.213.160","192.168.1.5","TCP","1078","80 > 55531 [PSH, ACK] Seq=176008 Ack=1 Win=2920 Len=1024"
"340","2.349315000","193.138.213.160","192.168.1.5","TCP","1078","80 > 55531 [PSH, ACK] Seq=177032 Ack=1 Win=2920 Len=1024"
"341","2.352000000","193.138.213.160","192.168.1.5","TCP","1078","80 > 55531 [PSH, ACK] Seq=178056 Ack=1 Win=2920 Len=1024"
"343","2.364342000","193.138.213.160","192.168.1.5","TCP","1078","80 > 55531 [PSH, ACK] Seq=179080 Ack=1 Win=2920 Len=1024"
"344","2.369552000","193.138.213.160","192.168.1.5","TCP","1078","80 > 55531 [PSH, ACK] Seq=180104 Ack=1 Win=2920 Len=1024"
"346","2.371286000","193.138.213.160","192.168.1.5","TCP","1078","80 > 55531 [PSH, ACK] Seq=181128 Ack=1 Win=2920 Len=1024"
"348","2.387025000","193.138.213.160","192.168.1.5","TCP","1078","80 > 55531 [PSH, ACK] Seq=182152 Ack=1 Win=2920 Len=1024"
"350","2.395577000","193.138.213.160","192.168.1.5","TCP","1078","80 > 55531 [PSH, ACK] Seq=183176 Ack=1 Win=2920 Len=1024"
"351","2.409026000","193.138.213.160","192.168.1.5","TCP","1078","80 > 55531 [PSH, ACK] Seq=184200 Ack=1 Win=2920 Len=1024"
"353","2.438724000","193.138.213.160","192.168.1.5","TCP","1078","80 > 55531 [PSH, ACK] Seq=185224 Ack=1 Win=2920 Len=1024"
"354","2.451293000","193.138.213.160","192.168.1.5","TCP","1078","80 > 55531 [PSH, ACK] Seq=186248 Ack=1 Win=2920 Len=1024"
"356","2.468682000","193.138.213.160","192.168.1.5","TCP","1078","80 > 55531 [PSH, ACK] Seq=187272 Ack=1 Win=2920 Len=1024"
"358","2.472001000","193.138.213.160","192.168.1.5","TCP","1078","80 > 55531 [PSH, ACK] Seq=188296 Ack=1 Win=2920 Len=1024"
"360","2.491066000","193.138.213.160","192.168.1.5","TCP","1078","80 > 55531 [PSH, ACK] Seq=189320 Ack=1 Win=2920 Len=1024"
"361","2.496567000","193.138.213.160","192.168.1.5","TCP","1078","80 > 55531 [PSH, ACK] Seq=190344 Ack=1 Win=2920 Len=1024"
"363","2.518028000","193.138.213.160","192.168.1.5","TCP","1078","80 > 55531 [PSH, ACK] Seq=191368 Ack=1 Win=2920 Len=1024"
"364","2.523033000","193.138.213.160","192.168.1.5","TCP","1078","80 > 55531 [PSH, ACK] Seq=192392 Ack=1 Win=2920 Len=1024"
"366","2.549029000","193.138.213.160","192.168.1.5","TCP","1078","80 > 55531 [PSH, ACK] Seq=193416 Ack=1 Win=2920 Len=1024"
"367","2.583036000","193.138.213.160","192.168.1.5","TCP","1078","80 > 55531 [PSH, ACK] Seq=194440 Ack=1 Win=2920 Len=1024"
"369","2.599030000","193.138.213.160","192.168.1.5","TCP","1078","80 > 55531 [PSH, ACK] Seq=195464 Ack=1 Win=2920 Len=1024"
"370","2.618028000","193.138.213.160","192.168.1.5","TCP","1078","80 > 55531 [PSH, ACK] Seq=196488 Ack=1 Win=2920 Len=1024"
"372","2.624027000","193.138.213.160","192.168.1.5","TCP","1078","80 > 55531 [PSH, ACK] Seq=197512 Ack=1 Win=2920 Len=1024"
"373","2.637028000","193.138.213.160","192.168.1.5","TCP","1078","80 > 55531 [PSH, ACK] Seq=198536 Ack=1 Win=2920 Len=1024"
"375","2.643031000","193.138.213.160","192.168.1.5","TCP","1078","80 > 55531 [PSH, ACK] Seq=199560 Ack=1 Win=2920 Len=1024"
"376","2.690033000","193.138.213.160","192.168.1.5","TCP","375","80 > 55531 [ACK] Seq=200584 Ack=1 Win=2920 Len=321"
"378","2.692096000","193.138.213.160","192.168.1.5","TCP","121","80 > 55531 [ACK] Seq=200905 Ack=1 Win=2920 Len=67"
"379","2.695028000","193.138.213.160","192.168.1.5","TCP","1078","80 > 55531 [PSH, ACK] Seq=200972 Ack=1 Win=2920 Len=1024"
"381","2.700030000","193.138.213.160","192.168.1.5","TCP","1078","80 > 55531 [PSH, ACK] Seq=201996 Ack=1 Win=2920 Len=1024"
"382","2.719034000","193.138.213.160","192.168.1.5","TCP","1078","80 > 55531 [PSH, ACK] Seq=203020 Ack=1 Win=2920 Len=1024"
"384","2.724033000","193.138.213.160","192.168.1.5","TCP","1078","80 > 55531 [PSH, ACK] Seq=204044 Ack=1 Win=2920 Len=1024"
"385","2.739032000","193.138.213.160","192.168.1.5","TCP","1078","80 > 55531 [PSH, ACK] Seq=205068 Ack=1 Win=2920 Len=1024"
"387","2.756033000","193.138.213.160","192.168.1.5","TCP","1078","80 > 55531 [PSH, ACK] Seq=206092 Ack=1 Win=2920 Len=1024"
"388","2.761032000","193.138.213.160","192.168.1.5","TCP","1078","80 > 55531 [PSH, ACK] Seq=207116 Ack=1 Win=2920 Len=1024"
"390","2.767564000","193.138.213.160","192.168.1.5","TCP","1078","80 > 55531 [PSH, ACK] Seq=208140 Ack=1 Win=2920 Len=1024"
"391","2.784033000","193.138.213.160","192.168.1.5","TCP","1078","80 > 55531 [PSH, ACK] Seq=209164 Ack=1 Win=2920 Len=1024"
"393","2.799033000","193.138.213.160","192.168.1.5","TCP","1078","80 > 55531 [PSH, ACK] Seq=210188 Ack=1 Win=2920 Len=1024"
"394","2.815032000","193.138.213.160","192.168.1.5","TCP","1078","80 > 55531 [PSH, ACK] Seq=211212 Ack=1 Win=2920 Len=1024"
"396","2.822033000","193.138.213.160","192.168.1.5","TCP","1078","80 > 55531 [PSH, ACK] Seq=212236 Ack=1 Win=2920 Len=1024"
"397","2.840159000","193.138.213.160","192.168.1.5","TCP","1078","80 > 55531 [PSH, ACK] Seq=213260 Ack=1 Win=2920 Len=1024"
"399","2.849032000","193.138.213.160","192.168.1.5","TCP","1078","80 > 55531 [PSH, ACK] Seq=214284 Ack=1 Win=2920 Len=1024"
"400","2.866039000","193.138.213.160","192.168.1.5","TCP","1078","80 > 55531 [PSH, ACK] Seq=215308 Ack=1 Win=2920 Len=1024"
"402","2.881031000","193.138.213.160","192.168.1.5","TCP","1078","80 > 55531 [PSH, ACK] Seq=216332 Ack=1 Win=2920 Len=1024"
"403","2.891190000","193.138.213.160","192.168.1.5","TCP","1078","80 > 55531 [PSH, ACK] Seq=217356 Ack=1 Win=2920 Len=1024"
"405","2.917305000","193.138.213.160","192.168.1.5","TCP","1078","80 > 55531 [PSH, ACK] Seq=218380 Ack=1 Win=2920 Len=1024"
"406","2.917581000","193.138.213.160","192.168.1.5","TCP","1078","80 > 55531 [PSH, ACK] Seq=219404 Ack=1 Win=2920 Len=1024"
"408","2.937277000","193.138.213.160","192.168.1.5","TCP","1078","80 > 55531 [PSH, ACK] Seq=220428 Ack=1 Win=2920 Len=1024"
"409","2.951030000","193.138.213.160","192.168.1.5","TCP","1078","80 > 55531 [PSH, ACK] Seq=221452 Ack=1 Win=2920 Len=1024"
"411","2.962035000","193.138.213.160","192.168.1.5","TCP","1078","80 > 55531 [PSH, ACK] Seq=222476 Ack=1 Win=2920 Len=1024"
"412","2.964369000","193.138.213.160","192.168.1.5","TCP","1078","80 > 55531 [PSH, ACK] Seq=223500 Ack=1 Win=2920 Len=1024"
"414","2.977254000","193.138.213.160","192.168.1.5","TCP","1078","80 > 55531 [PSH, ACK] Seq=224524 Ack=1 Win=2920 Len=1024"
"415","2.987040000","193.138.213.160","192.168.1.5","TCP","1078","80 > 55531 [PSH, ACK] Seq=225548 Ack=1 Win=2920 Len=1024"
"417","2.991034000","193.138.213.160","192.168.1.5","TCP","1078","80 > 55531 [PSH, ACK] Seq=226572 Ack=1 Win=2920 Len=1024"
"418","3.007039000","193.138.213.160","192.168.1.5","TCP","1078","80 > 55531 [PSH, ACK] Seq=227596 Ack=1 Win=2920 Len=1024"
"420","3.019036000","193.138.213.160","192.168.1.5","TCP","1078","80 > 55531 [PSH, ACK] Seq=228620 Ack=1 Win=2920 Len=1024"
"421","3.037036000","193.138.213.160","192.168.1.5","TCP","1078","80 > 55531 [PSH, ACK] Seq=229644 Ack=1 Win=2920 Len=1024"
"423","3.057995000","193.138.213.160","192.168.1.5","TCP","1078","80 > 55531 [PSH, ACK] Seq=230668 Ack=1 Win=2920 Len=1024"
"424","3.069035000","193.138.213.160","192.168.1.5","TCP","1078","80 > 55531 [PSH, ACK] Seq=231692 Ack=1 Win=2920 Len=1024"
"426","3.101041000","193.138.213.160","192.168.1.5","TCP","317","80 > 55531 [ACK] Seq=232716 Ack=1 Win=2920 Len=263"
"427","3.103035000","193.138.213.160","192.168.1.5","TCP","121","80 > 55531 [ACK] Seq=232979 Ack=1 Win=2920 Len=67"
"429","3.105037000","193.138.213.160","192.168.1.5","TCP","1078","80 > 55531 [PSH, ACK] Seq=233046 Ack=1 Win=2920 Len=1024"
"430","3.126036000","193.138.213.160","192.168.1.5","TCP","1078","80 > 55531 [PSH, ACK] Seq=234070 Ack=1 Win=2920 Len=1024"
"432","3.135033000","193.138.213.160","192.168.1.5","TCP","1078","80 > 55531 [PSH, ACK] Seq=235094 Ack=1 Win=2920 Len=1024"
"433","3.142039000","193.138.213.160","192.168.1.5","TCP","1078","80 > 55531 [PSH, ACK] Seq=236118 Ack=1 Win=2920 Len=1024"
"435","3.159035000","193.138.213.160","192.168.1.5","TCP","1078","80 > 55531 [PSH, ACK] Seq=237142 Ack=1 Win=2920 Len=1024"
"436","3.162034000","193.138.213.160","192.168.1.5","TCP","1078","80 > 55531 [PSH, ACK] Seq=238166 Ack=1 Win=2920 Len=1024"
"438","3.165169000","193.138.213.160","192.168.1.5","TCP","1078","80 > 55531 [PSH, ACK] Seq=239190 Ack=1 Win=2920 Len=1024"
"439","3.191044000","193.138.213.160","192.168.1.5","TCP","1078","80 > 55531 [PSH, ACK] Seq=240214 Ack=1 Win=2920 Len=1024"
"441","3.202243000","193.138.213.160","192.168.1.5","TCP","1078","80 > 55531 [PSH, ACK] Seq=241238 Ack=1 Win=2920 Len=1024"
"442","3.209119000","193.138.213.160","192.168.1.5","TCP","1078","80 > 55531 [PSH, ACK] Seq=242262 Ack=1 Win=2920 Len=1024"
"444","3.218037000","193.138.213.160","192.168.1.5","TCP","1078","80 > 55531 [PSH, ACK] Seq=243286 Ack=1 Win=2920 Len=1024"
"445","3.227036000","193.138.213.160","192.168.1.5","TCP","1078","80 > 55531 [PSH, ACK] Seq=244310 Ack=1 Win=2920 Len=1024"
"447","3.231981000","193.138.213.160","192.168.1.5","TCP","1078","80 > 55531 [PSH, ACK] Seq=245334 Ack=1 Win=2920 Len=1024"
"448","3.251047000","193.138.213.160","192.168.1.5","TCP","1078","80 > 55531 [PSH, ACK] Seq=246358 Ack=1 Win=2920 Len=1024"
"450","3.261534000","193.138.213.160","192.168.1.5","TCP","1078","80 > 55531 [PSH, ACK] Seq=247382 Ack=1 Win=2920 Len=1024"
"451","3.269036000","193.138.213.160","192.168.1.5","TCP","1078","80 > 55531 [PSH, ACK] Seq=248406 Ack=1 Win=2920 Len=1024"
"453","3.287037000","193.138.213.160","192.168.1.5","TCP","1078","80 > 55531 [PSH, ACK] Seq=249430 Ack=1 Win=2920 Len=1024"
"454","3.297585000","193.138.213.160","192.168.1.5","TCP","1078","80 > 55531 [PSH, ACK] Seq=250454 Ack=1 Win=2920 Len=1024"
"457","3.306036000","193.138.213.160","192.168.1.5","TCP","1078","80 > 55531 [PSH, ACK] Seq=251478 Ack=1 Win=2920 Len=1024"
"458","3.316039000","193.138.213.160","192.168.1.5","TCP","1078","80 > 55531 [PSH, ACK] Seq=252502 Ack=1 Win=2920 Len=1024"
"460","3.336038000","193.138.213.160","192.168.1.5","TCP","1078","80 > 55531 [PSH, ACK] Seq=253526 Ack=1 Win=2920 Len=1024"
"461","3.348039000","193.138.213.160","192.168.1.5","TCP","1078","80 > 55531 [PSH, ACK] Seq=254550 Ack=1 Win=2920 Len=1024"
"463","3.356137000","193.138.213.160","192.168.1.5","TCP","1078","80 > 55531 [PSH, ACK] Seq=255574 Ack=1 Win=2920 Len=1024"
"464","3.368036000","193.138.213.160","192.168.1.5","TCP","1078","80 > 55531 [PSH, ACK] Seq=256598 Ack=1 Win=2920 Len=1024"
"466","3.382037000","193.138.213.160","192.168.1.5","TCP","1078","80 > 55531 [PSH, ACK] Seq=257622 Ack=1 Win=2920 Len=1024"
"467","3.389129000","193.138.213.160","192.168.1.5","TCP","1078","80 > 55531 [PSH, ACK] Seq=258646 Ack=1 Win=2920 Len=1024"
"469","3.396544000","193.138.213.160","192.168.1.5","TCP","1078","80 > 55531 [PSH, ACK] Seq=259670 Ack=1 Win=2920 Len=1024"
"470","3.407041000","193.138.213.160","192.168.1.5","TCP","1078","80 > 55531 [PSH, ACK] Seq=260694 Ack=1 Win=2920 Len=1024"
"472","3.420135000","193.138.213.160","192.168.1.5","TCP","1078","80 > 55531 [PSH, ACK] Seq=261718 Ack=1 Win=2920 Len=1024"
"473","3.428056000","193.138.213.160","192.168.1.5","TCP","1078","80 > 55531 [PSH, ACK] Seq=262742 Ack=1 Win=2920 Len=1024"
"475","3.434149000","193.138.213.160","192.168.1.5","TCP","1078","80 > 55531 [PSH, ACK] Seq=263766 Ack=1 Win=2920 Len=1024"
"476","3.468034000","193.138.213.160","192.168.1.5","TCP","425","80 > 55531 [ACK] Seq=264790 Ack=1 Win=2920 Len=371"
"478","3.470038000","193.138.213.160","192.168.1.5","TCP","1078","80 > 55531 [PSH, ACK] Seq=265161 Ack=1 Win=2920 Len=1024"
"479","3.476037000","193.138.213.160","192.168.1.5","TCP","1078","80 > 55531 [PSH, ACK] Seq=266185 Ack=1 Win=2920 Len=1024"
"481","3.487038000","193.138.213.160","192.168.1.5","TCP","1078","80 > 55531 [PSH, ACK] Seq=267209 Ack=1 Win=2920 Len=1024"
"482","3.507043000","193.138.213.160","192.168.1.5","TCP","1078","80 > 55531 [PSH, ACK] Seq=268233 Ack=1 Win=2920 Len=1024"
"484","3.517261000","193.138.213.160","192.168.1.5","TCP","1078","80 > 55531 [PSH, ACK] Seq=269257 Ack=1 Win=2920 Len=1024"
"485","3.536038000","193.138.213.160","192.168.1.5","TCP","1078","80 > 55531 [PSH, ACK] Seq=270281 Ack=1 Win=2920 Len=1024"
"487","3.541037000","193.138.213.160","192.168.1.5","TCP","1078","80 > 55531 [PSH, ACK] Seq=271305 Ack=1 Win=2920 Len=1024"
"488","3.561037000","193.138.213.160","192.168.1.5","TCP","1078","80 > 55531 [PSH, ACK] Seq=272329 Ack=1 Win=2920 Len=1024"
"490","3.574037000","193.138.213.160","192.168.1.5","TCP","1078","80 > 55531 [PSH, ACK] Seq=273353 Ack=1 Win=2920 Len=1024"
"491","3.583043000","193.138.213.160","192.168.1.5","TCP","1078","80 > 55531 [PSH, ACK] Seq=274377 Ack=1 Win=2920 Len=1024"
"493","3.596172000","193.138.213.160","192.168.1.5","TCP","1078","80 > 55531 [PSH, ACK] Seq=275401 Ack=1 Win=2920 Len=1024"
"494","3.601038000","193.138.213.160","192.168.1.5","TCP","1078","80 > 55531 [PSH, ACK] Seq=276425 Ack=1 Win=2920 Len=1024"
"496","3.608040000","193.138.213.160","192.168.1.5","TCP","1078","80 > 55531 [PSH, ACK] Seq=277449 Ack=1 Win=2920 Len=1024"
"497","3.619127000","193.138.213.160","192.168.1.5","TCP","1078","80 > 55531 [PSH, ACK] Seq=278473 Ack=1 Win=2920 Len=1024"
"499","3.627717000","193.138.213.160","192.168.1.5","TCP","1078","80 > 55531 [PSH, ACK] Seq=279497 Ack=1 Win=2920 Len=1024"
"500","3.633040000","193.138.213.160","192.168.1.5","TCP","1078","80 > 55531 [PSH, ACK] Seq=280521 Ack=1 Win=2920 Len=1024"
"502","3.637040000","193.138.213.160","192.168.1.5","TCP","1078","80 > 55531 [PSH, ACK] Seq=281545 Ack=1 Win=2920 Len=1024"
"503","3.641042000","193.138.213.160","192.168.1.5","TCP","1078","80 > 55531 [PSH, ACK] Seq=282569 Ack=1 Win=2920 Len=1024"
"505","3.662528000","193.138.213.160","192.168.1.5","TCP","1078","80 > 55531 [PSH, ACK] Seq=283593 Ack=1 Win=2920 Len=1024"
"506","3.666978000","193.138.213.160","192.168.1.5","TCP","1078","80 > 55531 [PSH, ACK] Seq=284617 Ack=1 Win=2920 Len=1024"
"508","3.683041000","193.138.213.160","192.168.1.5","TCP","1078","80 > 55531 [PSH, ACK] Seq=285641 Ack=1 Win=2920 Len=1024"
"509","3.691045000","193.138.213.160","192.168.1.5","TCP","1078","80 > 55531 [PSH, ACK] Seq=286665 Ack=1 Win=2920 Len=1024"
"511","3.705797000","193.138.213.160","192.168.1.5","TCP","1078","80 > 55531 [PSH, ACK] Seq=287689 Ack=1 Win=2920 Len=1024"
"512","3.721042000","193.138.213.160","192.168.1.5","TCP","1078","80 > 55531 [PSH, ACK] Seq=288713 Ack=1 Win=2920 Len=1024"
"514","3.734842000","193.138.213.160","192.168.1.5","TCP","1078","80 > 55531 [PSH, ACK] Seq=289737 Ack=1 Win=2920 Len=1024"
"515","3.742240000","193.138.213.160","192.168.1.5","TCP","1078","80 > 55531 [PSH, ACK] Seq=290761 Ack=1 Win=2920 Len=1024"
"517","3.761045000","193.138.213.160","192.168.1.5","TCP","1078","80 > 55531 [PSH, ACK] Seq=291785 Ack=1 Win=2920 Len=1024"
"518","3.771047000","193.138.213.160","192.168.1.5","TCP","1078","80 > 55531 [PSH, ACK] Seq=292809 Ack=1 Win=2920 Len=1024"
"520","3.781042000","193.138.213.160","192.168.1.5","TCP","1078","80 > 55531 [PSH, ACK] Seq=293833 Ack=1 Win=2920 Len=1024"
"521","3.793049000","193.138.213.160","192.168.1.5","TCP","1078","80 > 55531 [PSH, ACK] Seq=294857 Ack=1 Win=2920 Len=1024"
"523","3.800057000","193.138.213.160","192.168.1.5","TCP","1078","80 > 55531 [PSH, ACK] Seq=295881 Ack=1 Win=2920 Len=1024"
"524","3.835045000","193.138.213.160","192.168.1.5","TCP","303","80 > 55531 [ACK] Seq=296905 Ack=1 Win=2920 Len=249"
"526","3.837042000","193.138.213.160","192.168.1.5","TCP","121","80 > 55531 [ACK] Seq=297154 Ack=1 Win=2920 Len=67"
"527","3.839547000","193.138.213.160","192.168.1.5","TCP","1078","80 > 55531 [PSH, ACK] Seq=297221 Ack=1 Win=2920 Len=1024"
"529","3.858054000","193.138.213.160","192.168.1.5","TCP","1078","80 > 55531 [PSH, ACK] Seq=298245 Ack=1 Win=2920 Len=1024"
"530","3.862258000","193.138.213.160","192.168.1.5","TCP","1078","80 > 55531 [PSH, ACK] Seq=299269 Ack=1 Win=2920 Len=1024"
"532","3.882262000","193.138.213.160","192.168.1.5","TCP","1078","80 > 55531 [PSH, ACK] Seq=300293 Ack=1 Win=2920 Len=1024"
"533","3.892047000","193.138.213.160","192.168.1.5","TCP","1078","80 > 55531 [PSH, ACK] Seq=301317 Ack=1 Win=2920 Len=1024"
"535","3.902046000","193.138.213.160","192.168.1.5","TCP","1078","80 > 55531 [PSH, ACK] Seq=302341 Ack=1 Win=2920 Len=1024"
"536","3.903218000","193.138.213.160","192.168.1.5","TCP","1078","80 > 55531 [PSH, ACK] Seq=303365 Ack=1 Win=2920 Len=1024"
"538","3.922094000","193.138.213.160","192.168.1.5","TCP","1078","80 > 55531 [PSH, ACK] Seq=304389 Ack=1 Win=2920 Len=1024"
"539","3.932135000","193.138.213.160","192.168.1.5","TCP","1078","80 > 55531 [PSH, ACK] Seq=305413 Ack=1 Win=2920 Len=1024"
"541","3.941733000","193.138.213.160","192.168.1.5","TCP","1078","80 > 55531 [PSH, ACK] Seq=306437 Ack=1 Win=2920 Len=1024"
"542","3.957344000","193.138.213.160","192.168.1.5","TCP","1078","80 > 55531 [PSH, ACK] Seq=307461 Ack=1 Win=2920 Len=1024"
"545","3.967638000","193.138.213.160","192.168.1.5","TCP","1078","80 > 55531 [PSH, ACK] Seq=308485 Ack=1 Win=2920 Len=1024"
"546","3.974116000","193.138.213.160","192.168.1.5","TCP","1078","80 > 55531 [PSH, ACK] Seq=309509 Ack=1 Win=2920 Len=1024"
"548","3.990056000","193.138.213.160","192.168.1.5","TCP","1078","80 > 55531 [PSH, ACK] Seq=310533 Ack=1 Win=2920 Len=1024"
"549","3.997044000","193.138.213.160","192.168.1.5","TCP","1078","80 > 55531 [PSH, ACK] Seq=311557 Ack=1 Win=2920 Len=1024"
"551","4.009413000","193.138.213.160","192.168.1.5","TCP","1078","80 > 55531 [PSH, ACK] Seq=312581 Ack=1 Win=2920 Len=1024"
"552","4.020865000","193.138.213.160","192.168.1.5","TCP","1078","80 > 55531 [PSH, ACK] Seq=313605 Ack=1 Win=2920 Len=1024"
"554","4.031286000","193.138.213.160","192.168.1.5","TCP","1078","80 > 55531 [PSH, ACK] Seq=314629 Ack=1 Win=2920 Len=1024"
"555","4.038674000","193.138.213.160","192.168.1.5","TCP","1078","80 > 55531 [PSH, ACK] Seq=315653 Ack=1 Win=2920 Len=1024"
"557","4.050558000","193.138.213.160","192.168.1.5","TCP","1078","80 > 55531 [PSH, ACK] Seq=316677 Ack=1 Win=2920 Len=1024"
