"No.","Time","Source","Destination","Protocol","Length","Info"
"1","0.000000000","163.1.201.45","192.168.1.5","TCP","62","1935 > 55261 [PSH, ACK] Seq=1 Ack=1 Win=23771 Len=8"
"2","0.000003000","163.1.201.45","192.168.1.5","RTMP","1514","Unknown (0x0)"
"4","0.002001000","163.1.201.45","192.168.1.5","RTMP","220","Unknown (0x0)"
"5","0.002003000","163.1.201.45","192.168.1.5","RTMP","1514","Unknown (0x0)"
"6","0.002006000","163.1.201.45","192.168.1.5","RTMP","355","Unknown (0x0)"
"7","0.002007000","163.1.201.45","192.168.1.5","RTMP","1514","Unknown (0x0)"
"8","0.002009000","163.1.201.45","192.168.1.5","TCP","331","1935 > 55261 [PSH, ACK] Seq=4856 Ack=1 Win=23771 Len=277"
"12","0.249956000","163.1.201.45","192.168.1.5","TCP","62","1935 > 55261 [PSH, ACK] Seq=5133 Ack=1 Win=23771 Len=8"
"13","0.249958000","163.1.201.45","192.168.1.5","RTMP","1514","Unknown (0x0)|Unknown (0x0)|Unknown (0x0)"
"15","0.251143000","163.1.201.45","192.168.1.5","TCP","411","1935 > 55261 [PSH, ACK] Seq=6601 Ack=1 Win=23771 Len=357"
"16","0.258007000","163.1.201.45","192.168.1.5","TCP","1514","1935 > 55261 [ACK] Seq=6958 Ack=1 Win=23771 Len=1460"
"17","0.258010000","163.1.201.45","192.168.1.5","RTMP","1514","Unknown (0x0)"
"18","0.258014000","163.1.201.45","192.168.1.5","TCP","1238","1935 > 55261 [PSH, ACK] Seq=9878 Ack=1 Win=23771 Len=1184"
"19","0.258016000","163.1.201.45","192.168.1.5","TCP","1514","1935 > 55261 [ACK] Seq=11062 Ack=1 Win=23771 Len=1460"
"20","0.258019000","163.1.201.45","192.168.1.5","TCP","1514","1935 > 55261 [ACK] Seq=12522 Ack=1 Win=23771 Len=1460"
"21","0.258020000","163.1.201.45","192.168.1.5","RTMP","1231","Unknown (0x0)|Unknown (0x0)"
"24","0.260008000","163.1.201.45","192.168.1.5","TCP","1514","1935 > 55261 [ACK] Seq=15159 Ack=1 Win=23771 Len=1460"
"25","0.260011000","163.1.201.45","192.168.1.5","TCP","1514","1935 > 55261 [ACK] Seq=16619 Ack=1 Win=23771 Len=1460"
"26","0.260014000","163.1.201.45","192.168.1.5","TCP","1231","1935 > 55261 [PSH, ACK] Seq=18079 Ack=1 Win=23771 Len=1177"
"27","0.260016000","163.1.201.45","192.168.1.5","TCP","1514","1935 > 55261 [ACK] Seq=19256 Ack=1 Win=23771 Len=1460"
"28","0.260019000","163.1.201.45","192.168.1.5","RTMP","1514","Unknown (0x0)|Unknown (0x0)|Unknown (0x0)"
"29","0.260021000","163.1.201.45","192.168.1.5","RTMP","1231","Unknown (0x0)"
"30","0.260023000","163.1.201.45","192.168.1.5","TCP","1514","1935 > 55261 [ACK] Seq=23353 Ack=1 Win=23771 Len=1460"
"31","0.260024000","163.1.201.45","192.168.1.5","RTMP","1514","Unknown (0x0)|Unknown (0x0)"
"32","0.260027000","163.1.201.45","192.168.1.5","TCP","1231","1935 > 55261 [PSH, ACK] Seq=26273 Ack=1 Win=23771 Len=1177"
"33","0.260029000","163.1.201.45","192.168.1.5","TCP","1514","1935 > 55261 [ACK] Seq=27450 Ack=1 Win=23771 Len=1460"
"36","0.261454000","163.1.201.45","192.168.1.5","RTMP","1514","Unknown (0x0)"
"37","0.261456000","163.1.201.45","192.168.1.5","RTMP","1231","Unknown (0x0)"
"38","0.261459000","163.1.201.45","192.168.1.5","TCP","1514","1935 > 55261 [ACK] Seq=31547 Ack=1 Win=23771 Len=1460"
"39","0.261461000","163.1.201.45","192.168.1.5","RTMP","1514","Unknown (0x0)|Unknown (0x0)"
"40","0.261464000","163.1.201.45","192.168.1.5","RTMP","1231","Unknown (0x0)"
"41","0.261465000","163.1.201.45","192.168.1.5","RTMP","1514","Video Data|Unknown (0x0)"
"44","0.262698000","163.1.201.45","192.168.1.5","RTMP","1514","Unknown (0x0)"
"45","0.262701000","163.1.201.45","192.168.1.5","TCP","1231","1935 > 55261 [PSH, ACK] Seq=38564 Ack=1 Win=23771 Len=1177"
"46","0.262704000","163.1.201.45","192.168.1.5","TCP","55","1935 > 55261 [PSH, ACK] Seq=39741 Ack=1 Win=23771 Len=1"
"47","0.262705000","163.1.201.45","192.168.1.5","RTMP","1514","Unknown (0x0)|Unknown (0x0)|Unknown (0x0)"
"48","0.262707000","163.1.201.45","192.168.1.5","TCP","808","1935 > 55261 [PSH, ACK] Seq=41202 Ack=1 Win=23771 Len=754"
"49","0.262708000","163.1.201.45","192.168.1.5","RTMP","1514","Window Acknowledgement Size"
"50","0.262711000","163.1.201.45","192.168.1.5","TCP","1376","1935 > 55261 [PSH, ACK] Seq=43416 Ack=1 Win=23771 Len=1322"
"51","0.262713000","163.1.201.45","192.168.1.5","TCP","1514","1935 > 55261 [ACK] Seq=44738 Ack=1 Win=23771 Len=1460"
"52","0.262716000","163.1.201.45","192.168.1.5","RTMP","974","Unknown (0x0)"
"53","0.262717000","163.1.201.45","192.168.1.5","RTMP","1193","Unknown (0x0)"
"59","0.500009000","163.1.201.45","192.168.1.5","TCP","62","1935 > 55261 [PSH, ACK] Seq=48257 Ack=1 Win=23771 Len=8"
"60","0.502009000","163.1.201.45","192.168.1.5","RTMP","1514","Unknown (0x0)|Unknown (0x0)|Unknown (0x0)"
"62","0.502931000","163.1.201.45","192.168.1.5","TCP","665","1935 > 55261 [PSH, ACK] Seq=49725 Ack=1 Win=23771 Len=611"
"63","0.502935000","163.1.201.45","192.168.1.5","TCP","1514","1935 > 55261 [ACK] Seq=50336 Ack=1 Win=23771 Len=1460"
"64","0.502937000","163.1.201.45","192.168.1.5","TCP","677","1935 > 55261 [PSH, ACK] Seq=51796 Ack=1 Win=23771 Len=623"
"65","0.502939000","163.1.201.45","192.168.1.5","TCP","1514","1935 > 55261 [ACK] Seq=52419 Ack=1 Win=23771 Len=1460"
"66","0.502941000","163.1.201.45","192.168.1.5","RTMP","475","Unknown (0x0)"
"67","0.502942000","163.1.201.45","192.168.1.5","TCP","1514","1935 > 55261 [ACK] Seq=54300 Ack=1 Win=23771 Len=1460"
"68","0.502944000","163.1.201.45","192.168.1.5","TCP","528","1935 > 55261 [PSH, ACK] Seq=55760 Ack=1 Win=23771 Len=474"
"73","0.749799000","163.1.201.45","192.168.1.5","TCP","62","1935 > 55261 [PSH, ACK] Seq=56234 Ack=1 Win=23771 Len=8"
"74","0.749980000","163.1.201.45","192.168.1.5","RTMP","1514","Unknown (0x0)"
"75","0.749983000","163.1.201.45","192.168.1.5","RTMP","518","Unknown (0x0)|Unknown (0x0)|Unknown (0x0)"
"77","0.750335000","163.1.201.45","192.168.1.5","RTMP","1514","Unknown (0x0)|Unknown (0x0)"
"78","0.750337000","163.1.201.45","192.168.1.5","RTMP","528","Unknown (0x0)"
"80","0.750785000","163.1.201.45","192.168.1.5","RTMP","1514","Unknown (0x0)|Unknown (0x0)"
"81","0.750788000","163.1.201.45","192.168.1.5","TCP","625","1935 > 55261 [PSH, ACK] Seq=61560 Ack=1 Win=23771 Len=571"
"82","0.750791000","163.1.201.45","192.168.1.5","TCP","1514","1935 > 55261 [ACK] Seq=62131 Ack=1 Win=23771 Len=1460"
"84","0.751038000","163.1.201.45","192.168.1.5","RTMP","813","Unknown (0x0)"
"86","1.000015000","163.1.201.45","192.168.1.5","TCP","62","1935 > 55261 [PSH, ACK] Seq=64350 Ack=1 Win=23771 Len=8"
"87","1.000018000","163.1.201.45","192.168.1.5","TCP","1514","1935 > 55261 [ACK] Seq=64358 Ack=1 Win=23771 Len=1460"
"89","1.001244000","163.1.201.45","192.168.1.5","RTMP","739","Unknown (0x0)"
"90","1.001246000","163.1.201.45","192.168.1.5","TCP","1514","1935 > 55261 [ACK] Seq=66503 Ack=1 Win=23771 Len=1460"
"91","1.001250000","163.1.201.45","192.168.1.5","TCP","728","1935 > 55261 [PSH, ACK] Seq=67963 Ack=1 Win=23771 Len=674"
"93","1.004016000","163.1.201.45","192.168.1.5","RTMP","1514","Unknown (0x0)|Unknown (0x0)"
"94","1.004018000","163.1.201.45","192.168.1.5","TCP","755","1935 > 55261 [PSH, ACK] Seq=70097 Ack=1 Win=23771 Len=701"
"95","1.004021000","163.1.201.45","192.168.1.5","RTMP","1514","Unknown (0x0)"
"96","1.004024000","163.1.201.45","192.168.1.5","TCP","560","1935 > 55261 [PSH, ACK] Seq=72258 Ack=1 Win=23771 Len=506"
"99","1.248783000","163.1.201.45","192.168.1.5","TCP","62","1935 > 55261 [PSH, ACK] Seq=72764 Ack=1 Win=23771 Len=8"
"100","1.251013000","163.1.201.45","192.168.1.5","RTMP","1514","Unknown (0x0)"
"102","1.253013000","163.1.201.45","192.168.1.5","TCP","537","1935 > 55261 [PSH, ACK] Seq=74232 Ack=1 Win=23771 Len=483"
"103","1.258025000","163.1.201.45","192.168.1.5","TCP","1514","1935 > 55261 [ACK] Seq=74715 Ack=1 Win=23771 Len=1460"
"104","1.258027000","163.1.201.45","192.168.1.5","TCP","1514","1935 > 55261 [ACK] Seq=76175 Ack=1 Win=23771 Len=1460"
"105","1.258031000","163.1.201.45","192.168.1.5","RTMP","1238","Unknown (0x0)|Unknown (0x0)"
"106","1.258033000","163.1.201.45","192.168.1.5","RTMP","1514","Unknown (0x0)|Unknown (0x0)|Unknown (0x0)|Unknown (0x0)"
"107","1.258035000","163.1.201.45","192.168.1.5","TCP","1514","1935 > 55261 [ACK] Seq=80279 Ack=1 Win=23771 Len=1460"
"108","1.258037000","163.1.201.45","192.168.1.5","TCP","1231","1935 > 55261 [PSH, ACK] Seq=81739 Ack=1 Win=23771 Len=1177"
"109","1.258039000","163.1.201.45","192.168.1.5","TCP","1514","1935 > 55261 [ACK] Seq=82916 Ack=1 Win=23771 Len=1460"
"110","1.258041000","163.1.201.45","192.168.1.5","RTMP","1514","Unknown (0x0)"
"111","1.258043000","163.1.201.45","192.168.1.5","TCP","1231","1935 > 55261 [PSH, ACK] Seq=85836 Ack=1 Win=23771 Len=1177"
"112","1.258045000","163.1.201.45","192.168.1.5","TCP","1514","1935 > 55261 [ACK] Seq=87013 Ack=1 Win=23771 Len=1460"
"116","1.260020000","163.1.201.45","192.168.1.5","TCP","1514","1935 > 55261 [ACK] Seq=88473 Ack=1 Win=23771 Len=1460"
"117","1.260022000","163.1.201.45","192.168.1.5","RTMP","1231","Unknown (0x0)|Unknown (0x0)|Unknown (0x0)"
"118","1.260026000","163.1.201.45","192.168.1.5","TCP","1514","1935 > 55261 [ACK] Seq=91110 Ack=1 Win=23771 Len=1460"
"119","1.260027000","163.1.201.45","192.168.1.5","RTMP","1514","Unknown (0x0)|Unknown (0x0)|Unknown (0x0)"
"120","1.260030000","163.1.201.45","192.168.1.5","TCP","1231","1935 > 55261 [PSH, ACK] Seq=94030 Ack=1 Win=23771 Len=1177"
"121","1.260032000","163.1.201.45","192.168.1.5","TCP","1514","1935 > 55261 [ACK] Seq=95207 Ack=1 Win=23771 Len=1460"
"122","1.260033000","163.1.201.45","192.168.1.5","TCP","1514","1935 > 55261 [ACK] Seq=96667 Ack=1 Win=23771 Len=1460"
"123","1.260035000","163.1.201.45","192.168.1.5","TCP","1231","1935 > 55261 [PSH, ACK] Seq=98127 Ack=1 Win=23771 Len=1177"
"124","1.260037000","163.1.201.45","192.168.1.5","RTMP","1514","Unknown (0x0)"
"125","1.260039000","163.1.201.45","192.168.1.5","RTMP","1514","Unknown (0x0)"
"130","1.262021000","163.1.201.45","192.168.1.5","TCP","1231","1935 > 55261 [PSH, ACK] Seq=102224 Ack=1 Win=23771 Len=1177"
"131","1.262024000","163.1.201.45","192.168.1.5","RTMP","1514","Video Data|Unknown (0x0)|Unknown (0x0)"
"132","1.262027000","163.1.201.45","192.168.1.5","TCP","1514","1935 > 55261 [ACK] Seq=104861 Ack=1 Win=23771 Len=1460"
"133","1.262029000","163.1.201.45","192.168.1.5","TCP","1231","1935 > 55261 [PSH, ACK] Seq=106321 Ack=1 Win=23771 Len=1177"
"134","1.262030000","163.1.201.45","192.168.1.5","TCP","1514","1935 > 55261 [ACK] Seq=107498 Ack=1 Win=23771 Len=1460"
"135","1.262032000","163.1.201.45","192.168.1.5","TCP","900","1935 > 55261 [PSH, ACK] Seq=108958 Ack=1 Win=23771 Len=846"
"136","1.262034000","163.1.201.45","192.168.1.5","RTMP","1514","Unknown (0x0)|Unknown (0x0)"
"137","1.262036000","163.1.201.45","192.168.1.5","TCP","125","1935 > 55261 [PSH, ACK] Seq=111264 Ack=1 Win=23771 Len=71"
"138","1.262037000","163.1.201.45","192.168.1.5","TCP","1514","1935 > 55261 [ACK] Seq=111335 Ack=1 Win=23771 Len=1460"
"139","1.262039000","163.1.201.45","192.168.1.5","TCP","1189","1935 > 55261 [PSH, ACK] Seq=112795 Ack=1 Win=23771 Len=1135"
"145","1.500017000","163.1.201.45","192.168.1.5","TCP","62","1935 > 55261 [PSH, ACK] Seq=113930 Ack=1 Win=23771 Len=8"
"146","1.502018000","163.1.201.45","192.168.1.5","RTMP","1514","Unknown (0x0)"
"148","1.504020000","163.1.201.45","192.168.1.5","RTMP","978","Unknown (0x0)"
"149","1.504022000","163.1.201.45","192.168.1.5","TCP","1514","1935 > 55261 [ACK] Seq=116322 Ack=1 Win=23771 Len=1460"
"150","1.504026000","163.1.201.45","192.168.1.5","RTMP","997","Unknown (0x0)"
"151","1.504027000","163.1.201.45","192.168.1.5","RTMP","1514","Unknown (0x0)|Unknown (0x0)|Unknown (0x0)"
"152","1.504030000","163.1.201.45","192.168.1.5","TCP","815","1935 > 55261 [PSH, ACK] Seq=120185 Ack=1 Win=23771 Len=761"
"153","1.504031000","163.1.201.45","192.168.1.5","TCP","1514","1935 > 55261 [ACK] Seq=120946 Ack=1 Win=23771 Len=1460"
"154","1.504033000","163.1.201.45","192.168.1.5","TCP","711","1935 > 55261 [PSH, ACK] Seq=122406 Ack=1 Win=23771 Len=657"
"160","1.750021000","163.1.201.45","192.168.1.5","TCP","62","1935 > 55261 [PSH, ACK] Seq=123063 Ack=1 Win=23771 Len=8"
"161","1.751579000","163.1.201.45","192.168.1.5","TCP","1514","1935 > 55261 [ACK] Seq=123071 Ack=1 Win=23771 Len=1460"
"163","1.754966000","163.1.201.45","192.168.1.5","TCP","754","1935 > 55261 [PSH, ACK] Seq=124531 Ack=1 Win=23771 Len=700"
"164","1.758025000","163.1.201.45","192.168.1.5","RTMP","1514","Unknown (0x0)"
"165","1.758029000","163.1.201.45","192.168.1.5","TCP","552","1935 > 55261 [PSH, ACK] Seq=126691 Ack=1 Win=23771 Len=498"
"166","1.758030000","163.1.201.45","192.168.1.5","RTMP","1514","Unknown (0x0)|Unknown (0x0)|Unknown (0x0)|Unknown (0x0)"
"168","1.760021000","163.1.201.45","192.168.1.5","RTMP","567","Unknown (0x0)|Unknown (0x0)"
"169","1.760023000","163.1.201.45","192.168.1.5","TCP","1514","1935 > 55261 [ACK] Seq=129162 Ack=1 Win=23771 Len=1460"
"170","1.760027000","163.1.201.45","192.168.1.5","RTMP","498","Unknown (0x0)|Unknown (0x0)"
"173","2.000023000","163.1.201.45","192.168.1.5","TCP","62","1935 > 55261 [PSH, ACK] Seq=131066 Ack=1 Win=23771 Len=8"
"174","2.003019000","163.1.201.45","192.168.1.5","RTMP","1514","Unknown (0x0)|Unknown (0x0)|Unknown (0x0)"
"176","2.005055000","163.1.201.45","192.168.1.5","RTMP","341","Unknown (0x0)"
"177","2.008024000","163.1.201.45","192.168.1.5","RTMP","1514","Unknown (0x0)|Unknown (0x0)|Unknown (0x0)"
"178","2.008027000","163.1.201.45","192.168.1.5","TCP","323","1935 > 55261 [PSH, ACK] Seq=134281 Ack=1 Win=23771 Len=269"
"179","2.008028000","163.1.201.45","192.168.1.5","RTMP","1514","Unknown (0x0)|Unknown (0x0)|Unknown (0x0)"
"180","2.008031000","163.1.201.45","192.168.1.5","RTMP","471","Unknown (0x0)"
"183","2.010022000","163.1.201.45","192.168.1.5","TCP","1514","1935 > 55261 [ACK] Seq=136427 Ack=1 Win=23771 Len=1460"
"184","2.010025000","163.1.201.45","192.168.1.5","TCP","404","1935 > 55261 [PSH, ACK] Seq=137887 Ack=1 Win=23771 Len=350"
"186","2.250027000","163.1.201.45","192.168.1.5","TCP","62","1935 > 55261 [PSH, ACK] Seq=138237 Ack=1 Win=23771 Len=8"
"187","2.252027000","163.1.201.45","192.168.1.5","RTMP","1514","Unknown (0x0)"
"188","2.252029000","163.1.201.45","192.168.1.5","RTMP","401","Unknown (0x0)|Unknown (0x0)"
"190","2.258028000","163.1.201.45","192.168.1.5","RTMP","1514","Unknown (0x0)"
"191","2.258031000","163.1.201.45","192.168.1.5","TCP","364","1935 > 55261 [PSH, ACK] Seq=141512 Ack=1 Win=23771 Len=310"
"193","2.260031000","163.1.201.45","192.168.1.5","TCP","1514","1935 > 55261 [ACK] Seq=141822 Ack=1 Win=23771 Len=1460"
"194","2.260033000","163.1.201.45","192.168.1.5","RTMP","1514","Unknown (0x0)"
"195","2.260037000","163.1.201.45","192.168.1.5","RTMP","1238","Unknown (0x0)"
"196","2.260039000","163.1.201.45","192.168.1.5","TCP","1514","1935 > 55261 [ACK] Seq=145926 Ack=1 Win=23771 Len=1460"
"197","2.260041000","163.1.201.45","192.168.1.5","RTMP","1514","Unknown (0x0)"
"198","2.260043000","163.1.201.45","192.168.1.5","RTMP","1231","Unknown (0x0)"
"199","2.260044000","163.1.201.45","192.168.1.5","RTMP","1514","Unknown (0x0)|Unknown (0x0)"
"200","2.260046000","163.1.201.45","192.168.1.5","RTMP","1514","Unknown (0x0)|Unknown (0x0)|Unknown (0x0)"
"201","2.260048000","163.1.201.45","192.168.1.5","RTMP","1231","Unknown (0x0)|Unknown (0x0)"
"202","2.260050000","163.1.201.45","192.168.1.5","RTMP","1514","Unknown (0x0)"
"206","2.260858000","163.1.201.45","192.168.1.5","TCP","1514","1935 > 55261 [ACK] Seq=155580 Ack=1 Win=23771 Len=1460"
"207","2.260861000","163.1.201.45","192.168.1.5","TCP","1231","1935 > 55261 [PSH, ACK] Seq=157040 Ack=1 Win=23771 Len=1177"
"208","2.260865000","163.1.201.45","192.168.1.5","TCP","1514","1935 > 55261 [ACK] Seq=158217 Ack=1 Win=23771 Len=1460"
"209","2.260867000","163.1.201.45","192.168.1.5","TCP","1514","1935 > 55261 [ACK] Seq=159677 Ack=1 Win=23771 Len=1460"
"210","2.260870000","163.1.201.45","192.168.1.5","TCP","1231","1935 > 55261 [PSH, ACK] Seq=161137 Ack=1 Win=23771 Len=1177"
"211","2.260871000","163.1.201.45","192.168.1.5","RTMP","1514","Unknown (0x0)"
"212","2.260873000","163.1.201.45","192.168.1.5","RTMP","1514","Unknown (0x0)|Unknown (0x0)|Unknown (0x0)|Unknown (0x0)|Unknown (0x0)|Unknown (0x0)|Unknown (0x0)"
"213","2.260875000","163.1.201.45","192.168.1.5","TCP","1231","1935 > 55261 [PSH, ACK] Seq=165234 Ack=1 Win=23771 Len=1177"
"214","2.260877000","163.1.201.45","192.168.1.5","TCP","1514","1935 > 55261 [ACK] Seq=166411 Ack=1 Win=23771 Len=1460"
"215","2.260879000","163.1.201.45","192.168.1.5","RTMP","1514","Unknown (0x0)|Unknown (0x0)"
"220","2.261571000","163.1.201.45","192.168.1.5","RTMP","1231","Unknown (0x0)|Unknown (0x0)"
"221","2.261574000","163.1.201.45","192.168.1.5","RTMP","1514","Video Data|Unknown (0x0)|Unknown (0x0)"
"222","2.261577000","163.1.201.45","192.168.1.5","RTMP","1514","Unknown (0x0)"
"223","2.261580000","163.1.201.45","192.168.1.5","RTMP","1231","Unknown (0x0)"
"224","2.261581000","163.1.201.45","192.168.1.5","TCP","1514","1935 > 55261 [ACK] Seq=174605 Ack=1 Win=23771 Len=1460"
"225","2.261584000","163.1.201.45","192.168.1.5","RTMP","742","Unknown (0x0)|Unknown (0x0)|Unknown (0x0)"
"226","2.261586000","163.1.201.45","192.168.1.5","RTMP","1483","Unknown (0x0)"
"230","2.500027000","163.1.201.45","192.168.1.5","TCP","62","1935 > 55261 [PSH, ACK] Seq=178182 Ack=1 Win=23771 Len=8"
"231","2.500029000","163.1.201.45","192.168.1.5","RTMP","1514","Unknown (0x0)|Unknown (0x0)"
"233","2.502029000","163.1.201.45","192.168.1.5","RTMP","1285","Unknown (0x0)|Unknown (0x0)|Unknown (0x0)"
"234","2.502032000","163.1.201.45","192.168.1.5","TCP","1514","1935 > 55261 [ACK] Seq=180881 Ack=1 Win=23771 Len=1460"
"235","2.502034000","163.1.201.45","192.168.1.5","RTMP","1166","Unknown (0x0)"
"237","2.505027000","163.1.201.45","192.168.1.5","TCP","1514","1935 > 55261 [ACK] Seq=183453 Ack=1 Win=23771 Len=1460"
"238","2.507029000","163.1.201.45","192.168.1.5","TCP","1402","1935 > 55261 [PSH, ACK] Seq=184913 Ack=1 Win=23771 Len=1348"
"239","2.507033000","163.1.201.45","192.168.1.5","RTMP","1514","Unknown (0x0)"
"240","2.507036000","163.1.201.45","192.168.1.5","TCP","92","1935 > 55261 [PSH, ACK] Seq=187721 Ack=1 Win=23771 Len=38"
"241","2.507036000","163.1.201.45","192.168.1.5","TCP","1514","1935 > 55261 [ACK] Seq=187759 Ack=1 Win=23771 Len=1460"
"242","2.507039000","163.1.201.45","192.168.1.5","TCP","140","1935 > 55261 [PSH, ACK] Seq=189219 Ack=1 Win=23771 Len=86"
"246","2.750031000","163.1.201.45","192.168.1.5","TCP","62","1935 > 55261 [PSH, ACK] Seq=189305 Ack=1 Win=23771 Len=8"
"247","2.752035000","163.1.201.45","192.168.1.5","RTMP","1514","Unknown (0x0)"
"249","2.754038000","163.1.201.45","192.168.1.5","RTMP","380","Unknown (0x0)"
"250","2.754042000","163.1.201.45","192.168.1.5","RTMP","1514","Unknown (0x0)"
"251","2.754045000","163.1.201.45","192.168.1.5","TCP","308","1935 > 55261 [PSH, ACK] Seq=192559 Ack=1 Win=23771 Len=254"
"252","2.754046000","163.1.201.45","192.168.1.5","TCP","1514","1935 > 55261 [ACK] Seq=192813 Ack=1 Win=23771 Len=1460"
"253","2.754048000","163.1.201.45","192.168.1.5","RTMP","378","Unknown (0x0)"
"254","2.754050000","163.1.201.45","192.168.1.5","TCP","1514","1935 > 55261 [ACK] Seq=194597 Ack=1 Win=23771 Len=1460"
"255","2.754051000","163.1.201.45","192.168.1.5","RTMP","379","Unknown (0x0)"
"256","2.754052000","163.1.201.45","192.168.1.5","RTMP","1514","Unknown (0x0)|Unknown (0x0)"
"257","2.754055000","163.1.201.45","192.168.1.5","TCP","178","1935 > 55261 [PSH, ACK] Seq=197842 Ack=1 Win=23771 Len=124"
"262","2.756036000","163.1.201.45","192.168.1.5","RTMP","1514","Unknown (0x0)"
"263","2.756038000","163.1.201.45","192.168.1.5","TCP","155","1935 > 55261 [PSH, ACK] Seq=199426 Ack=1 Win=23771 Len=101"
"264","2.756041000","163.1.201.45","192.168.1.5","RTMP","1514","Unknown (0x0)"
"265","2.756043000","163.1.201.45","192.168.1.5","TCP","212","1935 > 55261 [PSH, ACK] Seq=200987 Ack=1 Win=23771 Len=158"
"266","2.756044000","163.1.201.45","192.168.1.5","TCP","1514","1935 > 55261 [ACK] Seq=201145 Ack=1 Win=23771 Len=1460"
"267","2.756046000","163.1.201.45","192.168.1.5","TCP","114","1935 > 55261 [PSH, ACK] Seq=202605 Ack=1 Win=23771 Len=60"
"272","3.001039000","163.1.201.45","192.168.1.5","TCP","62","1935 > 55261 [PSH, ACK] Seq=202665 Ack=1 Win=23771 Len=8"
"273","3.001041000","163.1.201.45","192.168.1.5","RTMP","1514","Unknown (0x0)|Unknown (0x0)"
"274","3.001043000","163.1.201.45","192.168.1.5","TCP","122","1935 > 55261 [PSH, ACK] Seq=204133 Ack=1 Win=23771 Len=68"
"275","3.001045000","163.1.201.45","192.168.1.5","TCP","1514","1935 > 55261 [ACK] Seq=204201 Ack=1 Win=23771 Len=1460"
"276","3.001047000","163.1.201.45","192.168.1.5","TCP","153","1935 > 55261 [PSH, ACK] Seq=205661 Ack=1 Win=23771 Len=99"
"279","3.003038000","163.1.201.45","192.168.1.5","RTMP","1514","Unknown (0x0)"
"280","3.003040000","163.1.201.45","192.168.1.5","RTMP","1439","Window Acknowledgement Size|Unknown (0x0)"
"281","3.003044000","163.1.201.45","192.168.1.5","RTMP","1514","Unknown (0x0)"
"282","3.003046000","163.1.201.45","192.168.1.5","RTMP","1274","Unknown (0x0)"
"283","3.003048000","163.1.201.45","192.168.1.5","TCP","1514","1935 > 55261 [ACK] Seq=211285 Ack=1 Win=23771 Len=1460"
"284","3.003050000","163.1.201.45","192.168.1.5","TCP","1364","1935 > 55261 [PSH, ACK] Seq=212745 Ack=1 Win=23771 Len=1310"
"291","3.250160000","163.1.201.45","192.168.1.5","TCP","62","1935 > 55261 [PSH, ACK] Seq=214055 Ack=1 Win=23771 Len=8"
"292","3.250161000","163.1.201.45","192.168.1.5","TCP","1514","1935 > 55261 [ACK] Seq=214063 Ack=1 Win=23771 Len=1460"
"294","3.250528000","163.1.201.45","192.168.1.5","TCP","1387","1935 > 55261 [PSH, ACK] Seq=215523 Ack=1 Win=23771 Len=1333"
"295","3.256045000","163.1.201.45","192.168.1.5","TCP","1514","1935 > 55261 [ACK] Seq=216856 Ack=1 Win=23771 Len=1460"
"296","3.256048000","163.1.201.45","192.168.1.5","RTMP","1361","Unknown (0x0)|Unknown (0x0)"
"297","3.256050000","163.1.201.45","192.168.1.5","TCP","1514","1935 > 55261 [ACK] Seq=219623 Ack=1 Win=23771 Len=1460"
"298","3.256052000","163.1.201.45","192.168.1.5","TCP","61","1935 > 55261 [PSH, ACK] Seq=221083 Ack=1 Win=23771 Len=7"
"299","3.256053000","163.1.201.45","192.168.1.5","TCP","1433","1935 > 55261 [PSH, ACK] Seq=221090 Ack=1 Win=23771 Len=1379"
"302","3.499413000","163.1.201.45","192.168.1.5","TCP","62","1935 > 55261 [PSH, ACK] Seq=222469 Ack=1 Win=23771 Len=8"
"303","3.500511000","163.1.201.45","192.168.1.5","RTMP","1514","Unknown (0xb)"
"305","3.501041000","163.1.201.45","192.168.1.5","TCP","1514","1935 > 55261 [ACK] Seq=223937 Ack=1 Win=23771 Len=1460"
"306","3.501047000","163.1.201.45","192.168.1.5","RTMP","1230","Unknown (0x0)"
"307","3.501048000","163.1.201.45","192.168.1.5","TCP","1514","1935 > 55261 [ACK] Seq=226573 Ack=1 Win=23771 Len=1460"
"309","3.501498000","163.1.201.45","192.168.1.5","TCP","1514","1935 > 55261 [ACK] Seq=228033 Ack=1 Win=23771 Len=1460"
"310","3.501500000","163.1.201.45","192.168.1.5","TCP","1231","1935 > 55261 [PSH, ACK] Seq=229493 Ack=1 Win=23771 Len=1177"
"311","3.501504000","163.1.201.45","192.168.1.5","RTMP","1514","Unknown (0x0)"
"312","3.501506000","163.1.201.45","192.168.1.5","RTMP","1514","Unknown (0x0)|Unknown (0x0)|Unknown (0x0)|Unknown (0x0)|Unknown (0x0)|Unknown (0x0)"
"315","3.502783000","163.1.201.45","192.168.1.5","RTMP","1231","Unknown (0x0)"
"316","3.502785000","163.1.201.45","192.168.1.5","TCP","1514","1935 > 55261 [ACK] Seq=234767 Ack=1 Win=23771 Len=1460"
"318","3.503146000","163.1.201.45","192.168.1.5","TCP","1514","1935 > 55261 [ACK] Seq=236227 Ack=1 Win=23771 Len=1460"
"319","3.503148000","163.1.201.45","192.168.1.5","RTMP","1231","Unknown (0x0)|Unknown (0x0)|Unknown (0x0)"
"320","3.503152000","163.1.201.45","192.168.1.5","RTMP","1514","Unknown (0x0)"
"321","3.503154000","163.1.201.45","192.168.1.5","TCP","1514","1935 > 55261 [ACK] Seq=240324 Ack=1 Win=23771 Len=1460"
"322","3.503156000","163.1.201.45","192.168.1.5","TCP","1231","1935 > 55261 [PSH, ACK] Seq=241784 Ack=1 Win=23771 Len=1177"
"323","3.503159000","163.1.201.45","192.168.1.5","TCP","1514","1935 > 55261 [ACK] Seq=242961 Ack=1 Win=23771 Len=1460"
"326","3.503517000","163.1.201.45","192.168.1.5","TCP","1514","1935 > 55261 [ACK] Seq=244421 Ack=1 Win=23771 Len=1460"
"327","3.503520000","163.1.201.45","192.168.1.5","TCP","1231","1935 > 55261 [PSH, ACK] Seq=245881 Ack=1 Win=23771 Len=1177"
"330","3.503701000","163.1.201.45","192.168.1.5","TCP","1514","1935 > 55261 [ACK] Seq=247058 Ack=1 Win=23771 Len=1460"
"331","3.503898000","163.1.201.45","192.168.1.5","TCP","1514","1935 > 55261 [ACK] Seq=248518 Ack=1 Win=23771 Len=1460"
"333","3.504210000","163.1.201.45","192.168.1.5","TCP","1231","1935 > 55261 [PSH, ACK] Seq=249978 Ack=1 Win=23771 Len=1177"
"334","3.504508000","163.1.201.45","192.168.1.5","RTMP","1514","Unknown (0x0)|Unknown (0x0)"
"335","3.504511000","163.1.201.45","192.168.1.5","TCP","1514","1935 > 55261 [ACK] Seq=252615 Ack=1 Win=23771 Len=1460"
"337","3.504746000","163.1.201.45","192.168.1.5","RTMP","1231","Unknown (0x0)"
"338","3.504749000","163.1.201.45","192.168.1.5","TCP","1514","1935 > 55261 [ACK] Seq=255252 Ack=1 Win=23771 Len=1460"
"340","3.505003000","163.1.201.45","192.168.1.5","TCP","1472","1935 > 55261 [PSH, ACK] Seq=256712 Ack=1 Win=23771 Len=1418"
"341","3.505282000","163.1.201.45","192.168.1.5","RTMP","1514","Unknown (0x0)"
"342","3.505286000","163.1.201.45","192.168.1.5","RTMP","396","Unknown (0x0)|Unknown (0x0)"
"344","3.505571000","163.1.201.45","192.168.1.5","RTMP","1514","Unknown (0x0)"
"345","3.505574000","163.1.201.45","192.168.1.5","TCP","431","1935 > 55261 [PSH, ACK] Seq=261392 Ack=1 Win=23771 Len=377"
"346","3.505577000","163.1.201.45","192.168.1.5","RTMP","1514","Unknown (0x0)|Unknown (0x0)|Unknown (0x0)|Unknown (0x0)|Unknown (0x0)|Unknown (0x0)|Unknown (0x0)"
"347","3.505578000","163.1.201.45","192.168.1.5","TCP","271","1935 > 55261 [PSH, ACK] Seq=263229 Ack=1 Win=23771 Len=217"
"350","3.505956000","163.1.201.45","192.168.1.5","RTMP","1514","Unknown (0x0)"
"351","3.505959000","163.1.201.45","192.168.1.5","TCP","155","1935 > 55261 [PSH, ACK] Seq=264906 Ack=1 Win=23771 Len=101"
"353","3.509040000","163.1.201.45","192.168.1.5","RTMP","1514","Unknown (0x0)"
"354","3.509045000","163.1.201.45","192.168.1.5","TCP","325","1935 > 55261 [PSH, ACK] Seq=266467 Ack=1 Win=23771 Len=271"
"355","3.509046000","163.1.201.45","192.168.1.5","RTMP","1514","Unknown (0x0)"
"356","3.509048000","163.1.201.45","192.168.1.5","TCP","58","1935 > 55261 [PSH, ACK] Seq=268198 Ack=1 Win=23771 Len=4"
"357","3.509049000","163.1.201.45","192.168.1.5","TCP","1504","1935 > 55261 [PSH, ACK] Seq=268202 Ack=1 Win=23771 Len=1450"
"361","3.749356000","163.1.201.45","192.168.1.5","TCP","62","1935 > 55261 [PSH, ACK] Seq=269652 Ack=1 Win=23771 Len=8"
"362","3.751262000","163.1.201.45","192.168.1.5","TCP","1514","1935 > 55261 [ACK] Seq=269660 Ack=1 Win=23771 Len=1460"
"363","3.751264000","163.1.201.45","192.168.1.5","RTMP","1278","Unknown (0x0)"
"365","3.754045000","163.1.201.45","192.168.1.5","RTMP","1514","Window Acknowledgement Size|Unknown (0x0)"
"366","3.754047000","163.1.201.45","192.168.1.5","RTMP","1211","Unknown (0x0)"
"367","3.754051000","163.1.201.45","192.168.1.5","TCP","1514","1935 > 55261 [ACK] Seq=274961 Ack=1 Win=23771 Len=1460"
"368","3.754054000","163.1.201.45","192.168.1.5","TCP","1064","1935 > 55261 [PSH, ACK] Seq=276421 Ack=1 Win=23771 Len=1010"
"369","3.754056000","163.1.201.45","192.168.1.5","RTMP","1514","Unknown (0x0)|Unknown (0x0)"
"370","3.754058000","163.1.201.45","192.168.1.5","RTMP","824","Unknown (0x0)|Unknown (0x0)"
"375","4.001044000","163.1.201.45","192.168.1.5","TCP","62","1935 > 55261 [PSH, ACK] Seq=279661 Ack=1 Win=23771 Len=8"
"376","4.003042000","163.1.201.45","192.168.1.5","RTMP","1514","Unknown (0x0)"
"378","4.005047000","163.1.201.45","192.168.1.5","TCP","793","1935 > 55261 [PSH, ACK] Seq=281129 Ack=1 Win=23771 Len=739"
"379","4.005049000","163.1.201.45","192.168.1.5","TCP","1514","1935 > 55261 [ACK] Seq=281868 Ack=1 Win=23771 Len=1460"
"380","4.005053000","163.1.201.45","192.168.1.5","TCP","1140","1935 > 55261 [PSH, ACK] Seq=283328 Ack=1 Win=23771 Len=1086"
"381","4.005055000","163.1.201.45","192.168.1.5","TCP","1514","1935 > 55261 [ACK] Seq=284414 Ack=1 Win=23771 Len=1460"
"382","4.005057000","163.1.201.45","192.168.1.5","TCP","856","1935 > 55261 [PSH, ACK] Seq=285874 Ack=1 Win=23771 Len=802"
"385","4.008049000","163.1.201.45","192.168.1.5","RTMP","1514","Unknown (0x0)"
"386","4.010041000","163.1.201.45","192.168.1.5","TCP","689","1935 > 55261 [PSH, ACK] Seq=288136 Ack=1 Win=23771 Len=635"
"388","4.249133000","163.1.201.45","192.168.1.5","TCP","62","1935 > 55261 [PSH, ACK] Seq=288771 Ack=1 Win=23771 Len=8"
"389","4.249135000","163.1.201.45","192.168.1.5","RTMP","1514","Unknown (0x0)|Unknown (0x0)"
"391","4.250027000","163.1.201.45","192.168.1.5","RTMP","439","Unknown (0x0)"
"392","4.253046000","163.1.201.45","192.168.1.5","TCP","1514","1935 > 55261 [ACK] Seq=290624 Ack=1 Win=23771 Len=1460"
"394","4.255046000","163.1.201.45","192.168.1.5","TCP","602","1935 > 55261 [PSH, ACK] Seq=292084 Ack=1 Win=23771 Len=548"
"395","4.255050000","163.1.201.45","192.168.1.5","RTMP","1514","Unknown (0x0)|Unknown (0x0)"
"396","4.255053000","163.1.201.45","192.168.1.5","TCP","466","1935 > 55261 [PSH, ACK] Seq=294092 Ack=1 Win=23771 Len=412"
"399","4.500051000","163.1.201.45","192.168.1.5","TCP","62","1935 > 55261 [PSH, ACK] Seq=294504 Ack=1 Win=23771 Len=8"
"400","4.502049000","163.1.201.45","192.168.1.5","TCP","1514","1935 > 55261 [ACK] Seq=294512 Ack=1 Win=23771 Len=1460"
"402","4.504059000","163.1.201.45","192.168.1.5","RTMP","555","Unknown (0x0)|Unknown (0x0)|Unknown (0x0)"
"403","4.504061000","163.1.201.45","192.168.1.5","RTMP","1514","Unknown (0x0)"
"404","4.504065000","163.1.201.45","192.168.1.5","TCP","1514","1935 > 55261 [ACK] Seq=297933 Ack=1 Win=23771 Len=1460"
"405","4.504066000","163.1.201.45","192.168.1.5","RTMP","1238","Unknown (0x0)|Unknown (0x0)"
"406","4.504069000","163.1.201.45","192.168.1.5","TCP","1514","1935 > 55261 [ACK] Seq=300577 Ack=1 Win=23771 Len=1460"
"407","4.504071000","163.1.201.45","192.168.1.5","TCP","1514","1935 > 55261 [ACK] Seq=302037 Ack=1 Win=23771 Len=1460"
"408","4.504073000","163.1.201.45","192.168.1.5","RTMP","1231","Unknown (0x0)|Unknown (0x0)"
"411","4.506057000","163.1.201.45","192.168.1.5","TCP","1514","1935 > 55261 [ACK] Seq=304674 Ack=1 Win=23771 Len=1460"
"412","4.507544000","163.1.201.45","192.168.1.5","TCP","1514","1935 > 55261 [ACK] Seq=306134 Ack=1 Win=23771 Len=1460"
"413","4.507549000","163.1.201.45","192.168.1.5","RTMP","1231","Unknown (0x0)|Unknown (0x0)"
"414","4.507550000","163.1.201.45","192.168.1.5","TCP","1514","1935 > 55261 [ACK] Seq=308771 Ack=1 Win=23771 Len=1460"
"415","4.507553000","163.1.201.45","192.168.1.5","TCP","1514","1935 > 55261 [ACK] Seq=310231 Ack=1 Win=23771 Len=1460"
"416","4.507555000","163.1.201.45","192.168.1.5","RTMP","1231","Unknown (0x0)"
"417","4.507556000","163.1.201.45","192.168.1.5","RTMP","1514","Unknown (0x0)|Unknown (0x0)"
"418","4.507559000","163.1.201.45","192.168.1.5","TCP","1514","1935 > 55261 [ACK] Seq=314328 Ack=1 Win=23771 Len=1460"
"419","4.507561000","163.1.201.45","192.168.1.5","TCP","1231","1935 > 55261 [PSH, ACK] Seq=315788 Ack=1 Win=23771 Len=1177"
"420","4.507563000","163.1.201.45","192.168.1.5","TCP","1514","1935 > 55261 [ACK] Seq=316965 Ack=1 Win=23771 Len=1460"
"424","4.508475000","163.1.201.45","192.168.1.5","TCP","1514","1935 > 55261 [ACK] Seq=318425 Ack=1 Win=23771 Len=1460"
"425","4.508478000","163.1.201.45","192.168.1.5","TCP","1231","1935 > 55261 [PSH, ACK] Seq=319885 Ack=1 Win=23771 Len=1177"
"427","4.508751000","163.1.201.45","192.168.1.5","RTMP","1514","Unknown (0x0)|Unknown (0x0)|Unknown (0x0)|Unknown (0x0)|Unknown (0x0)"
"428","4.508753000","163.1.201.45","192.168.1.5","RTMP","1514","Unknown (0x0)"
"429","4.508757000","163.1.201.45","192.168.1.5","TCP","1231","1935 > 55261 [PSH, ACK] Seq=323982 Ack=1 Win=23771 Len=1177"
"431","4.509053000","163.1.201.45","192.168.1.5","RTMP","1514","Unknown (0x0)|Unknown (0x0)"
"432","4.509316000","163.1.201.45","192.168.1.5","RTMP","1514","Unknown (0x0)|Unknown (0x0)|Unknown (0x0)"
"433","4.509320000","163.1.201.45","192.168.1.5","TCP","1231","1935 > 55261 [PSH, ACK] Seq=328079 Ack=1 Win=23771 Len=1177"
"435","4.509574000","163.1.201.45","192.168.1.5","RTMP","1514","Video Data"
"436","4.509673000","163.1.201.45","192.168.1.5","TCP","538","1935 > 55261 [PSH, ACK] Seq=330716 Ack=1 Win=23771 Len=484"
"438","4.509954000","163.1.201.45","192.168.1.5","RTMP","1514","Unknown (0x0)"
"439","4.509956000","163.1.201.45","192.168.1.5","RTMP","129","Unknown (0xb)"
"441","4.510410000","163.1.201.45","192.168.1.5","TCP","1514","1935 > 55261 [ACK] Seq=332735 Ack=1 Win=23771 Len=1460"
"442","4.510545000","163.1.201.45","192.168.1.5","RTMP","1127","Unknown (0x0)"
"444","4.510859000","163.1.201.45","192.168.1.5","RTMP","1514","Unknown (0x0)|Unknown (0x0)"
"445","4.510863000","163.1.201.45","192.168.1.5","TCP","954","1935 > 55261 [PSH, ACK] Seq=336728 Ack=1 Win=23771 Len=900"
"447","4.749415000","163.1.201.45","192.168.1.5","TCP","62","1935 > 55261 [PSH, ACK] Seq=337628 Ack=1 Win=23771 Len=8"
"448","4.749417000","163.1.201.45","192.168.1.5","TCP","1514","1935 > 55261 [ACK] Seq=337636 Ack=1 Win=23771 Len=1460"
"450","4.749727000","163.1.201.45","192.168.1.5","TCP","685","1935 > 55261 [PSH, ACK] Seq=339096 Ack=1 Win=23771 Len=631"
"451","4.749913000","163.1.201.45","192.168.1.5","TCP","1514","1935 > 55261 [ACK] Seq=339727 Ack=1 Win=23771 Len=1460"
"453","4.750133000","163.1.201.45","192.168.1.5","TCP","734","1935 > 55261 [PSH, ACK] Seq=341187 Ack=1 Win=23771 Len=680"
"454","4.750432000","163.1.201.45","192.168.1.5","TCP","1514","1935 > 55261 [ACK] Seq=341867 Ack=1 Win=23771 Len=1460"
"455","4.750435000","163.1.201.45","192.168.1.5","RTMP","808","Unknown (0x0)"
"457","4.750960000","163.1.201.45","192.168.1.5","RTMP","1514","Unknown (0x0)|Unknown (0x0)"
"458","4.753050000","163.1.201.45","192.168.1.5","RTMP","513","Unknown (0x0)"
"460","5.000056000","163.1.201.45","192.168.1.5","TCP","62","1935 > 55261 [PSH, ACK] Seq=346000 Ack=1 Win=23771 Len=8"
"461","5.000579000","163.1.201.45","192.168.1.5","TCP","1514","1935 > 55261 [ACK] Seq=346008 Ack=1 Win=23771 Len=1460"
"462","5.000582000","163.1.201.45","192.168.1.5","TCP","440","1935 > 55261 [PSH, ACK] Seq=347468 Ack=1 Win=23771 Len=386"
"464","5.004060000","163.1.201.45","192.168.1.5","TCP","1514","1935 > 55261 [ACK] Seq=347854 Ack=1 Win=23771 Len=1460"
"465","5.004062000","163.1.201.45","192.168.1.5","RTMP","505","Unknown (0xb)"
"466","5.004066000","163.1.201.45","192.168.1.5","RTMP","1514","Unknown (0x0)"
"467","5.004068000","163.1.201.45","192.168.1.5","RTMP","382","Unknown (0x0)|Unknown (0x0)"
"468","5.004069000","163.1.201.45","192.168.1.5","RTMP","1514","Unknown (0x0)|Unknown (0x0)"
"469","5.004071000","163.1.201.45","192.168.1.5","TCP","375","1935 > 55261 [PSH, ACK] Seq=353013 Ack=1 Win=23771 Len=321"
"473","5.249042000","163.1.201.45","192.168.1.5","TCP","62","1935 > 55261 [PSH, ACK] Seq=353334 Ack=1 Win=23771 Len=8"
"474","5.249674000","163.1.201.45","192.168.1.5","TCP","1514","1935 > 55261 [ACK] Seq=353342 Ack=1 Win=23771 Len=1460"
"476","5.250138000","163.1.201.45","192.168.1.5","TCP","413","1935 > 55261 [PSH, ACK] Seq=354802 Ack=1 Win=23771 Len=359"
"477","5.251199000","163.1.201.45","192.168.1.5","RTMP","1514","Unknown (0x0)|Unknown (0x0)|Unknown (0x0)"
"479","5.251584000","163.1.201.45","192.168.1.5","RTMP","232","Unknown (0x0)"
"480","5.251585000","163.1.201.45","192.168.1.5","RTMP","1514","Unknown (0x0)|Unknown (0x0)|Unknown (0x0)|Unknown (0x0)"
"481","5.251589000","163.1.201.45","192.168.1.5","RTMP","348","Unknown (0x0)"
"484","5.500062000","163.1.201.45","192.168.1.5","TCP","62","1935 > 55261 [PSH, ACK] Seq=358553 Ack=1 Win=23771 Len=8"
"485","5.500992000","163.1.201.45","192.168.1.5","RTMP","1514","Unknown (0x0)"
"486","5.500996000","163.1.201.45","192.168.1.5","TCP","400","1935 > 55261 [PSH, ACK] Seq=360021 Ack=1 Win=23771 Len=346"
"488","5.504464000","163.1.201.45","192.168.1.5","RTMP","1514","Unknown (0x0)"
"489","5.504467000","163.1.201.45","192.168.1.5","RTMP","333","Unknown (0x0)"
"490","5.504468000","163.1.201.45","192.168.1.5","TCP","1514","1935 > 55261 [ACK] Seq=362106 Ack=1 Win=23771 Len=1460"
"492","5.504838000","163.1.201.45","192.168.1.5","TCP","1514","1935 > 55261 [ACK] Seq=363566 Ack=1 Win=23771 Len=1460"
"493","5.504841000","163.1.201.45","192.168.1.5","TCP","1238","1935 > 55261 [PSH, ACK] Seq=365026 Ack=1 Win=23771 Len=1184"
"495","5.505202000","163.1.201.45","192.168.1.5","TCP","1514","1935 > 55261 [ACK] Seq=366210 Ack=1 Win=23771 Len=1460"
"496","5.505205000","163.1.201.45","192.168.1.5","TCP","1514","1935 > 55261 [ACK] Seq=367670 Ack=1 Win=23771 Len=1460"
"498","5.505443000","163.1.201.45","192.168.1.5","RTMP","1231","Unknown (0x0)|Unknown (0x0)|Unknown (0x0)|Unknown (0x0)|Unknown (0xb)"
"499","5.505445000","163.1.201.45","192.168.1.5","TCP","1514","1935 > 55261 [ACK] Seq=370307 Ack=1 Win=23771 Len=1460"
"501","5.508506000","163.1.201.45","192.168.1.5","RTMP","1514","Unknown (0x0)"
"502","5.508509000","163.1.201.45","192.168.1.5","TCP","1231","1935 > 55261 [PSH, ACK] Seq=373227 Ack=1 Win=23771 Len=1177"
"503","5.508512000","163.1.201.45","192.168.1.5","TCP","1514","1935 > 55261 [ACK] Seq=374404 Ack=1 Win=23771 Len=1460"
"504","5.508514000","163.1.201.45","192.168.1.5","TCP","1514","1935 > 55261 [ACK] Seq=375864 Ack=1 Win=23771 Len=1460"
"505","5.508516000","163.1.201.45","192.168.1.5","TCP","1231","1935 > 55261 [PSH, ACK] Seq=377324 Ack=1 Win=23771 Len=1177"
"506","5.508518000","163.1.201.45","192.168.1.5","RTMP","1514","Unknown (0x0)"
"507","5.508520000","163.1.201.45","192.168.1.5","RTMP","1514","Unknown (0x0)"
"508","5.508522000","163.1.201.45","192.168.1.5","RTMP","1231","Unknown (0x0)|Unknown (0x0)"
"509","5.508523000","163.1.201.45","192.168.1.5","TCP","1514","1935 > 55261 [ACK] Seq=382598 Ack=1 Win=23771 Len=1460"
"510","5.508526000","163.1.201.45","192.168.1.5","RTMP","1514","Unknown (0x0)|Unknown (0x0)|Unknown (0x0)"
"515","5.509127000","163.1.201.45","192.168.1.5","TCP","1231","1935 > 55261 [PSH, ACK] Seq=385518 Ack=1 Win=23771 Len=1177"
"516","5.509129000","163.1.201.45","192.168.1.5","RTMP","1514","Video Data"
"517","5.509133000","163.1.201.45","192.168.1.5","RTMP","1514","Unknown (0x0)|Unknown (0x0)|Unknown (0x0)"
"518","5.509135000","163.1.201.45","192.168.1.5","TCP","1231","1935 > 55261 [PSH, ACK] Seq=389615 Ack=1 Win=23771 Len=1177"
"519","5.509137000","163.1.201.45","192.168.1.5","TCP","1514","1935 > 55261 [ACK] Seq=390792 Ack=1 Win=23771 Len=1460"
"520","5.509139000","163.1.201.45","192.168.1.5","RTMP","1514","Unknown (0x0)"
"521","5.509141000","163.1.201.45","192.168.1.5","RTMP","1231","Unknown (0x0)|Unknown (0x0)"
"522","5.509144000","163.1.201.45","192.168.1.5","RTMP","1514","Unknown (0x0)"
"523","5.509146000","163.1.201.45","192.168.1.5","TCP","527","1935 > 55261 [PSH, ACK] Seq=396349 Ack=1 Win=23771 Len=473"
"524","5.509147000","163.1.201.45","192.168.1.5","TCP","1514","1935 > 55261 [ACK] Seq=396822 Ack=1 Win=23771 Len=1460"
"528","5.509561000","163.1.201.45","192.168.1.5","TCP","140","1935 > 55261 [PSH, ACK] Seq=398282 Ack=1 Win=23771 Len=86"
"529","5.509562000","163.1.201.45","192.168.1.5","TCP","1514","1935 > 55261 [ACK] Seq=398368 Ack=1 Win=23771 Len=1460"
"530","5.509565000","163.1.201.45","192.168.1.5","RTMP","1021","Unknown (0x0)"
"534","5.751070000","163.1.201.45","192.168.1.5","TCP","62","1935 > 55261 [PSH, ACK] Seq=400795 Ack=1 Win=23771 Len=8"
"535","5.753068000","163.1.201.45","192.168.1.5","TCP","1514","1935 > 55261 [ACK] Seq=400803 Ack=1 Win=23771 Len=1460"
"536","5.753072000","163.1.201.45","192.168.1.5","TCP","791","1935 > 55261 [PSH, ACK] Seq=402263 Ack=1 Win=23771 Len=737"
