"No.","Time","Source","Destination","Protocol","Length","Info"
"2","0.001106000","217.166.60.247","192.168.1.4","TCP","1078","80 > 56965 [PSH, ACK] Seq=1 Ack=1 Win=2920 Len=1024"
"4","0.001782000","217.166.60.247","192.168.1.4","TCP","1078","80 > 56965 [PSH, ACK] Seq=1025 Ack=1 Win=2920 Len=1024"
"6","0.030869000","217.166.60.247","192.168.1.4","TCP","1078","80 > 56965 [PSH, ACK] Seq=2049 Ack=1 Win=2920 Len=1024"
"8","0.031501000","217.166.60.247","192.168.1.4","TCP","1078","80 > 56965 [PSH, ACK] Seq=3073 Ack=1 Win=2920 Len=1024"
"10","0.050817000","217.166.60.247","192.168.1.4","TCP","1078","80 > 56965 [PSH, ACK] Seq=4097 Ack=1 Win=2920 Len=1024"
"12","0.053671000","217.166.60.247","192.168.1.4","TCP","1078","80 > 56965 [PSH, ACK] Seq=5121 Ack=1 Win=2920 Len=1024"
"13","0.061079000","217.166.60.247","192.168.1.4","TCP","1078","80 > 56965 [PSH, ACK] Seq=6145 Ack=1 Win=2920 Len=1024"
"15","0.063975000","217.166.60.247","192.168.1.4","TCP","1078","80 > 56965 [PSH, ACK] Seq=7169 Ack=1 Win=2920 Len=1024"
"16","0.066086000","217.166.60.247","192.168.1.4","TCP","1078","80 > 56965 [PSH, ACK] Seq=8193 Ack=1 Win=2920 Len=1024"
"18","0.066754000","217.166.60.247","192.168.1.4","TCP","1078","80 > 56965 [PSH, ACK] Seq=9217 Ack=1 Win=2920 Len=1024"
"19","0.068252000","217.166.60.247","192.168.1.4","TCP","1078","80 > 56965 [PSH, ACK] Seq=10241 Ack=1 Win=2920 Len=1024"
"21","0.083222000","217.166.60.247","192.168.1.4","TCP","1078","80 > 56965 [PSH, ACK] Seq=11265 Ack=1 Win=2920 Len=1024"
"22","0.086055000","217.166.60.247","192.168.1.4","TCP","1078","80 > 56965 [PSH, ACK] Seq=12289 Ack=1 Win=2920 Len=1024"
"24","0.108216000","217.166.60.247","192.168.1.4","TCP","1078","80 > 56965 [PSH, ACK] Seq=13313 Ack=1 Win=2920 Len=1024"
"25","0.112239000","217.166.60.247","192.168.1.4","TCP","1078","80 > 56965 [PSH, ACK] Seq=14337 Ack=1 Win=2920 Len=1024"
"27","0.140565000","217.166.60.247","192.168.1.4","TCP","1078","80 > 56965 [PSH, ACK] Seq=15361 Ack=1 Win=2920 Len=1024"
"28","0.142539000","217.166.60.247","192.168.1.4","TCP","1078","80 > 56965 [PSH, ACK] Seq=16385 Ack=1 Win=2920 Len=1024"
"31","0.158965000","217.166.60.247","192.168.1.4","TCP","1078","80 > 56965 [PSH, ACK] Seq=17409 Ack=1 Win=2920 Len=1024"
"32","0.162511000","217.166.60.247","192.168.1.4","TCP","1078","80 > 56965 [PSH, ACK] Seq=18433 Ack=1 Win=2920 Len=1024"
"34","0.171603000","217.166.60.247","192.168.1.4","TCP","1078","80 > 56965 [PSH, ACK] Seq=19457 Ack=1 Win=2920 Len=1024"
"35","0.172261000","217.166.60.247","192.168.1.4","TCP","1078","80 > 56965 [PSH, ACK] Seq=20481 Ack=1 Win=2920 Len=1024"
"37","0.179002000","217.166.60.247","192.168.1.4","TCP","1078","80 > 56965 [PSH, ACK] Seq=21505 Ack=1 Win=2920 Len=1024"
"38","0.185377000","217.166.60.247","192.168.1.4","TCP","1078","80 > 56965 [PSH, ACK] Seq=22529 Ack=1 Win=2920 Len=1024"
"40","0.186823000","217.166.60.247","192.168.1.4","TCP","1078","80 > 56965 [PSH, ACK] Seq=23553 Ack=1 Win=2920 Len=1024"
"41","0.187599000","217.166.60.247","192.168.1.4","TCP","1078","80 > 56965 [PSH, ACK] Seq=24577 Ack=1 Win=2920 Len=1024"
"43","0.197964000","217.166.60.247","192.168.1.4","TCP","285","80 > 56965 [ACK] Seq=25601 Ack=1 Win=2920 Len=231"
"44","0.197966000","217.166.60.247","192.168.1.4","TCP","121","80 > 56965 [ACK] Seq=25832 Ack=1 Win=2920 Len=67"
"46","0.199760000","217.166.60.247","192.168.1.4","TCP","1078","80 > 56965 [PSH, ACK] Seq=25899 Ack=1 Win=2920 Len=1024"
"47","0.201086000","217.166.60.247","192.168.1.4","TCP","1078","80 > 56965 [PSH, ACK] Seq=26923 Ack=1 Win=2920 Len=1024"
"49","0.220572000","217.166.60.247","192.168.1.4","TCP","1078","80 > 56965 [PSH, ACK] Seq=27947 Ack=1 Win=2920 Len=1024"
"50","0.221232000","217.166.60.247","192.168.1.4","TCP","1078","80 > 56965 [PSH, ACK] Seq=28971 Ack=1 Win=2920 Len=1024"
"52","0.253690000","217.166.60.247","192.168.1.4","TCP","1078","80 > 56965 [PSH, ACK] Seq=29995 Ack=1 Win=2920 Len=1024"
"53","0.259676000","217.166.60.247","192.168.1.4","TCP","1078","80 > 56965 [PSH, ACK] Seq=31019 Ack=1 Win=2920 Len=1024"
"55","0.270111000","217.166.60.247","192.168.1.4","TCP","1078","80 > 56965 [PSH, ACK] Seq=32043 Ack=1 Win=2920 Len=1024"
"56","0.277990000","217.166.60.247","192.168.1.4","TCP","1078","80 > 56965 [PSH, ACK] Seq=33067 Ack=1 Win=2920 Len=1024"
"58","0.285370000","217.166.60.247","192.168.1.4","TCP","1078","80 > 56965 [PSH, ACK] Seq=34091 Ack=1 Win=2920 Len=1024"
"59","0.286789000","217.166.60.247","192.168.1.4","TCP","1078","80 > 56965 [PSH, ACK] Seq=35115 Ack=1 Win=2920 Len=1024"
"61","0.294573000","217.166.60.247","192.168.1.4","TCP","1078","80 > 56965 [PSH, ACK] Seq=36139 Ack=1 Win=2920 Len=1024"
"62","0.298570000","217.166.60.247","192.168.1.4","TCP","1078","80 > 56965 [PSH, ACK] Seq=37163 Ack=1 Win=2920 Len=1024"
"64","0.300570000","217.166.60.247","192.168.1.4","TCP","1078","80 > 56965 [PSH, ACK] Seq=38187 Ack=1 Win=2920 Len=1024"
"65","0.307544000","217.166.60.247","192.168.1.4","TCP","1078","80 > 56965 [PSH, ACK] Seq=39211 Ack=1 Win=2920 Len=1024"
"67","0.313577000","217.166.60.247","192.168.1.4","TCP","1078","80 > 56965 [PSH, ACK] Seq=40235 Ack=1 Win=2920 Len=1024"
"68","0.317991000","217.166.60.247","192.168.1.4","TCP","1078","80 > 56965 [PSH, ACK] Seq=41259 Ack=1 Win=2920 Len=1024"
"70","0.328250000","217.166.60.247","192.168.1.4","TCP","1078","80 > 56965 [PSH, ACK] Seq=42283 Ack=1 Win=2920 Len=1024"
"71","0.329392000","217.166.60.247","192.168.1.4","TCP","1078","80 > 56965 [PSH, ACK] Seq=43307 Ack=1 Win=2920 Len=1024"
"73","0.368257000","217.166.60.247","192.168.1.4","TCP","1078","80 > 56965 [PSH, ACK] Seq=44331 Ack=1 Win=2920 Len=1024"
"74","0.370100000","217.166.60.247","192.168.1.4","TCP","1078","80 > 56965 [PSH, ACK] Seq=45355 Ack=1 Win=2920 Len=1024"
"76","0.388249000","217.166.60.247","192.168.1.4","TCP","1078","80 > 56965 [PSH, ACK] Seq=46379 Ack=1 Win=2920 Len=1024"
"77","0.394402000","217.166.60.247","192.168.1.4","TCP","1078","80 > 56965 [PSH, ACK] Seq=47403 Ack=1 Win=2920 Len=1024"
"79","0.397296000","217.166.60.247","192.168.1.4","TCP","1078","80 > 56965 [PSH, ACK] Seq=48427 Ack=1 Win=2920 Len=1024"
"80","0.397976000","217.166.60.247","192.168.1.4","TCP","1078","80 > 56965 [PSH, ACK] Seq=49451 Ack=1 Win=2920 Len=1024"
"83","0.406815000","217.166.60.247","192.168.1.4","TCP","1078","80 > 56965 [PSH, ACK] Seq=50475 Ack=1 Win=2920 Len=1024"
"84","0.412251000","217.166.60.247","192.168.1.4","TCP","1078","80 > 56965 [PSH, ACK] Seq=51499 Ack=1 Win=2920 Len=1024"
"86","0.418957000","217.166.60.247","192.168.1.4","TCP","1078","80 > 56965 [PSH, ACK] Seq=52523 Ack=1 Win=2920 Len=1024"
"87","0.423948000","217.166.60.247","192.168.1.4","TCP","1078","80 > 56965 [PSH, ACK] Seq=53547 Ack=1 Win=2920 Len=1024"
"89","0.427583000","217.166.60.247","192.168.1.4","TCP","1078","80 > 56965 [PSH, ACK] Seq=54571 Ack=1 Win=2920 Len=1024"
"90","0.431576000","217.166.60.247","192.168.1.4","TCP","1078","80 > 56965 [PSH, ACK] Seq=55595 Ack=1 Win=2920 Len=1024"
"92","0.441103000","217.166.60.247","192.168.1.4","TCP","1078","80 > 56965 [PSH, ACK] Seq=56619 Ack=1 Win=2920 Len=1024"
"93","0.444660000","217.166.60.247","192.168.1.4","TCP","1078","80 > 56965 [PSH, ACK] Seq=57643 Ack=1 Win=2920 Len=1024"
"95","0.481054000","217.166.60.247","192.168.1.4","TCP","373","80 > 56965 [ACK] Seq=58667 Ack=1 Win=2920 Len=319"
"96","0.481055000","217.166.60.247","192.168.1.4","TCP","1078","80 > 56965 [PSH, ACK] Seq=58986 Ack=1 Win=2920 Len=1024"
"98","0.483963000","217.166.60.247","192.168.1.4","TCP","1078","80 > 56965 [PSH, ACK] Seq=60010 Ack=1 Win=2920 Len=1024"
"99","0.501110000","217.166.60.247","192.168.1.4","TCP","1078","80 > 56965 [PSH, ACK] Seq=61034 Ack=1 Win=2920 Len=1024"
"101","0.502536000","217.166.60.247","192.168.1.4","TCP","1078","80 > 56965 [PSH, ACK] Seq=62058 Ack=1 Win=2920 Len=1024"
"102","0.506805000","217.166.60.247","192.168.1.4","TCP","1078","80 > 56965 [PSH, ACK] Seq=63082 Ack=1 Win=2920 Len=1024"
"104","0.510164000","217.166.60.247","192.168.1.4","TCP","1078","80 > 56965 [PSH, ACK] Seq=64106 Ack=1 Win=2920 Len=1024"
"105","0.521810000","217.166.60.247","192.168.1.4","TCP","1078","80 > 56965 [PSH, ACK] Seq=65130 Ack=1 Win=2920 Len=1024"
"107","0.526114000","217.166.60.247","192.168.1.4","TCP","1078","80 > 56965 [PSH, ACK] Seq=66154 Ack=1 Win=2920 Len=1024"
"108","0.532280000","217.166.60.247","192.168.1.4","TCP","1078","80 > 56965 [PSH, ACK] Seq=67178 Ack=1 Win=2920 Len=1024"
"110","0.533581000","217.166.60.247","192.168.1.4","TCP","1078","80 > 56965 [PSH, ACK] Seq=68202 Ack=1 Win=2920 Len=1024"
"111","0.540579000","217.166.60.247","192.168.1.4","TCP","1078","80 > 56965 [PSH, ACK] Seq=69226 Ack=1 Win=2920 Len=1024"
"113","0.546579000","217.166.60.247","192.168.1.4","TCP","1078","80 > 56965 [PSH, ACK] Seq=70250 Ack=1 Win=2920 Len=1024"
"114","0.553583000","217.166.60.247","192.168.1.4","TCP","1078","80 > 56965 [PSH, ACK] Seq=71274 Ack=1 Win=2920 Len=1024"
"117","0.591580000","217.166.60.247","192.168.1.4","TCP","1078","80 > 56965 [PSH, ACK] Seq=72298 Ack=1 Win=2920 Len=1024"
"118","0.592582000","217.166.60.247","192.168.1.4","TCP","1078","80 > 56965 [PSH, ACK] Seq=73322 Ack=1 Win=2920 Len=1024"
"120","0.608581000","217.166.60.247","192.168.1.4","TCP","1078","80 > 56965 [PSH, ACK] Seq=74346 Ack=1 Win=2920 Len=1024"
"121","0.609580000","217.166.60.247","192.168.1.4","TCP","1078","80 > 56965 [PSH, ACK] Seq=75370 Ack=1 Win=2920 Len=1024"
"123","0.615102000","217.166.60.247","192.168.1.4","TCP","1078","80 > 56965 [PSH, ACK] Seq=76394 Ack=1 Win=2920 Len=1024"
"124","0.622581000","217.166.60.247","192.168.1.4","TCP","1078","80 > 56965 [PSH, ACK] Seq=77418 Ack=1 Win=2920 Len=1024"
"126","0.628582000","217.166.60.247","192.168.1.4","TCP","1078","80 > 56965 [PSH, ACK] Seq=78442 Ack=1 Win=2920 Len=1024"
"127","0.629582000","217.166.60.247","192.168.1.4","TCP","1078","80 > 56965 [PSH, ACK] Seq=79466 Ack=1 Win=2920 Len=1024"
"129","0.640582000","217.166.60.247","192.168.1.4","TCP","1078","80 > 56965 [PSH, ACK] Seq=80490 Ack=1 Win=2920 Len=1024"
"130","0.641080000","217.166.60.247","192.168.1.4","TCP","1078","80 > 56965 [PSH, ACK] Seq=81514 Ack=1 Win=2920 Len=1024"
"132","0.652254000","217.166.60.247","192.168.1.4","TCP","1078","80 > 56965 [PSH, ACK] Seq=82538 Ack=1 Win=2920 Len=1024"
"133","0.655812000","217.166.60.247","192.168.1.4","TCP","1078","80 > 56965 [PSH, ACK] Seq=83562 Ack=1 Win=2920 Len=1024"
"135","0.661807000","217.166.60.247","192.168.1.4","TCP","1078","80 > 56965 [PSH, ACK] Seq=84586 Ack=1 Win=2920 Len=1024"
"137","0.663946000","217.166.60.247","192.168.1.4","TCP","1078","80 > 56965 [PSH, ACK] Seq=85610 Ack=1 Win=2920 Len=1024"
"139","0.700434000","217.166.60.247","192.168.1.4","TCP","1078","80 > 56965 [PSH, ACK] Seq=86634 Ack=1 Win=2920 Len=1024"
"140","0.701113000","217.166.60.247","192.168.1.4","TCP","1078","80 > 56965 [PSH, ACK] Seq=87658 Ack=1 Win=2920 Len=1024"
"142","0.721152000","217.166.60.247","192.168.1.4","TCP","1078","80 > 56965 [PSH, ACK] Seq=88682 Ack=1 Win=2920 Len=1024"
"143","0.721801000","217.166.60.247","192.168.1.4","TCP","1078","80 > 56965 [PSH, ACK] Seq=89706 Ack=1 Win=2920 Len=1024"
"145","0.730587000","217.166.60.247","192.168.1.4","TCP","1078","80 > 56965 [PSH, ACK] Seq=90730 Ack=1 Win=2920 Len=1024"
"146","0.738589000","217.166.60.247","192.168.1.4","TCP","375","[TCP segment of a reassembled PDU]"
"148","0.739582000","217.166.60.247","192.168.1.4","TCP","121","80 > 56965 [ACK] Seq=92075 Ack=1 Win=2920 Len=67"
"149","0.740215000","217.166.60.247","192.168.1.4","TCP","1078","80 > 56965 [PSH, ACK] Seq=92142 Ack=1 Win=2920 Len=1024"
"151","0.740587000","217.166.60.247","192.168.1.4","TCP","1078","80 > 56965 [PSH, ACK] Seq=93166 Ack=1 Win=2920 Len=1024"
"152","0.741857000","217.166.60.247","192.168.1.4","TCP","1078","80 > 56965 [PSH, ACK] Seq=94190 Ack=1 Win=2920 Len=1024"
"154","0.748595000","217.166.60.247","192.168.1.4","TCP","1078","80 > 56965 [PSH, ACK] Seq=95214 Ack=1 Win=2920 Len=1024"
"155","0.752261000","217.166.60.247","192.168.1.4","TCP","1078","80 > 56965 [PSH, ACK] Seq=96238 Ack=1 Win=2920 Len=1024"
"157","0.761829000","217.166.60.247","192.168.1.4","TCP","1078","80 > 56965 [PSH, ACK] Seq=97262 Ack=1 Win=2920 Len=1024"
"158","0.763235000","217.166.60.247","192.168.1.4","TCP","1078","80 > 56965 [PSH, ACK] Seq=98286 Ack=1 Win=2920 Len=1024"
"160","0.772286000","217.166.60.247","192.168.1.4","TCP","1078","80 > 56965 [PSH, ACK] Seq=99310 Ack=1 Win=2920 Len=1024"
"161","0.778097000","217.166.60.247","192.168.1.4","TCP","1078","80 > 56965 [PSH, ACK] Seq=100334 Ack=1 Win=2920 Len=1024"
"163","0.807593000","217.166.60.247","192.168.1.4","TCP","1078","80 > 56965 [PSH, ACK] Seq=101358 Ack=1 Win=2920 Len=1024"
"164","0.808590000","217.166.60.247","192.168.1.4","TCP","1078","80 > 56965 [PSH, ACK] Seq=102382 Ack=1 Win=2920 Len=1024"
"166","0.828250000","217.166.60.247","192.168.1.4","TCP","1078","80 > 56965 [PSH, ACK] Seq=103406 Ack=1 Win=2920 Len=1024"
"167","0.833034000","217.166.60.247","192.168.1.4","TCP","1078","80 > 56965 [PSH, ACK] Seq=104430 Ack=1 Win=2920 Len=1024"
"169","0.848336000","217.166.60.247","192.168.1.4","TCP","1078","80 > 56965 [PSH, ACK] Seq=105454 Ack=1 Win=2920 Len=1024"
"170","0.853721000","217.166.60.247","192.168.1.4","TCP","1078","80 > 56965 [PSH, ACK] Seq=106478 Ack=1 Win=2920 Len=1024"
"172","0.855131000","217.166.60.247","192.168.1.4","TCP","1078","80 > 56965 [PSH, ACK] Seq=107502 Ack=1 Win=2920 Len=1024"
"173","0.859010000","217.166.60.247","192.168.1.4","TCP","1078","80 > 56965 [PSH, ACK] Seq=108526 Ack=1 Win=2920 Len=1024"
"175","0.861190000","217.166.60.247","192.168.1.4","TCP","1078","80 > 56965 [PSH, ACK] Seq=109550 Ack=1 Win=2920 Len=1024"
"176","0.862550000","217.166.60.247","192.168.1.4","TCP","1078","80 > 56965 [PSH, ACK] Seq=110574 Ack=1 Win=2920 Len=1024"
"179","0.870212000","217.166.60.247","192.168.1.4","TCP","1078","80 > 56965 [PSH, ACK] Seq=111598 Ack=1 Win=2920 Len=1024"
"180","0.872284000","217.166.60.247","192.168.1.4","TCP","1078","80 > 56965 [PSH, ACK] Seq=112622 Ack=1 Win=2920 Len=1024"
"182","0.886843000","217.166.60.247","192.168.1.4","TCP","1078","80 > 56965 [PSH, ACK] Seq=113646 Ack=1 Win=2920 Len=1024"
"183","0.892288000","217.166.60.247","192.168.1.4","TCP","1078","80 > 56965 [PSH, ACK] Seq=114670 Ack=1 Win=2920 Len=1024"
"185","0.918995000","217.166.60.247","192.168.1.4","TCP","1078","80 > 56965 [PSH, ACK] Seq=115694 Ack=1 Win=2920 Len=1024"
"186","0.920414000","217.166.60.247","192.168.1.4","TCP","1078","80 > 56965 [PSH, ACK] Seq=116718 Ack=1 Win=2920 Len=1024"
"188","0.952294000","217.166.60.247","192.168.1.4","TCP","1078","80 > 56965 [PSH, ACK] Seq=117742 Ack=1 Win=2920 Len=1024"
"189","0.957989000","217.166.60.247","192.168.1.4","TCP","1078","80 > 56965 [PSH, ACK] Seq=118766 Ack=1 Win=2920 Len=1024"
"191","0.961836000","217.166.60.247","192.168.1.4","TCP","1078","80 > 56965 [PSH, ACK] Seq=119790 Ack=1 Win=2920 Len=1024"
"192","0.963995000","217.166.60.247","192.168.1.4","TCP","1078","80 > 56965 [PSH, ACK] Seq=120814 Ack=1 Win=2920 Len=1024"
"194","0.967596000","217.166.60.247","192.168.1.4","TCP","1078","80 > 56965 [PSH, ACK] Seq=121838 Ack=1 Win=2920 Len=1024"
"195","0.968256000","217.166.60.247","192.168.1.4","TCP","1078","80 > 56965 [PSH, ACK] Seq=122862 Ack=1 Win=2920 Len=1024"
"197","0.971596000","217.166.60.247","192.168.1.4","TCP","1078","80 > 56965 [PSH, ACK] Seq=123886 Ack=1 Win=2920 Len=1024"
"198","0.973598000","217.166.60.247","192.168.1.4","TCP","272","80 > 56965 [ACK] Seq=124910 Ack=1 Win=2920 Len=218"
"199","0.973598000","217.166.60.247","192.168.1.4","TCP","121","80 > 56965 [ACK] Seq=125128 Ack=1 Win=2920 Len=67"
"201","0.975139000","217.166.60.247","192.168.1.4","TCP","1078","80 > 56965 [PSH, ACK] Seq=125195 Ack=1 Win=2920 Len=1024"
"202","0.984605000","217.166.60.247","192.168.1.4","TCP","1078","80 > 56965 [PSH, ACK] Seq=126219 Ack=1 Win=2920 Len=1024"
"205","0.988259000","217.166.60.247","192.168.1.4","TCP","1078","80 > 56965 [PSH, ACK] Seq=127243 Ack=1 Win=2920 Len=1024"
"206","0.999838000","217.166.60.247","192.168.1.4","TCP","1078","80 > 56965 [PSH, ACK] Seq=128267 Ack=1 Win=2920 Len=1024"
"208","1.000397000","217.166.60.247","192.168.1.4","TCP","1078","80 > 56965 [PSH, ACK] Seq=129291 Ack=1 Win=2920 Len=1024"
"209","1.026855000","217.166.60.247","192.168.1.4","TCP","1078","80 > 56965 [PSH, ACK] Seq=130315 Ack=1 Win=2920 Len=1024"
"211","1.027550000","217.166.60.247","192.168.1.4","TCP","1078","80 > 56965 [PSH, ACK] Seq=131339 Ack=1 Win=2920 Len=1024"
"212","1.066891000","217.166.60.247","192.168.1.4","TCP","1078","80 > 56965 [PSH, ACK] Seq=132363 Ack=1 Win=2920 Len=1024"
"214","1.069580000","217.166.60.247","192.168.1.4","TCP","1078","80 > 56965 [PSH, ACK] Seq=133387 Ack=1 Win=2920 Len=1024"
"215","1.073047000","217.166.60.247","192.168.1.4","TCP","1078","80 > 56965 [PSH, ACK] Seq=134411 Ack=1 Win=2920 Len=1024"
"217","1.080429000","217.166.60.247","192.168.1.4","TCP","1078","80 > 56965 [PSH, ACK] Seq=135435 Ack=1 Win=2920 Len=1024"
"218","1.085419000","217.166.60.247","192.168.1.4","TCP","1078","80 > 56965 [PSH, ACK] Seq=136459 Ack=1 Win=2920 Len=1024"
"220","1.086858000","217.166.60.247","192.168.1.4","TCP","1078","80 > 56965 [PSH, ACK] Seq=137483 Ack=1 Win=2920 Len=1024"
"221","1.087584000","217.166.60.247","192.168.1.4","TCP","1078","80 > 56965 [PSH, ACK] Seq=138507 Ack=1 Win=2920 Len=1024"
"223","1.097583000","217.166.60.247","192.168.1.4","TCP","1078","80 > 56965 [PSH, ACK] Seq=139531 Ack=1 Win=2920 Len=1024"
"224","1.097584000","217.166.60.247","192.168.1.4","TCP","1078","80 > 56965 [PSH, ACK] Seq=140555 Ack=1 Win=2920 Len=1024"
"226","1.107605000","217.166.60.247","192.168.1.4","TCP","1078","80 > 56965 [PSH, ACK] Seq=141579 Ack=1 Win=2920 Len=1024"
"227","1.107606000","217.166.60.247","192.168.1.4","TCP","1078","80 > 56965 [PSH, ACK] Seq=142603 Ack=1 Win=2920 Len=1024"
"229","1.135201000","217.166.60.247","192.168.1.4","TCP","1078","80 > 56965 [PSH, ACK] Seq=143627 Ack=1 Win=2920 Len=1024"
"230","1.135862000","217.166.60.247","192.168.1.4","TCP","1078","80 > 56965 [PSH, ACK] Seq=144651 Ack=1 Win=2920 Len=1024"
"232","1.176606000","217.166.60.247","192.168.1.4","TCP","1078","80 > 56965 [PSH, ACK] Seq=145675 Ack=1 Win=2920 Len=1024"
"233","1.185428000","217.166.60.247","192.168.1.4","TCP","1078","80 > 56965 [PSH, ACK] Seq=146699 Ack=1 Win=2920 Len=1024"
"235","1.188335000","217.166.60.247","192.168.1.4","TCP","1078","80 > 56965 [PSH, ACK] Seq=147723 Ack=1 Win=2920 Len=1024"
"236","1.196603000","217.166.60.247","192.168.1.4","TCP","1078","80 > 56965 [PSH, ACK] Seq=148747 Ack=1 Win=2920 Len=1024"
"238","1.199021000","217.166.60.247","192.168.1.4","TCP","1078","80 > 56965 [PSH, ACK] Seq=149771 Ack=1 Win=2920 Len=1024"
"239","1.200433000","217.166.60.247","192.168.1.4","TCP","1078","80 > 56965 [PSH, ACK] Seq=150795 Ack=1 Win=2920 Len=1024"
"241","1.201856000","217.166.60.247","192.168.1.4","TCP","1078","80 > 56965 [PSH, ACK] Seq=151819 Ack=1 Win=2920 Len=1024"
"242","1.202581000","217.166.60.247","192.168.1.4","TCP","1078","80 > 56965 [PSH, ACK] Seq=152843 Ack=1 Win=2920 Len=1024"
"244","1.204697000","217.166.60.247","192.168.1.4","TCP","1078","80 > 56965 [PSH, ACK] Seq=153867 Ack=1 Win=2920 Len=1024"
"245","1.208279000","217.166.60.247","192.168.1.4","TCP","1078","80 > 56965 [PSH, ACK] Seq=154891 Ack=1 Win=2920 Len=1024"
"247","1.220609000","217.166.60.247","192.168.1.4","TCP","1078","80 > 56965 [PSH, ACK] Seq=155915 Ack=1 Win=2920 Len=1024"
"248","1.222608000","217.166.60.247","192.168.1.4","TCP","1078","80 > 56965 [PSH, ACK] Seq=156939 Ack=1 Win=2920 Len=1024"
"250","1.242617000","217.166.60.247","192.168.1.4","TCP","313","[TCP segment of a reassembled PDU]"
"251","1.242619000","217.166.60.247","192.168.1.4","TCP","121","80 > 56965 [ACK] Seq=158222 Ack=1 Win=2920 Len=67"
"253","1.246618000","217.166.60.247","192.168.1.4","TCP","1078","80 > 56965 [PSH, ACK] Seq=158289 Ack=1 Win=2920 Len=1024"
"254","1.247610000","217.166.60.247","192.168.1.4","TCP","1078","80 > 56965 [PSH, ACK] Seq=159313 Ack=1 Win=2920 Len=1024"
"256","1.294620000","217.166.60.247","192.168.1.4","TCP","1078","80 > 56965 [PSH, ACK] Seq=160337 Ack=1 Win=2920 Len=1024"
"257","1.298049000","217.166.60.247","192.168.1.4","TCP","1078","80 > 56965 [PSH, ACK] Seq=161361 Ack=1 Win=2920 Len=1024"
"259","1.304611000","217.166.60.247","192.168.1.4","TCP","1078","80 > 56965 [PSH, ACK] Seq=162385 Ack=1 Win=2920 Len=1024"
"260","1.309463000","217.166.60.247","192.168.1.4","TCP","1078","80 > 56965 [PSH, ACK] Seq=163409 Ack=1 Win=2920 Len=1024"
"262","1.315188000","217.166.60.247","192.168.1.4","TCP","1078","80 > 56965 [PSH, ACK] Seq=164433 Ack=1 Win=2920 Len=1024"
"263","1.321153000","217.166.60.247","192.168.1.4","TCP","1078","80 > 56965 [PSH, ACK] Seq=165457 Ack=1 Win=2920 Len=1024"
"265","1.322574000","217.166.60.247","192.168.1.4","TCP","1078","80 > 56965 [PSH, ACK] Seq=166481 Ack=1 Win=2920 Len=1024"
"266","1.326144000","217.166.60.247","192.168.1.4","TCP","1078","80 > 56965 [PSH, ACK] Seq=167505 Ack=1 Win=2920 Len=1024"
"268","1.332613000","217.166.60.247","192.168.1.4","TCP","1078","80 > 56965 [PSH, ACK] Seq=168529 Ack=1 Win=2920 Len=1024"
"269","1.335611000","217.166.60.247","192.168.1.4","TCP","1078","80 > 56965 [PSH, ACK] Seq=169553 Ack=1 Win=2920 Len=1024"
"271","1.364835000","217.166.60.247","192.168.1.4","TCP","1078","80 > 56965 [PSH, ACK] Seq=170577 Ack=1 Win=2920 Len=1024"
"272","1.365455000","217.166.60.247","192.168.1.4","TCP","1078","80 > 56965 [PSH, ACK] Seq=171601 Ack=1 Win=2920 Len=1024"
"273","1.365458000","217.166.60.247","192.168.1.4","TCP","1078","80 > 56965 [PSH, ACK] Seq=172625 Ack=1 Win=2920 Len=1024"
"274","1.365459000","217.166.60.247","192.168.1.4","TCP","1078","80 > 56965 [PSH, ACK] Seq=173649 Ack=1 Win=2920 Len=1024"
"276","1.404757000","217.166.60.247","192.168.1.4","TCP","1078","80 > 56965 [PSH, ACK] Seq=174673 Ack=1 Win=2920 Len=1024"
"277","1.406155000","217.166.60.247","192.168.1.4","TCP","1078","80 > 56965 [PSH, ACK] Seq=175697 Ack=1 Win=2920 Len=1024"
"279","1.419617000","217.166.60.247","192.168.1.4","TCP","1078","80 > 56965 [PSH, ACK] Seq=176721 Ack=1 Win=2920 Len=1024"
"280","1.423318000","217.166.60.247","192.168.1.4","TCP","1078","80 > 56965 [PSH, ACK] Seq=177745 Ack=1 Win=2920 Len=1024"
"282","1.427635000","217.166.60.247","192.168.1.4","TCP","1078","80 > 56965 [PSH, ACK] Seq=178769 Ack=1 Win=2920 Len=1024"
"283","1.428306000","217.166.60.247","192.168.1.4","TCP","1078","80 > 56965 [PSH, ACK] Seq=179793 Ack=1 Win=2920 Len=1024"
"285","1.432337000","217.166.60.247","192.168.1.4","TCP","1078","80 > 56965 [PSH, ACK] Seq=180817 Ack=1 Win=2920 Len=1024"
"286","1.433750000","217.166.60.247","192.168.1.4","TCP","1078","80 > 56965 [PSH, ACK] Seq=181841 Ack=1 Win=2920 Len=1024"
"288","1.471658000","217.166.60.247","192.168.1.4","TCP","1078","80 > 56965 [PSH, ACK] Seq=182865 Ack=1 Win=2920 Len=1024"
"289","1.480479000","217.166.60.247","192.168.1.4","TCP","1078","80 > 56965 [PSH, ACK] Seq=183889 Ack=1 Win=2920 Len=1024"
"291","1.485446000","217.166.60.247","192.168.1.4","TCP","1078","80 > 56965 [PSH, ACK] Seq=184913 Ack=1 Win=2920 Len=1024"
"292","1.488352000","217.166.60.247","192.168.1.4","TCP","1078","80 > 56965 [PSH, ACK] Seq=185937 Ack=1 Win=2920 Len=1024"
"294","1.493066000","217.166.60.247","192.168.1.4","TCP","1078","80 > 56965 [PSH, ACK] Seq=186961 Ack=1 Win=2920 Len=1024"
"295","1.495945000","217.166.60.247","192.168.1.4","TCP","1078","80 > 56965 [PSH, ACK] Seq=187985 Ack=1 Win=2920 Len=1024"
"297","1.515203000","217.166.60.247","192.168.1.4","TCP","1078","80 > 56965 [PSH, ACK] Seq=189009 Ack=1 Win=2920 Len=1024"
"298","1.519035000","217.166.60.247","192.168.1.4","TCP","1078","80 > 56965 [PSH, ACK] Seq=190033 Ack=1 Win=2920 Len=1024"
"300","1.530855000","217.166.60.247","192.168.1.4","TCP","365","80 > 56965 [ACK] Seq=191057 Ack=1 Win=2920 Len=311"
"301","1.532342000","217.166.60.247","192.168.1.4","TCP","1078","80 > 56965 [PSH, ACK] Seq=191368 Ack=1 Win=2920 Len=1024"
"303","1.533799000","217.166.60.247","192.168.1.4","TCP","1078","80 > 56965 [PSH, ACK] Seq=192392 Ack=1 Win=2920 Len=1024"
"304","1.535896000","217.166.60.247","192.168.1.4","TCP","1078","80 > 56965 [PSH, ACK] Seq=193416 Ack=1 Win=2920 Len=1024"
"306","1.537389000","217.166.60.247","192.168.1.4","TCP","1078","80 > 56965 [PSH, ACK] Seq=194440 Ack=1 Win=2920 Len=1024"
"307","1.541205000","217.166.60.247","192.168.1.4","TCP","1078","80 > 56965 [PSH, ACK] Seq=195464 Ack=1 Win=2920 Len=1024"
"309","1.541894000","217.166.60.247","192.168.1.4","TCP","1078","80 > 56965 [PSH, ACK] Seq=196488 Ack=1 Win=2920 Len=1024"
"310","1.589629000","217.166.60.247","192.168.1.4","TCP","1078","80 > 56965 [PSH, ACK] Seq=197512 Ack=1 Win=2920 Len=1024"
"312","1.594543000","217.166.60.247","192.168.1.4","TCP","1078","80 > 56965 [PSH, ACK] Seq=198536 Ack=1 Win=2920 Len=1024"
"313","1.601958000","217.166.60.247","192.168.1.4","TCP","1078","80 > 56965 [PSH, ACK] Seq=199560 Ack=1 Win=2920 Len=1024"
"314","1.601959000","217.166.60.247","192.168.1.4","TCP","1078","80 > 56965 [PSH, ACK] Seq=200584 Ack=1 Win=2920 Len=1024"
"316","1.604773000","217.166.60.247","192.168.1.4","TCP","1078","80 > 56965 [PSH, ACK] Seq=201608 Ack=1 Win=2920 Len=1024"
"317","1.606915000","217.166.60.247","192.168.1.4","TCP","1078","80 > 56965 [PSH, ACK] Seq=202632 Ack=1 Win=2920 Len=1024"
"319","1.627630000","217.166.60.247","192.168.1.4","TCP","1078","80 > 56965 [PSH, ACK] Seq=203656 Ack=1 Win=2920 Len=1024"
"320","1.640629000","217.166.60.247","192.168.1.4","TCP","1078","80 > 56965 [PSH, ACK] Seq=204680 Ack=1 Win=2920 Len=1024"
"322","1.641623000","217.166.60.247","192.168.1.4","TCP","1078","80 > 56965 [PSH, ACK] Seq=205704 Ack=1 Win=2920 Len=1024"
"323","1.642623000","217.166.60.247","192.168.1.4","TCP","1078","80 > 56965 [PSH, ACK] Seq=206728 Ack=1 Win=2920 Len=1024"
"325","1.647625000","217.166.60.247","192.168.1.4","TCP","1078","80 > 56965 [PSH, ACK] Seq=207752 Ack=1 Win=2920 Len=1024"
"326","1.649627000","217.166.60.247","192.168.1.4","TCP","1078","80 > 56965 [PSH, ACK] Seq=208776 Ack=1 Win=2920 Len=1024"
"328","1.653626000","217.166.60.247","192.168.1.4","TCP","1078","80 > 56965 [PSH, ACK] Seq=209800 Ack=1 Win=2920 Len=1024"
"330","1.697335000","217.166.60.247","192.168.1.4","TCP","1078","80 > 56965 [PSH, ACK] Seq=210824 Ack=1 Win=2920 Len=1024"
"332","1.699035000","217.166.60.247","192.168.1.4","TCP","1078","80 > 56965 [PSH, ACK] Seq=211848 Ack=1 Win=2920 Len=1024"
"333","1.713778000","217.166.60.247","192.168.1.4","TCP","1078","80 > 56965 [PSH, ACK] Seq=212872 Ack=1 Win=2920 Len=1024"
"335","1.719032000","217.166.60.247","192.168.1.4","TCP","1078","80 > 56965 [PSH, ACK] Seq=213896 Ack=1 Win=2920 Len=1024"
"336","1.723360000","217.166.60.247","192.168.1.4","TCP","1078","80 > 56965 [PSH, ACK] Seq=214920 Ack=1 Win=2920 Len=1024"
"338","1.728377000","217.166.60.247","192.168.1.4","TCP","1078","80 > 56965 [PSH, ACK] Seq=215944 Ack=1 Win=2920 Len=1024"
"339","1.732354000","217.166.60.247","192.168.1.4","TCP","1078","80 > 56965 [PSH, ACK] Seq=216968 Ack=1 Win=2920 Len=1024"
"341","1.748337000","217.166.60.247","192.168.1.4","TCP","1078","80 > 56965 [PSH, ACK] Seq=217992 Ack=1 Win=2920 Len=1024"
"342","1.753770000","217.166.60.247","192.168.1.4","TCP","1078","80 > 56965 [PSH, ACK] Seq=219016 Ack=1 Win=2920 Len=1024"
"344","1.755935000","217.166.60.247","192.168.1.4","TCP","1078","80 > 56965 [PSH, ACK] Seq=220040 Ack=1 Win=2920 Len=1024"
"345","1.759062000","217.166.60.247","192.168.1.4","TCP","1078","80 > 56965 [PSH, ACK] Seq=221064 Ack=1 Win=2920 Len=1024"
"347","1.761219000","217.166.60.247","192.168.1.4","TCP","1078","80 > 56965 [PSH, ACK] Seq=222088 Ack=1 Win=2920 Len=1024"
"348","1.761911000","217.166.60.247","192.168.1.4","TCP","1078","80 > 56965 [PSH, ACK] Seq=223112 Ack=1 Win=2920 Len=1024"
"350","1.804719000","217.166.60.247","192.168.1.4","TCP","296","80 > 56965 [ACK] Seq=224136 Ack=1 Win=2920 Len=242"
"351","1.805416000","217.166.60.247","192.168.1.4","TCP","121","80 > 56965 [ACK] Seq=224378 Ack=1 Win=2920 Len=67"
"353","1.806638000","217.166.60.247","192.168.1.4","TCP","1078","80 > 56965 [PSH, ACK] Seq=224445 Ack=1 Win=2920 Len=1024"
"354","1.807636000","217.166.60.247","192.168.1.4","TCP","1078","80 > 56965 [PSH, ACK] Seq=225469 Ack=1 Win=2920 Len=1024"
"356","1.822615000","217.166.60.247","192.168.1.4","TCP","1078","80 > 56965 [PSH, ACK] Seq=226493 Ack=1 Win=2920 Len=1024"
"357","1.828362000","217.166.60.247","192.168.1.4","TCP","1078","80 > 56965 [PSH, ACK] Seq=227517 Ack=1 Win=2920 Len=1024"
"359","1.830991000","217.166.60.247","192.168.1.4","TCP","1078","80 > 56965 [PSH, ACK] Seq=228541 Ack=1 Win=2920 Len=1024"
"360","1.832348000","217.166.60.247","192.168.1.4","TCP","1078","80 > 56965 [PSH, ACK] Seq=229565 Ack=1 Win=2920 Len=1024"
"362","1.839076000","217.166.60.247","192.168.1.4","TCP","1078","80 > 56965 [PSH, ACK] Seq=230589 Ack=1 Win=2920 Len=1024"
"363","1.843346000","217.166.60.247","192.168.1.4","TCP","1078","80 > 56965 [PSH, ACK] Seq=231613 Ack=1 Win=2920 Len=1024"
"366","1.861913000","217.166.60.247","192.168.1.4","TCP","1078","80 > 56965 [PSH, ACK] Seq=232637 Ack=1 Win=2920 Len=1024"
"367","1.865641000","217.166.60.247","192.168.1.4","TCP","1078","80 > 56965 [PSH, ACK] Seq=233661 Ack=1 Win=2920 Len=1024"
"369","1.869528000","217.166.60.247","192.168.1.4","TCP","1078","80 > 56965 [PSH, ACK] Seq=234685 Ack=1 Win=2920 Len=1024"
"370","1.870219000","217.166.60.247","192.168.1.4","TCP","1078","80 > 56965 [PSH, ACK] Seq=235709 Ack=1 Win=2920 Len=1024"
"372","1.871678000","217.166.60.247","192.168.1.4","TCP","1078","80 > 56965 [PSH, ACK] Seq=236733 Ack=1 Win=2920 Len=1024"
"373","1.915225000","217.166.60.247","192.168.1.4","TCP","1078","80 > 56965 [PSH, ACK] Seq=237757 Ack=1 Win=2920 Len=1024"
"375","1.916656000","217.166.60.247","192.168.1.4","TCP","1078","80 > 56965 [PSH, ACK] Seq=238781 Ack=1 Win=2920 Len=1024"
"376","1.921210000","217.166.60.247","192.168.1.4","TCP","1078","80 > 56965 [PSH, ACK] Seq=239805 Ack=1 Win=2920 Len=1024"
"378","1.935943000","217.166.60.247","192.168.1.4","TCP","1078","80 > 56965 [PSH, ACK] Seq=240829 Ack=1 Win=2920 Len=1024"
"379","1.940527000","217.166.60.247","192.168.1.4","TCP","1078","80 > 56965 [PSH, ACK] Seq=241853 Ack=1 Win=2920 Len=1024"
"381","1.952384000","217.166.60.247","192.168.1.4","TCP","1078","80 > 56965 [PSH, ACK] Seq=242877 Ack=1 Win=2920 Len=1024"
"382","1.952385000","217.166.60.247","192.168.1.4","TCP","1078","80 > 56965 [PSH, ACK] Seq=243901 Ack=1 Win=2920 Len=1024"
"384","1.955217000","217.166.60.247","192.168.1.4","TCP","1078","80 > 56965 [PSH, ACK] Seq=244925 Ack=1 Win=2920 Len=1024"
"385","1.960503000","217.166.60.247","192.168.1.4","TCP","1078","80 > 56965 [PSH, ACK] Seq=245949 Ack=1 Win=2920 Len=1024"
"387","1.973826000","217.166.60.247","192.168.1.4","TCP","1078","80 > 56965 [PSH, ACK] Seq=246973 Ack=1 Win=2920 Len=1024"
"388","1.980506000","217.166.60.247","192.168.1.4","TCP","1078","80 > 56965 [PSH, ACK] Seq=247997 Ack=1 Win=2920 Len=1024"
"390","1.981942000","217.166.60.247","192.168.1.4","TCP","1078","80 > 56965 [PSH, ACK] Seq=249021 Ack=1 Win=2920 Len=1024"
"391","1.986205000","217.166.60.247","192.168.1.4","TCP","1078","80 > 56965 [PSH, ACK] Seq=250045 Ack=1 Win=2920 Len=1024"
"393","2.023345000","217.166.60.247","192.168.1.4","TCP","1078","80 > 56965 [PSH, ACK] Seq=251069 Ack=1 Win=2920 Len=1024"
"394","2.026230000","217.166.60.247","192.168.1.4","TCP","1078","80 > 56965 [PSH, ACK] Seq=252093 Ack=1 Win=2920 Len=1024"
"396","2.028342000","217.166.60.247","192.168.1.4","TCP","1078","80 > 56965 [PSH, ACK] Seq=253117 Ack=1 Win=2920 Len=1024"
"397","2.030656000","217.166.60.247","192.168.1.4","TCP","1078","80 > 56965 [PSH, ACK] Seq=254141 Ack=1 Win=2920 Len=1024"
"399","2.061944000","217.166.60.247","192.168.1.4","TCP","1078","80 > 56965 [PSH, ACK] Seq=255165 Ack=1 Win=2920 Len=1024"
"400","2.064117000","217.166.60.247","192.168.1.4","TCP","1078","80 > 56965 [PSH, ACK] Seq=256189 Ack=1 Win=2920 Len=1024"
"402","2.075168000","217.166.60.247","192.168.1.4","TCP","235","80 > 56965 [ACK] Seq=257213 Ack=1 Win=2920 Len=181"
"403","2.075169000","217.166.60.247","192.168.1.4","TCP","121","80 > 56965 [ACK] Seq=257394 Ack=1 Win=2920 Len=67"
"405","2.076775000","217.166.60.247","192.168.1.4","TCP","1078","80 > 56965 [PSH, ACK] Seq=257461 Ack=1 Win=2920 Len=1024"
"406","2.082688000","217.166.60.247","192.168.1.4","TCP","1078","80 > 56965 [PSH, ACK] Seq=258485 Ack=1 Win=2920 Len=1024"
"408","2.089532000","217.166.60.247","192.168.1.4","TCP","1078","80 > 56965 [PSH, ACK] Seq=259509 Ack=1 Win=2920 Len=1024"
"409","2.095226000","217.166.60.247","192.168.1.4","TCP","1078","80 > 56965 [PSH, ACK] Seq=260533 Ack=1 Win=2920 Len=1024"
"411","2.099097000","217.166.60.247","192.168.1.4","TCP","1078","80 > 56965 [PSH, ACK] Seq=261557 Ack=1 Win=2920 Len=1024"
"412","2.101964000","217.166.60.247","192.168.1.4","TCP","1078","80 > 56965 [PSH, ACK] Seq=262581 Ack=1 Win=2920 Len=1024"
"414","2.104090000","217.166.60.247","192.168.1.4","TCP","1078","80 > 56965 [PSH, ACK] Seq=263605 Ack=1 Win=2920 Len=1024"
"415","2.106216000","217.166.60.247","192.168.1.4","TCP","1078","80 > 56965 [PSH, ACK] Seq=264629 Ack=1 Win=2920 Len=1024"
"417","2.135966000","217.166.60.247","192.168.1.4","TCP","1078","80 > 56965 [PSH, ACK] Seq=265653 Ack=1 Win=2920 Len=1024"
"418","2.137436000","217.166.60.247","192.168.1.4","TCP","1078","80 > 56965 [PSH, ACK] Seq=266677 Ack=1 Win=2920 Len=1024"
"420","2.139133000","217.166.60.247","192.168.1.4","TCP","1078","80 > 56965 [PSH, ACK] Seq=267701 Ack=1 Win=2920 Len=1024"
"421","2.139134000","217.166.60.247","192.168.1.4","TCP","1078","80 > 56965 [PSH, ACK] Seq=268725 Ack=1 Win=2920 Len=1024"
"423","2.173834000","217.166.60.247","192.168.1.4","TCP","1078","80 > 56965 [PSH, ACK] Seq=269749 Ack=1 Win=2920 Len=1024"
"424","2.185509000","217.166.60.247","192.168.1.4","TCP","1078","80 > 56965 [PSH, ACK] Seq=270773 Ack=1 Win=2920 Len=1024"
"426","2.193807000","217.166.60.247","192.168.1.4","TCP","1078","80 > 56965 [PSH, ACK] Seq=271797 Ack=1 Win=2920 Len=1024"
"427","2.197417000","217.166.60.247","192.168.1.4","TCP","1078","80 > 56965 [PSH, ACK] Seq=272821 Ack=1 Win=2920 Len=1024"
"429","2.204128000","217.166.60.247","192.168.1.4","TCP","1078","80 > 56965 [PSH, ACK] Seq=273845 Ack=1 Win=2920 Len=1024"
"430","2.206947000","217.166.60.247","192.168.1.4","TCP","1078","80 > 56965 [PSH, ACK] Seq=274869 Ack=1 Win=2920 Len=1024"
"432","2.210276000","217.166.60.247","192.168.1.4","TCP","1078","80 > 56965 [PSH, ACK] Seq=275893 Ack=1 Win=2920 Len=1024"
"433","2.213819000","217.166.60.247","192.168.1.4","TCP","1078","80 > 56965 [PSH, ACK] Seq=276917 Ack=1 Win=2920 Len=1024"
"435","2.221963000","217.166.60.247","192.168.1.4","TCP","1078","80 > 56965 [PSH, ACK] Seq=277941 Ack=1 Win=2920 Len=1024"
"436","2.222649000","217.166.60.247","192.168.1.4","TCP","1078","80 > 56965 [PSH, ACK] Seq=278965 Ack=1 Win=2920 Len=1024"
"438","2.247659000","217.166.60.247","192.168.1.4","TCP","1078","80 > 56965 [PSH, ACK] Seq=279989 Ack=1 Win=2920 Len=1024"
"439","2.249656000","217.166.60.247","192.168.1.4","TCP","1078","80 > 56965 [PSH, ACK] Seq=281013 Ack=1 Win=2920 Len=1024"
"441","2.254660000","217.166.60.247","192.168.1.4","TCP","1078","80 > 56965 [PSH, ACK] Seq=282037 Ack=1 Win=2920 Len=1024"
"442","2.256596000","217.166.60.247","192.168.1.4","TCP","1078","80 > 56965 [PSH, ACK] Seq=283061 Ack=1 Win=2920 Len=1024"
"444","2.296684000","217.166.60.247","192.168.1.4","TCP","1078","80 > 56965 [PSH, ACK] Seq=284085 Ack=1 Win=2920 Len=1024"
"445","2.300661000","217.166.60.247","192.168.1.4","TCP","1078","80 > 56965 [PSH, ACK] Seq=285109 Ack=1 Win=2920 Len=1024"
"447","2.306207000","217.166.60.247","192.168.1.4","TCP","1078","80 > 56965 [PSH, ACK] Seq=286133 Ack=1 Win=2920 Len=1024"
"448","2.308367000","217.166.60.247","192.168.1.4","TCP","1078","80 > 56965 [PSH, ACK] Seq=287157 Ack=1 Win=2920 Len=1024"
"450","2.316689000","217.166.60.247","192.168.1.4","TCP","1078","80 > 56965 [PSH, ACK] Seq=288181 Ack=1 Win=2920 Len=1024"
"451","2.323358000","217.166.60.247","192.168.1.4","TCP","1078","80 > 56965 [PSH, ACK] Seq=289205 Ack=1 Win=2920 Len=1024"
"453","2.331627000","217.166.60.247","192.168.1.4","TCP","372","80 > 56965 [ACK] Seq=290229 Ack=1 Win=2920 Len=318"
"454","2.331628000","217.166.60.247","192.168.1.4","TCP","121","80 > 56965 [ACK] Seq=290547 Ack=1 Win=2920 Len=67"
"456","2.333113000","217.166.60.247","192.168.1.4","TCP","1078","80 > 56965 [PSH, ACK] Seq=290614 Ack=1 Win=2920 Len=1024"
"457","2.334540000","217.166.60.247","192.168.1.4","TCP","1078","80 > 56965 [PSH, ACK] Seq=291638 Ack=1 Win=2920 Len=1024"
"459","2.335981000","217.166.60.247","192.168.1.4","TCP","1078","80 > 56965 [PSH, ACK] Seq=292662 Ack=1 Win=2920 Len=1024"
"460","2.337390000","217.166.60.247","192.168.1.4","TCP","1078","80 > 56965 [PSH, ACK] Seq=293686 Ack=1 Win=2920 Len=1024"
"462","2.356684000","217.166.60.247","192.168.1.4","TCP","1078","80 > 56965 [PSH, ACK] Seq=294710 Ack=1 Win=2920 Len=1024"
"463","2.359905000","217.166.60.247","192.168.1.4","TCP","1078","80 > 56965 [PSH, ACK] Seq=295734 Ack=1 Win=2920 Len=1024"
"465","2.366945000","217.166.60.247","192.168.1.4","TCP","1078","80 > 56965 [PSH, ACK] Seq=296758 Ack=1 Win=2920 Len=1024"
"466","2.366947000","217.166.60.247","192.168.1.4","TCP","1078","80 > 56965 [PSH, ACK] Seq=297782 Ack=1 Win=2920 Len=1024"
"468","2.407709000","217.166.60.247","192.168.1.4","TCP","1078","80 > 56965 [PSH, ACK] Seq=298806 Ack=1 Win=2920 Len=1024"
"469","2.417397000","217.166.60.247","192.168.1.4","TCP","1078","80 > 56965 [PSH, ACK] Seq=299830 Ack=1 Win=2920 Len=1024"
"471","2.422694000","217.166.60.247","192.168.1.4","TCP","1078","80 > 56965 [PSH, ACK] Seq=300854 Ack=1 Win=2920 Len=1024"
"472","2.427693000","217.166.60.247","192.168.1.4","TCP","1078","80 > 56965 [PSH, ACK] Seq=301878 Ack=1 Win=2920 Len=1024"
"474","2.432470000","217.166.60.247","192.168.1.4","TCP","1078","80 > 56965 [PSH, ACK] Seq=302902 Ack=1 Win=2920 Len=1024"
"475","2.439126000","217.166.60.247","192.168.1.4","TCP","1078","80 > 56965 [PSH, ACK] Seq=303926 Ack=1 Win=2920 Len=1024"
"477","2.444124000","217.166.60.247","192.168.1.4","TCP","1078","80 > 56965 [PSH, ACK] Seq=304950 Ack=1 Win=2920 Len=1024"
"478","2.448375000","217.166.60.247","192.168.1.4","TCP","1078","80 > 56965 [PSH, ACK] Seq=305974 Ack=1 Win=2920 Len=1024"
"480","2.449575000","217.166.60.247","192.168.1.4","TCP","1078","80 > 56965 [PSH, ACK] Seq=306998 Ack=1 Win=2920 Len=1024"
"481","2.453857000","217.166.60.247","192.168.1.4","TCP","1078","80 > 56965 [PSH, ACK] Seq=308022 Ack=1 Win=2920 Len=1024"
"483","2.470999000","217.166.60.247","192.168.1.4","TCP","1078","80 > 56965 [PSH, ACK] Seq=309046 Ack=1 Win=2920 Len=1024"
"484","2.472417000","217.166.60.247","192.168.1.4","TCP","1078","80 > 56965 [PSH, ACK] Seq=310070 Ack=1 Win=2920 Len=1024"
"486","2.475256000","217.166.60.247","192.168.1.4","TCP","1078","80 > 56965 [PSH, ACK] Seq=311094 Ack=1 Win=2920 Len=1024"
"487","2.476694000","217.166.60.247","192.168.1.4","TCP","1078","80 > 56965 [PSH, ACK] Seq=312118 Ack=1 Win=2920 Len=1024"
"489","2.524180000","217.166.60.247","192.168.1.4","TCP","1078","80 > 56965 [PSH, ACK] Seq=313142 Ack=1 Win=2920 Len=1024"
"490","2.526957000","217.166.60.247","192.168.1.4","TCP","1078","80 > 56965 [PSH, ACK] Seq=314166 Ack=1 Win=2920 Len=1024"
"492","2.535970000","217.166.60.247","192.168.1.4","TCP","1078","80 > 56965 [PSH, ACK] Seq=315190 Ack=1 Win=2920 Len=1024"
"493","2.539132000","217.166.60.247","192.168.1.4","TCP","1078","80 > 56965 [PSH, ACK] Seq=316214 Ack=1 Win=2920 Len=1024"
"495","2.553843000","217.166.60.247","192.168.1.4","TCP","1078","80 > 56965 [PSH, ACK] Seq=317238 Ack=1 Win=2920 Len=1024"
