"No.","Time","Source","Destination","Protocol","Length","Info"
"1","0.000000000","193.138.213.169","192.168.1.5","TCP","1078","80 > 56627 [PSH, ACK] Seq=1 Ack=1 Win=2920 Len=1024"
"2","0.000660000","193.138.213.169","192.168.1.5","TCP","1078","80 > 56627 [PSH, ACK] Seq=1025 Ack=1 Win=2920 Len=1024"
"4","0.007359000","193.138.213.169","192.168.1.5","TCP","1078","80 > 56627 [PSH, ACK] Seq=2049 Ack=1 Win=2920 Len=1024"
"5","0.008787000","193.138.213.169","192.168.1.5","TCP","1078","80 > 56627 [PSH, ACK] Seq=3073 Ack=1 Win=2920 Len=1024"
"7","0.022803000","193.138.213.169","192.168.1.5","TCP","1078","80 > 56627 [PSH, ACK] Seq=4097 Ack=1 Win=2920 Len=1024"
"8","0.028080000","193.138.213.169","192.168.1.5","TCP","1078","80 > 56627 [PSH, ACK] Seq=5121 Ack=1 Win=2920 Len=1024"
"10","0.032965000","193.138.213.169","192.168.1.5","TCP","1078","80 > 56627 [PSH, ACK] Seq=6145 Ack=1 Win=2920 Len=1024"
"11","0.033262000","193.138.213.169","192.168.1.5","TCP","1078","80 > 56627 [PSH, ACK] Seq=7169 Ack=1 Win=2920 Len=1024"
"13","0.055950000","193.138.213.169","192.168.1.5","TCP","1078","80 > 56627 [PSH, ACK] Seq=8193 Ack=1 Win=2920 Len=1024"
"14","0.071644000","193.138.213.169","192.168.1.5","TCP","1060","80 > 56627 [ACK] Seq=9217 Ack=1 Win=2920 Len=1006"
"16","0.086560000","193.138.213.169","192.168.1.5","TCP","121","80 > 56627 [ACK] Seq=10223 Ack=1 Win=2920 Len=67"
"17","0.088070000","193.138.213.169","192.168.1.5","TCP","1078","80 > 56627 [PSH, ACK] Seq=10290 Ack=1 Win=2920 Len=1024"
"19","0.093798000","193.138.213.169","192.168.1.5","TCP","1078","80 > 56627 [PSH, ACK] Seq=11314 Ack=1 Win=2920 Len=1024"
"20","0.102093000","193.138.213.169","192.168.1.5","TCP","1078","80 > 56627 [PSH, ACK] Seq=12338 Ack=1 Win=2920 Len=1024"
"22","0.109539000","193.138.213.169","192.168.1.5","TCP","1078","80 > 56627 [PSH, ACK] Seq=13362 Ack=1 Win=2920 Len=1024"
"23","0.121408000","193.138.213.169","192.168.1.5","TCP","1078","80 > 56627 [PSH, ACK] Seq=14386 Ack=1 Win=2920 Len=1024"
"25","0.127361000","193.138.213.169","192.168.1.5","TCP","1078","80 > 56627 [PSH, ACK] Seq=15410 Ack=1 Win=2920 Len=1024"
"26","0.130214000","193.138.213.169","192.168.1.5","TCP","1078","80 > 56627 [PSH, ACK] Seq=16434 Ack=1 Win=2920 Len=1024"
"28","0.131660000","193.138.213.169","192.168.1.5","TCP","1078","80 > 56627 [PSH, ACK] Seq=17458 Ack=1 Win=2920 Len=1024"
"29","0.142811000","193.138.213.169","192.168.1.5","TCP","1078","80 > 56627 [PSH, ACK] Seq=18482 Ack=1 Win=2920 Len=1024"
"31","0.147358000","193.138.213.169","192.168.1.5","TCP","1078","80 > 56627 [PSH, ACK] Seq=19506 Ack=1 Win=2920 Len=1024"
"32","0.149521000","193.138.213.169","192.168.1.5","TCP","1078","80 > 56627 [PSH, ACK] Seq=20530 Ack=1 Win=2920 Len=1024"
"34","0.150253000","193.138.213.169","192.168.1.5","TCP","1078","80 > 56627 [PSH, ACK] Seq=21554 Ack=1 Win=2920 Len=1024"
"35","0.188109000","193.138.213.169","192.168.1.5","TCP","1078","80 > 56627 [PSH, ACK] Seq=22578 Ack=1 Win=2920 Len=1024"
"37","0.189516000","193.138.213.169","192.168.1.5","TCP","1078","80 > 56627 [PSH, ACK] Seq=23602 Ack=1 Win=2920 Len=1024"
"38","0.203515000","193.138.213.169","192.168.1.5","TCP","1078","80 > 56627 [PSH, ACK] Seq=24626 Ack=1 Win=2920 Len=1024"
"40","0.219950000","193.138.213.169","192.168.1.5","TCP","1078","80 > 56627 [PSH, ACK] Seq=25650 Ack=1 Win=2920 Len=1024"
"41","0.230210000","193.138.213.169","192.168.1.5","TCP","1078","80 > 56627 [PSH, ACK] Seq=26674 Ack=1 Win=2920 Len=1024"
"43","0.240668000","193.138.213.169","192.168.1.5","TCP","1078","80 > 56627 [PSH, ACK] Seq=27698 Ack=1 Win=2920 Len=1024"
"44","0.242816000","193.138.213.169","192.168.1.5","TCP","1078","80 > 56627 [PSH, ACK] Seq=28722 Ack=1 Win=2920 Len=1024"
"46","0.247418000","193.138.213.169","192.168.1.5","TCP","1078","80 > 56627 [PSH, ACK] Seq=29746 Ack=1 Win=2920 Len=1024"
"47","0.248073000","193.138.213.169","192.168.1.5","TCP","1078","80 > 56627 [PSH, ACK] Seq=30770 Ack=1 Win=2920 Len=1024"
"49","0.261392000","193.138.213.169","192.168.1.5","TCP","1078","80 > 56627 [PSH, ACK] Seq=31794 Ack=1 Win=2920 Len=1024"
"50","0.268106000","193.138.213.169","192.168.1.5","TCP","1078","80 > 56627 [PSH, ACK] Seq=32818 Ack=1 Win=2920 Len=1024"
"52","0.273066000","193.138.213.169","192.168.1.5","TCP","1078","80 > 56627 [PSH, ACK] Seq=33842 Ack=1 Win=2920 Len=1024"
"53","0.280658000","193.138.213.169","192.168.1.5","TCP","1078","80 > 56627 [PSH, ACK] Seq=34866 Ack=1 Win=2920 Len=1024"
"55","0.308105000","193.138.213.169","192.168.1.5","TCP","1078","80 > 56627 [PSH, ACK] Seq=35890 Ack=1 Win=2920 Len=1024"
"56","0.312351000","193.138.213.169","192.168.1.5","TCP","1078","80 > 56627 [PSH, ACK] Seq=36914 Ack=1 Win=2920 Len=1024"
"58","0.320661000","193.138.213.169","192.168.1.5","TCP","1078","80 > 56627 [PSH, ACK] Seq=37938 Ack=1 Win=2920 Len=1024"
"59","0.327358000","193.138.213.169","192.168.1.5","TCP","1078","80 > 56627 [PSH, ACK] Seq=38962 Ack=1 Win=2920 Len=1024"
"61","0.347392000","193.138.213.169","192.168.1.5","TCP","1078","80 > 56627 [PSH, ACK] Seq=39986 Ack=1 Win=2920 Len=1024"
"62","0.348075000","193.138.213.169","192.168.1.5","TCP","1078","80 > 56627 [PSH, ACK] Seq=41010 Ack=1 Win=2920 Len=1024"
"64","0.357867000","193.138.213.169","192.168.1.5","TCP","1078","80 > 56627 [PSH, ACK] Seq=42034 Ack=1 Win=2920 Len=1024"
"65","0.361384000","193.138.213.169","192.168.1.5","TCP","1011","80 > 56627 [ACK] Seq=43058 Ack=1 Win=2920 Len=957"
"67","0.362674000","193.138.213.169","192.168.1.5","TCP","121","80 > 56627 [ACK] Seq=44015 Ack=1 Win=2920 Len=67"
"68","0.364950000","193.138.213.169","192.168.1.5","TCP","1078","80 > 56627 [PSH, ACK] Seq=44082 Ack=1 Win=2920 Len=1024"
"70","0.366650000","193.138.213.169","192.168.1.5","TCP","1078","80 > 56627 [PSH, ACK] Seq=45106 Ack=1 Win=2920 Len=1024"
"71","0.383545000","193.138.213.169","192.168.1.5","TCP","1078","80 > 56627 [PSH, ACK] Seq=46130 Ack=1 Win=2920 Len=1024"
"73","0.387355000","193.138.213.169","192.168.1.5","TCP","1078","80 > 56627 [PSH, ACK] Seq=47154 Ack=1 Win=2920 Len=1024"
"74","0.397832000","193.138.213.169","192.168.1.5","TCP","1078","80 > 56627 [PSH, ACK] Seq=48178 Ack=1 Win=2920 Len=1024"
"76","0.398105000","193.138.213.169","192.168.1.5","TCP","1078","80 > 56627 [PSH, ACK] Seq=49202 Ack=1 Win=2920 Len=1024"
"77","0.432435000","193.138.213.169","192.168.1.5","TCP","1078","80 > 56627 [PSH, ACK] Seq=50226 Ack=1 Win=2920 Len=1024"
"79","0.433063000","193.138.213.169","192.168.1.5","TCP","1078","80 > 56627 [PSH, ACK] Seq=51250 Ack=1 Win=2920 Len=1024"
"80","0.447381000","193.138.213.169","192.168.1.5","TCP","1078","80 > 56627 [PSH, ACK] Seq=52274 Ack=1 Win=2920 Len=1024"
"82","0.450967000","193.138.213.169","192.168.1.5","TCP","1078","80 > 56627 [PSH, ACK] Seq=53298 Ack=1 Win=2920 Len=1024"
"83","0.467391000","193.138.213.169","192.168.1.5","TCP","1078","80 > 56627 [PSH, ACK] Seq=54322 Ack=1 Win=2920 Len=1024"
"85","0.471634000","193.138.213.169","192.168.1.5","TCP","1078","80 > 56627 [PSH, ACK] Seq=55346 Ack=1 Win=2920 Len=1024"
"86","0.477803000","193.138.213.169","192.168.1.5","TCP","1078","80 > 56627 [PSH, ACK] Seq=56370 Ack=1 Win=2920 Len=1024"
"88","0.483508000","193.138.213.169","192.168.1.5","TCP","1078","80 > 56627 [PSH, ACK] Seq=57394 Ack=1 Win=2920 Len=1024"
"89","0.488133000","193.138.213.169","192.168.1.5","TCP","1078","80 > 56627 [PSH, ACK] Seq=58418 Ack=1 Win=2920 Len=1024"
"91","0.504250000","193.138.213.169","192.168.1.5","TCP","1078","80 > 56627 [PSH, ACK] Seq=59442 Ack=1 Win=2920 Len=1024"
"92","0.510206000","193.138.213.169","192.168.1.5","TCP","1078","80 > 56627 [PSH, ACK] Seq=60466 Ack=1 Win=2920 Len=1024"
"94","0.517101000","193.138.213.169","192.168.1.5","TCP","1078","80 > 56627 [PSH, ACK] Seq=61490 Ack=1 Win=2920 Len=1024"
"95","0.523512000","193.138.213.169","192.168.1.5","TCP","1078","80 > 56627 [PSH, ACK] Seq=62514 Ack=1 Win=2920 Len=1024"
"97","0.555944000","193.138.213.169","192.168.1.5","TCP","1078","80 > 56627 [PSH, ACK] Seq=63538 Ack=1 Win=2920 Len=1024"
"98","0.556247000","193.138.213.169","192.168.1.5","TCP","1078","80 > 56627 [PSH, ACK] Seq=64562 Ack=1 Win=2920 Len=1024"
"100","0.564264000","193.138.213.169","192.168.1.5","TCP","1078","80 > 56627 [PSH, ACK] Seq=65586 Ack=1 Win=2920 Len=1024"
"101","0.565682000","193.138.213.169","192.168.1.5","TCP","1078","80 > 56627 [PSH, ACK] Seq=66610 Ack=1 Win=2920 Len=1024"
"103","0.582804000","193.138.213.169","192.168.1.5","TCP","1078","80 > 56627 [PSH, ACK] Seq=67634 Ack=1 Win=2920 Len=1024"
"104","0.584219000","193.138.213.169","192.168.1.5","TCP","1078","80 > 56627 [PSH, ACK] Seq=68658 Ack=1 Win=2920 Len=1024"
"106","0.593061000","193.138.213.169","192.168.1.5","TCP","1078","80 > 56627 [PSH, ACK] Seq=69682 Ack=1 Win=2920 Len=1024"
"107","0.594480000","193.138.213.169","192.168.1.5","TCP","1078","80 > 56627 [PSH, ACK] Seq=70706 Ack=1 Win=2920 Len=1024"
"109","0.603510000","193.138.213.169","192.168.1.5","TCP","1078","80 > 56627 [PSH, ACK] Seq=71730 Ack=1 Win=2920 Len=1024"
"110","0.605654000","193.138.213.169","192.168.1.5","TCP","1078","80 > 56627 [PSH, ACK] Seq=72754 Ack=1 Win=2920 Len=1024"
"112","0.630983000","193.138.213.169","192.168.1.5","TCP","1078","80 > 56627 [PSH, ACK] Seq=73778 Ack=1 Win=2920 Len=1024"
"113","0.632346000","193.138.213.169","192.168.1.5","TCP","1078","80 > 56627 [PSH, ACK] Seq=74802 Ack=1 Win=2920 Len=1024"
"115","0.640664000","193.138.213.169","192.168.1.5","HTTP","1078","Continuation"
"116","0.643502000","193.138.213.169","192.168.1.5","TCP","1069","80 > 56627 [ACK] Seq=76850 Ack=1 Win=2920 Len=1015"
"118","0.674422000","193.138.213.169","192.168.1.5","TCP","121","80 > 56627 [ACK] Seq=77865 Ack=1 Win=2920 Len=67"
"119","0.677112000","193.138.213.169","192.168.1.5","TCP","1078","80 > 56627 [PSH, ACK] Seq=77932 Ack=1 Win=2920 Len=1024"
"121","0.682827000","193.138.213.169","192.168.1.5","TCP","1078","80 > 56627 [PSH, ACK] Seq=78956 Ack=1 Win=2920 Len=1024"
"122","0.690919000","193.138.213.169","192.168.1.5","TCP","1078","80 > 56627 [PSH, ACK] Seq=79980 Ack=1 Win=2920 Len=1024"
"124","0.697086000","193.138.213.169","192.168.1.5","TCP","1078","80 > 56627 [PSH, ACK] Seq=81004 Ack=1 Win=2920 Len=1024"
"125","0.703504000","193.138.213.169","192.168.1.5","TCP","1078","80 > 56627 [PSH, ACK] Seq=82028 Ack=1 Win=2920 Len=1024"
"127","0.710201000","193.138.213.169","192.168.1.5","TCP","1078","80 > 56627 [PSH, ACK] Seq=83052 Ack=1 Win=2920 Len=1024"
"128","0.717084000","193.138.213.169","192.168.1.5","TCP","1078","80 > 56627 [PSH, ACK] Seq=84076 Ack=1 Win=2920 Len=1024"
"130","0.723510000","193.138.213.169","192.168.1.5","TCP","1078","80 > 56627 [PSH, ACK] Seq=85100 Ack=1 Win=2920 Len=1024"
"131","0.728062000","193.138.213.169","192.168.1.5","TCP","1078","80 > 56627 [PSH, ACK] Seq=86124 Ack=1 Win=2920 Len=1024"
"133","0.735215000","193.138.213.169","192.168.1.5","TCP","1078","80 > 56627 [PSH, ACK] Seq=87148 Ack=1 Win=2920 Len=1024"
"134","0.751647000","193.138.213.169","192.168.1.5","TCP","1078","80 > 56627 [PSH, ACK] Seq=88172 Ack=1 Win=2920 Len=1024"
"136","0.754481000","193.138.213.169","192.168.1.5","TCP","1078","80 > 56627 [PSH, ACK] Seq=89196 Ack=1 Win=2920 Len=1024"
"137","0.758507000","193.138.213.169","192.168.1.5","TCP","1078","80 > 56627 [PSH, ACK] Seq=90220 Ack=1 Win=2920 Len=1024"
"139","0.761410000","193.138.213.169","192.168.1.5","TCP","1078","80 > 56627 [PSH, ACK] Seq=91244 Ack=1 Win=2920 Len=1024"
"140","0.795215000","193.138.213.169","192.168.1.5","TCP","1078","80 > 56627 [PSH, ACK] Seq=92268 Ack=1 Win=2920 Len=1024"
"142","0.807376000","193.138.213.169","192.168.1.5","TCP","1078","80 > 56627 [PSH, ACK] Seq=93292 Ack=1 Win=2920 Len=1024"
"143","0.808063000","193.138.213.169","192.168.1.5","TCP","1078","80 > 56627 [PSH, ACK] Seq=94316 Ack=1 Win=2920 Len=1024"
"145","0.819970000","193.138.213.169","192.168.1.5","TCP","1078","80 > 56627 [PSH, ACK] Seq=95340 Ack=1 Win=2920 Len=1024"
"146","0.823506000","193.138.213.169","192.168.1.5","TCP","1078","80 > 56627 [PSH, ACK] Seq=96364 Ack=1 Win=2920 Len=1024"
"148","0.844266000","193.138.213.169","192.168.1.5","TCP","1078","80 > 56627 [PSH, ACK] Seq=97388 Ack=1 Win=2920 Len=1024"
"149","0.844578000","193.138.213.169","192.168.1.5","TCP","1078","80 > 56627 [PSH, ACK] Seq=98412 Ack=1 Win=2920 Len=1024"
"151","0.845424000","193.138.213.169","192.168.1.5","TCP","1078","80 > 56627 [PSH, ACK] Seq=99436 Ack=1 Win=2920 Len=1024"
"152","0.845705000","193.138.213.169","192.168.1.5","TCP","1078","80 > 56627 [PSH, ACK] Seq=100460 Ack=1 Win=2920 Len=1024"
"154","0.873071000","193.138.213.169","192.168.1.5","TCP","1078","80 > 56627 [PSH, ACK] Seq=101484 Ack=1 Win=2920 Len=1024"
"155","0.877796000","193.138.213.169","192.168.1.5","TCP","1078","80 > 56627 [PSH, ACK] Seq=102508 Ack=1 Win=2920 Len=1024"
"157","0.882785000","193.138.213.169","192.168.1.5","TCP","1078","80 > 56627 [PSH, ACK] Seq=103532 Ack=1 Win=2920 Len=1024"
"158","0.888058000","193.138.213.169","192.168.1.5","TCP","1078","80 > 56627 [PSH, ACK] Seq=104556 Ack=1 Win=2920 Len=1024"
"160","0.917833000","193.138.213.169","192.168.1.5","TCP","1078","80 > 56627 [PSH, ACK] Seq=105580 Ack=1 Win=2920 Len=1024"
"161","0.924931000","193.138.213.169","192.168.1.5","TCP","1078","80 > 56627 [PSH, ACK] Seq=106604 Ack=1 Win=2920 Len=1024"
"163","0.930915000","193.138.213.169","192.168.1.5","TCP","1078","80 > 56627 [PSH, ACK] Seq=107628 Ack=1 Win=2920 Len=1024"
"164","0.937106000","193.138.213.169","192.168.1.5","TCP","1078","80 > 56627 [PSH, ACK] Seq=108652 Ack=1 Win=2920 Len=1024"
"166","0.942109000","193.138.213.169","192.168.1.5","TCP","1078","80 > 56627 [PSH, ACK] Seq=109676 Ack=1 Win=2920 Len=1024"
"167","0.948084000","193.138.213.169","192.168.1.5","TCP","1078","80 > 56627 [ACK] Seq=110700 Ack=1 Win=2920 Len=1024"
"169","0.960552000","193.138.213.169","192.168.1.5","HTTP","105","Continuation"
"170","0.962101000","193.138.213.169","192.168.1.5","TCP","1078","80 > 56627 [PSH, ACK] Seq=111775 Ack=1 Win=2920 Len=1024"
"172","0.963564000","193.138.213.169","192.168.1.5","TCP","1078","80 > 56627 [PSH, ACK] Seq=112799 Ack=1 Win=2920 Len=1024"
"173","0.965648000","193.138.213.169","192.168.1.5","TCP","1078","80 > 56627 [PSH, ACK] Seq=113823 Ack=1 Win=2920 Len=1024"
"175","0.968770000","193.138.213.169","192.168.1.5","TCP","1078","80 > 56627 [PSH, ACK] Seq=114847 Ack=1 Win=2920 Len=1024"
"176","0.993765000","193.138.213.169","192.168.1.5","TCP","1078","80 > 56627 [PSH, ACK] Seq=115871 Ack=1 Win=2920 Len=1024"
"178","0.997081000","193.138.213.169","192.168.1.5","TCP","1078","80 > 56627 [PSH, ACK] Seq=116895 Ack=1 Win=2920 Len=1024"
"179","1.003499000","193.138.213.169","192.168.1.5","TCP","1078","80 > 56627 [PSH, ACK] Seq=117919 Ack=1 Win=2920 Len=1024"
"181","1.005638000","193.138.213.169","192.168.1.5","TCP","1078","80 > 56627 [PSH, ACK] Seq=118943 Ack=1 Win=2920 Len=1024"
"182","1.046656000","193.138.213.169","192.168.1.5","TCP","1078","80 > 56627 [PSH, ACK] Seq=119967 Ack=1 Win=2920 Len=1024"
"184","1.048058000","193.138.213.169","192.168.1.5","TCP","1078","80 > 56627 [PSH, ACK] Seq=120991 Ack=1 Win=2920 Len=1024"
"185","1.056782000","193.138.213.169","192.168.1.5","TCP","1078","80 > 56627 [PSH, ACK] Seq=122015 Ack=1 Win=2920 Len=1024"
"187","1.057314000","193.138.213.169","192.168.1.5","TCP","1078","80 > 56627 [PSH, ACK] Seq=123039 Ack=1 Win=2920 Len=1024"
"188","1.063499000","193.138.213.169","192.168.1.5","TCP","1078","80 > 56627 [PSH, ACK] Seq=124063 Ack=1 Win=2920 Len=1024"
"190","1.082107000","193.138.213.169","192.168.1.5","TCP","1078","80 > 56627 [PSH, ACK] Seq=125087 Ack=1 Win=2920 Len=1024"
"191","1.090909000","193.138.213.169","192.168.1.5","TCP","1078","80 > 56627 [PSH, ACK] Seq=126111 Ack=1 Win=2920 Len=1024"
"193","1.097074000","193.138.213.169","192.168.1.5","TCP","1078","80 > 56627 [PSH, ACK] Seq=127135 Ack=1 Win=2920 Len=1024"
"194","1.101381000","193.138.213.169","192.168.1.5","TCP","1078","80 > 56627 [PSH, ACK] Seq=128159 Ack=1 Win=2920 Len=1024"
"196","1.112360000","193.138.213.169","192.168.1.5","TCP","1078","80 > 56627 [PSH, ACK] Seq=129183 Ack=1 Win=2920 Len=1024"
"197","1.120649000","193.138.213.169","192.168.1.5","TCP","1078","80 > 56627 [PSH, ACK] Seq=130207 Ack=1 Win=2920 Len=1024"
"199","1.127450000","193.138.213.169","192.168.1.5","TCP","1078","80 > 56627 [PSH, ACK] Seq=131231 Ack=1 Win=2920 Len=1024"
"200","1.133763000","193.138.213.169","192.168.1.5","TCP","1078","80 > 56627 [PSH, ACK] Seq=132255 Ack=1 Win=2920 Len=1024"
"202","1.162878000","193.138.213.169","192.168.1.5","TCP","1078","80 > 56627 [PSH, ACK] Seq=133279 Ack=1 Win=2920 Len=1024"
"203","1.165695000","193.138.213.169","192.168.1.5","TCP","1078","80 > 56627 [PSH, ACK] Seq=134303 Ack=1 Win=2920 Len=1024"
"205","1.172395000","193.138.213.169","192.168.1.5","TCP","1078","80 > 56627 [PSH, ACK] Seq=135327 Ack=1 Win=2920 Len=1024"
"206","1.175212000","193.138.213.169","192.168.1.5","TCP","1078","80 > 56627 [PSH, ACK] Seq=136351 Ack=1 Win=2920 Len=1024"
"208","1.179931000","193.138.213.169","192.168.1.5","TCP","1078","80 > 56627 [PSH, ACK] Seq=137375 Ack=1 Win=2920 Len=1024"
"209","1.181364000","193.138.213.169","192.168.1.5","TCP","1078","80 > 56627 [PSH, ACK] Seq=138399 Ack=1 Win=2920 Len=1024"
"211","1.207378000","193.138.213.169","192.168.1.5","TCP","1078","80 > 56627 [PSH, ACK] Seq=139423 Ack=1 Win=2920 Len=1024"
"212","1.208056000","193.138.213.169","192.168.1.5","TCP","1078","80 > 56627 [PSH, ACK] Seq=140447 Ack=1 Win=2920 Len=1024"
"214","1.217135000","193.138.213.169","192.168.1.5","TCP","1078","80 > 56627 [PSH, ACK] Seq=141471 Ack=1 Win=2920 Len=1024"
"215","1.217787000","193.138.213.169","192.168.1.5","TCP","1078","80 > 56627 [PSH, ACK] Seq=142495 Ack=1 Win=2920 Len=1024"
"217","1.238571000","193.138.213.169","192.168.1.5","TCP","1078","80 > 56627 [PSH, ACK] Seq=143519 Ack=1 Win=2920 Len=1024"
"218","1.250231000","193.138.213.169","192.168.1.5","TCP","939","80 > 56627 [ACK] Seq=144543 Ack=1 Win=2920 Len=885"
"220","1.250781000","193.138.213.169","192.168.1.5","TCP","121","80 > 56627 [ACK] Seq=145428 Ack=1 Win=2920 Len=67"
"221","1.251652000","193.138.213.169","192.168.1.5","TCP","1078","80 > 56627 [PSH, ACK] Seq=145495 Ack=1 Win=2920 Len=1024"
"223","1.253070000","193.138.213.169","192.168.1.5","TCP","1078","80 > 56627 [PSH, ACK] Seq=146519 Ack=1 Win=2920 Len=1024"
"224","1.284980000","193.138.213.169","192.168.1.5","TCP","1078","80 > 56627 [PSH, ACK] Seq=147543 Ack=1 Win=2920 Len=1024"
"226","1.290914000","193.138.213.169","192.168.1.5","TCP","1078","80 > 56627 [PSH, ACK] Seq=148567 Ack=1 Win=2920 Len=1024"
"227","1.297797000","193.138.213.169","192.168.1.5","TCP","1078","80 > 56627 [PSH, ACK] Seq=149591 Ack=1 Win=2920 Len=1024"
"229","1.302071000","193.138.213.169","192.168.1.5","TCP","1078","80 > 56627 [PSH, ACK] Seq=150615 Ack=1 Win=2920 Len=1024"
"230","1.308056000","193.138.213.169","192.168.1.5","TCP","1078","80 > 56627 [PSH, ACK] Seq=151639 Ack=1 Win=2920 Len=1024"
"232","1.315901000","193.138.213.169","192.168.1.5","TCP","1078","80 > 56627 [PSH, ACK] Seq=152663 Ack=1 Win=2920 Len=1024"
"233","1.330202000","193.138.213.169","192.168.1.5","TCP","1078","80 > 56627 [PSH, ACK] Seq=153687 Ack=1 Win=2920 Len=1024"
"235","1.337080000","193.138.213.169","192.168.1.5","TCP","1078","80 > 56627 [PSH, ACK] Seq=154711 Ack=1 Win=2920 Len=1024"
"236","1.341371000","193.138.213.169","192.168.1.5","TCP","1078","80 > 56627 [PSH, ACK] Seq=155735 Ack=1 Win=2920 Len=1024"
"238","1.347367000","193.138.213.169","192.168.1.5","TCP","1078","80 > 56627 [PSH, ACK] Seq=156759 Ack=1 Win=2920 Len=1024"
"239","1.367374000","193.138.213.169","192.168.1.5","TCP","1078","80 > 56627 [PSH, ACK] Seq=157783 Ack=1 Win=2920 Len=1024"
"241","1.368061000","193.138.213.169","192.168.1.5","TCP","1078","80 > 56627 [PSH, ACK] Seq=158807 Ack=1 Win=2920 Len=1024"
"242","1.370902000","193.138.213.169","192.168.1.5","TCP","1078","80 > 56627 [PSH, ACK] Seq=159831 Ack=1 Win=2920 Len=1024"
"244","1.402091000","193.138.213.169","192.168.1.5","TCP","1078","80 > 56627 [PSH, ACK] Seq=160855 Ack=1 Win=2920 Len=1024"
"245","1.402396000","193.138.213.169","192.168.1.5","TCP","1078","80 > 56627 [PSH, ACK] Seq=161879 Ack=1 Win=2920 Len=1024"
"247","1.415965000","193.138.213.169","192.168.1.5","TCP","1078","80 > 56627 [PSH, ACK] Seq=162903 Ack=1 Win=2920 Len=1024"
"248","1.417822000","193.138.213.169","192.168.1.5","TCP","1078","80 > 56627 [PSH, ACK] Seq=163927 Ack=1 Win=2920 Len=1024"
"250","1.428055000","193.138.213.169","192.168.1.5","TCP","1078","80 > 56627 [PSH, ACK] Seq=164951 Ack=1 Win=2920 Len=1024"
"251","1.430191000","193.138.213.169","192.168.1.5","TCP","1078","80 > 56627 [PSH, ACK] Seq=165975 Ack=1 Win=2920 Len=1024"
"254","1.453086000","193.138.213.169","192.168.1.5","TCP","1078","80 > 56627 [PSH, ACK] Seq=166999 Ack=1 Win=2920 Len=1024"
"258","1.457100000","193.138.213.169","192.168.1.5","TCP","1078","80 > 56627 [PSH, ACK] Seq=168023 Ack=1 Win=2920 Len=1024"
"268","1.460653000","193.138.213.169","192.168.1.5","TCP","1078","80 > 56627 [PSH, ACK] Seq=169047 Ack=1 Win=2920 Len=1024"
"272","1.462255000","193.138.213.169","192.168.1.5","TCP","1078","80 > 56627 [PSH, ACK] Seq=170071 Ack=1 Win=2920 Len=1024"
"301","1.488065000","193.138.213.169","192.168.1.5","TCP","1078","80 > 56627 [PSH, ACK] Seq=171095 Ack=1 Win=2920 Len=1024"
"302","1.495211000","193.138.213.169","192.168.1.5","TCP","1078","80 > 56627 [PSH, ACK] Seq=172119 Ack=1 Win=2920 Len=1024"
"304","1.502115000","193.138.213.169","192.168.1.5","TCP","1078","80 > 56627 [PSH, ACK] Seq=173143 Ack=1 Win=2920 Len=1024"
"305","1.506627000","193.138.213.169","192.168.1.5","TCP","1078","80 > 56627 [PSH, ACK] Seq=174167 Ack=1 Win=2920 Len=1024"
"307","1.522093000","193.138.213.169","192.168.1.5","TCP","1078","80 > 56627 [PSH, ACK] Seq=175191 Ack=1 Win=2920 Len=1024"
"308","1.526637000","193.138.213.169","192.168.1.5","TCP","1078","80 > 56627 [PSH, ACK] Seq=176215 Ack=1 Win=2920 Len=1024"
"310","1.533771000","193.138.213.169","192.168.1.5","TCP","1078","80 > 56627 [PSH, ACK] Seq=177239 Ack=1 Win=2920 Len=1024"
"325","1.555910000","193.138.213.169","192.168.1.5","TCP","993","80 > 56627 [ACK] Seq=178263 Ack=1 Win=2920 Len=939"
"327","1.556341000","193.138.213.169","192.168.1.5","TCP","121","80 > 56627 [ACK] Seq=179202 Ack=1 Win=2920 Len=67"
"328","1.557094000","193.138.213.169","192.168.1.5","TCP","1078","80 > 56627 [PSH, ACK] Seq=179269 Ack=1 Win=2920 Len=1024"
"330","1.564252000","193.138.213.169","192.168.1.5","TCP","1078","80 > 56627 [PSH, ACK] Seq=180293 Ack=1 Win=2920 Len=1024"
"331","1.573058000","193.138.213.169","192.168.1.5","TCP","1078","80 > 56627 [PSH, ACK] Seq=181317 Ack=1 Win=2920 Len=1024"
"333","1.574487000","193.138.213.169","192.168.1.5","TCP","1078","80 > 56627 [PSH, ACK] Seq=182341 Ack=1 Win=2920 Len=1024"
"334","1.577784000","193.138.213.169","192.168.1.5","TCP","1078","80 > 56627 [PSH, ACK] Seq=183365 Ack=1 Win=2920 Len=1024"
"336","1.579926000","193.138.213.169","192.168.1.5","TCP","1078","80 > 56627 [PSH, ACK] Seq=184389 Ack=1 Win=2920 Len=1024"
"337","1.611640000","193.138.213.169","192.168.1.5","TCP","1078","80 > 56627 [PSH, ACK] Seq=185413 Ack=1 Win=2920 Len=1024"
"339","1.615192000","193.138.213.169","192.168.1.5","TCP","1078","80 > 56627 [PSH, ACK] Seq=186437 Ack=1 Win=2920 Len=1024"
"340","1.622798000","193.138.213.169","192.168.1.5","TCP","1078","80 > 56627 [PSH, ACK] Seq=187461 Ack=1 Win=2920 Len=1024"
"342","1.623585000","193.138.213.169","192.168.1.5","TCP","1078","80 > 56627 [PSH, ACK] Seq=188485 Ack=1 Win=2920 Len=1024"
"343","1.642130000","193.138.213.169","192.168.1.5","TCP","1078","80 > 56627 [PSH, ACK] Seq=189509 Ack=1 Win=2920 Len=1024"
"345","1.642796000","193.138.213.169","192.168.1.5","TCP","1078","80 > 56627 [PSH, ACK] Seq=190533 Ack=1 Win=2920 Len=1024"
"346","1.672395000","193.138.213.169","192.168.1.5","TCP","1078","80 > 56627 [PSH, ACK] Seq=191557 Ack=1 Win=2920 Len=1024"
"348","1.674473000","193.138.213.169","192.168.1.5","TCP","1078","80 > 56627 [PSH, ACK] Seq=192581 Ack=1 Win=2920 Len=1024"
"349","1.675895000","193.138.213.169","192.168.1.5","TCP","1078","80 > 56627 [PSH, ACK] Seq=193605 Ack=1 Win=2920 Len=1024"
"351","1.694504000","193.138.213.169","192.168.1.5","TCP","1078","80 > 56627 [PSH, ACK] Seq=194629 Ack=1 Win=2920 Len=1024"
"352","1.698578000","193.138.213.169","192.168.1.5","TCP","1078","80 > 56627 [PSH, ACK] Seq=195653 Ack=1 Win=2920 Len=1024"
"354","1.707339000","193.138.213.169","192.168.1.5","TCP","1078","80 > 56627 [PSH, ACK] Seq=196677 Ack=1 Win=2920 Len=1024"
"355","1.713047000","193.138.213.169","192.168.1.5","TCP","1078","80 > 56627 [PSH, ACK] Seq=197701 Ack=1 Win=2920 Len=1024"
"357","1.731641000","193.138.213.169","192.168.1.5","TCP","1078","80 > 56627 [PSH, ACK] Seq=198725 Ack=1 Win=2920 Len=1024"
"358","1.737784000","193.138.213.169","192.168.1.5","TCP","1078","80 > 56627 [PSH, ACK] Seq=199749 Ack=1 Win=2920 Len=1024"
"360","1.744922000","193.138.213.169","192.168.1.5","TCP","1078","80 > 56627 [PSH, ACK] Seq=200773 Ack=1 Win=2920 Len=1024"
"361","1.750940000","193.138.213.169","192.168.1.5","TCP","1078","80 > 56627 [PSH, ACK] Seq=201797 Ack=1 Win=2920 Len=1024"
"363","1.760660000","193.138.213.169","192.168.1.5","TCP","1078","80 > 56627 [PSH, ACK] Seq=202821 Ack=1 Win=2920 Len=1024"
"364","1.764921000","193.138.213.169","192.168.1.5","TCP","1078","80 > 56627 [PSH, ACK] Seq=203845 Ack=1 Win=2920 Len=1024"
"366","1.788057000","193.138.213.169","192.168.1.5","TCP","1078","80 > 56627 [PSH, ACK] Seq=204869 Ack=1 Win=2920 Len=1024"
"367","1.792322000","193.138.213.169","192.168.1.5","TCP","1078","80 > 56627 [PSH, ACK] Seq=205893 Ack=1 Win=2920 Len=1024"
"369","1.795193000","193.138.213.169","192.168.1.5","TCP","1078","80 > 56627 [PSH, ACK] Seq=206917 Ack=1 Win=2920 Len=1024"
"370","1.797807000","193.138.213.169","192.168.1.5","TCP","1078","80 > 56627 [PSH, ACK] Seq=207941 Ack=1 Win=2920 Len=1024"
"372","1.815246000","193.138.213.169","192.168.1.5","TCP","1078","80 > 56627 [PSH, ACK] Seq=208965 Ack=1 Win=2920 Len=1024"
"373","1.815888000","193.138.213.169","192.168.1.5","TCP","1078","80 > 56627 [PSH, ACK] Seq=209989 Ack=1 Win=2920 Len=1024"
"375","1.828057000","193.138.213.169","192.168.1.5","TCP","1078","80 > 56627 [PSH, ACK] Seq=211013 Ack=1 Win=2920 Len=1024"
"376","1.834455000","193.138.213.169","192.168.1.5","TCP","1033","80 > 56627 [ACK] Seq=212037 Ack=1 Win=2920 Len=979"
"378","1.860541000","193.138.213.169","192.168.1.5","TCP","121","80 > 56627 [ACK] Seq=213016 Ack=1 Win=2920 Len=67"
"382","1.862066000","193.138.213.169","192.168.1.5","TCP","1078","80 > 56627 [PSH, ACK] Seq=213083 Ack=1 Win=2920 Len=1024"
"384","1.868054000","193.138.213.169","192.168.1.5","TCP","1078","80 > 56627 [PSH, ACK] Seq=214107 Ack=1 Win=2920 Len=1024"
"385","1.869466000","193.138.213.169","192.168.1.5","TCP","1078","80 > 56627 [PSH, ACK] Seq=215131 Ack=1 Win=2920 Len=1024"
"387","1.870916000","193.138.213.169","192.168.1.5","TCP","1078","80 > 56627 [PSH, ACK] Seq=216155 Ack=1 Win=2920 Len=1024"
"388","1.885672000","193.138.213.169","192.168.1.5","TCP","1078","80 > 56627 [PSH, ACK] Seq=217179 Ack=1 Win=2920 Len=1024"
"390","1.890902000","193.138.213.169","192.168.1.5","TCP","1078","80 > 56627 [PSH, ACK] Seq=218203 Ack=1 Win=2920 Len=1024"
"391","1.911630000","193.138.213.169","192.168.1.5","TCP","1078","80 > 56627 [PSH, ACK] Seq=219227 Ack=1 Win=2920 Len=1024"
"393","1.919924000","193.138.213.169","192.168.1.5","TCP","1078","80 > 56627 [PSH, ACK] Seq=220251 Ack=1 Win=2920 Len=1024"
"394","1.926654000","193.138.213.169","192.168.1.5","TCP","1078","80 > 56627 [PSH, ACK] Seq=221275 Ack=1 Win=2920 Len=1024"
"396","1.932324000","193.138.213.169","192.168.1.5","TCP","1078","80 > 56627 [PSH, ACK] Seq=222299 Ack=1 Win=2920 Len=1024"
"397","1.939942000","193.138.213.169","192.168.1.5","TCP","1078","80 > 56627 [PSH, ACK] Seq=223323 Ack=1 Win=2920 Len=1024"
"399","1.943484000","193.138.213.169","192.168.1.5","TCP","1078","80 > 56627 [PSH, ACK] Seq=224347 Ack=1 Win=2920 Len=1024"
"400","1.955922000","193.138.213.169","192.168.1.5","TCP","1078","80 > 56627 [PSH, ACK] Seq=225371 Ack=1 Win=2920 Len=1024"
"402","1.961422000","193.138.213.169","192.168.1.5","TCP","1078","80 > 56627 [PSH, ACK] Seq=226395 Ack=1 Win=2920 Len=1024"
"403","1.980651000","193.138.213.169","192.168.1.5","TCP","1078","80 > 56627 [PSH, ACK] Seq=227419 Ack=1 Win=2920 Len=1024"
"405","1.986627000","193.138.213.169","192.168.1.5","TCP","1078","80 > 56627 [PSH, ACK] Seq=228443 Ack=1 Win=2920 Len=1024"
"406","1.987326000","193.138.213.169","192.168.1.5","TCP","1078","80 > 56627 [PSH, ACK] Seq=229467 Ack=1 Win=2920 Len=1024"
"409","2.002105000","193.138.213.169","192.168.1.5","TCP","1078","80 > 56627 [PSH, ACK] Seq=230491 Ack=1 Win=2920 Len=1024"
"410","2.002766000","193.138.213.169","192.168.1.5","TCP","1078","80 > 56627 [PSH, ACK] Seq=231515 Ack=1 Win=2920 Len=1024"
"412","2.028070000","193.138.213.169","192.168.1.5","TCP","1078","80 > 56627 [PSH, ACK] Seq=232539 Ack=1 Win=2920 Len=1024"
"413","2.029467000","193.138.213.169","192.168.1.5","TCP","1078","80 > 56627 [PSH, ACK] Seq=233563 Ack=1 Win=2920 Len=1024"
"415","2.045665000","193.138.213.169","192.168.1.5","TCP","1078","80 > 56627 [PSH, ACK] Seq=234587 Ack=1 Win=2920 Len=1024"
"416","2.048036000","193.138.213.169","192.168.1.5","TCP","1078","80 > 56627 [PSH, ACK] Seq=235611 Ack=1 Win=2920 Len=1024"
"418","2.059929000","193.138.213.169","192.168.1.5","TCP","1078","80 > 56627 [PSH, ACK] Seq=236635 Ack=1 Win=2920 Len=1024"
"419","2.061340000","193.138.213.169","192.168.1.5","TCP","1078","80 > 56627 [PSH, ACK] Seq=237659 Ack=1 Win=2920 Len=1024"
"421","2.071631000","193.138.213.169","192.168.1.5","TCP","1078","80 > 56627 [PSH, ACK] Seq=238683 Ack=1 Win=2920 Len=1024"
"422","2.072321000","193.138.213.169","192.168.1.5","TCP","1078","80 > 56627 [PSH, ACK] Seq=239707 Ack=1 Win=2920 Len=1024"
"424","2.100674000","193.138.213.169","192.168.1.5","TCP","1078","80 > 56627 [PSH, ACK] Seq=240731 Ack=1 Win=2920 Len=1024"
"425","2.106638000","193.138.213.169","192.168.1.5","TCP","1078","80 > 56627 [PSH, ACK] Seq=241755 Ack=1 Win=2920 Len=1024"
"427","2.110885000","193.138.213.169","192.168.1.5","TCP","1078","80 > 56627 [PSH, ACK] Seq=242779 Ack=1 Win=2920 Len=1024"
"428","2.117055000","193.138.213.169","192.168.1.5","TCP","1078","80 > 56627 [PSH, ACK] Seq=243803 Ack=1 Win=2920 Len=1024"
"430","2.122058000","193.138.213.169","192.168.1.5","TCP","1078","80 > 56627 [PSH, ACK] Seq=244827 Ack=1 Win=2920 Len=1024"
"431","2.148785000","193.138.213.169","192.168.1.5","TCP","964","80 > 56627 [ACK] Seq=245851 Ack=1 Win=2920 Len=910"
"433","2.149323000","193.138.213.169","192.168.1.5","TCP","121","80 > 56627 [ACK] Seq=246761 Ack=1 Win=2920 Len=67"
"434","2.150922000","193.138.213.169","192.168.1.5","TCP","1078","80 > 56627 [PSH, ACK] Seq=246828 Ack=1 Win=2920 Len=1024"
"436","2.158502000","193.138.213.169","192.168.1.5","TCP","1078","80 > 56627 [PSH, ACK] Seq=247852 Ack=1 Win=2920 Len=1024"
"437","2.166616000","193.138.213.169","192.168.1.5","TCP","1078","80 > 56627 [PSH, ACK] Seq=248876 Ack=1 Win=2920 Len=1024"
"439","2.172317000","193.138.213.169","192.168.1.5","TCP","1078","80 > 56627 [PSH, ACK] Seq=249900 Ack=1 Win=2920 Len=1024"
"440","2.177777000","193.138.213.169","192.168.1.5","TCP","1078","80 > 56627 [PSH, ACK] Seq=250924 Ack=1 Win=2920 Len=1024"
"442","2.183138000","193.138.213.169","192.168.1.5","TCP","1078","80 > 56627 [PSH, ACK] Seq=251948 Ack=1 Win=2920 Len=1024"
"443","2.192320000","193.138.213.169","192.168.1.5","TCP","1078","80 > 56627 [PSH, ACK] Seq=252972 Ack=1 Win=2920 Len=1024"
"445","2.194460000","193.138.213.169","192.168.1.5","TCP","1078","80 > 56627 [PSH, ACK] Seq=253996 Ack=1 Win=2920 Len=1024"
"446","2.222121000","193.138.213.169","192.168.1.5","TCP","1078","80 > 56627 [PSH, ACK] Seq=255020 Ack=1 Win=2920 Len=1024"
"448","2.222766000","193.138.213.169","192.168.1.5","TCP","1078","80 > 56627 [PSH, ACK] Seq=256044 Ack=1 Win=2920 Len=1024"
"449","2.232323000","193.138.213.169","192.168.1.5","TCP","1078","80 > 56627 [PSH, ACK] Seq=257068 Ack=1 Win=2920 Len=1024"
"451","2.234507000","193.138.213.169","192.168.1.5","TCP","1078","80 > 56627 [PSH, ACK] Seq=258092 Ack=1 Win=2920 Len=1024"
"452","2.269498000","193.138.213.169","192.168.1.5","TCP","1078","80 > 56627 [PSH, ACK] Seq=259116 Ack=1 Win=2920 Len=1024"
"454","2.272319000","193.138.213.169","192.168.1.5","TCP","1078","80 > 56627 [PSH, ACK] Seq=260140 Ack=1 Win=2920 Len=1024"
"455","2.275948000","193.138.213.169","192.168.1.5","TCP","1078","80 > 56627 [PSH, ACK] Seq=261164 Ack=1 Win=2920 Len=1024"
"457","2.282103000","193.138.213.169","192.168.1.5","TCP","1078","80 > 56627 [PSH, ACK] Seq=262188 Ack=1 Win=2920 Len=1024"
"458","2.282763000","193.138.213.169","192.168.1.5","TCP","1078","80 > 56627 [PSH, ACK] Seq=263212 Ack=1 Win=2920 Len=1024"
"460","2.297088000","193.138.213.169","192.168.1.5","TCP","1078","80 > 56627 [PSH, ACK] Seq=264236 Ack=1 Win=2920 Len=1024"
"461","2.301338000","193.138.213.169","192.168.1.5","TCP","1078","80 > 56627 [PSH, ACK] Seq=265260 Ack=1 Win=2920 Len=1024"
"463","2.310178000","193.138.213.169","192.168.1.5","TCP","1078","80 > 56627 [PSH, ACK] Seq=266284 Ack=1 Win=2920 Len=1024"
"464","2.313742000","193.138.213.169","192.168.1.5","TCP","1078","80 > 56627 [PSH, ACK] Seq=267308 Ack=1 Win=2920 Len=1024"
"466","2.342085000","193.138.213.169","192.168.1.5","TCP","1078","80 > 56627 [PSH, ACK] Seq=268332 Ack=1 Win=2920 Len=1024"
"467","2.350195000","193.138.213.169","192.168.1.5","TCP","1078","80 > 56627 [PSH, ACK] Seq=269356 Ack=1 Win=2920 Len=1024"
"469","2.355200000","193.138.213.169","192.168.1.5","TCP","1078","80 > 56627 [PSH, ACK] Seq=270380 Ack=1 Win=2920 Len=1024"
"470","2.360634000","193.138.213.169","192.168.1.5","TCP","1078","80 > 56627 [PSH, ACK] Seq=271404 Ack=1 Win=2920 Len=1024"
"472","2.388009000","193.138.213.169","192.168.1.5","TCP","1078","80 > 56627 [PSH, ACK] Seq=272428 Ack=1 Win=2920 Len=1024"
"473","2.388353000","193.138.213.169","192.168.1.5","TCP","1078","80 > 56627 [PSH, ACK] Seq=273452 Ack=1 Win=2920 Len=1024"
"475","2.391597000","193.138.213.169","192.168.1.5","TCP","1078","80 > 56627 [PSH, ACK] Seq=274476 Ack=1 Win=2920 Len=1024"
"476","2.393028000","193.138.213.169","192.168.1.5","TCP","1078","80 > 56627 [PSH, ACK] Seq=275500 Ack=1 Win=2920 Len=1024"
"478","2.398493000","193.138.213.169","192.168.1.5","TCP","1078","80 > 56627 [PSH, ACK] Seq=276524 Ack=1 Win=2920 Len=1024"
"479","2.400654000","193.138.213.169","192.168.1.5","TCP","1078","80 > 56627 [PSH, ACK] Seq=277548 Ack=1 Win=2920 Len=1024"
"481","2.417827000","193.138.213.169","192.168.1.5","TCP","1078","80 > 56627 [PSH, ACK] Seq=278572 Ack=1 Win=2920 Len=1024"
"482","2.430205000","193.138.213.169","192.168.1.5","TCP","1053","80 > 56627 [ACK] Seq=279596 Ack=1 Win=2920 Len=999"
"484","2.430899000","193.138.213.169","192.168.1.5","TCP","1078","80 > 56627 [PSH, ACK] Seq=280595 Ack=1 Win=2920 Len=1024"
"485","2.432339000","193.138.213.169","192.168.1.5","TCP","1078","80 > 56627 [PSH, ACK] Seq=281619 Ack=1 Win=2920 Len=1024"
"487","2.473079000","193.138.213.169","192.168.1.5","TCP","1078","80 > 56627 [PSH, ACK] Seq=282643 Ack=1 Win=2920 Len=1024"
"488","2.475897000","193.138.213.169","192.168.1.5","TCP","1078","80 > 56627 [PSH, ACK] Seq=283667 Ack=1 Win=2920 Len=1024"
"490","2.477773000","193.138.213.169","192.168.1.5","TCP","1078","80 > 56627 [PSH, ACK] Seq=284691 Ack=1 Win=2920 Len=1024"
"491","2.479912000","193.138.213.169","192.168.1.5","TCP","1078","80 > 56627 [PSH, ACK] Seq=285715 Ack=1 Win=2920 Len=1024"
"493","2.507334000","193.138.213.169","192.168.1.5","TCP","1078","80 > 56627 [PSH, ACK] Seq=286739 Ack=1 Win=2920 Len=1024"
"494","2.512320000","193.138.213.169","192.168.1.5","TCP","1078","80 > 56627 [PSH, ACK] Seq=287763 Ack=1 Win=2920 Len=1024"
"496","2.518512000","193.138.213.169","192.168.1.5","TCP","1078","80 > 56627 [PSH, ACK] Seq=288787 Ack=1 Win=2920 Len=1024"
"497","2.524224000","193.138.213.169","192.168.1.5","TCP","1078","80 > 56627 [PSH, ACK] Seq=289811 Ack=1 Win=2920 Len=1024"
"499","2.528029000","193.138.213.169","192.168.1.5","TCP","1078","80 > 56627 [PSH, ACK] Seq=290835 Ack=1 Win=2920 Len=1024"
"500","2.535188000","193.138.213.169","192.168.1.5","TCP","1078","80 > 56627 [PSH, ACK] Seq=291859 Ack=1 Win=2920 Len=1024"
"502","2.552314000","193.138.213.169","192.168.1.5","TCP","1078","80 > 56627 [PSH, ACK] Seq=292883 Ack=1 Win=2920 Len=1024"
"503","2.557766000","193.138.213.169","192.168.1.5","TCP","1078","80 > 56627 [PSH, ACK] Seq=293907 Ack=1 Win=2920 Len=1024"
"506","2.565625000","193.138.213.169","192.168.1.5","TCP","1078","80 > 56627 [PSH, ACK] Seq=294931 Ack=1 Win=2920 Len=1024"
"507","2.573751000","193.138.213.169","192.168.1.5","TCP","1078","80 > 56627 [PSH, ACK] Seq=295955 Ack=1 Win=2920 Len=1024"
"509","2.592774000","193.138.213.169","192.168.1.5","TCP","1078","80 > 56627 [PSH, ACK] Seq=296979 Ack=1 Win=2920 Len=1024"
"510","2.593046000","193.138.213.169","192.168.1.5","TCP","1078","80 > 56627 [PSH, ACK] Seq=298003 Ack=1 Win=2920 Len=1024"
"512","2.598505000","193.138.213.169","192.168.1.5","TCP","1078","80 > 56627 [PSH, ACK] Seq=299027 Ack=1 Win=2920 Len=1024"
"513","2.599194000","193.138.213.169","192.168.1.5","TCP","1078","80 > 56627 [PSH, ACK] Seq=300051 Ack=1 Win=2920 Len=1024"
"515","2.631628000","193.138.213.169","192.168.1.5","TCP","1078","80 > 56627 [PSH, ACK] Seq=301075 Ack=1 Win=2920 Len=1024"
"516","2.635185000","193.138.213.169","192.168.1.5","TCP","1078","80 > 56627 [PSH, ACK] Seq=302099 Ack=1 Win=2920 Len=1024"
"518","2.641337000","193.138.213.169","192.168.1.5","TCP","1078","80 > 56627 [PSH, ACK] Seq=303123 Ack=1 Win=2920 Len=1024"
"519","2.642757000","193.138.213.169","192.168.1.5","TCP","1078","80 > 56627 [PSH, ACK] Seq=304147 Ack=1 Win=2920 Len=1024"
"521","2.653055000","193.138.213.169","192.168.1.5","TCP","1078","80 > 56627 [PSH, ACK] Seq=305171 Ack=1 Win=2920 Len=1024"
"522","2.655220000","193.138.213.169","192.168.1.5","TCP","1078","80 > 56627 [PSH, ACK] Seq=306195 Ack=1 Win=2920 Len=1024"
"524","2.677776000","193.138.213.169","192.168.1.5","TCP","1078","80 > 56627 [PSH, ACK] Seq=307219 Ack=1 Win=2920 Len=1024"
"525","2.681333000","193.138.213.169","192.168.1.5","TCP","1078","80 > 56627 [PSH, ACK] Seq=308243 Ack=1 Win=2920 Len=1024"
"527","2.691597000","193.138.213.169","192.168.1.5","TCP","1078","80 > 56627 [PSH, ACK] Seq=309267 Ack=1 Win=2920 Len=1024"
"528","2.695105000","193.138.213.169","192.168.1.5","TCP","1078","80 > 56627 [PSH, ACK] Seq=310291 Ack=1 Win=2920 Len=1024"
"530","2.710899000","193.138.213.169","192.168.1.5","TCP","1078","80 > 56627 [PSH, ACK] Seq=311315 Ack=1 Win=2920 Len=1024"
"531","2.717853000","193.138.213.169","192.168.1.5","TCP","1078","80 > 56627 [PSH, ACK] Seq=312339 Ack=1 Win=2920 Len=1024"
"533","2.734478000","193.138.213.169","192.168.1.5","TCP","1065","80 > 56627 [ACK] Seq=313363 Ack=1 Win=2920 Len=1011"
"534","2.735871000","193.138.213.169","192.168.1.5","TCP","1078","80 > 56627 [PSH, ACK] Seq=314374 Ack=1 Win=2920 Len=1024"
"536","2.755190000","193.138.213.169","192.168.1.5","TCP","1078","80 > 56627 [PSH, ACK] Seq=315398 Ack=1 Win=2920 Len=1024"
"537","2.762051000","193.138.213.169","192.168.1.5","TCP","1078","80 > 56627 [PSH, ACK] Seq=316422 Ack=1 Win=2920 Len=1024"
"540","2.768022000","193.138.213.169","192.168.1.5","TCP","1078","80 > 56627 [PSH, ACK] Seq=317446 Ack=1 Win=2920 Len=1024"
"541","2.775178000","193.138.213.169","192.168.1.5","TCP","1078","80 > 56627 [PSH, ACK] Seq=318470 Ack=1 Win=2920 Len=1024"
"543","2.779947000","193.138.213.169","192.168.1.5","TCP","1078","80 > 56627 [PSH, ACK] Seq=319494 Ack=1 Win=2920 Len=1024"
"544","2.782750000","193.138.213.169","192.168.1.5","TCP","1078","80 > 56627 [PSH, ACK] Seq=320518 Ack=1 Win=2920 Len=1024"
