"No.","Time","Source","Destination","Protocol","Length","Info"
"1","0.000000000","163.1.201.45","192.168.1.5","TCP","62","1935 > 55754 [PSH, ACK] Seq=1 Ack=1 Win=23716 Len=8"
"2","0.003340000","163.1.201.45","192.168.1.5","RTMP","1514","Unknown (0x74)"
"4","0.004561000","163.1.201.45","192.168.1.5","TCP","1514","1935 > 55754 [ACK] Seq=1469 Ack=1 Win=23716 Len=1460"
"5","0.005167000","163.1.201.45","192.168.1.5","RTMP","1230","Unknown (0x0)|Unknown (0x0)"
"7","0.005401000","163.1.201.45","192.168.1.5","RTMP","1514","Unknown (0x0)"
"8","0.005447000","163.1.201.45","192.168.1.5","TCP","1514","1935 > 55754 [ACK] Seq=5565 Ack=1 Win=23716 Len=1460"
"10","0.005646000","163.1.201.45","192.168.1.5","RTMP","1231","Unknown (0x0)|Unknown (0x0)|Unknown (0x0)"
"11","0.005688000","163.1.201.45","192.168.1.5","RTMP","1514","Unknown (0x0)"
"13","0.005905000","163.1.201.45","192.168.1.5","RTMP","1514","Unknown (0x0)"
"14","0.005938000","163.1.201.45","192.168.1.5","TCP","1231","1935 > 55754 [PSH, ACK] Seq=11122 Ack=1 Win=23716 Len=1177"
"16","0.006056000","163.1.201.45","192.168.1.5","RTMP","1514","Unknown (0x0)|Unknown (0x0)|Unknown (0x0)|Unknown (0x0)|Unknown (0x0)"
"17","0.006201000","163.1.201.45","192.168.1.5","TCP","1514","1935 > 55754 [ACK] Seq=13759 Ack=1 Win=23716 Len=1460"
"19","0.006304000","163.1.201.45","192.168.1.5","TCP","1231","1935 > 55754 [PSH, ACK] Seq=15219 Ack=1 Win=23716 Len=1177"
"20","0.006342000","163.1.201.45","192.168.1.5","RTMP","1514","Unknown (0x0)"
"22","0.006546000","163.1.201.45","192.168.1.5","RTMP","1514","Unknown (0x0)"
"23","0.006578000","163.1.201.45","192.168.1.5","RTMP","1231","Unknown (0x0)"
"25","0.006685000","163.1.201.45","192.168.1.5","RTMP","1514","Unknown (0x0)|Unknown (0x0)|Unknown (0x0)"
"26","0.006828000","163.1.201.45","192.168.1.5","TCP","1514","1935 > 55754 [ACK] Seq=21953 Ack=1 Win=23716 Len=1460"
"28","0.006931000","163.1.201.45","192.168.1.5","RTMP","1231","Unknown (0x0)"
"29","0.006969000","163.1.201.45","192.168.1.5","RTMP","1514","Unknown (0x0)|Unknown (0x74)|Unknown (0x0)|Unknown (0x0)|Unknown (0x0)|Unknown (0x0)|Unknown (0x0)"
"32","0.007180000","163.1.201.45","192.168.1.5","TCP","1514","1935 > 55754 [ACK] Seq=26050 Ack=1 Win=23716 Len=1460"
"33","0.007213000","163.1.201.45","192.168.1.5","TCP","1231","1935 > 55754 [PSH, ACK] Seq=27510 Ack=1 Win=23716 Len=1177"
"35","0.007322000","163.1.201.45","192.168.1.5","RTMP","1514","Unknown (0x0)|Unknown (0x0)"
"36","0.007435000","163.1.201.45","192.168.1.5","TCP","1514","1935 > 55754 [ACK] Seq=30147 Ack=1 Win=23716 Len=1460"
"39","0.007696000","163.1.201.45","192.168.1.5","TCP","1231","1935 > 55754 [PSH, ACK] Seq=31607 Ack=1 Win=23716 Len=1177"
"40","0.007816000","163.1.201.45","192.168.1.5","RTMP","1514","Unknown (0x0)|Unknown (0x0)"
"42","0.008018000","163.1.201.45","192.168.1.5","TCP","1514","1935 > 55754 [ACK] Seq=34244 Ack=1 Win=23716 Len=1460"
"43","0.008050000","163.1.201.45","192.168.1.5","TCP","1231","1935 > 55754 [PSH, ACK] Seq=35704 Ack=1 Win=23716 Len=1177"
"45","0.008239000","163.1.201.45","192.168.1.5","RTMP","1514","Unknown (0x0)|Unknown (0x0)"
"46","0.008271000","163.1.201.45","192.168.1.5","RTMP","1514","Unknown (0x0)|Unknown (0x0)|Unknown (0x0)|Unknown (0x0)|Unknown (0x0)|Unknown (0x0)"
"49","0.008460000","163.1.201.45","192.168.1.5","TCP","1231","1935 > 55754 [PSH, ACK] Seq=39801 Ack=1 Win=23716 Len=1177"
"50","0.008497000","163.1.201.45","192.168.1.5","RTMP","1514","Unknown (0x0)|Unknown (0x0)|Unknown (0x0)|Unknown (0x0)"
"52","0.008700000","163.1.201.45","192.168.1.5","TCP","1514","1935 > 55754 [ACK] Seq=42438 Ack=1 Win=23716 Len=1460"
"53","0.008733000","163.1.201.45","192.168.1.5","TCP","1231","1935 > 55754 [PSH, ACK] Seq=43898 Ack=1 Win=23716 Len=1177"
"55","0.008831000","163.1.201.45","192.168.1.5","RTMP","1514","Unknown (0x0)|Unknown (0x0)|Unknown (0x0)"
"57","0.008952000","163.1.201.45","192.168.1.5","TCP","1514","1935 > 55754 [ACK] Seq=46535 Ack=1 Win=23716 Len=1460"
"59","0.009052000","163.1.201.45","192.168.1.5","TCP","1231","1935 > 55754 [PSH, ACK] Seq=47995 Ack=1 Win=23716 Len=1177"
"62","0.010643000","163.1.201.45","192.168.1.5","RTMP","1514","Unknown (0x0)"
"63","0.010763000","163.1.201.45","192.168.1.5","TCP","1514","1935 > 55754 [ACK] Seq=50632 Ack=1 Win=23716 Len=1460"
"65","0.010983000","163.1.201.45","192.168.1.5","RTMP","1231","Unknown (0x74)|Unknown (0x0)|Unknown (0x0)|Unknown (0x0)"
"66","0.011026000","163.1.201.45","192.168.1.5","TCP","55","1935 > 55754 [PSH, ACK] Seq=53269 Ack=1 Win=23716 Len=1"
"68","0.011124000","163.1.201.45","192.168.1.5","RTMP","1514","Unknown (0x0)|Unknown (0x0)"
"69","0.011273000","163.1.201.45","192.168.1.5","RTMP","1514","Unknown (0x0)"
"71","0.011375000","163.1.201.45","192.168.1.5","RTMP","1231","Unknown (0x0)"
"72","0.011415000","163.1.201.45","192.168.1.5","TCP","1514","1935 > 55754 [ACK] Seq=57367 Ack=1 Win=23716 Len=1460"
"74","0.011621000","163.1.201.45","192.168.1.5","RTMP","1514","Unknown (0x0)|Unknown (0x0)"
"75","0.011907000","163.1.201.45","192.168.1.5","RTMP","1230","Unknown (0x0)|Unknown (0x74)|Unknown (0x0)"
"77","0.012022000","163.1.201.45","192.168.1.5","RTMP","1514","Unknown (0x0)"
"78","0.012234000","163.1.201.45","192.168.1.5","RTMP","1514","Unknown (0x0)|Unknown (0x0)|Unknown (0x0)"
"80","0.012339000","163.1.201.45","192.168.1.5","TCP","1514","1935 > 55754 [ACK] Seq=64383 Ack=1 Win=23716 Len=1460"
"81","0.012385000","163.1.201.45","192.168.1.5","TCP","900","1935 > 55754 [PSH, ACK] Seq=65843 Ack=1 Win=23716 Len=846"
"83","0.123082000","163.1.201.45","192.168.1.5","RTMP","1514","Unknown (0x0)"
"84","0.123259000","163.1.201.45","192.168.1.5","TCP","1514","1935 > 55754 [ACK] Seq=68149 Ack=1 Win=23716 Len=1460"
"86","0.123422000","163.1.201.45","192.168.1.5","TCP","1231","1935 > 55754 [PSH, ACK] Seq=69609 Ack=1 Win=23716 Len=1177"
"87","0.123792000","163.1.201.45","192.168.1.5","RTMP","1514","Unknown (0x0)|Unknown (0x0)|Unknown (0x0)|Unknown (0x0)|Unknown (0x0)|Unknown (0x0)"
"89","0.123910000","163.1.201.45","192.168.1.5","TCP","1514","1935 > 55754 [ACK] Seq=72246 Ack=1 Win=23716 Len=1460"
"90","0.123942000","163.1.201.45","192.168.1.5","RTMP","1231","Unknown (0x0)"
"92","0.124046000","163.1.201.45","192.168.1.5","RTMP","1514","Unknown (0x0)"
"93","0.124083000","163.1.201.45","192.168.1.5","RTMP","1514","Unknown (0x0)"
"95","0.124321000","163.1.201.45","192.168.1.5","RTMP","1231","Unknown (0x0)|Unknown (0x0)|Unknown (0x0)|Unknown (0x0)|Unknown (0x0)|Unknown (0x0)|Unknown (0x0)|Unknown (0x0)|Unknown (0x0)"
"96","0.124357000","163.1.201.45","192.168.1.5","RTMP","1514","Unknown (0x0)"
"98","0.124454000","163.1.201.45","192.168.1.5","TCP","1514","1935 > 55754 [ACK] Seq=80440 Ack=1 Win=23716 Len=1460"
"99","0.124485000","163.1.201.45","192.168.1.5","RTMP","1231","Unknown (0x0)"
"101","0.124576000","163.1.201.45","192.168.1.5","RTMP","1514","Unknown (0x0)|Unknown (0x0)|Unknown (0x0)|Unknown (0x0)"
"102","0.124730000","163.1.201.45","192.168.1.5","TCP","1514","1935 > 55754 [ACK] Seq=84537 Ack=1 Win=23716 Len=1460"
"104","0.124831000","163.1.201.45","192.168.1.5","RTMP","1231","Unknown (0x0)|Unknown (0x0)"
"105","0.124860000","163.1.201.45","192.168.1.5","RTMP","1514","Unknown (0x0)"
"107","0.124951000","163.1.201.45","192.168.1.5","RTMP","1514","Unknown (0x0)"
"108","0.125084000","163.1.201.45","192.168.1.5","RTMP","1231","Unknown (0x0)"
"110","0.125188000","163.1.201.45","192.168.1.5","RTMP","1514","Unknown (0x0)"
"113","0.139103000","163.1.201.45","192.168.1.5","TCP","1514","1935 > 55754 [ACK] Seq=92731 Ack=1 Win=23716 Len=1460"
"114","0.139158000","163.1.201.45","192.168.1.5","TCP","1231","1935 > 55754 [PSH, ACK] Seq=94191 Ack=1 Win=23716 Len=1177"
"116","0.139396000","163.1.201.45","192.168.1.5","RTMP","1514","Unknown (0x0)"
"117","0.139439000","163.1.201.45","192.168.1.5","RTMP","1514","Unknown (0x0)"
"119","0.139702000","163.1.201.45","192.168.1.5","TCP","1231","1935 > 55754 [PSH, ACK] Seq=98288 Ack=1 Win=23716 Len=1177"
"120","0.139869000","163.1.201.45","192.168.1.5","RTMP","1514","Unknown (0x0)"
"122","0.139980000","163.1.201.45","192.168.1.5","TCP","1514","1935 > 55754 [ACK] Seq=100925 Ack=1 Win=23716 Len=1460"
"123","0.140009000","163.1.201.45","192.168.1.5","TCP","1231","1935 > 55754 [PSH, ACK] Seq=102385 Ack=1 Win=23716 Len=1177"
"125","0.140112000","163.1.201.45","192.168.1.5","RTMP","1514","Unknown (0x0)|Unknown (0x0)|Unknown (0x0)|Unknown (0x0)"
"126","0.140290000","163.1.201.45","192.168.1.5","TCP","1514","1935 > 55754 [ACK] Seq=105022 Ack=1 Win=23716 Len=1460"
"128","0.140391000","163.1.201.45","192.168.1.5","RTMP","1027","Unknown (0x0)"
"129","0.140427000","163.1.201.45","192.168.1.5","TCP","1514","1935 > 55754 [ACK] Seq=107455 Ack=1 Win=23716 Len=1460"
"131","0.140527000","163.1.201.45","192.168.1.5","TCP","1514","1935 > 55754 [ACK] Seq=108915 Ack=1 Win=23716 Len=1460"
"132","0.140555000","163.1.201.45","192.168.1.5","TCP","1238","1935 > 55754 [PSH, ACK] Seq=110375 Ack=1 Win=23716 Len=1184"
"134","0.140783000","163.1.201.45","192.168.1.5","RTMP","1514","Unknown (0x0)|Unknown (0x0)|Unknown (0x74)|Unknown (0x0)|Unknown (0x0)"
"135","0.140822000","163.1.201.45","192.168.1.5","RTMP","1514","Unknown (0x0)"
"137","0.140919000","163.1.201.45","192.168.1.5","RTMP","1231","Unknown (0x0)"
"138","0.140957000","163.1.201.45","192.168.1.5","RTMP","1514","Unknown (0x0)"
"140","0.141182000","163.1.201.45","192.168.1.5","RTMP","1514","Unknown (0x0)"
"141","0.141214000","163.1.201.45","192.168.1.5","RTMP","1231","Unknown (0x0)|Unknown (0x0)|Unknown (0x0)"
"143","0.141324000","163.1.201.45","192.168.1.5","RTMP","1514","Unknown (0x0)|Unknown (0x0)"
"144","0.141358000","163.1.201.45","192.168.1.5","TCP","1514","1935 > 55754 [ACK] Seq=121213 Ack=1 Win=23716 Len=1460"
"147","0.180471000","163.1.201.45","192.168.1.5","TCP","1231","1935 > 55754 [PSH, ACK] Seq=122673 Ack=1 Win=23716 Len=1177"
"148","0.180554000","163.1.201.45","192.168.1.5","RTMP","1514","Unknown (0x0)|Unknown (0x0)|Unknown (0x0)|Unknown (0x0)"
"150","0.180726000","163.1.201.45","192.168.1.5","RTMP","1514","Unknown (0x0)|Unknown (0x0)"
"151","0.180884000","163.1.201.45","192.168.1.5","RTMP","1231","Unknown (0x0)"
"153","0.181010000","163.1.201.45","192.168.1.5","RTMP","1514","Unknown (0x0)"
"154","0.181050000","163.1.201.45","192.168.1.5","RTMP","1514","Unknown (0x0)"
"156","0.181147000","163.1.201.45","192.168.1.5","RTMP","1231","Unknown (0x0)"
"158","0.245476000","163.1.201.45","192.168.1.5","RTMP","1514","Unknown (0x0)|Unknown (0x0)"
"160","0.245773000","163.1.201.45","192.168.1.5","RTMP","1514","Unknown (0x0)|Unknown (0x0)"
"161","0.245888000","163.1.201.45","192.168.1.5","RTMP","1231","Unknown (0x0)|Unknown (0x0)|Unknown (0x0)"
"163","0.246017000","163.1.201.45","192.168.1.5","RTMP","1514","Unknown (0x0)"
"164","0.269919000","163.1.201.45","192.168.1.5","TCP","1514","1935 > 55754 [ACK] Seq=137601 Ack=1 Win=23716 Len=1460"
"166","0.270023000","163.1.201.45","192.168.1.5","RTMP","1231","Unknown (0x0)"
"167","0.270077000","163.1.201.45","192.168.1.5","RTMP","1514","Unknown (0x0)|Unknown (0x0)"
"169","0.270176000","163.1.201.45","192.168.1.5","RTMP","1514","Unknown (0x0)"
"170","0.270207000","163.1.201.45","192.168.1.5","TCP","1231","1935 > 55754 [PSH, ACK] Seq=143158 Ack=1 Win=23716 Len=1177"
"172","0.270441000","163.1.201.45","192.168.1.5","RTMP","1514","Unknown (0x0)|Unknown (0x0)|Unknown (0x0)"
"173","0.270483000","163.1.201.45","192.168.1.5","RTMP","1514","Unknown (0x0)|Unknown (0x0)"
"175","0.270587000","163.1.201.45","192.168.1.5","TCP","1231","1935 > 55754 [PSH, ACK] Seq=147255 Ack=1 Win=23716 Len=1177"
"176","0.270622000","163.1.201.45","192.168.1.5","RTMP","1514","Unknown (0x0)"
"178","0.270717000","163.1.201.45","192.168.1.5","TCP","152","1935 > 55754 [PSH, ACK] Seq=149892 Ack=1 Win=23716 Len=98"
"179","0.270743000","163.1.201.45","192.168.1.5","RTMP","1514","Unknown (0x0)|Unknown (0x0)"
"181","0.270834000","163.1.201.45","192.168.1.5","TCP","1514","1935 > 55754 [ACK] Seq=151450 Ack=1 Win=23716 Len=1460"
"182","0.270862000","163.1.201.45","192.168.1.5","RTMP","1238","Unknown (0x0)"
"185","0.277134000","163.1.201.45","192.168.1.5","RTMP","1514","Unknown (0x0)"
"186","0.277186000","163.1.201.45","192.168.1.5","RTMP","1514","Unknown (0x74)|Unknown (0x0)|Unknown (0x0)|Unknown (0x0)|Unknown (0x0)|Unknown (0x0)"
"188","0.277313000","163.1.201.45","192.168.1.5","RTMP","1231","Unknown (0x0)"
"189","0.277363000","163.1.201.45","192.168.1.5","RTMP","1514","Unknown (0x0)"
"191","0.277469000","163.1.201.45","192.168.1.5","TCP","1514","1935 > 55754 [ACK] Seq=159651 Ack=1 Win=23716 Len=1460"
"192","0.277497000","163.1.201.45","192.168.1.5","RTMP","1231","Unknown (0x0)|Unknown (0x0)"
"194","0.277601000","163.1.201.45","192.168.1.5","RTMP","1514","Unknown (0x0)"
"195","0.277635000","163.1.201.45","192.168.1.5","RTMP","1514","Unknown (0x0)"
"197","0.277728000","163.1.201.45","192.168.1.5","TCP","1231","1935 > 55754 [PSH, ACK] Seq=165208 Ack=1 Win=23716 Len=1177"
"198","0.277755000","163.1.201.45","192.168.1.5","RTMP","1514","Unknown (0x0)|Unknown (0x0)"
"200","0.277846000","163.1.201.45","192.168.1.5","TCP","1514","1935 > 55754 [ACK] Seq=167845 Ack=1 Win=23716 Len=1460"
"201","0.277874000","163.1.201.45","192.168.1.5","TCP","1231","1935 > 55754 [PSH, ACK] Seq=169305 Ack=1 Win=23716 Len=1177"
"203","0.277965000","163.1.201.45","192.168.1.5","RTMP","1514","Unknown (0x0)"
"204","0.277994000","163.1.201.45","192.168.1.5","RTMP","1514","Unknown (0x0)"
"206","0.278084000","163.1.201.45","192.168.1.5","RTMP","1231","Unknown (0x0)|Unknown (0x0)"
"207","0.278112000","163.1.201.45","192.168.1.5","RTMP","1514","Unknown (0x0)|Unknown (0x0)"
"209","0.278203000","163.1.201.45","192.168.1.5","TCP","1514","1935 > 55754 [ACK] Seq=176039 Ack=1 Win=23716 Len=1460"
"210","0.278230000","163.1.201.45","192.168.1.5","RTMP","1231","Unknown (0x0)|Unknown (0x0)"
"212","0.278318000","163.1.201.45","192.168.1.5","RTMP","1514","Unknown (0x0)"
"213","0.278348000","163.1.201.45","192.168.1.5","TCP","1514","1935 > 55754 [ACK] Seq=180136 Ack=1 Win=23716 Len=1460"
"215","0.278442000","163.1.201.45","192.168.1.5","TCP","1231","1935 > 55754 [PSH, ACK] Seq=181596 Ack=1 Win=23716 Len=1177"
"216","0.278588000","163.1.201.45","192.168.1.5","RTMP","1514","Unknown (0x0)"
"218","0.278694000","163.1.201.45","192.168.1.5","TCP","1514","1935 > 55754 [ACK] Seq=184233 Ack=1 Win=23716 Len=1460"
"219","0.278722000","163.1.201.45","192.168.1.5","TCP","1231","1935 > 55754 [PSH, ACK] Seq=185693 Ack=1 Win=23716 Len=1177"
"222","0.295616000","163.1.201.45","192.168.1.5","RTMP","1514","Unknown (0x0)"
"223","0.295680000","163.1.201.45","192.168.1.5","TCP","1514","1935 > 55754 [ACK] Seq=188330 Ack=1 Win=23716 Len=1460"
"225","0.295944000","163.1.201.45","192.168.1.5","RTMP","1231","Unknown (0x0)"
"226","0.296058000","163.1.201.45","192.168.1.5","RTMP","1514","Unknown (0x0)"
"228","0.296323000","163.1.201.45","192.168.1.5","TCP","1514","1935 > 55754 [ACK] Seq=192427 Ack=1 Win=23716 Len=1460"
"229","0.296357000","163.1.201.45","192.168.1.5","RTMP","1514","Unknown (0x0)|Unknown (0x0)"
"232","0.304538000","163.1.201.45","192.168.1.5","TCP","722","1935 > 55754 [PSH, ACK] Seq=195347 Ack=1 Win=23716 Len=668"
"233","0.379554000","163.1.201.45","192.168.1.5","RTMP","1514","Unknown (0x0)|Unknown (0x0)"
"235","0.379939000","163.1.201.45","192.168.1.5","TCP","1514","1935 > 55754 [ACK] Seq=197475 Ack=1 Win=23716 Len=1460"
"236","0.379971000","163.1.201.45","192.168.1.5","TCP","1231","1935 > 55754 [PSH, ACK] Seq=198935 Ack=1 Win=23716 Len=1177"
"238","0.380092000","163.1.201.45","192.168.1.5","RTMP","1514","Unknown (0x0)|Unknown (0x0)"
"239","0.380230000","163.1.201.45","192.168.1.5","RTMP","1514","Unknown (0x0)|Unknown (0x0)"
"241","0.380334000","163.1.201.45","192.168.1.5","RTMP","1231","Unknown (0x0)"
"242","0.392042000","163.1.201.45","192.168.1.5","RTMP","1514","Unknown (0x0)"
"244","0.392274000","163.1.201.45","192.168.1.5","RTMP","1514","Unknown (0x0)|Unknown (0x0)|Unknown (0x0)|Unknown (0x0)|Unknown (0x0)"
"245","0.392311000","163.1.201.45","192.168.1.5","RTMP","1231","Unknown (0x0)"
"247","0.392544000","163.1.201.45","192.168.1.5","RTMP","1514","Unknown (0x0)|Unknown (0x0)"
"248","0.392586000","163.1.201.45","192.168.1.5","TCP","1514","1935 > 55754 [ACK] Seq=209766 Ack=1 Win=23716 Len=1460"
"250","0.392685000","163.1.201.45","192.168.1.5","RTMP","1231","Unknown (0x0)"
"251","0.392833000","163.1.201.45","192.168.1.5","RTMP","1514","Unknown (0x0)|Unknown (0x0)"
"253","0.392943000","163.1.201.45","192.168.1.5","RTMP","1514","Unknown (0x0)|Unknown (0x74)|Unknown (0x0)"
"254","0.392972000","163.1.201.45","192.168.1.5","RTMP","1231","Unknown (0x0)|Unknown (0x0)"
"256","0.393200000","163.1.201.45","192.168.1.5","RTMP","1514","Unknown (0x0)"
"257","0.393240000","163.1.201.45","192.168.1.5","TCP","1514","1935 > 55754 [ACK] Seq=217960 Ack=1 Win=23716 Len=1460"
"259","0.393337000","163.1.201.45","192.168.1.5","TCP","1231","1935 > 55754 [PSH, ACK] Seq=219420 Ack=1 Win=23716 Len=1177"
"261","0.397945000","163.1.201.45","192.168.1.5","RTMP","1514","Unknown (0x0)|Unknown (0x0)"
"263","0.398185000","163.1.201.45","192.168.1.5","TCP","1514","1935 > 55754 [ACK] Seq=222057 Ack=1 Win=23716 Len=1460"
"264","0.398221000","163.1.201.45","192.168.1.5","TCP","1231","1935 > 55754 [PSH, ACK] Seq=223517 Ack=1 Win=23716 Len=1177"
"266","0.398437000","163.1.201.45","192.168.1.5","RTMP","1514","Unknown (0x0)"
"267","0.398479000","163.1.201.45","192.168.1.5","TCP","1514","1935 > 55754 [ACK] Seq=226154 Ack=1 Win=23716 Len=1460"
"269","0.398665000","163.1.201.45","192.168.1.5","TCP","1231","1935 > 55754 [PSH, ACK] Seq=227614 Ack=1 Win=23716 Len=1177"
"270","0.398707000","163.1.201.45","192.168.1.5","RTMP","1514","Unknown (0x0)"
"272","0.398908000","163.1.201.45","192.168.1.5","TCP","1514","1935 > 55754 [ACK] Seq=230251 Ack=1 Win=23716 Len=1460"
"273","0.398942000","163.1.201.45","192.168.1.5","RTMP","1231","Unknown (0x0)"
"275","0.399155000","163.1.201.45","192.168.1.5","RTMP","1514","Unknown (0x0)"
"276","0.399198000","163.1.201.45","192.168.1.5","RTMP","1514","Unknown (0x0)|Unknown (0x0)"
"278","0.399412000","163.1.201.45","192.168.1.5","RTMP","1514","Unknown (0x0)|Unknown (0x0)"
"279","0.399457000","163.1.201.45","192.168.1.5","RTMP","372","Unknown (0x0)|Unknown (0x0)"
"281","0.399563000","163.1.201.45","192.168.1.5","RTMP","1514","Unknown (0x0)|Unknown (0x0)|Unknown (0x0)"
"282","0.399708000","163.1.201.45","192.168.1.5","RTMP","1514","Unknown (0x0)"
"284","0.399808000","163.1.201.45","192.168.1.5","TCP","1231","1935 > 55754 [PSH, ACK] Seq=240506 Ack=1 Win=23716 Len=1177"
"285","0.399846000","163.1.201.45","192.168.1.5","RTMP","1514","Unknown (0x0)|Unknown (0x0)|Unknown (0x0)"
"287","0.400060000","163.1.201.45","192.168.1.5","RTMP","1514","Unknown (0x0)|Unknown (0x0)|Unknown (0x0)|Unknown (0x0)"
"288","0.400092000","163.1.201.45","192.168.1.5","RTMP","1231","Unknown (0x0)|Unknown (0x0)|Unknown (0x0)"
"290","0.400202000","163.1.201.45","192.168.1.5","RTMP","1514","Unknown (0x0)|Unknown (0x0)"
"291","0.400331000","163.1.201.45","192.168.1.5","TCP","1514","1935 > 55754 [ACK] Seq=247240 Ack=1 Win=23716 Len=1460"
"293","0.400434000","163.1.201.45","192.168.1.5","RTMP","1231","Unknown (0x0)"
"294","0.409676000","163.1.201.45","192.168.1.5","RTMP","1514","Unknown (0x0)"
"296","0.409897000","163.1.201.45","192.168.1.5","TCP","1514","1935 > 55754 [ACK] Seq=251337 Ack=1 Win=23716 Len=1460"
"297","0.416990000","163.1.201.45","192.168.1.5","TCP","1231","1935 > 55754 [PSH, ACK] Seq=252797 Ack=1 Win=23716 Len=1177"
"299","0.417149000","163.1.201.45","192.168.1.5","RTMP","1514","Unknown (0x0)"
"300","0.417192000","163.1.201.45","192.168.1.5","TCP","1514","1935 > 55754 [ACK] Seq=255434 Ack=1 Win=23716 Len=1460"
"302","0.417288000","163.1.201.45","192.168.1.5","TCP","1231","1935 > 55754 [PSH, ACK] Seq=256894 Ack=1 Win=23716 Len=1177"
"303","0.487624000","163.1.201.45","192.168.1.5","RTMP","1514","Unknown (0x0)"
"305","0.487865000","163.1.201.45","192.168.1.5","RTMP","1514","Unknown (0x0)|Unknown (0x0)|Unknown (0x0)"
"306","0.487900000","163.1.201.45","192.168.1.5","RTMP","1231","Unknown (0x0)|Unknown (0x0)"
"309","0.516487000","163.1.201.45","192.168.1.5","RTMP","1514","Unknown (0x0)"
"310","0.516643000","163.1.201.45","192.168.1.5","RTMP","1514","Unknown (0x0)|Unknown (0x0)|Unknown (0x0)"
"312","0.516773000","163.1.201.45","192.168.1.5","RTMP","1231","Unknown (0x0)|Unknown (0x0)|Unknown (0x0)|Unknown (0x0)|Unknown (0x0)"
"313","0.516922000","163.1.201.45","192.168.1.5","RTMP","1514","Unknown (0x0)|Unknown (0x0)|Unknown (0x0)|Unknown (0x0)|Unknown (0x0)"
"315","0.517035000","163.1.201.45","192.168.1.5","RTMP","1514","Unknown (0x0)"
"316","0.517173000","163.1.201.45","192.168.1.5","RTMP","1231","Unknown (0x0)|Unknown (0x0)|Unknown (0x0)|Unknown (0x0)"
"318","0.517285000","163.1.201.45","192.168.1.5","RTMP","1514","Unknown (0x0)|Unknown (0x0)|Unknown (0x0)|Unknown (0x0)"
"319","0.517321000","163.1.201.45","192.168.1.5","TCP","1514","1935 > 55754 [ACK] Seq=271822 Ack=1 Win=23716 Len=1460"
"321","0.517536000","163.1.201.45","192.168.1.5","RTMP","1231","Unknown (0x0)"
"322","0.517582000","163.1.201.45","192.168.1.5","TCP","55","1935 > 55754 [PSH, ACK] Seq=274459 Ack=1 Win=23716 Len=1"
"324","0.517683000","163.1.201.45","192.168.1.5","RTMP","1514","Unknown (0x0)|Unknown (0x0)"
"325","0.517719000","163.1.201.45","192.168.1.5","RTMP","1514","Unknown (0x74)"
"327","0.517956000","163.1.201.45","192.168.1.5","RTMP","1514","Unknown (0x0)"
"328","0.518001000","163.1.201.45","192.168.1.5","TCP","99","1935 > 55754 [PSH, ACK] Seq=278840 Ack=1 Win=23716 Len=45"
"330","0.518110000","163.1.201.45","192.168.1.5","RTMP","1514","Unknown (0x0)"
"331","0.518146000","163.1.201.45","192.168.1.5","TCP","1514","1935 > 55754 [ACK] Seq=280345 Ack=1 Win=23716 Len=1460"
"333","0.518238000","163.1.201.45","192.168.1.5","TCP","1231","1935 > 55754 [PSH, ACK] Seq=281805 Ack=1 Win=23716 Len=1177"
"334","0.518394000","163.1.201.45","192.168.1.5","RTMP","1514","Unknown (0x0)|Unknown (0x0)"
"336","0.518498000","163.1.201.45","192.168.1.5","RTMP","1514","Unknown (0x0)"
"337","0.518526000","163.1.201.45","192.168.1.5","RTMP","1231","Unknown (0x0)"
"339","0.518618000","163.1.201.45","192.168.1.5","RTMP","1514","Unknown (0x0)|Unknown (0x0)|Unknown (0x0)|Unknown (0x0)|Unknown (0x0)"
"340","0.518736000","163.1.201.45","192.168.1.5","RTMP","1514","Unknown (0x0)|Unknown (0x0)|Unknown (0x0)|Unknown (0x0)|Unknown (0x0)"
"342","0.518837000","163.1.201.45","192.168.1.5","TCP","1231","1935 > 55754 [PSH, ACK] Seq=289999 Ack=1 Win=23716 Len=1177"
"344","0.536277000","163.1.201.45","192.168.1.5","RTMP","1514","Unknown (0x0)|Unknown (0x0)|Unknown (0x0)|Unknown (0x0)"
"345","0.536444000","163.1.201.45","192.168.1.5","TCP","1514","1935 > 55754 [ACK] Seq=292636 Ack=1 Win=23716 Len=1460"
"347","0.536606000","163.1.201.45","192.168.1.5","RTMP","1231","Unknown (0x0)"
"348","0.536891000","163.1.201.45","192.168.1.5","RTMP","1514","Unknown (0x0)|Unknown (0x0)|Unknown (0x0)"
"350","0.537010000","163.1.201.45","192.168.1.5","TCP","1514","1935 > 55754 [ACK] Seq=296733 Ack=1 Win=23716 Len=1460"
"351","0.537040000","163.1.201.45","192.168.1.5","TCP","1231","1935 > 55754 [PSH, ACK] Seq=298193 Ack=1 Win=23716 Len=1177"
"353","0.537147000","163.1.201.45","192.168.1.5","RTMP","1514","Unknown (0x0)|Unknown (0x0)"
"354","0.537181000","163.1.201.45","192.168.1.5","TCP","1514","1935 > 55754 [ACK] Seq=300830 Ack=1 Win=23716 Len=1460"
"356","0.537275000","163.1.201.45","192.168.1.5","RTMP","1231","Unknown (0x0)"
"357","0.537304000","163.1.201.45","192.168.1.5","RTMP","1514","Unknown (0x0)|Unknown (0x0)|Unknown (0x0)"
"359","0.537394000","163.1.201.45","192.168.1.5","RTMP","1514","Unknown (0x0)|Unknown (0x0)|Unknown (0x0)"
"360","0.537422000","163.1.201.45","192.168.1.5","TCP","1231","1935 > 55754 [PSH, ACK] Seq=306387 Ack=1 Win=23716 Len=1177"
"362","0.537513000","163.1.201.45","192.168.1.5","RTMP","1514","Unknown (0x0)|Unknown (0x0)|Unknown (0x0)|Unknown (0x0)|Unknown (0x0)|Unknown (0x0)"
"363","0.537542000","163.1.201.45","192.168.1.5","RTMP","1514","Unknown (0x0)|Unknown (0x0)|Unknown (0x0)"
"365","0.537632000","163.1.201.45","192.168.1.5","RTMP","1231","Unknown (0x74)|Unknown (0x0)|Unknown (0x0)"
"366","0.537729000","163.1.201.45","192.168.1.5","RTMP","1514","Unknown (0x0)"
"368","0.537828000","163.1.201.45","192.168.1.5","TCP","1514","1935 > 55754 [ACK] Seq=313121 Ack=1 Win=23716 Len=1460"
"369","0.537857000","163.1.201.45","192.168.1.5","TCP","1231","1935 > 55754 [PSH, ACK] Seq=314581 Ack=1 Win=23716 Len=1177"
"371","0.537952000","163.1.201.45","192.168.1.5","RTMP","274","Unknown (0x0)"
"372","0.537979000","163.1.201.45","192.168.1.5","RTMP","1514","Unknown (0x0)|Unknown (0x0)|Unknown (0x0)"
"374","0.538072000","163.1.201.45","192.168.1.5","TCP","1514","1935 > 55754 [ACK] Seq=317438 Ack=1 Win=23716 Len=1460"
"375","0.538101000","163.1.201.45","192.168.1.5","TCP","1230","1935 > 55754 [PSH, ACK] Seq=318898 Ack=1 Win=23716 Len=1176"
"380","0.595985000","163.1.201.45","192.168.1.5","RTMP","1514","Unknown (0x0)|Unknown (0x0)|Unknown (0x0)"
"381","0.596102000","163.1.201.45","192.168.1.5","TCP","1514","1935 > 55754 [ACK] Seq=321534 Ack=1 Win=23716 Len=1460"
"383","0.596311000","163.1.201.45","192.168.1.5","TCP","1231","1935 > 55754 [PSH, ACK] Seq=322994 Ack=1 Win=23716 Len=1177"
"384","0.596362000","163.1.201.45","192.168.1.5","RTMP","1514","Unknown (0x0)|Unknown (0x0)|Unknown (0x0)|Unknown (0x0)|Unknown (0x0)|Unknown (0x0)|Unknown (0x0)|Unknown (0x0)"
"386","0.596470000","163.1.201.45","192.168.1.5","TCP","1514","1935 > 55754 [ACK] Seq=325631 Ack=1 Win=23716 Len=1460"
"387","0.596580000","163.1.201.45","192.168.1.5","TCP","1231","1935 > 55754 [PSH, ACK] Seq=327091 Ack=1 Win=23716 Len=1177"
"390","0.626959000","163.1.201.45","192.168.1.5","RTMP","1514","Unknown (0x0)|Unknown (0x0)"
"391","0.629432000","163.1.201.45","192.168.1.5","RTMP","1514","Unknown (0x0)|Unknown (0x0)|Unknown (0x0)"
"393","0.641255000","163.1.201.45","192.168.1.5","RTMP","1231","Unknown (0x0)"
"394","0.641334000","163.1.201.45","192.168.1.5","RTMP","1514","Unknown (0x0)|Unknown (0x0)|Unknown (0x0)|Unknown (0x0)|Unknown (0x0)"
"396","0.641502000","163.1.201.45","192.168.1.5","RTMP","1514","Unknown (0x0)|Unknown (0x0)"
"397","0.641532000","163.1.201.45","192.168.1.5","TCP","1231","1935 > 55754 [PSH, ACK] Seq=335285 Ack=1 Win=23716 Len=1177"
"399","0.641643000","163.1.201.45","192.168.1.5","RTMP","1514","Unknown (0x0)|Unknown (0x0)"
"400","0.641679000","163.1.201.45","192.168.1.5","RTMP","1514","Unknown (0x0)"
"402","0.641776000","163.1.201.45","192.168.1.5","RTMP","1231","Unknown (0x0)"
"403","0.641814000","163.1.201.45","192.168.1.5","RTMP","1514","Unknown (0x0)"
"405","0.641923000","163.1.201.45","192.168.1.5","RTMP","1514","Unknown (0x0)|Unknown (0x0)|Unknown (0x0)"
"406","0.641951000","163.1.201.45","192.168.1.5","RTMP","1231","Unknown (0x0)|Unknown (0x0)"
"409","0.650746000","163.1.201.45","192.168.1.5","RTMP","1514","Unknown (0x0)|Unknown (0x0)"
"410","0.650872000","163.1.201.45","192.168.1.5","RTMP","1514","Unknown (0x0)|Unknown (0x0)|Unknown (0x0)|Unknown (0x0)|Unknown (0x0)|Unknown (0x0)|Unknown (0x0)"
"412","0.651516000","163.1.201.45","192.168.1.5","TCP","1231","1935 > 55754 [PSH, ACK] Seq=347576 Ack=1 Win=23716 Len=1177"
"413","0.651643000","163.1.201.45","192.168.1.5","RTMP","1514","Unknown (0x0)|Unknown (0x0)|Unknown (0x0)|Unknown (0x0)"
"415","0.651867000","163.1.201.45","192.168.1.5","TCP","1514","1935 > 55754 [ACK] Seq=350213 Ack=1 Win=23716 Len=1460"
"416","0.651900000","163.1.201.45","192.168.1.5","RTMP","1231","Unknown (0x0)|Unknown (0x0)|Unknown (0x0)|Unknown (0x0)|Unknown (0x0)|Unknown (0x0)|Unknown (0x0)"
"418","0.652114000","163.1.201.45","192.168.1.5","RTMP","1514","Unknown (0x0)"
"419","0.652151000","163.1.201.45","192.168.1.5","TCP","1514","1935 > 55754 [ACK] Seq=354310 Ack=1 Win=23716 Len=1460"
"421","0.652248000","163.1.201.45","192.168.1.5","TCP","1231","1935 > 55754 [PSH, ACK] Seq=355770 Ack=1 Win=23716 Len=1177"
"422","0.652367000","163.1.201.45","192.168.1.5","RTMP","1514","Unknown (0x0)|Unknown (0x0)"
"424","0.652465000","163.1.201.45","192.168.1.5","TCP","1514","1935 > 55754 [ACK] Seq=358407 Ack=1 Win=23716 Len=1460"
"425","0.652586000","163.1.201.45","192.168.1.5","RTMP","1514","Unknown (0x0)|Unknown (0x0)|Unknown (0x0)"
"427","0.652685000","163.1.201.45","192.168.1.5","TCP","397","1935 > 55754 [PSH, ACK] Seq=361327 Ack=1 Win=23716 Len=343"
"429","0.656421000","163.1.201.45","192.168.1.5","RTMP","1514","Unknown (0x0)"
"430","0.656570000","163.1.201.45","192.168.1.5","RTMP","1514","Unknown (0x0)|Unknown (0x0)|Unknown (0x0)"
"432","0.656689000","163.1.201.45","192.168.1.5","RTMP","1231","Unknown (0x0)"
"433","0.656828000","163.1.201.45","192.168.1.5","RTMP","1514","Unknown (0x0)"
"435","0.656945000","163.1.201.45","192.168.1.5","RTMP","1514","Unknown (0x0)"
"436","0.657065000","163.1.201.45","192.168.1.5","TCP","1231","1935 > 55754 [PSH, ACK] Seq=368687 Ack=1 Win=23716 Len=1177"
"438","0.657178000","163.1.201.45","192.168.1.5","RTMP","1514","Unknown (0x0)|Unknown (0x0)|Unknown (0x0)|Unknown (0x0)"
"439","0.657314000","163.1.201.45","192.168.1.5","RTMP","1514","Unknown (0x0)"
"441","0.657413000","163.1.201.45","192.168.1.5","RTMP","1231","Unknown (0x0)|Unknown (0x0)"
"442","0.657443000","163.1.201.45","192.168.1.5","RTMP","1514","Unknown (0x0)|Unknown (0x0)"
"444","0.657643000","163.1.201.45","192.168.1.5","RTMP","1514","Unknown (0x0)|Unknown (0x0)|Unknown (0x0)"
"445","0.657675000","163.1.201.45","192.168.1.5","TCP","1231","1935 > 55754 [PSH, ACK] Seq=376881 Ack=1 Win=23716 Len=1177"
"447","0.657772000","163.1.201.45","192.168.1.5","RTMP","1514","Unknown (0x0)|Unknown (0x0)"
"448","0.657891000","163.1.201.45","192.168.1.5","RTMP","1514","Unknown (0x74)|Unknown (0x0)|Unknown (0x0)"
"450","0.657990000","163.1.201.45","192.168.1.5","RTMP","1231","Unknown (0x0)"
"451","0.658127000","163.1.201.45","192.168.1.5","RTMP","1514","Unknown (0x0)|Unknown (0x0)"
"453","0.658228000","163.1.201.45","192.168.1.5","TCP","1514","1935 > 55754 [ACK] Seq=383615 Ack=1 Win=23716 Len=1460"
"454","0.658256000","163.1.201.45","192.168.1.5","RTMP","1231","Unknown (0x0)|Unknown (0x0)|Unknown (0x0)|Unknown (0x0)"
"457","0.706028000","163.1.201.45","192.168.1.5","RTMP","1514","Unknown (0x0)|Unknown (0x0)"
"458","0.706201000","163.1.201.45","192.168.1.5","RTMP","1514","Unknown (0x0)"
"460","0.706375000","163.1.201.45","192.168.1.5","TCP","1231","1935 > 55754 [PSH, ACK] Seq=389172 Ack=1 Win=23716 Len=1177"
"461","0.706551000","163.1.201.45","192.168.1.5","RTMP","1514","Unknown (0x0)|Unknown (0x0)"
"463","0.706670000","163.1.201.45","192.168.1.5","TCP","1514","1935 > 55754 [ACK] Seq=391809 Ack=1 Win=23716 Len=1460"
"464","0.706699000","163.1.201.45","192.168.1.5","TCP","1231","1935 > 55754 [PSH, ACK] Seq=393269 Ack=1 Win=23716 Len=1177"
"466","0.749329000","163.1.201.45","192.168.1.5","RTMP","1514","Unknown (0x0)"
"467","0.749489000","163.1.201.45","192.168.1.5","TCP","1514","1935 > 55754 [ACK] Seq=395906 Ack=1 Win=23716 Len=1460"
"469","0.749641000","163.1.201.45","192.168.1.5","RTMP","1231","Unknown (0x0)|Unknown (0x0)"
"470","0.749779000","163.1.201.45","192.168.1.5","RTMP","1514","Unknown (0x0)|Unknown (0x0)|Unknown (0x0)"
"473","0.757551000","163.1.201.45","192.168.1.5","TCP","1514","1935 > 55754 [ACK] Seq=400003 Ack=1 Win=23716 Len=1460"
"474","0.757745000","163.1.201.45","192.168.1.5","TCP","1514","1935 > 55754 [ACK] Seq=401463 Ack=1 Win=23716 Len=1460"
"476","0.757893000","163.1.201.45","192.168.1.5","TCP","257","1935 > 55754 [PSH, ACK] Seq=402923 Ack=1 Win=23716 Len=203"
"477","0.757927000","163.1.201.45","192.168.1.5","TCP","55","1935 > 55754 [PSH, ACK] Seq=403126 Ack=1 Win=23716 Len=1"
"479","0.758120000","163.1.201.45","192.168.1.5","RTMP","1514","Unknown (0x0)|Unknown (0x0)|Unknown (0x74)"
"480","0.758160000","163.1.201.45","192.168.1.5","RTMP","1514","Unknown (0x0)|Unknown (0x0)"
"482","0.758332000","163.1.201.45","192.168.1.5","RTMP","1230","Unknown (0x0)|Unknown (0x0)"
"483","0.758442000","163.1.201.45","192.168.1.5","RTMP","1514","Unknown (0x0)"
"485","0.758624000","163.1.201.45","192.168.1.5","TCP","1514","1935 > 55754 [ACK] Seq=408683 Ack=1 Win=23716 Len=1460"
"486","0.758724000","163.1.201.45","192.168.1.5","TCP","1231","1935 > 55754 [PSH, ACK] Seq=410143 Ack=1 Win=23716 Len=1177"
"489","0.760875000","163.1.201.45","192.168.1.5","RTMP","1514","Unknown (0x0)|Unknown (0x0)"
"490","0.761007000","163.1.201.45","192.168.1.5","RTMP","1514","Unknown (0x0)|Unknown (0x0)|Unknown (0x0)"
"492","0.763593000","163.1.201.45","192.168.1.5","TCP","1231","1935 > 55754 [PSH, ACK] Seq=414240 Ack=1 Win=23716 Len=1177"
"493","0.763651000","163.1.201.45","192.168.1.5","RTMP","1514","Unknown (0x0)|Unknown (0x0)|Unknown (0x0)|Unknown (0x0)|Unknown (0x0)|Unknown (0x0)|Unknown (0x0)|Unknown (0x0)"
"495","0.763858000","163.1.201.45","192.168.1.5","TCP","1514","1935 > 55754 [ACK] Seq=416877 Ack=1 Win=23716 Len=1460"
"496","0.763891000","163.1.201.45","192.168.1.5","RTMP","1231","Unknown (0x0)"
"498","0.764077000","163.1.201.45","192.168.1.5","RTMP","1514","Unknown (0x0)|Unknown (0x0)|Unknown (0x0)|Unknown (0x0)"
"500","0.771231000","163.1.201.45","192.168.1.5","TCP","1514","1935 > 55754 [ACK] Seq=420974 Ack=1 Win=23716 Len=1460"
"501","0.771386000","163.1.201.45","192.168.1.5","RTMP","1231","Unknown (0x0)|Unknown (0x0)|Unknown (0x0)"
"503","0.771574000","163.1.201.45","192.168.1.5","RTMP","1514","Unknown (0x0)|Unknown (0x0)|Unknown (0x0)"
"504","0.771722000","163.1.201.45","192.168.1.5","RTMP","1514","Unknown (0x0)|Unknown (0x0)|Unknown (0x0)|Unknown (0x0)|Unknown (0x0)"
"506","0.771828000","163.1.201.45","192.168.1.5","RTMP","1231","Unknown (0x0)|Unknown (0x0)"
"507","0.771868000","163.1.201.45","192.168.1.5","RTMP","1514","Unknown (0x0)|Unknown (0x0)|Unknown (0x0)|Unknown (0x0)"
"509","0.772079000","163.1.201.45","192.168.1.5","TCP","1514","1935 > 55754 [ACK] Seq=429168 Ack=1 Win=23716 Len=1460"
"510","0.772112000","163.1.201.45","192.168.1.5","RTMP","1231","Unknown (0x0)|Unknown (0x0)|Unknown (0x0)"
"512","0.772210000","163.1.201.45","192.168.1.5","RTMP","1514","Unknown (0x0)"
"513","0.772347000","163.1.201.45","192.168.1.5","RTMP","1514","Unknown (0x0)"
"515","0.772447000","163.1.201.45","192.168.1.5","RTMP","1231","Unknown (0x0)"
"516","0.772475000","163.1.201.45","192.168.1.5","RTMP","1514","Unknown (0x0)"
"518","0.772674000","163.1.201.45","192.168.1.5","RTMP","1514","Unknown (0x0)|Unknown (0x0)|Unknown (0x0)|Unknown (0x0)"
"519","0.772705000","163.1.201.45","192.168.1.5","RTMP","1231","Unknown (0x0)|Unknown (0x0)|Unknown (0x0)"
"521","0.772800000","163.1.201.45","192.168.1.5","RTMP","1514","Unknown (0x0)|Unknown (0x0)|Unknown (0x0)"
"522","0.772927000","163.1.201.45","192.168.1.5","RTMP","1514","Unknown (0x0)"
"524","0.773027000","163.1.201.45","192.168.1.5","RTMP","1514","Unknown (0x0)"
"525","0.773054000","163.1.201.45","192.168.1.5","TCP","491","1935 > 55754 [PSH, ACK] Seq=444379 Ack=1 Win=23716 Len=437"
"527","0.773260000","163.1.201.45","192.168.1.5","RTMP","1514","Unknown (0x0)|Unknown (0x0)|Unknown (0x0)|Unknown (0x0)|Unknown (0x0)|Unknown (0x0)|Unknown (0x0)|Unknown (0x0)|Unknown (0x0)"
"528","0.773292000","163.1.201.45","192.168.1.5","TCP","1514","1935 > 55754 [ACK] Seq=446276 Ack=1 Win=23716 Len=1460"
"530","0.773397000","163.1.201.45","192.168.1.5","RTMP","1231","Unknown (0x0)"
"531","0.773426000","163.1.201.45","192.168.1.5","RTMP","1514","Unknown (0x0)|Unknown (0x0)|Unknown (0x0)|Unknown (0x0)|Unknown (0x74)|Unknown (0x0)|Unknown (0x0)"
"533","0.773611000","163.1.201.45","192.168.1.5","RTMP","1514","Unknown (0x0)|Unknown (0x0)"
"534","0.773641000","163.1.201.45","192.168.1.5","TCP","1231","1935 > 55754 [PSH, ACK] Seq=451833 Ack=1 Win=23716 Len=1177"
"538","0.822536000","163.1.201.45","192.168.1.5","RTMP","1514","Unknown (0x0)"
"539","0.822658000","163.1.201.45","192.168.1.5","TCP","1514","1935 > 55754 [ACK] Seq=454470 Ack=1 Win=23716 Len=1460"
"541","0.822868000","163.1.201.45","192.168.1.5","TCP","1231","1935 > 55754 [PSH, ACK] Seq=455930 Ack=1 Win=23716 Len=1177"
"542","0.822912000","163.1.201.45","192.168.1.5","RTMP","1514","Unknown (0x0)|Unknown (0x0)"
"544","0.823121000","163.1.201.45","192.168.1.5","TCP","1514","1935 > 55754 [ACK] Seq=458567 Ack=1 Win=23716 Len=1460"
"545","0.823148000","163.1.201.45","192.168.1.5","TCP","1231","1935 > 55754 [PSH, ACK] Seq=460027 Ack=1 Win=23716 Len=1177"
"548","0.859656000","163.1.201.45","192.168.1.5","RTMP","1514","Unknown (0x0)"
"549","0.859786000","163.1.201.45","192.168.1.5","RTMP","1514","Unknown (0x0)"
"551","0.859893000","163.1.201.45","192.168.1.5","RTMP","1231","Unknown (0x0)"
"552","0.865245000","163.1.201.45","192.168.1.5","RTMP","1514","Unknown (0x0)"
"554","0.865439000","163.1.201.45","192.168.1.5","TCP","1514","1935 > 55754 [ACK] Seq=466761 Ack=1 Win=23716 Len=1460"
"555","0.865477000","163.1.201.45","192.168.1.5","TCP","1231","1935 > 55754 [PSH, ACK] Seq=468221 Ack=1 Win=23716 Len=1177"
"557","0.865693000","163.1.201.45","192.168.1.5","RTMP","1514","Unknown (0x0)|Unknown (0x0)|Unknown (0x0)|Unknown (0x0)"
"558","0.865728000","163.1.201.45","192.168.1.5","RTMP","1514","Unknown (0x0)"
"560","0.865799000","163.1.201.45","192.168.1.5","RTMP","1231","Unknown (0x0)|Unknown (0x0)"
"561","0.871309000","163.1.201.45","192.168.1.5","RTMP","1514","Unknown (0x0)|Unknown (0x0)"
"563","0.871495000","163.1.201.45","192.168.1.5","TCP","1514","1935 > 55754 [ACK] Seq=474955 Ack=1 Win=23716 Len=1460"
"564","0.871522000","163.1.201.45","192.168.1.5","RTMP","1231","Unknown (0x0)"
"566","0.871710000","163.1.201.45","192.168.1.5","RTMP","1514","Unknown (0x0)"
"567","0.871743000","163.1.201.45","192.168.1.5","TCP","1514","1935 > 55754 [ACK] Seq=479052 Ack=1 Win=23716 Len=1460"
"569","0.871813000","163.1.201.45","192.168.1.5","TCP","1231","1935 > 55754 [PSH, ACK] Seq=480512 Ack=1 Win=23716 Len=1177"
"570","0.871917000","163.1.201.45","192.168.1.5","RTMP","1514","Unknown (0x0)"
"572","0.871996000","163.1.201.45","192.168.1.5","RTMP","1514","Unknown (0x0)|Unknown (0x0)|Unknown (0x0)"
"573","0.872088000","163.1.201.45","192.168.1.5","RTMP","1514","Unknown (0x0)"
"575","0.872160000","163.1.201.45","192.168.1.5","RTMP","423","Unknown (0x0)"
"577","0.893133000","163.1.201.45","192.168.1.5","RTMP","1514","Unknown (0x0)"
"578","0.893284000","163.1.201.45","192.168.1.5","TCP","1514","1935 > 55754 [ACK] Seq=487898 Ack=1 Win=23716 Len=1460"
"580","0.893462000","163.1.201.45","192.168.1.5","TCP","1231","1935 > 55754 [PSH, ACK] Seq=489358 Ack=1 Win=23716 Len=1177"
"581","0.893634000","163.1.201.45","192.168.1.5","RTMP","1514","Unknown (0x0)|Unknown (0x0)|Unknown (0x0)"
"583","0.893755000","163.1.201.45","192.168.1.5","RTMP","1514","Unknown (0x0)|Unknown (0x0)"
"584","0.893787000","163.1.201.45","192.168.1.5","TCP","1231","1935 > 55754 [PSH, ACK] Seq=493455 Ack=1 Win=23716 Len=1177"
"586","0.894023000","163.1.201.45","192.168.1.5","RTMP","1514","Unknown (0x0)|Unknown (0x0)|Unknown (0x0)|Unknown (0x0)|Unknown (0x0)"
"587","0.894063000","163.1.201.45","192.168.1.5","TCP","1514","1935 > 55754 [ACK] Seq=496092 Ack=1 Win=23716 Len=1460"
"589","0.894162000","163.1.201.45","192.168.1.5","TCP","1231","1935 > 55754 [PSH, ACK] Seq=497552 Ack=1 Win=23716 Len=1177"
"590","0.894192000","163.1.201.45","192.168.1.5","RTMP","1514","Unknown (0x0)"
"592","0.894377000","163.1.201.45","192.168.1.5","TCP","1514","1935 > 55754 [ACK] Seq=500189 Ack=1 Win=23716 Len=1460"
"593","0.894410000","163.1.201.45","192.168.1.5","TCP","1231","1935 > 55754 [PSH, ACK] Seq=501649 Ack=1 Win=23716 Len=1177"
