"No.","Time","Source","Destination","Protocol","Length","Info"
"1","0.000000000","217.166.60.247","192.168.1.5","TCP","493","80 > 59102 [ACK] Seq=1 Ack=1 Win=2920 Len=439"
"2","0.000036000","217.166.60.247","192.168.1.5","TCP","121","80 > 59102 [ACK] Seq=440 Ack=1 Win=2920 Len=67"
"4","0.000162000","217.166.60.247","192.168.1.5","TCP","1078","80 > 59102 [PSH, ACK] Seq=507 Ack=1 Win=2920 Len=1024"
"5","0.000895000","217.166.60.247","192.168.1.5","TCP","1078","80 > 59102 [PSH, ACK] Seq=1531 Ack=1 Win=2920 Len=1024"
"7","0.000970000","217.166.60.247","192.168.1.5","TCP","1078","80 > 59102 [PSH, ACK] Seq=2555 Ack=1 Win=2920 Len=1024"
"8","0.001043000","217.166.60.247","192.168.1.5","TCP","1078","80 > 59102 [PSH, ACK] Seq=3579 Ack=1 Win=2920 Len=1024"
"10","0.009177000","217.166.60.247","192.168.1.5","TCP","1078","80 > 59102 [PSH, ACK] Seq=4603 Ack=1 Win=2920 Len=1024"
"11","0.009545000","217.166.60.247","192.168.1.5","TCP","1078","80 > 59102 [PSH, ACK] Seq=5627 Ack=1 Win=2920 Len=1024"
"13","0.019045000","217.166.60.247","192.168.1.5","TCP","1078","80 > 59102 [PSH, ACK] Seq=6651 Ack=1 Win=2920 Len=1024"
"14","0.020788000","217.166.60.247","192.168.1.5","TCP","1078","80 > 59102 [PSH, ACK] Seq=7675 Ack=1 Win=2920 Len=1024"
"16","0.023248000","217.166.60.247","192.168.1.5","TCP","1078","80 > 59102 [PSH, ACK] Seq=8699 Ack=1 Win=2920 Len=1024"
"17","0.024563000","217.166.60.247","192.168.1.5","TCP","1078","80 > 59102 [PSH, ACK] Seq=9723 Ack=1 Win=2920 Len=1024"
"19","0.028192000","217.166.60.247","192.168.1.5","TCP","1078","80 > 59102 [PSH, ACK] Seq=10747 Ack=1 Win=2920 Len=1024"
"20","0.029445000","217.166.60.247","192.168.1.5","TCP","1078","80 > 59102 [PSH, ACK] Seq=11771 Ack=1 Win=2920 Len=1024"
"22","0.031038000","217.166.60.247","192.168.1.5","TCP","1078","80 > 59102 [PSH, ACK] Seq=12795 Ack=1 Win=2920 Len=1024"
"23","0.120125000","217.166.60.247","192.168.1.5","TCP","447","80 > 59102 [ACK] Seq=13819 Ack=1 Win=2920 Len=393"
"25","0.120694000","217.166.60.247","192.168.1.5","TCP","121","80 > 59102 [ACK] Seq=14212 Ack=1 Win=2920 Len=67"
"26","0.125536000","217.166.60.247","192.168.1.5","TCP","1078","80 > 59102 [PSH, ACK] Seq=14279 Ack=1 Win=2920 Len=1024"
"28","0.128088000","217.166.60.247","192.168.1.5","TCP","1078","80 > 59102 [PSH, ACK] Seq=15303 Ack=1 Win=2920 Len=1024"
"29","0.128414000","217.166.60.247","192.168.1.5","TCP","1078","80 > 59102 [PSH, ACK] Seq=16327 Ack=1 Win=2920 Len=1024"
"31","0.128667000","217.166.60.247","192.168.1.5","TCP","1078","80 > 59102 [PSH, ACK] Seq=17351 Ack=1 Win=2920 Len=1024"
"32","0.129395000","217.166.60.247","192.168.1.5","TCP","1078","80 > 59102 [PSH, ACK] Seq=18375 Ack=1 Win=2920 Len=1024"
"34","0.130319000","217.166.60.247","192.168.1.5","TCP","1078","80 > 59102 [PSH, ACK] Seq=19399 Ack=1 Win=2920 Len=1024"
"35","0.131678000","217.166.60.247","192.168.1.5","TCP","1078","80 > 59102 [PSH, ACK] Seq=20423 Ack=1 Win=2920 Len=1024"
"37","0.134268000","217.166.60.247","192.168.1.5","TCP","1078","80 > 59102 [PSH, ACK] Seq=21447 Ack=1 Win=2920 Len=1024"
"38","0.135922000","217.166.60.247","192.168.1.5","TCP","1078","80 > 59102 [PSH, ACK] Seq=22471 Ack=1 Win=2920 Len=1024"
"40","0.140951000","217.166.60.247","192.168.1.5","TCP","1078","80 > 59102 [PSH, ACK] Seq=23495 Ack=1 Win=2920 Len=1024"
"41","0.141208000","217.166.60.247","192.168.1.5","TCP","1078","80 > 59102 [PSH, ACK] Seq=24519 Ack=1 Win=2920 Len=1024"
"43","0.144662000","217.166.60.247","192.168.1.5","TCP","1078","80 > 59102 [PSH, ACK] Seq=25543 Ack=1 Win=2920 Len=1024"
"44","0.150476000","217.166.60.247","192.168.1.5","TCP","1078","80 > 59102 [PSH, ACK] Seq=26567 Ack=1 Win=2920 Len=1024"
"46","0.230434000","217.166.60.247","192.168.1.5","TCP","541","80 > 59102 [ACK] Seq=27591 Ack=1 Win=2920 Len=487"
"47","0.231947000","217.166.60.247","192.168.1.5","TCP","1078","80 > 59102 [PSH, ACK] Seq=28078 Ack=1 Win=2920 Len=1024"
"49","0.234287000","217.166.60.247","192.168.1.5","TCP","1078","80 > 59102 [PSH, ACK] Seq=29102 Ack=1 Win=2920 Len=1024"
"50","0.235908000","217.166.60.247","192.168.1.5","TCP","1078","80 > 59102 [PSH, ACK] Seq=30126 Ack=1 Win=2920 Len=1024"
"52","0.238550000","217.166.60.247","192.168.1.5","TCP","1078","80 > 59102 [PSH, ACK] Seq=31150 Ack=1 Win=2920 Len=1024"
"53","0.239973000","217.166.60.247","192.168.1.5","TCP","1078","80 > 59102 [PSH, ACK] Seq=32174 Ack=1 Win=2920 Len=1024"
"55","0.242854000","217.166.60.247","192.168.1.5","TCP","1078","80 > 59102 [PSH, ACK] Seq=33198 Ack=1 Win=2920 Len=1024"
"56","0.243842000","217.166.60.247","192.168.1.5","TCP","1078","80 > 59102 [PSH, ACK] Seq=34222 Ack=1 Win=2920 Len=1024"
"58","0.244539000","217.166.60.247","192.168.1.5","TCP","1078","80 > 59102 [PSH, ACK] Seq=35246 Ack=1 Win=2920 Len=1024"
"59","0.251229000","217.166.60.247","192.168.1.5","TCP","1078","80 > 59102 [PSH, ACK] Seq=36270 Ack=1 Win=2920 Len=1024"
"61","0.254271000","217.166.60.247","192.168.1.5","TCP","1078","80 > 59102 [PSH, ACK] Seq=37294 Ack=1 Win=2920 Len=1024"
"62","0.256845000","217.166.60.247","192.168.1.5","TCP","1078","80 > 59102 [PSH, ACK] Seq=38318 Ack=1 Win=2920 Len=1024"
"64","0.259446000","217.166.60.247","192.168.1.5","TCP","1078","80 > 59102 [PSH, ACK] Seq=39342 Ack=1 Win=2920 Len=1024"
"65","0.260313000","217.166.60.247","192.168.1.5","TCP","1078","80 > 59102 [PSH, ACK] Seq=40366 Ack=1 Win=2920 Len=1024"
"67","0.353549000","217.166.60.247","192.168.1.5","TCP","455","80 > 59102 [ACK] Seq=41390 Ack=1 Win=2920 Len=401"
"68","0.354702000","217.166.60.247","192.168.1.5","TCP","121","80 > 59102 [ACK] Seq=41791 Ack=1 Win=2920 Len=67"
"70","0.355955000","217.166.60.247","192.168.1.5","TCP","1078","80 > 59102 [PSH, ACK] Seq=41858 Ack=1 Win=2920 Len=1024"
"71","0.356242000","217.166.60.247","192.168.1.5","TCP","1078","80 > 59102 [PSH, ACK] Seq=42882 Ack=1 Win=2920 Len=1024"
"73","0.358199000","217.166.60.247","192.168.1.5","TCP","1078","80 > 59102 [PSH, ACK] Seq=43906 Ack=1 Win=2920 Len=1024"
"74","0.361942000","217.166.60.247","192.168.1.5","TCP","1078","80 > 59102 [PSH, ACK] Seq=44930 Ack=1 Win=2920 Len=1024"
"76","0.362199000","217.166.60.247","192.168.1.5","TCP","1078","80 > 59102 [PSH, ACK] Seq=45954 Ack=1 Win=2920 Len=1024"
"77","0.363839000","217.166.60.247","192.168.1.5","TCP","1078","80 > 59102 [PSH, ACK] Seq=46978 Ack=1 Win=2920 Len=1024"
"79","0.365263000","217.166.60.247","192.168.1.5","TCP","1078","80 > 59102 [PSH, ACK] Seq=48002 Ack=1 Win=2920 Len=1024"
"80","0.366344000","217.166.60.247","192.168.1.5","TCP","1078","80 > 59102 [PSH, ACK] Seq=49026 Ack=1 Win=2920 Len=1024"
"82","0.367503000","217.166.60.247","192.168.1.5","TCP","1078","80 > 59102 [PSH, ACK] Seq=50050 Ack=1 Win=2920 Len=1024"
"83","0.368883000","217.166.60.247","192.168.1.5","TCP","1078","80 > 59102 [PSH, ACK] Seq=51074 Ack=1 Win=2920 Len=1024"
"85","0.371023000","217.166.60.247","192.168.1.5","TCP","1078","80 > 59102 [PSH, ACK] Seq=52098 Ack=1 Win=2920 Len=1024"
"86","0.371784000","217.166.60.247","192.168.1.5","TCP","1078","80 > 59102 [PSH, ACK] Seq=53122 Ack=1 Win=2920 Len=1024"
"88","0.374976000","217.166.60.247","192.168.1.5","TCP","1078","80 > 59102 [PSH, ACK] Seq=54146 Ack=1 Win=2920 Len=1024"
"89","0.471924000","217.166.60.247","192.168.1.5","TCP","512","80 > 59102 [ACK] Seq=55170 Ack=1 Win=2920 Len=458"
"91","0.473397000","217.166.60.247","192.168.1.5","TCP","121","80 > 59102 [ACK] Seq=55628 Ack=1 Win=2920 Len=67"
"92","0.474291000","217.166.60.247","192.168.1.5","TCP","1078","80 > 59102 [PSH, ACK] Seq=55695 Ack=1 Win=2920 Len=1024"
"94","0.477606000","217.166.60.247","192.168.1.5","TCP","1078","80 > 59102 [PSH, ACK] Seq=56719 Ack=1 Win=2920 Len=1024"
"95","0.486003000","217.166.60.247","192.168.1.5","TCP","1078","80 > 59102 [PSH, ACK] Seq=57743 Ack=1 Win=2920 Len=1024"
"97","0.487688000","217.166.60.247","192.168.1.5","TCP","1078","80 > 59102 [PSH, ACK] Seq=58767 Ack=1 Win=2920 Len=1024"
"98","0.488835000","217.166.60.247","192.168.1.5","TCP","1078","80 > 59102 [PSH, ACK] Seq=59791 Ack=1 Win=2920 Len=1024"
"100","0.489540000","217.166.60.247","192.168.1.5","TCP","1078","80 > 59102 [PSH, ACK] Seq=60815 Ack=1 Win=2920 Len=1024"
"101","0.491013000","217.166.60.247","192.168.1.5","TCP","1078","80 > 59102 [PSH, ACK] Seq=61839 Ack=1 Win=2920 Len=1024"
"103","0.495011000","217.166.60.247","192.168.1.5","TCP","1078","80 > 59102 [PSH, ACK] Seq=62863 Ack=1 Win=2920 Len=1024"
"104","0.495935000","217.166.60.247","192.168.1.5","TCP","1078","80 > 59102 [PSH, ACK] Seq=63887 Ack=1 Win=2920 Len=1024"
"106","0.496420000","217.166.60.247","192.168.1.5","TCP","1078","80 > 59102 [PSH, ACK] Seq=64911 Ack=1 Win=2920 Len=1024"
"107","0.497893000","217.166.60.247","192.168.1.5","TCP","1078","80 > 59102 [PSH, ACK] Seq=65935 Ack=1 Win=2920 Len=1024"
"109","0.498545000","217.166.60.247","192.168.1.5","TCP","1078","80 > 59102 [PSH, ACK] Seq=66959 Ack=1 Win=2920 Len=1024"
"110","0.500222000","217.166.60.247","192.168.1.5","TCP","1078","80 > 59102 [PSH, ACK] Seq=67983 Ack=1 Win=2920 Len=1024"
"112","0.584935000","217.166.60.247","192.168.1.5","TCP","548","80 > 59102 [ACK] Seq=69007 Ack=1 Win=2920 Len=494"
"113","0.585063000","217.166.60.247","192.168.1.5","TCP","121","80 > 59102 [ACK] Seq=69501 Ack=1 Win=2920 Len=67"
"119","0.586581000","217.166.60.247","192.168.1.5","TCP","1078","80 > 59102 [PSH, ACK] Seq=69568 Ack=1 Win=2920 Len=1024"
"120","0.588124000","217.166.60.247","192.168.1.5","TCP","1078","80 > 59102 [PSH, ACK] Seq=70592 Ack=1 Win=2920 Len=1024"
"122","0.590388000","217.166.60.247","192.168.1.5","TCP","1078","80 > 59102 [PSH, ACK] Seq=71616 Ack=1 Win=2920 Len=1024"
"123","0.591867000","217.166.60.247","192.168.1.5","TCP","1078","80 > 59102 [PSH, ACK] Seq=72640 Ack=1 Win=2920 Len=1024"
"131","0.596787000","217.166.60.247","192.168.1.5","TCP","1078","80 > 59102 [PSH, ACK] Seq=73664 Ack=1 Win=2920 Len=1024"
"132","0.597936000","217.166.60.247","192.168.1.5","TCP","1078","80 > 59102 [PSH, ACK] Seq=74688 Ack=1 Win=2920 Len=1024"
"134","0.598625000","217.166.60.247","192.168.1.5","TCP","1078","80 > 59102 [PSH, ACK] Seq=75712 Ack=1 Win=2920 Len=1024"
"136","0.600045000","217.166.60.247","192.168.1.5","TCP","1078","80 > 59102 [PSH, ACK] Seq=76736 Ack=1 Win=2920 Len=1024"
"141","0.603158000","217.166.60.247","192.168.1.5","TCP","1078","80 > 59102 [PSH, ACK] Seq=77760 Ack=1 Win=2920 Len=1024"
"144","0.605318000","217.166.60.247","192.168.1.5","TCP","1078","80 > 59102 [PSH, ACK] Seq=78784 Ack=1 Win=2920 Len=1024"
"147","0.606734000","217.166.60.247","192.168.1.5","TCP","1078","80 > 59102 [PSH, ACK] Seq=79808 Ack=1 Win=2920 Len=1024"
"149","0.608977000","217.166.60.247","192.168.1.5","TCP","1078","80 > 59102 [PSH, ACK] Seq=80832 Ack=1 Win=2920 Len=1024"
"151","0.609584000","217.166.60.247","192.168.1.5","TCP","1078","80 > 59102 [PSH, ACK] Seq=81856 Ack=1 Win=2920 Len=1024"
"162","0.690144000","217.166.60.247","192.168.1.5","TCP","443","80 > 59102 [ACK] Seq=82880 Ack=1 Win=2920 Len=389"
"164","0.690802000","217.166.60.247","192.168.1.5","TCP","121","80 > 59102 [ACK] Seq=83269 Ack=1 Win=2920 Len=67"
"171","0.694323000","217.166.60.247","192.168.1.5","TCP","1078","80 > 59102 [PSH, ACK] Seq=83336 Ack=1 Win=2920 Len=1024"
"173","0.696465000","217.166.60.247","192.168.1.5","TCP","1078","80 > 59102 [PSH, ACK] Seq=84360 Ack=1 Win=2920 Len=1024"
"175","0.700662000","217.166.60.247","192.168.1.5","TCP","1078","80 > 59102 [PSH, ACK] Seq=85384 Ack=1 Win=2920 Len=1024"
"178","0.703406000","217.166.60.247","192.168.1.5","TCP","1078","80 > 59102 [PSH, ACK] Seq=86408 Ack=1 Win=2920 Len=1024"
"179","0.703522000","217.166.60.247","192.168.1.5","TCP","1078","80 > 59102 [PSH, ACK] Seq=87432 Ack=1 Win=2920 Len=1024"
"181","0.709809000","217.166.60.247","192.168.1.5","TCP","1078","80 > 59102 [PSH, ACK] Seq=88456 Ack=1 Win=2920 Len=1024"
"182","0.710176000","217.166.60.247","192.168.1.5","TCP","1078","80 > 59102 [PSH, ACK] Seq=89480 Ack=1 Win=2920 Len=1024"
"185","0.710430000","217.166.60.247","192.168.1.5","TCP","1078","80 > 59102 [PSH, ACK] Seq=90504 Ack=1 Win=2920 Len=1024"
"186","0.710541000","217.166.60.247","192.168.1.5","TCP","1078","80 > 59102 [PSH, ACK] Seq=91528 Ack=1 Win=2920 Len=1024"
"188","0.717204000","217.166.60.247","192.168.1.5","TCP","1078","80 > 59102 [PSH, ACK] Seq=92552 Ack=1 Win=2920 Len=1024"
"189","0.719299000","217.166.60.247","192.168.1.5","TCP","1078","80 > 59102 [PSH, ACK] Seq=93576 Ack=1 Win=2920 Len=1024"
"191","0.720544000","217.166.60.247","192.168.1.5","TCP","1078","80 > 59102 [PSH, ACK] Seq=94600 Ack=1 Win=2920 Len=1024"
"192","0.723079000","217.166.60.247","192.168.1.5","TCP","1078","80 > 59102 [PSH, ACK] Seq=95624 Ack=1 Win=2920 Len=1024"
"194","0.797411000","217.166.60.247","192.168.1.5","TCP","489","80 > 59102 [ACK] Seq=96648 Ack=1 Win=2920 Len=435"
"195","0.798278000","217.166.60.247","192.168.1.5","TCP","121","80 > 59102 [ACK] Seq=97083 Ack=1 Win=2920 Len=67"
"197","0.799388000","217.166.60.247","192.168.1.5","TCP","1078","80 > 59102 [PSH, ACK] Seq=97150 Ack=1 Win=2920 Len=1024"
"198","0.802337000","217.166.60.247","192.168.1.5","TCP","1078","80 > 59102 [PSH, ACK] Seq=98174 Ack=1 Win=2920 Len=1024"
"200","0.810235000","217.166.60.247","192.168.1.5","TCP","1078","80 > 59102 [PSH, ACK] Seq=99198 Ack=1 Win=2920 Len=1024"
"201","0.818048000","217.166.60.247","192.168.1.5","TCP","1078","80 > 59102 [PSH, ACK] Seq=100222 Ack=1 Win=2920 Len=1024"
"203","0.820642000","217.166.60.247","192.168.1.5","TCP","1078","80 > 59102 [PSH, ACK] Seq=101246 Ack=1 Win=2920 Len=1024"
"204","0.821823000","217.166.60.247","192.168.1.5","TCP","1078","80 > 59102 [PSH, ACK] Seq=102270 Ack=1 Win=2920 Len=1024"
"206","0.825343000","217.166.60.247","192.168.1.5","TCP","1078","80 > 59102 [PSH, ACK] Seq=103294 Ack=1 Win=2920 Len=1024"
"207","0.825636000","217.166.60.247","192.168.1.5","TCP","1078","80 > 59102 [PSH, ACK] Seq=104318 Ack=1 Win=2920 Len=1024"
"209","0.828809000","217.166.60.247","192.168.1.5","TCP","1078","80 > 59102 [PSH, ACK] Seq=105342 Ack=1 Win=2920 Len=1024"
"210","0.831231000","217.166.60.247","192.168.1.5","TCP","1078","80 > 59102 [PSH, ACK] Seq=106366 Ack=1 Win=2920 Len=1024"
"212","0.831474000","217.166.60.247","192.168.1.5","TCP","1078","80 > 59102 [PSH, ACK] Seq=107390 Ack=1 Win=2920 Len=1024"
"213","0.833567000","217.166.60.247","192.168.1.5","TCP","1078","80 > 59102 [PSH, ACK] Seq=108414 Ack=1 Win=2920 Len=1024"
"215","0.834320000","217.166.60.247","192.168.1.5","TCP","1078","80 > 59102 [PSH, ACK] Seq=109438 Ack=1 Win=2920 Len=1024"
"216","0.904429000","217.166.60.247","192.168.1.5","TCP","485","80 > 59102 [ACK] Seq=110462 Ack=1 Win=2920 Len=431"
"218","0.905945000","217.166.60.247","192.168.1.5","TCP","1078","80 > 59102 [PSH, ACK] Seq=110893 Ack=1 Win=2920 Len=1024"
"219","0.908913000","217.166.60.247","192.168.1.5","TCP","1078","80 > 59102 [PSH, ACK] Seq=111917 Ack=1 Win=2920 Len=1024"
"221","0.914092000","217.166.60.247","192.168.1.5","TCP","1078","80 > 59102 [PSH, ACK] Seq=112941 Ack=1 Win=2920 Len=1024"
"222","0.927003000","217.166.60.247","192.168.1.5","TCP","1078","80 > 59102 [PSH, ACK] Seq=113965 Ack=1 Win=2920 Len=1024"
"224","0.929522000","217.166.60.247","192.168.1.5","TCP","1078","80 > 59102 [PSH, ACK] Seq=114989 Ack=1 Win=2920 Len=1024"
"225","0.930960000","217.166.60.247","192.168.1.5","TCP","1078","80 > 59102 [PSH, ACK] Seq=116013 Ack=1 Win=2920 Len=1024"
"227","0.936198000","217.166.60.247","192.168.1.5","TCP","1078","80 > 59102 [PSH, ACK] Seq=117037 Ack=1 Win=2920 Len=1024"
"228","0.937811000","217.166.60.247","192.168.1.5","TCP","1078","80 > 59102 [PSH, ACK] Seq=118061 Ack=1 Win=2920 Len=1024"
"230","0.942478000","217.166.60.247","192.168.1.5","TCP","1078","80 > 59102 [PSH, ACK] Seq=119085 Ack=1 Win=2920 Len=1024"
"231","0.942707000","217.166.60.247","192.168.1.5","TCP","1078","80 > 59102 [PSH, ACK] Seq=120109 Ack=1 Win=2920 Len=1024"
"233","0.943655000","217.166.60.247","192.168.1.5","TCP","1078","80 > 59102 [PSH, ACK] Seq=121133 Ack=1 Win=2920 Len=1024"
"234","0.946091000","217.166.60.247","192.168.1.5","TCP","1078","80 > 59102 [PSH, ACK] Seq=122157 Ack=1 Win=2920 Len=1024"
"236","0.946163000","217.166.60.247","192.168.1.5","TCP","1078","80 > 59102 [PSH, ACK] Seq=123181 Ack=1 Win=2920 Len=1024"
"237","1.008701000","217.166.60.247","192.168.1.5","TCP","437","80 > 59102 [ACK] Seq=124205 Ack=1 Win=2920 Len=383"
"239","1.009599000","217.166.60.247","192.168.1.5","TCP","121","80 > 59102 [ACK] Seq=124588 Ack=1 Win=2920 Len=67"
"240","1.011046000","217.166.60.247","192.168.1.5","TCP","1078","80 > 59102 [PSH, ACK] Seq=124655 Ack=1 Win=2920 Len=1024"
"242","1.018842000","217.166.60.247","192.168.1.5","TCP","1078","80 > 59102 [PSH, ACK] Seq=125679 Ack=1 Win=2920 Len=1024"
"243","1.020097000","217.166.60.247","192.168.1.5","TCP","1078","80 > 59102 [PSH, ACK] Seq=126703 Ack=1 Win=2920 Len=1024"
"245","1.030998000","217.166.60.247","192.168.1.5","TCP","1078","80 > 59102 [PSH, ACK] Seq=127727 Ack=1 Win=2920 Len=1024"
"246","1.037299000","217.166.60.247","192.168.1.5","TCP","1078","80 > 59102 [PSH, ACK] Seq=128751 Ack=1 Win=2920 Len=1024"
"248","1.040691000","217.166.60.247","192.168.1.5","TCP","1078","80 > 59102 [PSH, ACK] Seq=129775 Ack=1 Win=2920 Len=1024"
"249","1.042799000","217.166.60.247","192.168.1.5","TCP","1078","80 > 59102 [PSH, ACK] Seq=130799 Ack=1 Win=2920 Len=1024"
"251","1.043777000","217.166.60.247","192.168.1.5","TCP","1078","80 > 59102 [PSH, ACK] Seq=131823 Ack=1 Win=2920 Len=1024"
"252","1.045335000","217.166.60.247","192.168.1.5","TCP","1078","80 > 59102 [PSH, ACK] Seq=132847 Ack=1 Win=2920 Len=1024"
"254","1.053626000","217.166.60.247","192.168.1.5","TCP","1078","80 > 59102 [PSH, ACK] Seq=133871 Ack=1 Win=2920 Len=1024"
"255","1.054317000","217.166.60.247","192.168.1.5","TCP","1078","80 > 59102 [PSH, ACK] Seq=134895 Ack=1 Win=2920 Len=1024"
"257","1.059223000","217.166.60.247","192.168.1.5","TCP","1078","80 > 59102 [PSH, ACK] Seq=135919 Ack=1 Win=2920 Len=1024"
"258","1.059621000","217.166.60.247","192.168.1.5","TCP","1078","80 > 59102 [PSH, ACK] Seq=136943 Ack=1 Win=2920 Len=1024"
"260","1.119874000","217.166.60.247","192.168.1.5","TCP","517","80 > 59102 [ACK] Seq=137967 Ack=1 Win=2920 Len=463"
"261","1.120495000","217.166.60.247","192.168.1.5","TCP","121","80 > 59102 [ACK] Seq=138430 Ack=1 Win=2920 Len=67"
"263","1.121930000","217.166.60.247","192.168.1.5","TCP","1078","80 > 59102 [PSH, ACK] Seq=138497 Ack=1 Win=2920 Len=1024"
"264","1.123377000","217.166.60.247","192.168.1.5","TCP","1078","80 > 59102 [PSH, ACK] Seq=139521 Ack=1 Win=2920 Len=1024"
"266","1.124535000","217.166.60.247","192.168.1.5","TCP","1078","80 > 59102 [PSH, ACK] Seq=140545 Ack=1 Win=2920 Len=1024"
"267","1.129047000","217.166.60.247","192.168.1.5","TCP","1078","80 > 59102 [PSH, ACK] Seq=141569 Ack=1 Win=2920 Len=1024"
"269","1.145314000","217.166.60.247","192.168.1.5","TCP","1078","80 > 59102 [PSH, ACK] Seq=142593 Ack=1 Win=2920 Len=1024"
"270","1.146343000","217.166.60.247","192.168.1.5","TCP","1078","80 > 59102 [PSH, ACK] Seq=143617 Ack=1 Win=2920 Len=1024"
"272","1.154448000","217.166.60.247","192.168.1.5","TCP","1078","80 > 59102 [PSH, ACK] Seq=144641 Ack=1 Win=2920 Len=1024"
"273","1.155239000","217.166.60.247","192.168.1.5","TCP","1078","80 > 59102 [PSH, ACK] Seq=145665 Ack=1 Win=2920 Len=1024"
"275","1.155691000","217.166.60.247","192.168.1.5","TCP","1078","80 > 59102 [PSH, ACK] Seq=146689 Ack=1 Win=2920 Len=1024"
"276","1.159001000","217.166.60.247","192.168.1.5","TCP","1078","80 > 59102 [PSH, ACK] Seq=147713 Ack=1 Win=2920 Len=1024"
"278","1.161676000","217.166.60.247","192.168.1.5","TCP","1078","80 > 59102 [PSH, ACK] Seq=148737 Ack=1 Win=2920 Len=1024"
"279","1.165437000","217.166.60.247","192.168.1.5","TCP","1078","80 > 59102 [PSH, ACK] Seq=149761 Ack=1 Win=2920 Len=1024"
"281","1.165718000","217.166.60.247","192.168.1.5","TCP","1078","80 > 59102 [PSH, ACK] Seq=150785 Ack=1 Win=2920 Len=1024"
"282","1.230619000","217.166.60.247","192.168.1.5","TCP","463","80 > 59102 [ACK] Seq=151809 Ack=1 Win=2920 Len=409"
"284","1.231387000","217.166.60.247","192.168.1.5","TCP","121","80 > 59102 [ACK] Seq=152218 Ack=1 Win=2920 Len=67"
"285","1.234319000","217.166.60.247","192.168.1.5","TCP","1078","80 > 59102 [PSH, ACK] Seq=152285 Ack=1 Win=2920 Len=1024"
"287","1.235484000","217.166.60.247","192.168.1.5","TCP","1078","80 > 59102 [PSH, ACK] Seq=153309 Ack=1 Win=2920 Len=1024"
"288","1.238158000","217.166.60.247","192.168.1.5","TCP","1078","80 > 59102 [PSH, ACK] Seq=154333 Ack=1 Win=2920 Len=1024"
"290","1.238424000","217.166.60.247","192.168.1.5","TCP","1078","80 > 59102 [PSH, ACK] Seq=155357 Ack=1 Win=2920 Len=1024"
"291","1.239061000","217.166.60.247","192.168.1.5","TCP","1078","80 > 59102 [PSH, ACK] Seq=156381 Ack=1 Win=2920 Len=1024"
"293","1.254604000","217.166.60.247","192.168.1.5","TCP","1078","80 > 59102 [PSH, ACK] Seq=157405 Ack=1 Win=2920 Len=1024"
"294","1.254967000","217.166.60.247","192.168.1.5","TCP","1078","80 > 59102 [PSH, ACK] Seq=158429 Ack=1 Win=2920 Len=1024"
"296","1.262560000","217.166.60.247","192.168.1.5","TCP","1078","80 > 59102 [PSH, ACK] Seq=159453 Ack=1 Win=2920 Len=1024"
"297","1.263096000","217.166.60.247","192.168.1.5","TCP","1078","80 > 59102 [PSH, ACK] Seq=160477 Ack=1 Win=2920 Len=1024"
"299","1.266618000","217.166.60.247","192.168.1.5","TCP","1078","80 > 59102 [PSH, ACK] Seq=161501 Ack=1 Win=2920 Len=1024"
"300","1.266892000","217.166.60.247","192.168.1.5","TCP","1078","80 > 59102 [PSH, ACK] Seq=162525 Ack=1 Win=2920 Len=1024"
"302","1.272260000","217.166.60.247","192.168.1.5","TCP","1078","80 > 59102 [PSH, ACK] Seq=163549 Ack=1 Win=2920 Len=1024"
"303","1.272518000","217.166.60.247","192.168.1.5","TCP","1078","80 > 59102 [PSH, ACK] Seq=164573 Ack=1 Win=2920 Len=1024"
"305","1.336797000","217.166.60.247","192.168.1.5","TCP","460","80 > 59102 [ACK] Seq=165597 Ack=1 Win=2920 Len=406"
"306","1.337642000","217.166.60.247","192.168.1.5","TCP","121","80 > 59102 [ACK] Seq=166003 Ack=1 Win=2920 Len=67"
"308","1.338529000","217.166.60.247","192.168.1.5","TCP","1078","80 > 59102 [PSH, ACK] Seq=166070 Ack=1 Win=2920 Len=1024"
"309","1.340682000","217.166.60.247","192.168.1.5","TCP","1078","80 > 59102 [PSH, ACK] Seq=167094 Ack=1 Win=2920 Len=1024"
"311","1.343908000","217.166.60.247","192.168.1.5","TCP","1078","80 > 59102 [PSH, ACK] Seq=168118 Ack=1 Win=2920 Len=1024"
"312","1.345600000","217.166.60.247","192.168.1.5","TCP","1078","80 > 59102 [PSH, ACK] Seq=169142 Ack=1 Win=2920 Len=1024"
"314","1.350955000","217.166.60.247","192.168.1.5","TCP","1078","80 > 59102 [PSH, ACK] Seq=170166 Ack=1 Win=2920 Len=1024"
"315","1.353754000","217.166.60.247","192.168.1.5","TCP","1078","80 > 59102 [PSH, ACK] Seq=171190 Ack=1 Win=2920 Len=1024"
"317","1.361997000","217.166.60.247","192.168.1.5","TCP","1078","80 > 59102 [PSH, ACK] Seq=172214 Ack=1 Win=2920 Len=1024"
"318","1.363097000","217.166.60.247","192.168.1.5","TCP","1078","80 > 59102 [PSH, ACK] Seq=173238 Ack=1 Win=2920 Len=1024"
"320","1.368781000","217.166.60.247","192.168.1.5","TCP","1078","80 > 59102 [PSH, ACK] Seq=174262 Ack=1 Win=2920 Len=1024"
"321","1.369512000","217.166.60.247","192.168.1.5","TCP","1078","80 > 59102 [PSH, ACK] Seq=175286 Ack=1 Win=2920 Len=1024"
"323","1.371410000","217.166.60.247","192.168.1.5","TCP","1078","80 > 59102 [PSH, ACK] Seq=176310 Ack=1 Win=2920 Len=1024"
"324","1.373536000","217.166.60.247","192.168.1.5","TCP","1078","80 > 59102 [PSH, ACK] Seq=177334 Ack=1 Win=2920 Len=1024"
"326","1.378041000","217.166.60.247","192.168.1.5","TCP","1078","80 > 59102 [PSH, ACK] Seq=178358 Ack=1 Win=2920 Len=1024"
"327","1.444683000","217.166.60.247","192.168.1.5","TCP","500","80 > 59102 [ACK] Seq=179382 Ack=1 Win=2920 Len=446"
"329","1.445078000","217.166.60.247","192.168.1.5","TCP","121","80 > 59102 [ACK] Seq=179828 Ack=1 Win=2920 Len=67"
"330","1.445424000","217.166.60.247","192.168.1.5","TCP","1078","80 > 59102 [PSH, ACK] Seq=179895 Ack=1 Win=2920 Len=1024"
"336","1.454990000","217.166.60.247","192.168.1.5","TCP","1078","80 > 59102 [PSH, ACK] Seq=180919 Ack=1 Win=2920 Len=1024"
"337","1.456160000","217.166.60.247","192.168.1.5","TCP","1078","80 > 59102 [PSH, ACK] Seq=181943 Ack=1 Win=2920 Len=1024"
"339","1.457324000","217.166.60.247","192.168.1.5","TCP","1078","80 > 59102 [PSH, ACK] Seq=182967 Ack=1 Win=2920 Len=1024"
"341","1.458023000","217.166.60.247","192.168.1.5","TCP","1078","80 > 59102 [PSH, ACK] Seq=183991 Ack=1 Win=2920 Len=1024"
"349","1.464578000","217.166.60.247","192.168.1.5","TCP","1078","80 > 59102 [PSH, ACK] Seq=185015 Ack=1 Win=2920 Len=1024"
"350","1.464836000","217.166.60.247","192.168.1.5","TCP","1078","80 > 59102 [PSH, ACK] Seq=186039 Ack=1 Win=2920 Len=1024"
"357","1.468106000","217.166.60.247","192.168.1.5","TCP","1078","80 > 59102 [PSH, ACK] Seq=187063 Ack=1 Win=2920 Len=1024"
"358","1.468796000","217.166.60.247","192.168.1.5","TCP","1078","80 > 59102 [PSH, ACK] Seq=188087 Ack=1 Win=2920 Len=1024"
"362","1.475138000","217.166.60.247","192.168.1.5","TCP","1078","80 > 59102 [PSH, ACK] Seq=189111 Ack=1 Win=2920 Len=1024"
"363","1.476347000","217.166.60.247","192.168.1.5","TCP","1078","80 > 59102 [PSH, ACK] Seq=190135 Ack=1 Win=2920 Len=1024"
"365","1.477832000","217.166.60.247","192.168.1.5","TCP","1078","80 > 59102 [PSH, ACK] Seq=191159 Ack=1 Win=2920 Len=1024"
"366","1.485365000","217.166.60.247","192.168.1.5","TCP","1078","80 > 59102 [PSH, ACK] Seq=192183 Ack=1 Win=2920 Len=1024"
"370","1.554909000","217.166.60.247","192.168.1.5","TCP","441","[TCP segment of a reassembled PDU]"
"371","1.555153000","217.166.60.247","192.168.1.5","TCP","121","80 > 59102 [ACK] Seq=193594 Ack=1 Win=2920 Len=67"
"373","1.556411000","217.166.60.247","192.168.1.5","TCP","1078","80 > 59102 [PSH, ACK] Seq=193661 Ack=1 Win=2920 Len=1024"
"374","1.557815000","217.166.60.247","192.168.1.5","TCP","1078","80 > 59102 [PSH, ACK] Seq=194685 Ack=1 Win=2920 Len=1024"
"376","1.565769000","217.166.60.247","192.168.1.5","TCP","1078","80 > 59102 [PSH, ACK] Seq=195709 Ack=1 Win=2920 Len=1024"
"377","1.567198000","217.166.60.247","192.168.1.5","TCP","1078","80 > 59102 [PSH, ACK] Seq=196733 Ack=1 Win=2920 Len=1024"
"379","1.568079000","217.166.60.247","192.168.1.5","TCP","1078","80 > 59102 [PSH, ACK] Seq=197757 Ack=1 Win=2920 Len=1024"
"380","1.570223000","217.166.60.247","192.168.1.5","TCP","1078","80 > 59102 [PSH, ACK] Seq=198781 Ack=1 Win=2920 Len=1024"
"382","1.573067000","217.166.60.247","192.168.1.5","TCP","1078","80 > 59102 [PSH, ACK] Seq=199805 Ack=1 Win=2920 Len=1024"
"383","1.574985000","217.166.60.247","192.168.1.5","TCP","1078","80 > 59102 [PSH, ACK] Seq=200829 Ack=1 Win=2920 Len=1024"
"385","1.576462000","217.166.60.247","192.168.1.5","TCP","1078","80 > 59102 [PSH, ACK] Seq=201853 Ack=1 Win=2920 Len=1024"
"386","1.577911000","217.166.60.247","192.168.1.5","TCP","1078","80 > 59102 [PSH, ACK] Seq=202877 Ack=1 Win=2920 Len=1024"
"388","1.586811000","217.166.60.247","192.168.1.5","TCP","1078","80 > 59102 [PSH, ACK] Seq=203901 Ack=1 Win=2920 Len=1024"
"389","1.588151000","217.166.60.247","192.168.1.5","TCP","1078","80 > 59102 [PSH, ACK] Seq=204925 Ack=1 Win=2920 Len=1024"
"400","1.605281000","217.166.60.247","192.168.1.5","TCP","1078","80 > 59102 [PSH, ACK] Seq=205949 Ack=1 Win=2920 Len=1024"
"438","1.664501000","217.166.60.247","192.168.1.5","TCP","553","80 > 59102 [ACK] Seq=206973 Ack=1 Win=2920 Len=499"
"440","1.665554000","217.166.60.247","192.168.1.5","TCP","1078","80 > 59102 [PSH, ACK] Seq=207472 Ack=1 Win=2920 Len=1024"
"441","1.665854000","217.166.60.247","192.168.1.5","TCP","1078","80 > 59102 [PSH, ACK] Seq=208496 Ack=1 Win=2920 Len=1024"
"443","1.667601000","217.166.60.247","192.168.1.5","TCP","1078","80 > 59102 [PSH, ACK] Seq=209520 Ack=1 Win=2920 Len=1024"
"444","1.672018000","217.166.60.247","192.168.1.5","TCP","1078","80 > 59102 [PSH, ACK] Seq=210544 Ack=1 Win=2920 Len=1024"
"449","1.677326000","217.166.60.247","192.168.1.5","TCP","1078","80 > 59102 [PSH, ACK] Seq=211568 Ack=1 Win=2920 Len=1024"
"450","1.678352000","217.166.60.247","192.168.1.5","TCP","1078","80 > 59102 [PSH, ACK] Seq=212592 Ack=1 Win=2920 Len=1024"
"452","1.680380000","217.166.60.247","192.168.1.5","TCP","1078","80 > 59102 [PSH, ACK] Seq=213616 Ack=1 Win=2920 Len=1024"
"463","1.684751000","217.166.60.247","192.168.1.5","TCP","1078","80 > 59102 [PSH, ACK] Seq=214640 Ack=1 Win=2920 Len=1024"
"466","1.686182000","217.166.60.247","192.168.1.5","TCP","1078","80 > 59102 [PSH, ACK] Seq=215664 Ack=1 Win=2920 Len=1024"
"467","1.687420000","217.166.60.247","192.168.1.5","TCP","1078","80 > 59102 [PSH, ACK] Seq=216688 Ack=1 Win=2920 Len=1024"
"469","1.688078000","217.166.60.247","192.168.1.5","TCP","1078","80 > 59102 [PSH, ACK] Seq=217712 Ack=1 Win=2920 Len=1024"
"474","1.709402000","217.166.60.247","192.168.1.5","TCP","1078","80 > 59102 [PSH, ACK] Seq=218736 Ack=1 Win=2920 Len=1024"
"476","1.709684000","217.166.60.247","192.168.1.5","TCP","1078","80 > 59102 [PSH, ACK] Seq=219760 Ack=1 Win=2920 Len=1024"
"477","1.770199000","217.166.60.247","192.168.1.5","TCP","447","80 > 59102 [ACK] Seq=220784 Ack=1 Win=2920 Len=393"
"479","1.770769000","217.166.60.247","192.168.1.5","TCP","121","80 > 59102 [ACK] Seq=221177 Ack=1 Win=2920 Len=67"
"480","1.773557000","217.166.60.247","192.168.1.5","TCP","1078","80 > 59102 [PSH, ACK] Seq=221244 Ack=1 Win=2920 Len=1024"
"482","1.774258000","217.166.60.247","192.168.1.5","TCP","1078","80 > 59102 [PSH, ACK] Seq=222268 Ack=1 Win=2920 Len=1024"
"483","1.778551000","217.166.60.247","192.168.1.5","TCP","1078","80 > 59102 [PSH, ACK] Seq=223292 Ack=1 Win=2920 Len=1024"
"485","1.786547000","217.166.60.247","192.168.1.5","TCP","1078","80 > 59102 [PSH, ACK] Seq=224316 Ack=1 Win=2920 Len=1024"
"486","1.788591000","217.166.60.247","192.168.1.5","TCP","1078","80 > 59102 [PSH, ACK] Seq=225340 Ack=1 Win=2920 Len=1024"
"488","1.790084000","217.166.60.247","192.168.1.5","TCP","1078","80 > 59102 [PSH, ACK] Seq=226364 Ack=1 Win=2920 Len=1024"
"489","1.790980000","217.166.60.247","192.168.1.5","TCP","1078","80 > 59102 [PSH, ACK] Seq=227388 Ack=1 Win=2920 Len=1024"
"491","1.795597000","217.166.60.247","192.168.1.5","TCP","1078","80 > 59102 [PSH, ACK] Seq=228412 Ack=1 Win=2920 Len=1024"
"492","1.795745000","217.166.60.247","192.168.1.5","TCP","1078","80 > 59102 [PSH, ACK] Seq=229436 Ack=1 Win=2920 Len=1024"
"494","1.796389000","217.166.60.247","192.168.1.5","TCP","1078","80 > 59102 [PSH, ACK] Seq=230460 Ack=1 Win=2920 Len=1024"
"495","1.798519000","217.166.60.247","192.168.1.5","TCP","1078","80 > 59102 [PSH, ACK] Seq=231484 Ack=1 Win=2920 Len=1024"
"497","1.819297000","217.166.60.247","192.168.1.5","TCP","1078","80 > 59102 [PSH, ACK] Seq=232508 Ack=1 Win=2920 Len=1024"
"498","1.820564000","217.166.60.247","192.168.1.5","TCP","1078","80 > 59102 [PSH, ACK] Seq=233532 Ack=1 Win=2920 Len=1024"
"500","1.887352000","217.166.60.247","192.168.1.5","TCP","477","80 > 59102 [ACK] Seq=234556 Ack=1 Win=2920 Len=423"
"501","1.887665000","217.166.60.247","192.168.1.5","TCP","1078","80 > 59102 [PSH, ACK] Seq=234979 Ack=1 Win=2920 Len=1024"
"503","1.887945000","217.166.60.247","192.168.1.5","TCP","1078","80 > 59102 [PSH, ACK] Seq=236003 Ack=1 Win=2920 Len=1024"
"504","1.888055000","217.166.60.247","192.168.1.5","TCP","1078","80 > 59102 [PSH, ACK] Seq=237027 Ack=1 Win=2920 Len=1024"
"506","1.888384000","217.166.60.247","192.168.1.5","TCP","1078","80 > 59102 [PSH, ACK] Seq=238051 Ack=1 Win=2920 Len=1024"
"507","1.894246000","217.166.60.247","192.168.1.5","TCP","1078","80 > 59102 [PSH, ACK] Seq=239075 Ack=1 Win=2920 Len=1024"
"509","1.897760000","217.166.60.247","192.168.1.5","TCP","1078","80 > 59102 [PSH, ACK] Seq=240099 Ack=1 Win=2920 Len=1024"
"510","1.898526000","217.166.60.247","192.168.1.5","TCP","1078","80 > 59102 [PSH, ACK] Seq=241123 Ack=1 Win=2920 Len=1024"
"512","1.900581000","217.166.60.247","192.168.1.5","TCP","1078","80 > 59102 [PSH, ACK] Seq=242147 Ack=1 Win=2920 Len=1024"
"513","1.901379000","217.166.60.247","192.168.1.5","TCP","1078","80 > 59102 [PSH, ACK] Seq=243171 Ack=1 Win=2920 Len=1024"
"515","1.903808000","217.166.60.247","192.168.1.5","TCP","1078","80 > 59102 [PSH, ACK] Seq=244195 Ack=1 Win=2920 Len=1024"
"516","1.904510000","217.166.60.247","192.168.1.5","TCP","1078","80 > 59102 [PSH, ACK] Seq=245219 Ack=1 Win=2920 Len=1024"
"518","1.907813000","217.166.60.247","192.168.1.5","TCP","1078","80 > 59102 [PSH, ACK] Seq=246243 Ack=1 Win=2920 Len=1024"
"519","1.926052000","217.166.60.247","192.168.1.5","TCP","1078","80 > 59102 [PSH, ACK] Seq=247267 Ack=1 Win=2920 Len=1024"
"521","1.994901000","217.166.60.247","192.168.1.5","TCP","447","80 > 59102 [ACK] Seq=248291 Ack=1 Win=2920 Len=393"
"522","1.995490000","217.166.60.247","192.168.1.5","TCP","121","80 > 59102 [ACK] Seq=248684 Ack=1 Win=2920 Len=67"
"524","2.001601000","217.166.60.247","192.168.1.5","TCP","1078","80 > 59102 [PSH, ACK] Seq=248751 Ack=1 Win=2920 Len=1024"
"525","2.002766000","217.166.60.247","192.168.1.5","TCP","1078","80 > 59102 [PSH, ACK] Seq=249775 Ack=1 Win=2920 Len=1024"
"527","2.003059000","217.166.60.247","192.168.1.5","TCP","1078","80 > 59102 [PSH, ACK] Seq=250799 Ack=1 Win=2920 Len=1024"
"528","2.003171000","217.166.60.247","192.168.1.5","TCP","1078","80 > 59102 [PSH, ACK] Seq=251823 Ack=1 Win=2920 Len=1024"
"530","2.004046000","217.166.60.247","192.168.1.5","TCP","1078","80 > 59102 [PSH, ACK] Seq=252847 Ack=1 Win=2920 Len=1024"
"531","2.005019000","217.166.60.247","192.168.1.5","TCP","1078","80 > 59102 [PSH, ACK] Seq=253871 Ack=1 Win=2920 Len=1024"
"533","2.007823000","217.166.60.247","192.168.1.5","TCP","1078","80 > 59102 [PSH, ACK] Seq=254895 Ack=1 Win=2920 Len=1024"
"534","2.009500000","217.166.60.247","192.168.1.5","TCP","1078","80 > 59102 [PSH, ACK] Seq=255919 Ack=1 Win=2920 Len=1024"
"536","2.010943000","217.166.60.247","192.168.1.5","TCP","1078","80 > 59102 [PSH, ACK] Seq=256943 Ack=1 Win=2920 Len=1024"
"537","2.017823000","217.166.60.247","192.168.1.5","TCP","1078","80 > 59102 [PSH, ACK] Seq=257967 Ack=1 Win=2920 Len=1024"
"539","2.019261000","217.166.60.247","192.168.1.5","TCP","1078","80 > 59102 [PSH, ACK] Seq=258991 Ack=1 Win=2920 Len=1024"
"540","2.020672000","217.166.60.247","192.168.1.5","TCP","1078","80 > 59102 [PSH, ACK] Seq=260015 Ack=1 Win=2920 Len=1024"
"542","2.031666000","217.166.60.247","192.168.1.5","TCP","1078","80 > 59102 [PSH, ACK] Seq=261039 Ack=1 Win=2920 Len=1024"
"549","2.103039000","217.166.60.247","192.168.1.5","TCP","508","80 > 59102 [ACK] Seq=262063 Ack=1 Win=2920 Len=454"
"551","2.103804000","217.166.60.247","192.168.1.5","TCP","121","80 > 59102 [ACK] Seq=262517 Ack=1 Win=2920 Len=67"
"552","2.109343000","217.166.60.247","192.168.1.5","TCP","1078","80 > 59102 [PSH, ACK] Seq=262584 Ack=1 Win=2920 Len=1024"
"554","2.113183000","217.166.60.247","192.168.1.5","TCP","1078","80 > 59102 [PSH, ACK] Seq=263608 Ack=1 Win=2920 Len=1024"
"555","2.113978000","217.166.60.247","192.168.1.5","TCP","1078","80 > 59102 [PSH, ACK] Seq=264632 Ack=1 Win=2920 Len=1024"
"557","2.117820000","217.166.60.247","192.168.1.5","TCP","1078","80 > 59102 [PSH, ACK] Seq=265656 Ack=1 Win=2920 Len=1024"
"558","2.119241000","217.166.60.247","192.168.1.5","TCP","1078","80 > 59102 [PSH, ACK] Seq=266680 Ack=1 Win=2920 Len=1024"
"560","2.120670000","217.166.60.247","192.168.1.5","TCP","1078","80 > 59102 [PSH, ACK] Seq=267704 Ack=1 Win=2920 Len=1024"
"561","2.124051000","217.166.60.247","192.168.1.5","TCP","1078","80 > 59102 [PSH, ACK] Seq=268728 Ack=1 Win=2920 Len=1024"
"563","2.124531000","217.166.60.247","192.168.1.5","TCP","1078","80 > 59102 [PSH, ACK] Seq=269752 Ack=1 Win=2920 Len=1024"
"564","2.126008000","217.166.60.247","192.168.1.5","TCP","1078","80 > 59102 [PSH, ACK] Seq=270776 Ack=1 Win=2920 Len=1024"
"566","2.130261000","217.166.60.247","192.168.1.5","TCP","1078","80 > 59102 [PSH, ACK] Seq=271800 Ack=1 Win=2920 Len=1024"
"567","2.132213000","217.166.60.247","192.168.1.5","TCP","1078","80 > 59102 [PSH, ACK] Seq=272824 Ack=1 Win=2920 Len=1024"
"569","2.133630000","217.166.60.247","192.168.1.5","TCP","1078","80 > 59102 [PSH, ACK] Seq=273848 Ack=1 Win=2920 Len=1024"
"570","2.134957000","217.166.60.247","192.168.1.5","TCP","1078","80 > 59102 [PSH, ACK] Seq=274872 Ack=1 Win=2920 Len=1024"
"573","2.210127000","217.166.60.247","192.168.1.5","TCP","501","80 > 59102 [ACK] Seq=275896 Ack=1 Win=2920 Len=447"
"574","2.211827000","217.166.60.247","192.168.1.5","TCP","1078","80 > 59102 [PSH, ACK] Seq=276343 Ack=1 Win=2920 Len=1024"
"576","2.220804000","217.166.60.247","192.168.1.5","TCP","1078","80 > 59102 [PSH, ACK] Seq=277367 Ack=1 Win=2920 Len=1024"
"577","2.221950000","217.166.60.247","192.168.1.5","TCP","1078","80 > 59102 [PSH, ACK] Seq=278391 Ack=1 Win=2920 Len=1024"
"579","2.222238000","217.166.60.247","192.168.1.5","TCP","1078","80 > 59102 [PSH, ACK] Seq=279415 Ack=1 Win=2920 Len=1024"
"580","2.224541000","217.166.60.247","192.168.1.5","TCP","1078","80 > 59102 [PSH, ACK] Seq=280439 Ack=1 Win=2920 Len=1024"
"582","2.225238000","217.166.60.247","192.168.1.5","TCP","1078","80 > 59102 [PSH, ACK] Seq=281463 Ack=1 Win=2920 Len=1024"
"583","2.230935000","217.166.60.247","192.168.1.5","TCP","1078","80 > 59102 [PSH, ACK] Seq=282487 Ack=1 Win=2920 Len=1024"
"585","2.232356000","217.166.60.247","192.168.1.5","TCP","1078","80 > 59102 [PSH, ACK] Seq=283511 Ack=1 Win=2920 Len=1024"
"586","2.235105000","217.166.60.247","192.168.1.5","TCP","1078","80 > 59102 [PSH, ACK] Seq=284535 Ack=1 Win=2920 Len=1024"
"588","2.236773000","217.166.60.247","192.168.1.5","TCP","1078","80 > 59102 [PSH, ACK] Seq=285559 Ack=1 Win=2920 Len=1024"
"589","2.239628000","217.166.60.247","192.168.1.5","TCP","1078","80 > 59102 [PSH, ACK] Seq=286583 Ack=1 Win=2920 Len=1024"
"591","2.240747000","217.166.60.247","192.168.1.5","TCP","1078","80 > 59102 [PSH, ACK] Seq=287607 Ack=1 Win=2920 Len=1024"
"592","2.241469000","217.166.60.247","192.168.1.5","TCP","1078","80 > 59102 [PSH, ACK] Seq=288631 Ack=1 Win=2920 Len=1024"
"595","2.320297000","217.166.60.247","192.168.1.5","TCP","485","80 > 59102 [ACK] Seq=289655 Ack=1 Win=2920 Len=431"
"596","2.320516000","217.166.60.247","192.168.1.5","TCP","121","80 > 59102 [ACK] Seq=290086 Ack=1 Win=2920 Len=67"
"598","2.321871000","217.166.60.247","192.168.1.5","TCP","1078","80 > 59102 [PSH, ACK] Seq=290153 Ack=1 Win=2920 Len=1024"
"599","2.323447000","217.166.60.247","192.168.1.5","TCP","1078","80 > 59102 [PSH, ACK] Seq=291177 Ack=1 Win=2920 Len=1024"
"601","2.330239000","217.166.60.247","192.168.1.5","TCP","1078","80 > 59102 [PSH, ACK] Seq=292201 Ack=1 Win=2920 Len=1024"
"602","2.332337000","217.166.60.247","192.168.1.5","TCP","1078","80 > 59102 [PSH, ACK] Seq=293225 Ack=1 Win=2920 Len=1024"
"604","2.333543000","217.166.60.247","192.168.1.5","TCP","1078","80 > 59102 [PSH, ACK] Seq=294249 Ack=1 Win=2920 Len=1024"
"605","2.335241000","217.166.60.247","192.168.1.5","TCP","1078","80 > 59102 [PSH, ACK] Seq=295273 Ack=1 Win=2920 Len=1024"
"607","2.337210000","217.166.60.247","192.168.1.5","TCP","1078","80 > 59102 [PSH, ACK] Seq=296297 Ack=1 Win=2920 Len=1024"
"608","2.340605000","217.166.60.247","192.168.1.5","TCP","1078","80 > 59102 [PSH, ACK] Seq=297321 Ack=1 Win=2920 Len=1024"
"610","2.341563000","217.166.60.247","192.168.1.5","TCP","1078","80 > 59102 [PSH, ACK] Seq=298345 Ack=1 Win=2920 Len=1024"
"611","2.342672000","217.166.60.247","192.168.1.5","TCP","1078","80 > 59102 [PSH, ACK] Seq=299369 Ack=1 Win=2920 Len=1024"
"613","2.344919000","217.166.60.247","192.168.1.5","TCP","1078","80 > 59102 [PSH, ACK] Seq=300393 Ack=1 Win=2920 Len=1024"
"614","2.345928000","217.166.60.247","192.168.1.5","TCP","1078","80 > 59102 [PSH, ACK] Seq=301417 Ack=1 Win=2920 Len=1024"
"616","2.353963000","217.166.60.247","192.168.1.5","TCP","1078","80 > 59102 [PSH, ACK] Seq=302441 Ack=1 Win=2920 Len=1024"
"618","2.431774000","217.166.60.247","192.168.1.5","TCP","505","80 > 59102 [ACK] Seq=303465 Ack=1 Win=2920 Len=451"
