"No.","Time","Source","Destination","Protocol","Length","Info"
"1","0.000000000","163.1.201.45","192.168.1.5","RTMP","1514","Unknown (0x0)"
"2","0.000833000","163.1.201.45","192.168.1.5","RTMP","622","Unknown (0x0)|Unknown (0x0)"
"4","0.001165000","163.1.201.45","192.168.1.5","TCP","1514","1935 > 56401 [ACK] Seq=2029 Ack=1 Win=23710 Len=1460"
"5","0.001282000","163.1.201.45","192.168.1.5","RTMP","1514","Unknown (0x0)|Unknown (0x0)|Unknown (0x0)|Unknown (0x0)|Unknown (0x0)"
"7","0.001491000","163.1.201.45","192.168.1.5","TCP","1238","1935 > 56401 [PSH, ACK] Seq=4949 Ack=1 Win=23710 Len=1184"
"8","0.001539000","163.1.201.45","192.168.1.5","RTMP","1514","Unknown (0x0)"
"10","0.001739000","163.1.201.45","192.168.1.5","RTMP","1514","Unknown (0x0)|Unknown (0x0)"
"11","0.001773000","163.1.201.45","192.168.1.5","RTMP","1231","Unknown (0x0)|Unknown (0x0)|Unknown (0x0)"
"14","0.006948000","163.1.201.45","192.168.1.5","TCP","1514","1935 > 56401 [ACK] Seq=10230 Ack=1 Win=23710 Len=1460"
"15","0.007259000","163.1.201.45","192.168.1.5","TCP","1514","1935 > 56401 [ACK] Seq=11690 Ack=1 Win=23710 Len=1460"
"17","0.011309000","163.1.201.45","192.168.1.5","TCP","1231","1935 > 56401 [PSH, ACK] Seq=13150 Ack=1 Win=23710 Len=1177"
"18","0.011379000","163.1.201.45","192.168.1.5","TCP","1514","1935 > 56401 [ACK] Seq=14327 Ack=1 Win=23710 Len=1460"
"20","0.011522000","163.1.201.45","192.168.1.5","RTMP","1514","Unknown (0x0)|Unknown (0x0)|Unknown (0x0)"
"21","0.011727000","163.1.201.45","192.168.1.5","RTMP","1231","Unknown (0x0)|Unknown (0x0)"
"23","0.011858000","163.1.201.45","192.168.1.5","RTMP","1514","Unknown (0x0)|Unknown (0x0)|Unknown (0x0)"
"24","0.011896000","163.1.201.45","192.168.1.5","RTMP","1514","Unknown (0x0)|Unknown (0x0)"
"26","0.011993000","163.1.201.45","192.168.1.5","TCP","1231","1935 > 56401 [PSH, ACK] Seq=21344 Ack=1 Win=23710 Len=1177"
"28","0.014661000","163.1.201.45","192.168.1.5","TCP","1514","1935 > 56401 [ACK] Seq=22521 Ack=1 Win=23710 Len=1460"
"29","0.015011000","163.1.201.45","192.168.1.5","TCP","1514","1935 > 56401 [ACK] Seq=23981 Ack=1 Win=23710 Len=1460"
"31","0.015312000","163.1.201.45","192.168.1.5","TCP","1231","1935 > 56401 [PSH, ACK] Seq=25441 Ack=1 Win=23710 Len=1177"
"32","0.015459000","163.1.201.45","192.168.1.5","RTMP","1514","Unknown (0x0)|Unknown (0x0)"
"34","0.015571000","163.1.201.45","192.168.1.5","TCP","339","1935 > 56401 [PSH, ACK] Seq=28078 Ack=1 Win=23710 Len=285"
"35","0.015693000","163.1.201.45","192.168.1.5","TCP","1514","1935 > 56401 [ACK] Seq=28363 Ack=1 Win=23710 Len=1460"
"37","0.015805000","163.1.201.45","192.168.1.5","TCP","1514","1935 > 56401 [ACK] Seq=29823 Ack=1 Win=23710 Len=1460"
"38","0.015924000","163.1.201.45","192.168.1.5","TCP","1238","1935 > 56401 [PSH, ACK] Seq=31283 Ack=1 Win=23710 Len=1184"
"40","0.016037000","163.1.201.45","192.168.1.5","TCP","1514","1935 > 56401 [ACK] Seq=32467 Ack=1 Win=23710 Len=1460"
"41","0.016151000","163.1.201.45","192.168.1.5","RTMP","1514","Unknown (0x0)"
"43","0.016328000","163.1.201.45","192.168.1.5","TCP","1231","1935 > 56401 [PSH, ACK] Seq=35387 Ack=1 Win=23710 Len=1177"
"44","0.017069000","163.1.201.45","192.168.1.5","RTMP","1514","Unknown (0x0)"
"46","0.017290000","163.1.201.45","192.168.1.5","RTMP","1514","Unknown (0x0)|Unknown (0x0)"
"47","0.017323000","163.1.201.45","192.168.1.5","TCP","1231","1935 > 56401 [PSH, ACK] Seq=39484 Ack=1 Win=23710 Len=1177"
"49","0.017538000","163.1.201.45","192.168.1.5","TCP","1514","1935 > 56401 [ACK] Seq=40661 Ack=1 Win=23710 Len=1460"
"50","0.017578000","163.1.201.45","192.168.1.5","RTMP","1514","Unknown (0x0)|Unknown (0x0)"
"52","0.017677000","163.1.201.45","192.168.1.5","RTMP","1231","Unknown (0x0)|Unknown (0x0)|Unknown (0x0)"
"53","0.017796000","163.1.201.45","192.168.1.5","TCP","1514","1935 > 56401 [ACK] Seq=44758 Ack=1 Win=23710 Len=1460"
"55","0.017978000","163.1.201.45","192.168.1.5","RTMP","1514","Unknown (0x0)|Unknown (0x0)|Unknown (0x0)|Unknown (0x0)|Unknown (0x0)"
"56","0.018692000","163.1.201.45","192.168.1.5","TCP","1231","1935 > 56401 [PSH, ACK] Seq=47678 Ack=1 Win=23710 Len=1177"
"58","0.018900000","163.1.201.45","192.168.1.5","RTMP","1514","Unknown (0x0)|Unknown (0x0)|Unknown (0x0)"
"59","0.018944000","163.1.201.45","192.168.1.5","TCP","1514","1935 > 56401 [ACK] Seq=50315 Ack=1 Win=23710 Len=1460"
"61","0.019147000","163.1.201.45","192.168.1.5","RTMP","1231","Unknown (0x0)"
"62","0.019190000","163.1.201.45","192.168.1.5","TCP","1514","1935 > 56401 [ACK] Seq=52952 Ack=1 Win=23710 Len=1460"
"64","0.019294000","163.1.201.45","192.168.1.5","RTMP","599","Unknown (0x0)"
"65","0.019433000","163.1.201.45","192.168.1.5","RTMP","1514","Unknown (0x0)|Unknown (0x0)"
"67","0.019542000","163.1.201.45","192.168.1.5","TCP","1514","1935 > 56401 [ACK] Seq=56417 Ack=1 Win=23710 Len=1460"
"68","0.019572000","163.1.201.45","192.168.1.5","TCP","1238","1935 > 56401 [PSH, ACK] Seq=57877 Ack=1 Win=23710 Len=1184"
"70","0.019803000","163.1.201.45","192.168.1.5","TCP","1514","1935 > 56401 [ACK] Seq=59061 Ack=1 Win=23710 Len=1460"
"71","0.019844000","163.1.201.45","192.168.1.5","RTMP","1514","Unknown (0x0)"
"73","0.019943000","163.1.201.45","192.168.1.5","RTMP","1231","Unknown (0x0)"
"74","0.020089000","163.1.201.45","192.168.1.5","RTMP","1514","Unknown (0x0)|Unknown (0x0)"
"76","0.020206000","163.1.201.45","192.168.1.5","RTMP","1514","Unknown (0x0)|Unknown (0x0)|Unknown (0x0)|Unknown (0x0)"
"77","0.020236000","163.1.201.45","192.168.1.5","TCP","1231","1935 > 56401 [PSH, ACK] Seq=66078 Ack=1 Win=23710 Len=1177"
"79","0.097561000","163.1.201.45","192.168.1.5","TCP","1514","1935 > 56401 [ACK] Seq=67255 Ack=1 Win=23710 Len=1460"
"80","0.097861000","163.1.201.45","192.168.1.5","TCP","1514","1935 > 56401 [ACK] Seq=68715 Ack=1 Win=23710 Len=1460"
"82","0.098815000","163.1.201.45","192.168.1.5","TCP","1231","1935 > 56401 [PSH, ACK] Seq=70175 Ack=1 Win=23710 Len=1177"
"83","0.099848000","163.1.201.45","192.168.1.5","TCP","1514","1935 > 56401 [ACK] Seq=71352 Ack=1 Win=23710 Len=1460"
"85","0.100264000","163.1.201.45","192.168.1.5","TCP","1514","1935 > 56401 [ACK] Seq=72812 Ack=1 Win=23710 Len=1460"
"86","0.100369000","163.1.201.45","192.168.1.5","RTMP","1231","Unknown (0x0)"
"88","0.108415000","163.1.201.45","192.168.1.5","RTMP","1514","Unknown (0x0)"
"89","0.108779000","163.1.201.45","192.168.1.5","TCP","1514","1935 > 56401 [ACK] Seq=76909 Ack=1 Win=23710 Len=1460"
"91","0.109083000","163.1.201.45","192.168.1.5","TCP","1231","1935 > 56401 [PSH, ACK] Seq=78369 Ack=1 Win=23710 Len=1177"
"92","0.109225000","163.1.201.45","192.168.1.5","TCP","1514","1935 > 56401 [ACK] Seq=79546 Ack=1 Win=23710 Len=1460"
"94","0.109347000","163.1.201.45","192.168.1.5","RTMP","407","Unknown (0x0)"
"95","0.109481000","163.1.201.45","192.168.1.5","RTMP","1514","Unknown (0x0)"
"97","0.109600000","163.1.201.45","192.168.1.5","RTMP","1514","Unknown (0x0)"
"98","0.109743000","163.1.201.45","192.168.1.5","TCP","1238","1935 > 56401 [PSH, ACK] Seq=84279 Ack=1 Win=23710 Len=1184"
"100","0.109861000","163.1.201.45","192.168.1.5","RTMP","1514","Unknown (0x0)"
"101","0.109901000","163.1.201.45","192.168.1.5","TCP","1514","1935 > 56401 [ACK] Seq=86923 Ack=1 Win=23710 Len=1460"
"103","0.110087000","163.1.201.45","192.168.1.5","RTMP","1231","Unknown (0x0)"
"104","0.114947000","163.1.201.45","192.168.1.5","TCP","1514","1935 > 56401 [ACK] Seq=89560 Ack=1 Win=23710 Len=1460"
"106","0.115299000","163.1.201.45","192.168.1.5","RTMP","1514","Unknown (0x0)"
"107","0.119710000","163.1.201.45","192.168.1.5","RTMP","1231","Unknown (0x0)"
"109","0.120139000","163.1.201.45","192.168.1.5","RTMP","1514","Unknown (0x0)|Unknown (0x0)|Unknown (0x0)|Unknown (0x0)"
"110","0.120184000","163.1.201.45","192.168.1.5","TCP","1514","1935 > 56401 [ACK] Seq=95117 Ack=1 Win=23710 Len=1460"
"112","0.120285000","163.1.201.45","192.168.1.5","TCP","1231","1935 > 56401 [PSH, ACK] Seq=96577 Ack=1 Win=23710 Len=1177"
"113","0.120325000","163.1.201.45","192.168.1.5","TCP","1514","1935 > 56401 [ACK] Seq=97754 Ack=1 Win=23710 Len=1460"
"115","0.120436000","163.1.201.45","192.168.1.5","RTMP","1514","Unknown (0x0)"
"116","0.120468000","163.1.201.45","192.168.1.5","RTMP","1231","Unknown (0x0)|Unknown (0x0)|Unknown (0x0)"
"118","0.120579000","163.1.201.45","192.168.1.5","TCP","1514","1935 > 56401 [ACK] Seq=101851 Ack=1 Win=23710 Len=1460"
"119","0.120619000","163.1.201.45","192.168.1.5","RTMP","1514","Unknown (0x0)"
"121","0.120856000","163.1.201.45","192.168.1.5","RTMP","1231","Unknown (0x0)|Unknown (0x0)"
"122","0.120904000","163.1.201.45","192.168.1.5","TCP","1514","1935 > 56401 [ACK] Seq=105948 Ack=1 Win=23710 Len=1460"
"124","0.121021000","163.1.201.45","192.168.1.5","RTMP","580","Unknown (0x0)|Unknown (0x0)"
"125","0.122492000","163.1.201.45","192.168.1.5","RTMP","1514","Unknown (0x0)|Unknown (0x0)|Unknown (0x0)"
"127","0.122641000","163.1.201.45","192.168.1.5","RTMP","1514","Unknown (0x0)"
"128","0.122672000","163.1.201.45","192.168.1.5","RTMP","1238","Unknown (0x0)"
"130","0.122784000","163.1.201.45","192.168.1.5","TCP","1514","1935 > 56401 [ACK] Seq=112038 Ack=1 Win=23710 Len=1460"
"131","0.122821000","163.1.201.45","192.168.1.5","RTMP","1514","Unknown (0x0)|Unknown (0x0)|Unknown (0x0)"
"133","0.122914000","163.1.201.45","192.168.1.5","TCP","1231","1935 > 56401 [PSH, ACK] Seq=114958 Ack=1 Win=23710 Len=1177"
"134","0.122951000","163.1.201.45","192.168.1.5","TCP","1514","1935 > 56401 [ACK] Seq=116135 Ack=1 Win=23710 Len=1460"
"136","0.123050000","163.1.201.45","192.168.1.5","TCP","1514","1935 > 56401 [ACK] Seq=117595 Ack=1 Win=23710 Len=1460"
"137","0.123078000","163.1.201.45","192.168.1.5","RTMP","1231","Unknown (0x0)"
"139","0.123261000","163.1.201.45","192.168.1.5","TCP","1514","1935 > 56401 [ACK] Seq=120232 Ack=1 Win=23710 Len=1460"
"140","0.123554000","163.1.201.45","192.168.1.5","RTMP","1514","Unknown (0x0)|Unknown (0x0)"
"142","0.123756000","163.1.201.45","192.168.1.5","RTMP","1231","Unknown (0x0)|Unknown (0x0)|Unknown (0x0)|Unknown (0x0)"
"143","0.123791000","163.1.201.45","192.168.1.5","TCP","1514","1935 > 56401 [ACK] Seq=124329 Ack=1 Win=23710 Len=1460"
"145","0.123985000","163.1.201.45","192.168.1.5","TCP","1514","1935 > 56401 [ACK] Seq=125789 Ack=1 Win=23710 Len=1460"
"146","0.124017000","163.1.201.45","192.168.1.5","RTMP","1231","Unknown (0x0)"
"148","0.124190000","163.1.201.45","192.168.1.5","TCP","1514","1935 > 56401 [ACK] Seq=128426 Ack=1 Win=23710 Len=1460"
"149","0.124296000","163.1.201.45","192.168.1.5","RTMP","1514","Unknown (0x0)|Unknown (0x0)"
"151","0.124536000","163.1.201.45","192.168.1.5","RTMP","1231","Unknown (0x0)"
"153","0.194902000","163.1.201.45","192.168.1.5","RTMP","1514","Unknown (0x0)|Unknown (0x0)|Unknown (0x0)"
"154","0.195075000","163.1.201.45","192.168.1.5","TCP","439","1935 > 56401 [PSH, ACK] Seq=133983 Ack=1 Win=23710 Len=385"
"156","0.195666000","163.1.201.45","192.168.1.5","TCP","1514","1935 > 56401 [ACK] Seq=134368 Ack=1 Win=23710 Len=1460"
"157","0.196733000","163.1.201.45","192.168.1.5","RTMP","1514","Unknown (0x0)"
"159","0.196855000","163.1.201.45","192.168.1.5","RTMP","1238","Unknown (0x0)|Unknown (0x0)|Unknown (0x0)"
"160","0.196893000","163.1.201.45","192.168.1.5","RTMP","1514","Unknown (0x0)"
"162","0.197101000","163.1.201.45","192.168.1.5","RTMP","1514","Unknown (0x0)|Unknown (0x0)"
"163","0.197129000","163.1.201.45","192.168.1.5","TCP","1231","1935 > 56401 [PSH, ACK] Seq=141392 Ack=1 Win=23710 Len=1177"
"165","0.203969000","163.1.201.45","192.168.1.5","RTMP","1514","Unknown (0x0)|Unknown (0x0)"
"166","0.204295000","163.1.201.45","192.168.1.5","TCP","1514","1935 > 56401 [ACK] Seq=144029 Ack=1 Win=23710 Len=1460"
"168","0.204593000","163.1.201.45","192.168.1.5","RTMP","1231","Unknown (0x0)|Unknown (0x0)|Unknown (0x0)"
"169","0.205410000","163.1.201.45","192.168.1.5","RTMP","1514","Unknown (0x0)|Unknown (0x0)|Unknown (0x0)|Unknown (0x0)"
"171","0.205747000","163.1.201.45","192.168.1.5","RTMP","1514","Unknown (0x0)"
"172","0.206181000","163.1.201.45","192.168.1.5","TCP","1231","1935 > 56401 [PSH, ACK] Seq=149586 Ack=1 Win=23710 Len=1177"
"174","0.210576000","163.1.201.45","192.168.1.5","RTMP","1514","Unknown (0x0)"
"175","0.211733000","163.1.201.45","192.168.1.5","RTMP","1514","Unknown (0x0)|Unknown (0x0)|Unknown (0x0)"
"177","0.211966000","163.1.201.45","192.168.1.5","RTMP","1231","Unknown (0x0)"
"178","0.216513000","163.1.201.45","192.168.1.5","RTMP","1514","Unknown (0x0)|Unknown (0x0)"
"180","0.217686000","163.1.201.45","192.168.1.5","RTMP","1514","Unknown (0x0)"
"181","0.217929000","163.1.201.45","192.168.1.5","TCP","1231","1935 > 56401 [PSH, ACK] Seq=157780 Ack=1 Win=23710 Len=1177"
"183","0.218142000","163.1.201.45","192.168.1.5","TCP","1514","1935 > 56401 [ACK] Seq=158957 Ack=1 Win=23710 Len=1460"
"184","0.218183000","163.1.201.45","192.168.1.5","RTMP","563","Unknown (0x0)|Unknown (0x0)|Unknown (0x0)"
"186","0.218374000","163.1.201.45","192.168.1.5","RTMP","1514","Unknown (0x0)|Unknown (0x0)|Unknown (0x0)"
"187","0.218417000","163.1.201.45","192.168.1.5","TCP","1514","1935 > 56401 [ACK] Seq=162386 Ack=1 Win=23710 Len=1460"
"189","0.218617000","163.1.201.45","192.168.1.5","TCP","1238","1935 > 56401 [PSH, ACK] Seq=163846 Ack=1 Win=23710 Len=1184"
"190","0.218662000","163.1.201.45","192.168.1.5","TCP","1514","1935 > 56401 [ACK] Seq=165030 Ack=1 Win=23710 Len=1460"
"192","0.220846000","163.1.201.45","192.168.1.5","TCP","1514","1935 > 56401 [ACK] Seq=166490 Ack=1 Win=23710 Len=1460"
"193","0.220877000","163.1.201.45","192.168.1.5","RTMP","1231","Unknown (0x0)"
"195","0.221000000","163.1.201.45","192.168.1.5","TCP","1514","1935 > 56401 [ACK] Seq=169127 Ack=1 Win=23710 Len=1460"
"196","0.221140000","163.1.201.45","192.168.1.5","TCP","1514","1935 > 56401 [ACK] Seq=170587 Ack=1 Win=23710 Len=1460"
"198","0.221250000","163.1.201.45","192.168.1.5","TCP","1231","1935 > 56401 [PSH, ACK] Seq=172047 Ack=1 Win=23710 Len=1177"
"199","0.221410000","163.1.201.45","192.168.1.5","RTMP","1514","Unknown (0x0)"
"201","0.221525000","163.1.201.45","192.168.1.5","TCP","1514","1935 > 56401 [ACK] Seq=174684 Ack=1 Win=23710 Len=1460"
"202","0.221554000","163.1.201.45","192.168.1.5","TCP","1231","1935 > 56401 [PSH, ACK] Seq=176144 Ack=1 Win=23710 Len=1177"
"204","0.221901000","163.1.201.45","192.168.1.5","RTMP","1514","Unknown (0x0)|Unknown (0x0)|Unknown (0x0)|Unknown (0x0)"
"205","0.224051000","163.1.201.45","192.168.1.5","TCP","1514","1935 > 56401 [ACK] Seq=178781 Ack=1 Win=23710 Len=1460"
"207","0.224290000","163.1.201.45","192.168.1.5","TCP","1231","1935 > 56401 [PSH, ACK] Seq=180241 Ack=1 Win=23710 Len=1177"
"208","0.224346000","163.1.201.45","192.168.1.5","TCP","1514","1935 > 56401 [ACK] Seq=181418 Ack=1 Win=23710 Len=1460"
"210","0.224561000","163.1.201.45","192.168.1.5","RTMP","1514","Unknown (0x0)|Unknown (0x0)"
"211","0.224598000","163.1.201.45","192.168.1.5","TCP","1231","1935 > 56401 [PSH, ACK] Seq=184338 Ack=1 Win=23710 Len=1177"
"213","0.224833000","163.1.201.45","192.168.1.5","RTMP","1514","Unknown (0x0)"
"214","0.224878000","163.1.201.45","192.168.1.5","RTMP","297","Unknown (0x0)"
"216","0.224988000","163.1.201.45","192.168.1.5","RTMP","1514","Unknown (0x0)|Unknown (0x0)"
"217","0.225144000","163.1.201.45","192.168.1.5","TCP","1514","1935 > 56401 [ACK] Seq=188678 Ack=1 Win=23710 Len=1460"
"219","0.225259000","163.1.201.45","192.168.1.5","TCP","1238","1935 > 56401 [PSH, ACK] Seq=190138 Ack=1 Win=23710 Len=1184"
"220","0.225301000","163.1.201.45","192.168.1.5","TCP","1514","1935 > 56401 [ACK] Seq=191322 Ack=1 Win=23710 Len=1460"
"222","0.225507000","163.1.201.45","192.168.1.5","RTMP","1514","Unknown (0x0)|Unknown (0x0)|Unknown (0x0)|Unknown (0x0)"
"223","0.225543000","163.1.201.45","192.168.1.5","TCP","1231","1935 > 56401 [PSH, ACK] Seq=194242 Ack=1 Win=23710 Len=1177"
"225","0.226198000","163.1.201.45","192.168.1.5","RTMP","1514","Unknown (0x0)"
"226","0.226326000","163.1.201.45","192.168.1.5","TCP","1514","1935 > 56401 [ACK] Seq=196879 Ack=1 Win=23710 Len=1460"
"228","0.226515000","163.1.201.45","192.168.1.5","RTMP","1231","Unknown (0x0)"
"230","0.297253000","163.1.201.45","192.168.1.5","TCP","1514","1935 > 56401 [ACK] Seq=199516 Ack=1 Win=23710 Len=1460"
"232","0.297526000","163.1.201.45","192.168.1.5","RTMP","1514","Unknown (0x0)"
"233","0.298055000","163.1.201.45","192.168.1.5","RTMP","1231","Unknown (0x0)|Unknown (0x0)|Unknown (0x0)"
"235","0.298913000","163.1.201.45","192.168.1.5","TCP","1514","1935 > 56401 [ACK] Seq=203613 Ack=1 Win=23710 Len=1460"
"236","0.299039000","163.1.201.45","192.168.1.5","TCP","1514","1935 > 56401 [ACK] Seq=205073 Ack=1 Win=23710 Len=1460"
"238","0.299158000","163.1.201.45","192.168.1.5","RTMP","1231","Unknown (0x0)"
"239","0.303922000","163.1.201.45","192.168.1.5","TCP","1514","1935 > 56401 [ACK] Seq=207710 Ack=1 Win=23710 Len=1460"
"241","0.304230000","163.1.201.45","192.168.1.5","TCP","1514","1935 > 56401 [ACK] Seq=209170 Ack=1 Win=23710 Len=1460"
"242","0.304473000","163.1.201.45","192.168.1.5","RTMP","1231","Unknown (0x0)|Unknown (0x0)|Unknown (0x0)|Unknown (0x0)"
"244","0.304700000","163.1.201.45","192.168.1.5","TCP","1514","1935 > 56401 [ACK] Seq=211807 Ack=1 Win=23710 Len=1460"
"245","0.304743000","163.1.201.45","192.168.1.5","TCP","1514","1935 > 56401 [ACK] Seq=213267 Ack=1 Win=23710 Len=1460"
"247","0.305304000","163.1.201.45","192.168.1.5","RTMP","1231","Unknown (0x0)|Unknown (0x0)"
"248","0.316606000","163.1.201.45","192.168.1.5","TCP","1514","1935 > 56401 [ACK] Seq=215904 Ack=1 Win=23710 Len=1460"
"250","0.317287000","163.1.201.45","192.168.1.5","TCP","1514","1935 > 56401 [ACK] Seq=217364 Ack=1 Win=23710 Len=1460"
"251","0.318499000","163.1.201.45","192.168.1.5","TCP","1231","1935 > 56401 [PSH, ACK] Seq=218824 Ack=1 Win=23710 Len=1177"
"253","0.318734000","163.1.201.45","192.168.1.5","RTMP","1514","Unknown (0x0)|Unknown (0x0)"
"254","0.318775000","163.1.201.45","192.168.1.5","RTMP","1514","Unknown (0x0)"
"256","0.318875000","163.1.201.45","192.168.1.5","TCP","1231","1935 > 56401 [PSH, ACK] Seq=222921 Ack=1 Win=23710 Len=1177"
"257","0.318914000","163.1.201.45","192.168.1.5","RTMP","1514","Unknown (0x0)"
"259","0.319015000","163.1.201.45","192.168.1.5","RTMP","1514","Unknown (0x0)"
"260","0.321509000","163.1.201.45","192.168.1.5","RTMP","1231","Unknown (0x0)"
"262","0.321647000","163.1.201.45","192.168.1.5","TCP","1514","1935 > 56401 [ACK] Seq=228195 Ack=1 Win=23710 Len=1460"
"263","0.323644000","163.1.201.45","192.168.1.5","RTMP","1514","Unknown (0x0)"
"265","0.323770000","163.1.201.45","192.168.1.5","RTMP","1231","Unknown (0x0)|Unknown (0x0)"
"266","0.323903000","163.1.201.45","192.168.1.5","TCP","1514","1935 > 56401 [ACK] Seq=232292 Ack=1 Win=23710 Len=1460"
"268","0.324121000","163.1.201.45","192.168.1.5","TCP","1514","1935 > 56401 [ACK] Seq=233752 Ack=1 Win=23710 Len=1460"
"269","0.324157000","163.1.201.45","192.168.1.5","TCP","1231","1935 > 56401 [PSH, ACK] Seq=235212 Ack=1 Win=23710 Len=1177"
"271","0.325458000","163.1.201.45","192.168.1.5","RTMP","1514","Unknown (0x0)|Unknown (0x0)|Unknown (0x0)|Unknown (0x0)|Unknown (0x0)"
"272","0.325505000","163.1.201.45","192.168.1.5","RTMP","1514","Unknown (0x0)|Unknown (0x0)"
"274","0.325616000","163.1.201.45","192.168.1.5","RTMP","1231","Unknown (0x0)"
"275","0.325669000","163.1.201.45","192.168.1.5","TCP","1514","1935 > 56401 [ACK] Seq=240486 Ack=1 Win=23710 Len=1460"
"277","0.325779000","163.1.201.45","192.168.1.5","TCP","1514","1935 > 56401 [ACK] Seq=241946 Ack=1 Win=23710 Len=1460"
"278","0.325810000","163.1.201.45","192.168.1.5","RTMP","456","Unknown (0x0)|Unknown (0x0)|Unknown (0x0)"
"280","0.326038000","163.1.201.45","192.168.1.5","RTMP","1514","Unknown (0x0)"
"281","0.326081000","163.1.201.45","192.168.1.5","TCP","1514","1935 > 56401 [ACK] Seq=245268 Ack=1 Win=23710 Len=1460"
"283","0.326206000","163.1.201.45","192.168.1.5","TCP","1238","1935 > 56401 [PSH, ACK] Seq=246728 Ack=1 Win=23710 Len=1184"
"284","0.326379000","163.1.201.45","192.168.1.5","RTMP","1514","Unknown (0x0)|Unknown (0x0)|Unknown (0x0)"
"286","0.326504000","163.1.201.45","192.168.1.5","TCP","1514","1935 > 56401 [ACK] Seq=249372 Ack=1 Win=23710 Len=1460"
"287","0.326533000","163.1.201.45","192.168.1.5","RTMP","1231","Unknown (0x0)"
"289","0.326869000","163.1.201.45","192.168.1.5","RTMP","1514","Unknown (0x0)"
"290","0.326987000","163.1.201.45","192.168.1.5","RTMP","1514","Unknown (0x0)"
"292","0.327185000","163.1.201.45","192.168.1.5","RTMP","1231","Unknown (0x0)"
"293","0.327226000","163.1.201.45","192.168.1.5","RTMP","1514","Unknown (0x0)"
"295","0.327412000","163.1.201.45","192.168.1.5","TCP","1514","1935 > 56401 [ACK] Seq=257566 Ack=1 Win=23710 Len=1460"
"296","0.327444000","163.1.201.45","192.168.1.5","RTMP","1231","Unknown (0x0)|Unknown (0x0)"
"298","0.328356000","163.1.201.45","192.168.1.5","RTMP","1514","Unknown (0x0)"
"300","0.328432000","163.1.201.45","192.168.1.5","TCP","1514","1935 > 56401 [ACK] Seq=261663 Ack=1 Win=23710 Len=1460"
"301","0.328507000","163.1.201.45","192.168.1.5","TCP","1231","1935 > 56401 [PSH, ACK] Seq=263123 Ack=1 Win=23710 Len=1177"
"303","0.401378000","163.1.201.45","192.168.1.5","TCP","1514","1935 > 56401 [ACK] Seq=264300 Ack=1 Win=23710 Len=1460"
"304","0.401683000","163.1.201.45","192.168.1.5","RTMP","1514","Unknown (0x0)|Unknown (0x0)"
"306","0.402521000","163.1.201.45","192.168.1.5","RTMP","1231","Unknown (0x0)|Unknown (0x0)|Unknown (0x0)"
"307","0.402858000","163.1.201.45","192.168.1.5","TCP","1514","1935 > 56401 [ACK] Seq=268397 Ack=1 Win=23710 Len=1460"
"309","0.403223000","163.1.201.45","192.168.1.5","RTMP","1514","Unknown (0x0)"
"310","0.403330000","163.1.201.45","192.168.1.5","TCP","1231","1935 > 56401 [PSH, ACK] Seq=271317 Ack=1 Win=23710 Len=1177"
"312","0.407513000","163.1.201.45","192.168.1.5","RTMP","1514","Unknown (0x0)|Unknown (0x0)"
"313","0.407777000","163.1.201.45","192.168.1.5","TCP","62","1935 > 56401 [PSH, ACK] Seq=273954 Ack=1 Win=23710 Len=8"
"315","0.408683000","163.1.201.45","192.168.1.5","TCP","1514","1935 > 56401 [ACK] Seq=273962 Ack=1 Win=23710 Len=1460"
"316","0.408801000","163.1.201.45","192.168.1.5","TCP","1514","1935 > 56401 [ACK] Seq=275422 Ack=1 Win=23710 Len=1460"
"318","0.408999000","163.1.201.45","192.168.1.5","RTMP","1238","Unknown (0x0)"
"319","0.420649000","163.1.201.45","192.168.1.5","TCP","1514","1935 > 56401 [ACK] Seq=278066 Ack=1 Win=23710 Len=1460"
"321","0.420951000","163.1.201.45","192.168.1.5","TCP","1514","1935 > 56401 [ACK] Seq=279526 Ack=1 Win=23710 Len=1460"
"322","0.421234000","163.1.201.45","192.168.1.5","TCP","1231","1935 > 56401 [PSH, ACK] Seq=280986 Ack=1 Win=23710 Len=1177"
"324","0.426811000","163.1.201.45","192.168.1.5","TCP","1514","1935 > 56401 [ACK] Seq=282163 Ack=1 Win=23710 Len=1460"
"325","0.427181000","163.1.201.45","192.168.1.5","RTMP","1514","Unknown (0x0)|Unknown (0x0)"
"327","0.427879000","163.1.201.45","192.168.1.5","TCP","1231","1935 > 56401 [PSH, ACK] Seq=285083 Ack=1 Win=23710 Len=1177"
"328","0.428947000","163.1.201.45","192.168.1.5","RTMP","1514","Unknown (0x0)"
"330","0.429308000","163.1.201.45","192.168.1.5","TCP","1514","1935 > 56401 [ACK] Seq=287720 Ack=1 Win=23710 Len=1460"
"331","0.430283000","163.1.201.45","192.168.1.5","TCP","1231","1935 > 56401 [PSH, ACK] Seq=289180 Ack=1 Win=23710 Len=1177"
"333","0.430592000","163.1.201.45","192.168.1.5","TCP","1514","1935 > 56401 [ACK] Seq=290357 Ack=1 Win=23710 Len=1460"
"334","0.431108000","163.1.201.45","192.168.1.5","TCP","1514","1935 > 56401 [ACK] Seq=291817 Ack=1 Win=23710 Len=1460"
"336","0.431322000","163.1.201.45","192.168.1.5","TCP","1231","1935 > 56401 [PSH, ACK] Seq=293277 Ack=1 Win=23710 Len=1177"
"337","0.431372000","163.1.201.45","192.168.1.5","TCP","1514","1935 > 56401 [ACK] Seq=294454 Ack=1 Win=23710 Len=1460"
"339","0.431585000","163.1.201.45","192.168.1.5","RTMP","1514","Unknown (0x0)|Unknown (0x0)"
"340","0.431622000","163.1.201.45","192.168.1.5","RTMP","1231","Unknown (0x0)"
"342","0.431846000","163.1.201.45","192.168.1.5","TCP","1514","1935 > 56401 [ACK] Seq=298551 Ack=1 Win=23710 Len=1460"
"343","0.431890000","163.1.201.45","192.168.1.5","RTMP","1514","Unknown (0x0)"
"345","0.431995000","163.1.201.45","192.168.1.5","TCP","77","1935 > 56401 [PSH, ACK] Seq=301471 Ack=1 Win=23710 Len=23"
"346","0.432298000","163.1.201.45","192.168.1.5","RTMP","1514","Unknown (0x0)|Unknown (0x0)|Unknown (0x0)|Unknown (0x0)|Unknown (0x0)|Unknown (0x0)"
"348","0.432584000","163.1.201.45","192.168.1.5","TCP","1514","1935 > 56401 [ACK] Seq=302954 Ack=1 Win=23710 Len=1460"
"349","0.432706000","163.1.201.45","192.168.1.5","TCP","1238","1935 > 56401 [PSH, ACK] Seq=304414 Ack=1 Win=23710 Len=1184"
"351","0.432920000","163.1.201.45","192.168.1.5","TCP","1514","1935 > 56401 [ACK] Seq=305598 Ack=1 Win=23710 Len=1460"
"352","0.432965000","163.1.201.45","192.168.1.5","RTMP","1514","Unknown (0x0)"
"354","0.433164000","163.1.201.45","192.168.1.5","RTMP","1231","Unknown (0x0)"
"355","0.433209000","163.1.201.45","192.168.1.5","TCP","1514","1935 > 56401 [ACK] Seq=309695 Ack=1 Win=23710 Len=1460"
"357","0.433413000","163.1.201.45","192.168.1.5","RTMP","1514","Unknown (0x0)|Unknown (0x0)|Unknown (0x0)"
"358","0.433448000","163.1.201.45","192.168.1.5","RTMP","1231","Unknown (0x0)|Unknown (0x0)"
"360","0.433630000","163.1.201.45","192.168.1.5","TCP","1514","1935 > 56401 [ACK] Seq=313792 Ack=1 Win=23710 Len=1460"
"361","0.434025000","163.1.201.45","192.168.1.5","RTMP","1514","Unknown (0x0)"
"363","0.434521000","163.1.201.45","192.168.1.5","RTMP","1231","Unknown (0x0)|Unknown (0x0)"
"364","0.434645000","163.1.201.45","192.168.1.5","TCP","1514","1935 > 56401 [ACK] Seq=317889 Ack=1 Win=23710 Len=1460"
"366","0.434848000","163.1.201.45","192.168.1.5","TCP","1514","1935 > 56401 [ACK] Seq=319349 Ack=1 Win=23710 Len=1460"
"367","0.434881000","163.1.201.45","192.168.1.5","TCP","1231","1935 > 56401 [PSH, ACK] Seq=320809 Ack=1 Win=23710 Len=1177"
"369","0.446135000","163.1.201.45","192.168.1.5","RTMP","1514","Unknown (0x0)|Unknown (0x0)"
"370","0.446416000","163.1.201.45","192.168.1.5","TCP","1514","1935 > 56401 [ACK] Seq=323446 Ack=1 Win=23710 Len=1460"
"372","0.448949000","163.1.201.45","192.168.1.5","TCP","1231","1935 > 56401 [PSH, ACK] Seq=324906 Ack=1 Win=23710 Len=1177"
"373","0.449085000","163.1.201.45","192.168.1.5","TCP","1514","1935 > 56401 [ACK] Seq=326083 Ack=1 Win=23710 Len=1460"
"375","0.449199000","163.1.201.45","192.168.1.5","RTMP","574","Unknown (0x0)|Unknown (0x0)|Unknown (0x0)"
"376","0.452018000","163.1.201.45","192.168.1.5","RTMP","1514","Unknown (0x0)|Unknown (0x0)"
"378","0.452210000","163.1.201.45","192.168.1.5","RTMP","1514","Unknown (0x0)|Unknown (0x0)"
"379","0.452310000","163.1.201.45","192.168.1.5","TCP","1238","1935 > 56401 [PSH, ACK] Seq=330983 Ack=1 Win=23710 Len=1184"
"381","0.502328000","163.1.201.45","192.168.1.5","TCP","1514","1935 > 56401 [ACK] Seq=332167 Ack=1 Win=23710 Len=1460"
"382","0.503292000","163.1.201.45","192.168.1.5","TCP","1514","1935 > 56401 [ACK] Seq=333627 Ack=1 Win=23710 Len=1460"
"384","0.503582000","163.1.201.45","192.168.1.5","RTMP","1231","Unknown (0x0)"
"385","0.503712000","163.1.201.45","192.168.1.5","TCP","1514","1935 > 56401 [ACK] Seq=336264 Ack=1 Win=23710 Len=1460"
"387","0.503927000","163.1.201.45","192.168.1.5","TCP","1514","1935 > 56401 [ACK] Seq=337724 Ack=1 Win=23710 Len=1460"
"388","0.503961000","163.1.201.45","192.168.1.5","RTMP","1231","Unknown (0x0)"
"390","0.519007000","163.1.201.45","192.168.1.5","RTMP","1514","Unknown (0x0)"
"391","0.519870000","163.1.201.45","192.168.1.5","RTMP","1514","Unknown (0x0)|Unknown (0x0)"
"393","0.520117000","163.1.201.45","192.168.1.5","RTMP","1231","Unknown (0x0)"
"394","0.520248000","163.1.201.45","192.168.1.5","RTMP","1514","Unknown (0x0)|Unknown (0x0)"
"396","0.520618000","163.1.201.45","192.168.1.5","RTMP","1514","Unknown (0x0)"
"397","0.520651000","163.1.201.45","192.168.1.5","RTMP","1231","Unknown (0x0)|Unknown (0x0)"
"399","0.524926000","163.1.201.45","192.168.1.5","RTMP","1514","Unknown (0x0)"
"400","0.525184000","163.1.201.45","192.168.1.5","TCP","1514","1935 > 56401 [ACK] Seq=350015 Ack=1 Win=23710 Len=1460"
"402","0.526183000","163.1.201.45","192.168.1.5","RTMP","1231","Unknown (0x0)|Unknown (0x0)|Unknown (0x0)|Unknown (0x0)"
"403","0.526333000","163.1.201.45","192.168.1.5","RTMP","1514","Unknown (0x0)|Unknown (0x0)|Unknown (0x0)"
"405","0.526466000","163.1.201.45","192.168.1.5","RTMP","549","Unknown (0x0)|Unknown (0x0)"
"406","0.526586000","163.1.201.45","192.168.1.5","TCP","1514","1935 > 56401 [ACK] Seq=354607 Ack=1 Win=23710 Len=1460"
"408","0.526877000","163.1.201.45","192.168.1.5","RTMP","1514","Unknown (0x0)|Unknown (0x0)"
"409","0.527308000","163.1.201.45","192.168.1.5","RTMP","1238","Unknown (0x0)|Unknown (0x0)|Unknown (0x0)"
"411","0.527816000","163.1.201.45","192.168.1.5","TCP","1514","1935 > 56401 [ACK] Seq=358711 Ack=1 Win=23710 Len=1460"
"412","0.528082000","163.1.201.45","192.168.1.5","RTMP","1514","Unknown (0x0)|Unknown (0x0)"
"414","0.528285000","163.1.201.45","192.168.1.5","TCP","1231","1935 > 56401 [PSH, ACK] Seq=361631 Ack=1 Win=23710 Len=1177"
"415","0.528708000","163.1.201.45","192.168.1.5","TCP","1514","1935 > 56401 [ACK] Seq=362808 Ack=1 Win=23710 Len=1460"
"417","0.528956000","163.1.201.45","192.168.1.5","TCP","1514","1935 > 56401 [ACK] Seq=364268 Ack=1 Win=23710 Len=1460"
"418","0.529066000","163.1.201.45","192.168.1.5","TCP","1231","1935 > 56401 [PSH, ACK] Seq=365728 Ack=1 Win=23710 Len=1177"
"420","0.529374000","163.1.201.45","192.168.1.5","TCP","1514","1935 > 56401 [ACK] Seq=366905 Ack=1 Win=23710 Len=1460"
"421","0.529490000","163.1.201.45","192.168.1.5","TCP","1514","1935 > 56401 [ACK] Seq=368365 Ack=1 Win=23710 Len=1460"
"423","0.529676000","163.1.201.45","192.168.1.5","RTMP","1231","Unknown (0x0)"
"425","0.531314000","163.1.201.45","192.168.1.5","RTMP","1514","Unknown (0x0)|Unknown (0x0)"
"426","0.531677000","163.1.201.45","192.168.1.5","RTMP","1514","Unknown (0x0)|Unknown (0x0)"
"428","0.531880000","163.1.201.45","192.168.1.5","RTMP","1231","Unknown (0x0)"
"429","0.532539000","163.1.201.45","192.168.1.5","TCP","1514","1935 > 56401 [ACK] Seq=375099 Ack=1 Win=23710 Len=1460"
"431","0.532751000","163.1.201.45","192.168.1.5","RTMP","1514","Unknown (0x0)"
"432","0.532785000","163.1.201.45","192.168.1.5","TCP","1231","1935 > 56401 [PSH, ACK] Seq=378019 Ack=1 Win=23710 Len=1177"
"434","0.533002000","163.1.201.45","192.168.1.5","TCP","1514","1935 > 56401 [ACK] Seq=379196 Ack=1 Win=23710 Len=1460"
"435","0.533045000","163.1.201.45","192.168.1.5","RTMP","357","Unknown (0x0)"
"437","0.533145000","163.1.201.45","192.168.1.5","RTMP","1514","Unknown (0x0)|Unknown (0x0)|Unknown (0x0)"
"438","0.533291000","163.1.201.45","192.168.1.5","TCP","1514","1935 > 56401 [ACK] Seq=382419 Ack=1 Win=23710 Len=1460"
"440","0.533395000","163.1.201.45","192.168.1.5","RTMP","1238","Unknown (0x0)"
"441","0.533437000","163.1.201.45","192.168.1.5","TCP","1514","1935 > 56401 [ACK] Seq=385063 Ack=1 Win=23710 Len=1460"
"443","0.533619000","163.1.201.45","192.168.1.5","RTMP","1514","Unknown (0x0)|Unknown (0x0)"
"444","0.533844000","163.1.201.45","192.168.1.5","TCP","1231","1935 > 56401 [PSH, ACK] Seq=387983 Ack=1 Win=23710 Len=1177"
"446","0.547063000","163.1.201.45","192.168.1.5","RTMP","1514","Unknown (0x0)|Unknown (0x0)"
"447","0.547357000","163.1.201.45","192.168.1.5","TCP","1514","1935 > 56401 [ACK] Seq=390620 Ack=1 Win=23710 Len=1460"
"449","0.547828000","163.1.201.45","192.168.1.5","TCP","1231","1935 > 56401 [PSH, ACK] Seq=392080 Ack=1 Win=23710 Len=1177"
"450","0.548622000","163.1.201.45","192.168.1.5","TCP","1514","1935 > 56401 [ACK] Seq=393257 Ack=1 Win=23710 Len=1460"
"452","0.548900000","163.1.201.45","192.168.1.5","TCP","1514","1935 > 56401 [ACK] Seq=394717 Ack=1 Win=23710 Len=1460"
"453","0.549450000","163.1.201.45","192.168.1.5","TCP","1231","1935 > 56401 [PSH, ACK] Seq=396177 Ack=1 Win=23710 Len=1177"
"455","0.598994000","163.1.201.45","192.168.1.5","TCP","1514","1935 > 56401 [ACK] Seq=397354 Ack=1 Win=23710 Len=1460"
"456","0.599299000","163.1.201.45","192.168.1.5","TCP","1514","1935 > 56401 [ACK] Seq=398814 Ack=1 Win=23710 Len=1460"
"458","0.599910000","163.1.201.45","192.168.1.5","TCP","1231","1935 > 56401 [PSH, ACK] Seq=400274 Ack=1 Win=23710 Len=1177"
"459","0.601068000","163.1.201.45","192.168.1.5","RTMP","1514","Unknown (0x0)"
"461","0.601373000","163.1.201.45","192.168.1.5","RTMP","1514","Unknown (0x0)|Unknown (0x0)|Unknown (0x0)|Unknown (0x0)|Unknown (0x0)|Unknown (0x0)"
"462","0.601648000","163.1.201.45","192.168.1.5","RTMP","1231","Unknown (0x0)|Unknown (0x0)"
"464","0.615392000","163.1.201.45","192.168.1.5","RTMP","1514","Unknown (0x0)"
"465","0.615662000","163.1.201.45","192.168.1.5","RTMP","1514","Unknown (0x0)|Unknown (0x0)"
"467","0.617668000","163.1.201.45","192.168.1.5","RTMP","1514","Unknown (0x0)"
"468","0.617720000","163.1.201.45","192.168.1.5","RTMP","1089","Unknown (0x0)"
"470","0.617907000","163.1.201.45","192.168.1.5","RTMP","1514","Unknown (0x0)|Unknown (0x0)|Unknown (0x0)"
"471","0.620291000","163.1.201.45","192.168.1.5","TCP","1514","1935 > 56401 [ACK] Seq=412423 Ack=1 Win=23710 Len=1460"
"473","0.620404000","163.1.201.45","192.168.1.5","RTMP","1231","Unknown (0x0)"
"474","0.620529000","163.1.201.45","192.168.1.5","TCP","1514","1935 > 56401 [ACK] Seq=415060 Ack=1 Win=23710 Len=1460"
"476","0.622545000","163.1.201.45","192.168.1.5","TCP","1514","1935 > 56401 [ACK] Seq=416520 Ack=1 Win=23710 Len=1460"
"477","0.622584000","163.1.201.45","192.168.1.5","RTMP","1231","Unknown (0x0)|Unknown (0x0)|Unknown (0x0)"
"479","0.622724000","163.1.201.45","192.168.1.5","RTMP","1514","Unknown (0x0)|Unknown (0x0)|Unknown (0x0)|Unknown (0x0)"
"480","0.622873000","163.1.201.45","192.168.1.5","TCP","1514","1935 > 56401 [ACK] Seq=420617 Ack=1 Win=23710 Len=1460"
"482","0.622976000","163.1.201.45","192.168.1.5","RTMP","1231","Unknown (0x0)|Unknown (0x0)"
"483","0.623019000","163.1.201.45","192.168.1.5","RTMP","1514","Unknown (0x0)|Unknown (0x0)"
"485","0.623216000","163.1.201.45","192.168.1.5","RTMP","1514","Unknown (0x0)|Unknown (0x0)"
"486","0.623250000","163.1.201.45","192.168.1.5","RTMP","1231","Unknown (0x0)"
"488","0.624919000","163.1.201.45","192.168.1.5","RTMP","1514","Unknown (0x0)|Unknown (0x0)|Unknown (0x0)|Unknown (0x0)|Unknown (0x0)|Unknown (0x0)"
"489","0.625219000","163.1.201.45","192.168.1.5","TCP","1514","1935 > 56401 [ACK] Seq=428811 Ack=1 Win=23710 Len=1460"
"491","0.625792000","163.1.201.45","192.168.1.5","RTMP","1231","Unknown (0x0)"
"492","0.626254000","163.1.201.45","192.168.1.5","RTMP","1412","Unknown (0x0)"
"494","0.626535000","163.1.201.45","192.168.1.5","RTMP","1514","Unknown (0x0)|Unknown (0x0)"
"495","0.626653000","163.1.201.45","192.168.1.5","TCP","1514","1935 > 56401 [ACK] Seq=434266 Ack=6 Win=23705 Len=1460"
"497","0.626831000","163.1.201.45","192.168.1.5","TCP","1238","1935 > 56401 [PSH, ACK] Seq=435726 Ack=6 Win=23705 Len=1184"
"498","0.627838000","163.1.201.45","192.168.1.5","RTMP","1514","Unknown (0x0)|Unknown (0x0)|Unknown (0x0)|Unknown (0x0)|Unknown (0x0)"
"500","0.628152000","163.1.201.45","192.168.1.5","RTMP","1514","Unknown (0x0)|Unknown (0x0)|Unknown (0x0)"
"501","0.628394000","163.1.201.45","192.168.1.5","RTMP","1231","Unknown (0x0)"
"503","0.629404000","163.1.201.45","192.168.1.5","RTMP","1514","Unknown (0x0)"
"504","0.629696000","163.1.201.45","192.168.1.5","RTMP","1514","Unknown (0x0)|Unknown (0x0)|Unknown (0x0)"
"506","0.629901000","163.1.201.45","192.168.1.5","RTMP","1231","Unknown (0x0)|Unknown (0x0)|Unknown (0x0)"
"507","0.629944000","163.1.201.45","192.168.1.5","RTMP","1514","Unknown (0x0)|Unknown (0x0)"
"509","0.630124000","163.1.201.45","192.168.1.5","TCP","1514","1935 > 56401 [ACK] Seq=446564 Ack=6 Win=23705 Len=1460"
"510","0.630797000","163.1.201.45","192.168.1.5","TCP","1231","1935 > 56401 [PSH, ACK] Seq=448024 Ack=6 Win=23705 Len=1177"
"512","0.631006000","163.1.201.45","192.168.1.5","TCP","1514","1935 > 56401 [ACK] Seq=449201 Ack=6 Win=23705 Len=1460"
"513","0.631048000","163.1.201.45","192.168.1.5","TCP","1514","1935 > 56401 [ACK] Seq=450661 Ack=6 Win=23705 Len=1460"
"515","0.631222000","163.1.201.45","192.168.1.5","RTMP","1231","Unknown (0x0)"
"516","0.631559000","163.1.201.45","192.168.1.5","RTMP","1514","Unknown (0x0)|Unknown (0x0)|Unknown (0x0)"
"518","0.631764000","163.1.201.45","192.168.1.5","TCP","1514","1935 > 56401 [ACK] Seq=454758 Ack=6 Win=23705 Len=1460"
"519","0.631799000","163.1.201.45","192.168.1.5","RTMP","1231","Unknown (0x0)"
"521","0.646382000","163.1.201.45","192.168.1.5","RTMP","1514","Unknown (0x0)"
"522","0.647443000","163.1.201.45","192.168.1.5","TCP","172","1935 > 56401 [PSH, ACK] Seq=458855 Ack=6 Win=23705 Len=118"
"524","0.647698000","163.1.201.45","192.168.1.5","TCP","1514","1935 > 56401 [ACK] Seq=458973 Ack=6 Win=23705 Len=1460"
"525","0.648258000","163.1.201.45","192.168.1.5","TCP","1514","1935 > 56401 [ACK] Seq=460433 Ack=6 Win=23705 Len=1460"
"527","0.648478000","163.1.201.45","192.168.1.5","RTMP","1238","Unknown (0x0)"
"529","0.700388000","163.1.201.45","192.168.1.5","TCP","1514","1935 > 56401 [ACK] Seq=463077 Ack=6 Win=23705 Len=1460"
"531","0.700681000","163.1.201.45","192.168.1.5","TCP","1514","1935 > 56401 [ACK] Seq=464537 Ack=6 Win=23705 Len=1460"
"532","0.700910000","163.1.201.45","192.168.1.5","RTMP","1231","Unknown (0x0)"
"534","0.701111000","163.1.201.45","192.168.1.5","RTMP","1514","Unknown (0x0)"
"535","0.701418000","163.1.201.45","192.168.1.5","RTMP","1514","Unknown (0x0)|Unknown (0x0)|Unknown (0x0)"
"537","0.702451000","163.1.201.45","192.168.1.5","RTMP","1231","Unknown (0x0)"
"538","0.714657000","163.1.201.45","192.168.1.5","RTMP","1514","Unknown (0x0)"
"540","0.716236000","163.1.201.45","192.168.1.5","TCP","1514","1935 > 56401 [ACK] Seq=472731 Ack=6 Win=23705 Len=1460"
"541","0.717324000","163.1.201.45","192.168.1.5","RTMP","1231","Unknown (0x0)|Unknown (0x0)"
"543","0.717826000","163.1.201.45","192.168.1.5","TCP","1514","1935 > 56401 [ACK] Seq=475368 Ack=6 Win=23705 Len=1460"
"544","0.717950000","163.1.201.45","192.168.1.5","RTMP","1514","Unknown (0x0)"
"546","0.718162000","163.1.201.45","192.168.1.5","TCP","1231","1935 > 56401 [PSH, ACK] Seq=478288 Ack=6 Win=23705 Len=1177"
"547","0.718212000","163.1.201.45","192.168.1.5","TCP","1514","1935 > 56401 [ACK] Seq=479465 Ack=6 Win=23705 Len=1460"
"549","0.718412000","163.1.201.45","192.168.1.5","RTMP","1514","Unknown (0x0)|Unknown (0x0)"
"550","0.718449000","163.1.201.45","192.168.1.5","RTMP","1231","Unknown (0x0)"
"552","0.719475000","163.1.201.45","192.168.1.5","RTMP","1466","Unknown (0x0)|Unknown (0x0)"
"553","0.719950000","163.1.201.45","192.168.1.5","RTMP","1514","Unknown (0x0)|Unknown (0x0)"
"555","0.720165000","163.1.201.45","192.168.1.5","TCP","1514","1935 > 56401 [ACK] Seq=486434 Ack=6 Win=23705 Len=1460"
"556","0.722553000","163.1.201.45","192.168.1.5","RTMP","1238","Unknown (0x0)"
"558","0.722768000","163.1.201.45","192.168.1.5","TCP","1514","1935 > 56401 [ACK] Seq=489078 Ack=6 Win=23705 Len=1460"
"559","0.724458000","163.1.201.45","192.168.1.5","TCP","1514","1935 > 56401 [ACK] Seq=490538 Ack=6 Win=23705 Len=1460"
"561","0.724583000","163.1.201.45","192.168.1.5","RTMP","1231","Unknown (0x0)"
"562","0.724633000","163.1.201.45","192.168.1.5","TCP","1514","1935 > 56401 [ACK] Seq=493175 Ack=6 Win=23705 Len=1460"
"564","0.724863000","163.1.201.45","192.168.1.5","RTMP","1514","Unknown (0x0)|Unknown (0x0)"
"565","0.724896000","163.1.201.45","192.168.1.5","RTMP","1231","Unknown (0x0)"
"567","0.725012000","163.1.201.45","192.168.1.5","RTMP","1514","Unknown (0x0)"
"568","0.725049000","163.1.201.45","192.168.1.5","RTMP","1514","Unknown (0x0)"
